Sample_file	Genome_file	Adjusted_ANI	Eff_cov	ANI_5-95_percentile	Eff_lambda	Lambda_5-95_percentile	Median_cov	Mean_cov_geq1	Containment_ind	Naive_ANI	Contig_name
trimmed_read1_3000829042-DNA.fastq.gz	gtdb_genomes_reps_r220/database/GCF/003/030/305/GCF_003030305.1_genomic.fna.gz	99.04	0.043	96.87-101.16	0.043	0.02-0.08	1	1.021	331/10561	89.43	NZ_CP023676.1 Cutibacterium acnes strain ATCC 6919 chromosome, complete genome
trimmed_read1_3000829042-DNA.fastq.gz	gtdb_genomes_reps_r220/database/GCF/000/688/415/GCF_000688415.1_genomic.fna.gz	98.74	0.455	98.50-99.04	0.455	0.40-0.49	1	1.259	2417/9809	95.58	NZ_JIAH01000001.1 Corynebacterium pseudodiphtheriticum DSM 44287 O146DRAFT_scaffold00010.10_C, whole genome shotgun sequence
trimmed_read1_3000829042-DNA.fastq.gz	gtdb_genomes_reps_r220/database/GCF/001/679/005/GCF_001679005.1_genomic.fna.gz	98.51	0.771	98.35-98.72	0.771	0.71-0.83	1	1.490	3321/9834	96.56	NZ_LXTW01000001.1 Moraxella nonliquefaciens strain CCUG 348 contig_1, whole genome shotgun sequence
trimmed_read1_3000829042-DNA.fastq.gz	gtdb_genomes_reps_r220/database/GCF/001/457/655/GCF_001457655.1_genomic.fna.gz	98.29	0.042	96.02-99.13	0.042	0.03-0.09	1	1.031	194/7983	88.70	NZ_LN831035.1 Haemophilus influenzae strain NCTC8143 chromosome 1, complete sequence
trimmed_read1_3000829042-DNA.fastq.gz	gtdb_genomes_reps_r220/database/GCF/019/703/545/GCF_019703545.1_genomic.fna.gz	97.90	0.050	95.66-99.71	0.050	0.03-0.10	1	1.034	205/8083	88.82	NZ_AP018771.1 Haemophilus influenzae strain CHBN-II-8 isolate 10H27 chromosome, complete genome
trimmed_read1_3000829042-DNA.fastq.gz	gtdb_genomes_reps_r220/database/GCF/005/888/195/GCF_005888195.1_genomic.fna.gz	97.81	0.045	95.21-98.93	0.045	0.03-0.10	1	1.049	183/8234	88.44	NZ_LNKR01000001.1 Haemophilus influenzae biotype aegyptius strain KC1018 contig_001, whole genome shotgun sequence
trimmed_read1_3000829042-DNA.fastq.gz	gtdb_genomes_reps_r220/database/GCF/000/245/815/GCF_000245815.1_genomic.fna.gz	97.71	2.995	NA-NA	HIGH	NA-NA	3	2.995	3819/7821	97.71	NZ_JH601103.1 Dolosigranulum pigrum ATCC 51524 supercont1.1, whole genome shotgun sequence
trimmed_read1_3000829042-DNA.fastq.gz	gtdb_genomes_reps_r220/database/GCF/002/014/765/GCF_002014765.1_genomic.fna.gz	97.19	0.229	96.62-97.75	0.229	0.18-0.28	1	1.240	757/8926	92.35	NZ_MUYT01000001.1 Moraxella lincolnii strain CCUG 9405 CCUG9405T_R1__paired__trimmed__paired__contig_1, whole genome shotgun sequence
trimmed_read1_3000829042-DNA.fastq.gz	gtdb_genomes_reps_r220/database/GCF/002/984/305/GCF_002984305.1_genomic.fna.gz	97.03	0.056	94.85-98.52	0.056	0.03-0.12	1	1.065	185/8528	88.38	NZ_NEAA01000096.1 Haemophilus influenzae strain 135P16H1 N135P16H1_100_1, whole genome shotgun sequence
trimmed_read1_3000829042-DNA.fastq.gz	gtdb_genomes_reps_r220/database/GCF/001/632/285/GCF_001632285.1_genomic.fna.gz	96.80	0.277	96.11-97.33	0.277	0.23-0.35	1	1.294	725/8176	92.48	NZ_LWAH01000001.1 Moraxella catarrhalis strain CCUG 353 contig_1, whole genome shotgun sequence
trimmed_read1_3000829042-DNA.fastq.gz	gtdb_genomes_reps_r220/database/GCF/900/475/755/GCF_900475755.1_genomic.fna.gz	95.79	0.065	93.63-96.63	0.065	0.05-0.12	1	1.047	129/7845	87.59	NZ_LS483411.1 Haemophilus influenzae strain NCTC11426 chromosome 1, complete sequence
trimmed_read1_3000829042-DNA.fastq.gz	gtdb_genomes_reps_r220/database/GCA/943/913/655/GCA_943913655.1_genomic.fna.gz	95.60	0.190	94.68-96.70	0.190	0.12-0.27	1	1.954	262/5936	90.42	CALTZA010000001.1 MAG: uncultured Francisella sp. isolate G79AyWT62A_bin.4.MAG genome assembly, contig: NODE_9_length_210779_cov_13.887189, whole genome shotgun sequence
trimmed_read1_3000829042-DNA.fastq.gz	gtdb_genomes_reps_r220/database/GCF/000/222/025/GCF_000222025.1_genomic.fna.gz	93.49	0.083	91.19-94.32	0.083	0.07-0.18	1	1.040	75/7558	86.17	NZ_AFQO01000022.1 Haemophilus haemolyticus M19501 M19501_022, whole genome shotgun sequence
trimmed_read1_3000829042-DNA.fastq.gz	gtdb_genomes_reps_r220/database/GCF/003/490/595/GCF_003490595.1_genomic.fna.gz	93.36	0.080	91.11-93.91	0.080	0.07-0.17	1	1.123	81/8755	85.98	NZ_QQGY01000001.1 Haemophilus haemolyticus strain M19079 M19079_HUY4190A121_cleaned_ctg_3577, whole genome shotgun sequence
trimmed_read1_3000829042-DNA.fastq.gz	gtdb_genomes_reps_r220/database/GCF/002/027/545/GCF_002027545.1_genomic.fna.gz	92.94	0.744	92.47-93.33	0.744	0.62-0.90	1	1.554	662/12181	91.03	NZ_MXAN01000001.1 Moraxella lacunata strain CCUG 4441 CCUG_4441T_0000001, whole genome shotgun sequence
trimmed_read1_3000829042-DNA.fastq.gz	gtdb_genomes_reps_r220/database/GCA/001/752/465/GCA_001752465.1_genomic.fna.gz	92.85	0.086	90.84-93.71	0.086	0.07-0.17	1	1.132	76/9119	85.69	MDJB01000001.1 Haemophilus quentini strain K068 K068_S8_L001_R1_001_(paired)_contig_1, whole genome shotgun sequence
trimmed_read1_3000829042-DNA.fastq.gz	gtdb_genomes_reps_r220/database/GCF/003/351/405/GCF_003351405.1_genomic.fna.gz	92.83	0.091	90.36-93.37	0.091	0.08-0.20	1	1.071	70/8082	85.80	NZ_CP031240.1 Haemophilus haemolyticus strain M19345 chromosome, complete genome
trimmed_read1_3000829042-DNA.fastq.gz	gtdb_genomes_reps_r220/database/GCF/015/223/095/GCF_015223095.1_genomic.fna.gz	92.80	0.704	92.31-93.22	0.704	0.58-0.84	1	1.563	584/11687	90.79	NZ_JADFBZ010000001.1 Moraxella sp. K127 Contig_001, whole genome shotgun sequence
trimmed_read1_3000829042-DNA.fastq.gz	gtdb_genomes_reps_r220/database/GCF/001/679/045/GCF_001679045.1_genomic.fna.gz	91.84	0.131	89.82-93.00	0.131	0.09-0.26	1	1.268	71/7971	85.87	NZ_LYCK01000001.1 Haemophilus haemolyticus strain CCUG 12834 contig_1, whole genome shotgun sequence
trimmed_read1_3000829042-DNA.fastq.gz	gtdb_genomes_reps_r220/database/GCF/003/352/385/GCF_003352385.1_genomic.fna.gz	91.80	0.105	89.24-92.63	0.105	0.09-0.25	1	1.050	60/8521	85.23	NZ_CP031243.1 Haemophilus haemolyticus strain M19346 chromosome, complete genome
trimmed_read1_3000829042-DNA.fastq.gz	gtdb_genomes_reps_r220/database/GCF/030/232/885/GCF_030232885.1_genomic.fna.gz	91.74	0.488	91.00-92.35	0.488	0.38-0.62	1	1.321	271/10137	88.97	NZ_JASPGD010000010.1 Corynebacterium sp. MSK297 NODE_10_length_83137_cov_46.783265, whole genome shotgun sequence
trimmed_read1_3000829042-DNA.fastq.gz	gtdb_genomes_reps_r220/database/GCF/006/384/255/GCF_006384255.1_genomic.fna.gz	91.62	0.107	89.20-91.96	0.107	0.10-0.22	1	1.131	61/8908	85.15	NZ_VCED01000001.1 Haemophilus seminalis strain SZY H1 Scaffold1, whole genome shotgun sequence
trimmed_read1_3000829042-DNA.fastq.gz	gtdb_genomes_reps_r220/database/GCF/000/375/525/GCF_000375525.1_genomic.fna.gz	91.09	0.530	90.32-91.90	0.530	0.39-0.71	1	1.300	240/10520	88.52	NZ_AQXC01000001.1 Corynebacterium propinquum DSM 44285 B142DRAFT_scaffold_0.1_C, whole genome shotgun sequence
trimmed_read1_3000829042-DNA.fastq.gz	gtdb_genomes_reps_r220/database/GCF/001/656/295/GCF_001656295.1_genomic.fna.gz	91.05	0.536	90.18-91.80	0.536	0.39-0.74	1	1.379	211/9300	88.50	NZ_LXHE01000009.1 Moraxella catarrhalis strain Z7574 Z7574_ctg-0, whole genome shotgun sequence
trimmed_read1_3000829042-DNA.fastq.gz	gtdb_genomes_reps_r220/database/GCF/030/826/625/GCF_030826625.1_genomic.fna.gz	90.95	0.463	89.88-91.77	0.463	0.32-0.65	1	1.265	189/9660	88.08	NZ_JAPJNQ010000054.1 MAG: Corynebacterium sp. isolate RAGGC_12 NODE_1032_length_14664_cov_8.518995, whole genome shotgun sequence
trimmed_read1_3000829042-DNA.fastq.gz	gtdb_genomes_reps_r220/database/GCF/003/490/935/GCF_003490935.1_genomic.fna.gz	90.78	0.154	88.59-92.12	0.154	0.10-0.33	1	1.186	59/8148	85.30	NZ_QQGD01000001.1 Haemophilus haemolyticus strain M19099 M19099_HUY4190A124_cleaned_ctg_3040, whole genome shotgun sequence
trimmed_read1_3000829042-DNA.fastq.gz	gtdb_genomes_reps_r220/database/GCF/020/102/855/GCF_020102855.1_genomic.fna.gz	90.63	0.085	88.56-91.34	0.085	0.07-0.19	1	1.066	76/19529	83.61	NZ_JADHZD010000001.1 Nocardioides lacusdianchii strain JXJ CY 38 NODE_1, whole genome shotgun sequence
