Sample_file	Genome_file	Adjusted_ANI	Eff_cov	ANI_5-95_percentile	Eff_lambda	Lambda_5-95_percentile	Median_cov	Mean_cov_geq1	Containment_ind	Naive_ANI	Contig_name
trimmed_read1_3000886283-DNA.fastq.gz	gtdb_genomes_reps_r220/database/GCF/000/688/415/GCF_000688415.1_genomic.fna.gz	98.79	0.362	98.48-99.07	0.362	0.32-0.40	1	1.225	2043/9809	95.07	NZ_JIAH01000001.1 Corynebacterium pseudodiphtheriticum DSM 44287 O146DRAFT_scaffold00010.10_C, whole genome shotgun sequence
trimmed_read1_3000886283-DNA.fastq.gz	gtdb_genomes_reps_r220/database/GCF/002/901/845/GCF_002901845.1_genomic.fna.gz	98.23	0.165	97.52-98.83	0.165	0.13-0.21	1	1.103	841/9599	92.45	NZ_PPQE01000008.1 Staphylococcus hominis subsp. hominis strain NCTC 11320 NCTC11320_e2_c10, whole genome shotgun sequence
trimmed_read1_3000886283-DNA.fastq.gz	gtdb_genomes_reps_r220/database/GCA/943/913/655/GCA_943913655.1_genomic.fna.gz	98.07	0.210	97.38-98.78	0.210	0.16-0.26	1	0.988	679/5936	93.24	CALTZA010000001.1 MAG: uncultured Francisella sp. isolate G79AyWT62A_bin.4.MAG genome assembly, contig: NODE_9_length_210779_cov_13.887189, whole genome shotgun sequence
trimmed_read1_3000886283-DNA.fastq.gz	gtdb_genomes_reps_r220/database/GCF/000/245/815/GCF_000245815.1_genomic.fna.gz	97.96	1.270	97.83-98.10	1.270	1.17-1.35	2	1.895	2966/7821	96.92	NZ_JH601103.1 Dolosigranulum pigrum ATCC 51524 supercont1.1, whole genome shotgun sequence
trimmed_read1_3000886283-DNA.fastq.gz	gtdb_genomes_reps_r220/database/GCF/003/030/305/GCF_003030305.1_genomic.fna.gz	97.72	0.147	96.90-98.36	0.147	0.11-0.19	1	1.071	704/10561	91.63	NZ_CP023676.1 Cutibacterium acnes strain ATCC 6919 chromosome, complete genome
trimmed_read1_3000886283-DNA.fastq.gz	gtdb_genomes_reps_r220/database/GCF/002/902/725/GCF_002902725.1_genomic.fna.gz	97.04	0.151	96.02-97.65	0.151	0.12-0.20	1	1.107	609/11056	91.07	NZ_PPRT01000001.1 Staphylococcus caprae strain NCTC 12196 f72aa3be-e669-408b-85af-2c2ab29b1624_c1, whole genome shotgun sequence
trimmed_read1_3000886283-DNA.fastq.gz	gtdb_genomes_reps_r220/database/GCF/028/621/715/GCF_028621715.1_genomic.fna.gz	96.24	0.161	95.38-96.93	0.161	0.12-0.21	1	1.087	608/13401	90.50	NZ_CP117466.1 Paracoccus marcusii strain MBLB0836 chromosome, complete genome
trimmed_read1_3000886283-DNA.fastq.gz	gtdb_genomes_reps_r220/database/GCF/006/742/205/GCF_006742205.1_genomic.fna.gz	95.60	0.103	94.30-96.88	0.103	0.07-0.16	1	1.089	247/10141	88.71	NZ_AP019721.1 Staphylococcus epidermidis strain NBRC 100911 chromosome, complete genome
trimmed_read1_3000886283-DNA.fastq.gz	gtdb_genomes_reps_r220/database/GCF/016/894/265/GCF_016894265.1_genomic.fna.gz	95.09	0.172	94.15-96.23	0.172	0.11-0.24	1	1.085	330/9961	89.59	NZ_CP069791.1 Corynebacterium tuberculostearicum strain FDAARGOS_1198 chromosome
trimmed_read1_3000886283-DNA.fastq.gz	gtdb_genomes_reps_r220/database/GCF/000/960/005/GCF_000960005.1_genomic.fna.gz	95.02	0.190	93.83-95.96	0.190	0.14-0.28	1	1.110	291/8198	89.79	NZ_JYGP01000001.1 Streptococcus mitis strain OT25 TZ90_contig000001, whole genome shotgun sequence
trimmed_read1_3000886283-DNA.fastq.gz	gtdb_genomes_reps_r220/database/GCF/000/722/765/GCF_000722765.2_genomic.fna.gz	95.01	0.150	93.78-96.62	0.150	0.09-0.23	1	1.099	232/8136	89.16	NZ_CP028415.1 Streptococcus mitis strain SK637 chromosome, complete genome
trimmed_read1_3000886283-DNA.fastq.gz	gtdb_genomes_reps_r220/database/GCF/003/942/775/GCF_003942775.1_genomic.fna.gz	94.98	0.208	93.85-95.59	0.208	0.16-0.29	1	1.180	338/8873	90.00	NZ_RJNX01000001.1 Streptococcus mitis strain BCC65 D8848_contig001, whole genome shotgun sequence
trimmed_read1_3000886283-DNA.fastq.gz	gtdb_genomes_reps_r220/database/GCA/000/471/045/GCA_000471045.1_genomic.fna.gz	94.96	0.118	93.78-96.37	0.118	0.08-0.17	1	1.117	291/12965	88.47	KI301992.1 actinobacterium LLX17 genomic scaffold scaffold00001, whole genome shotgun sequence
trimmed_read1_3000886283-DNA.fastq.gz	gtdb_genomes_reps_r220/database/GCF/000/220/085/GCF_000220085.1_genomic.fna.gz	94.96	0.151	93.95-96.15	0.151	0.09-0.22	1	1.079	229/8111	89.13	NZ_AFQV01000034.1 Streptococcus mitis SK1080 ctg1129645366110, whole genome shotgun sequence
trimmed_read1_3000886283-DNA.fastq.gz	gtdb_genomes_reps_r220/database/GCF/001/076/775/GCF_001076775.1_genomic.fna.gz	94.81	0.211	93.68-95.64	0.211	0.16-0.31	1	1.131	320/8803	89.86	NZ_JVGV01000002.1 Streptococcus pseudopneumoniae strain 445_SPSE 160_1845_293894, whole genome shotgun sequence
trimmed_read1_3000886283-DNA.fastq.gz	gtdb_genomes_reps_r220/database/GCF/002/096/755/GCF_002096755.1_genomic.fna.gz	94.74	0.226	93.87-95.48	0.226	0.17-0.30	1	1.173	335/8803	89.99	NZ_NCVF01000026.1 Streptococcus mitis strain RH_50275_09 s_mitis_RH_50275_09_ID_1, whole genome shotgun sequence
trimmed_read1_3000886283-DNA.fastq.gz	gtdb_genomes_reps_r220/database/GCF/946/190/335/GCF_946190335.1_genomic.fna.gz	94.70	0.213	93.58-95.60	0.213	0.15-0.30	1	1.217	290/8196	89.78	NZ_CAMHZN010000001.1 Streptococcus mitis isolate Streptococcus mitis NODE_1_length_678925_cov_140.780463, whole genome shotgun sequence
trimmed_read1_3000886283-DNA.fastq.gz	gtdb_genomes_reps_r220/database/GCF/002/238/115/GCF_002238115.1_genomic.fna.gz	94.67	0.172	93.59-95.61	0.172	0.12-0.24	1	1.221	276/9550	89.20	NZ_NGVM01000099.1 Streptococcus sp. KR NODE_100_length_653_cov_34.199, whole genome shotgun sequence
trimmed_read1_3000886283-DNA.fastq.gz	gtdb_genomes_reps_r220/database/GCF/006/385/165/GCF_006385165.1_genomic.fna.gz	94.61	0.168	93.34-95.96	0.168	0.09-0.25	1	1.112	197/7122	89.07	NZ_VFJA01000001.1 Streptococcus symci strain C17 Scaffold1, whole genome shotgun sequence
trimmed_read1_3000886283-DNA.fastq.gz	gtdb_genomes_reps_r220/database/GCA/927/911/355/GCA_927911355.1_genomic.fna.gz	94.59	0.245	93.61-95.43	0.245	0.18-0.33	1	1.134	269/6958	90.04	CAKMPG010000001.1 MAG TPA_asm: Streptococcus mitis isolate ERR3827238_bin.2_metaWRAP_v1.1_MAG genome assembly, contig: ERZ4768210.2, whole genome shotgun sequence
trimmed_read1_3000886283-DNA.fastq.gz	gtdb_genomes_reps_r220/database/GCA/905/221/155/GCA_905221155.1_genomic.fna.gz	94.57	0.191	93.44-95.58	0.191	0.13-0.28	1	1.218	261/8454	89.39	CAJNCB010000001.1 unidentified bacterium isolate Streptococcus species genome assembly, contig: NODE_1_length_917501_cov_53.194, whole genome shotgun sequence
trimmed_read1_3000886283-DNA.fastq.gz	gtdb_genomes_reps_r220/database/GCF/023/109/515/GCF_023109515.1_genomic.fna.gz	94.52	0.253	93.65-95.19	0.253	0.20-0.33	1	1.185	340/8654	90.09	NZ_JALDUM010000010.1 Streptococcus mitis strain S39 NODE_10_length_3920_cov_103.945149, whole genome shotgun sequence
trimmed_read1_3000886283-DNA.fastq.gz	gtdb_genomes_reps_r220/database/GCA/947/253/175/GCA_947253175.1_genomic.fna.gz	94.48	0.176	93.09-96.36	0.176	0.09-0.27	1	1.102	157/5429	89.20	CAMXYG010000001.1 MAG TPA_asm: uncultured Streptococcus sp. isolate SRR17635508_bin.2_metaWRAP_v1.3_MAG genome assembly, contig: ERZ14212505.19, whole genome shotgun sequence
trimmed_read1_3000886283-DNA.fastq.gz	gtdb_genomes_reps_r220/database/GCF/017/310/035/GCF_017310035.1_genomic.fna.gz	94.47	0.114	93.50-95.47	0.114	0.08-0.16	1	1.065	372/20108	87.92	NZ_CP022296.1 Nocardioides sp. S5 chromosome, complete genome
trimmed_read1_3000886283-DNA.fastq.gz	gtdb_genomes_reps_r220/database/GCF/009/496/205/GCF_009496205.1_genomic.fna.gz	94.46	0.212	93.40-95.15	0.212	0.15-0.29	1	1.218	280/8560	89.55	NZ_WIJO01000100.1 Streptococcus mitis strain SM11 NODE_100_length_1969_cov_22.233985, whole genome shotgun sequence
trimmed_read1_3000886283-DNA.fastq.gz	gtdb_genomes_reps_r220/database/GCA/916/050/595/GCA_916050595.1_genomic.fna.gz	94.42	0.218	93.22-95.97	0.218	0.13-0.34	1	1.114	184/5573	89.58	CAJZLM010000001.1 MAG TPA_asm: Streptococcus mitis isolate ERR2765141_bin.1_metaWRAP_v1.1_MAG genome assembly, contig: ERZ1674214.1, whole genome shotgun sequence
trimmed_read1_3000886283-DNA.fastq.gz	gtdb_genomes_reps_r220/database/GCF/022/179/765/GCF_022179765.1_genomic.fna.gz	94.41	0.108	93.26-95.45	0.108	0.07-0.16	1	1.085	412/23866	87.73	NZ_BPRE01000001.1 Methylorubrum suomiense strain DSM 14458 entry1, whole genome shotgun sequence
trimmed_read1_3000886283-DNA.fastq.gz	gtdb_genomes_reps_r220/database/GCF/019/218/685/GCF_019218685.1_genomic.fna.gz	94.39	0.208	93.23-95.45	0.208	0.14-0.30	1	1.227	264/8424	89.43	NZ_JAHUZC010000010.1 Streptococcus vulneris strain DM3B3 NODE_10_length_85275_cov_315.799702, whole genome shotgun sequence
trimmed_read1_3000886283-DNA.fastq.gz	gtdb_genomes_reps_r220/database/GCF/019/448/275/GCF_019448275.1_genomic.fna.gz	94.37	0.207	93.19-95.21	0.207	0.14-0.29	1	1.240	267/8602	89.40	NZ_JAHXBZ010000001.1 Streptococcus humanilactis strain IMAU99125 IMAU99125, whole genome shotgun sequence
trimmed_read1_3000886283-DNA.fastq.gz	gtdb_genomes_reps_r220/database/GCF/026/782/895/GCF_026782895.1_genomic.fna.gz	94.36	0.268	93.45-95.05	0.268	0.19-0.36	1	1.240	334/8605	90.05	NZ_JAKUXJ010000010.1 Streptococcus mitis strain D13054009 D13054009_S15_contig_10_consensus, whole genome shotgun sequence
trimmed_read1_3000886283-DNA.fastq.gz	gtdb_genomes_reps_r220/database/GCF/001/281/025/GCF_001281025.1_genomic.fna.gz	94.35	0.273	93.48-95.31	0.273	0.19-0.36	1	1.141	311/7893	90.09	NZ_CP012646.1 Streptococcus mitis strain KCOM 1350 (= ChDC B183) chromosome, complete genome
trimmed_read1_3000886283-DNA.fastq.gz	gtdb_genomes_reps_r220/database/GCF/000/187/745/GCF_000187745.1_genomic.fna.gz	94.35	0.168	93.32-95.62	0.168	0.11-0.25	1	1.158	241/9331	88.87	NZ_GL732486.1 Streptococcus sp. M334 supercont1.1, whole genome shotgun sequence
trimmed_read1_3000886283-DNA.fastq.gz	gtdb_genomes_reps_r220/database/GCF/002/005/545/GCF_002005545.1_genomic.fna.gz	94.34	0.179	93.32-95.44	0.179	0.13-0.27	1	1.119	235/8727	88.99	NZ_LBMT01000001.1 Streptococcus mitis strain 321A Scaffold1, whole genome shotgun sequence
trimmed_read1_3000886283-DNA.fastq.gz	gtdb_genomes_reps_r220/database/GCF/023/109/235/GCF_023109235.1_genomic.fna.gz	94.33	0.236	93.44-95.29	0.236	0.16-0.31	1	1.240	275/7968	89.71	NZ_JALDUC010000010.1 Streptococcus mitis strain S53 NODE_10_length_93322_cov_198.967258, whole genome shotgun sequence
trimmed_read1_3000886283-DNA.fastq.gz	gtdb_genomes_reps_r220/database/GCF/008/763/935/GCF_008763935.1_genomic.fna.gz	94.33	0.251	93.39-94.95	0.251	0.19-0.35	1	1.167	341/9346	89.87	NZ_VTQF01000017.1 Streptococcus mitis strain DE0498 NODE_100_length_5450_cov_55.629293, whole genome shotgun sequence
trimmed_read1_3000886283-DNA.fastq.gz	gtdb_genomes_reps_r220/database/GCA/905/221/245/GCA_905221245.1_genomic.fna.gz	94.33	0.216	93.37-95.21	0.216	0.15-0.30	1	1.180	266/8315	89.49	CAJNCK010000001.1 unidentified bacterium isolate Streptococcus species genome assembly, contig: NODE_1_length_394086_cov_61.6465, whole genome shotgun sequence
trimmed_read1_3000886283-DNA.fastq.gz	gtdb_genomes_reps_r220/database/GCF/002/096/835/GCF_002096835.1_genomic.fna.gz	94.33	0.214	93.28-95.30	0.214	0.15-0.29	1	1.253	249/7905	89.45	NZ_NCVG01000023.1 Streptococcus mitis strain RH_43861_09 s_mitis_RH_43861_09_ID_1, whole genome shotgun sequence
trimmed_read1_3000886283-DNA.fastq.gz	gtdb_genomes_reps_r220/database/GCA/000/385/835/GCA_000385835.1_genomic.fna.gz	94.28	0.192	93.05-95.14	0.192	0.14-0.28	1	1.184	250/8836	89.14	AQTU01000001.1 Streptococcus mitis 13/39 contig00001, whole genome shotgun sequence
trimmed_read1_3000886283-DNA.fastq.gz	gtdb_genomes_reps_r220/database/GCF/003/942/765/GCF_003942765.1_genomic.fna.gz	94.26	0.216	93.23-95.21	0.216	0.16-0.30	1	1.327	272/8775	89.40	NZ_RJNW01000001.1 Streptococcus mitis strain KLC01 D8849_contig001, whole genome shotgun sequence
trimmed_read1_3000886283-DNA.fastq.gz	gtdb_genomes_reps_r220/database/GCF/020/089/495/GCF_020089495.2_genomic.fna.gz	94.26	0.212	93.12-95.07	0.212	0.15-0.31	1	1.215	261/8470	89.38	NZ_JAIRCA020000001.1 Streptococcus sp. IMAU 99199 IMAU99199, whole genome shotgun sequence
trimmed_read1_3000886283-DNA.fastq.gz	gtdb_genomes_reps_r220/database/GCF/002/096/735/GCF_002096735.1_genomic.fna.gz	94.19	0.301	93.47-94.83	0.301	0.23-0.38	1	1.187	337/8264	90.19	NZ_NCVC01000017.1 Streptococcus mitis strain RH_8961_10 s_mitis_RH_8961_10_ID_1, whole genome shotgun sequence
trimmed_read1_3000886283-DNA.fastq.gz	gtdb_genomes_reps_r220/database/GCA/927/911/535/GCA_927911535.1_genomic.fna.gz	94.18	0.212	92.94-95.46	0.212	0.13-0.31	1	1.124	201/6752	89.28	CAKMQC010000001.1 MAG TPA_asm: Streptococcus mitis isolate ERR3827286_bin.1_metaWRAP_v1.1_MAG genome assembly, contig: ERZ4768129.98, whole genome shotgun sequence
trimmed_read1_3000886283-DNA.fastq.gz	gtdb_genomes_reps_r220/database/GCF/022/137/125/GCF_022137125.1_genomic.fna.gz	94.16	0.246	93.07-95.17	0.246	0.17-0.35	1	1.250	276/8173	89.65	NZ_JAKNEQ010000001.1 Streptococcus mitis strain DFI.2.96 NNOOAJHE_1, whole genome shotgun sequence
trimmed_read1_3000886283-DNA.fastq.gz	gtdb_genomes_reps_r220/database/GCF/023/110/245/GCF_023110245.1_genomic.fna.gz	94.15	0.240	93.15-94.99	0.240	0.18-0.33	1	1.186	280/8455	89.59	NZ_JALDVR010000010.1 Streptococcus mitis strain S03 NODE_10_length_52279_cov_241.670492, whole genome shotgun sequence
trimmed_read1_3000886283-DNA.fastq.gz	gtdb_genomes_reps_r220/database/GCA/905/369/855/GCA_905369855.1_genomic.fna.gz	94.14	0.251	93.09-95.11	0.251	0.16-0.37	1	1.128	235/6873	89.68	CAJPJN010000001.1 MAG: Streptococcus oralis isolate DRR046084-mag-bin.1 genome assembly, contig: DRR046084-mag-bin.1_2, whole genome shotgun sequence
trimmed_read1_3000886283-DNA.fastq.gz	gtdb_genomes_reps_r220/database/GCA/001/914/195/GCA_001914195.1_genomic.fna.gz	94.14	0.195	93.11-95.63	0.195	0.12-0.29	1	1.101	237/8685	89.03	MKYF01000030.1 MAG: Streptococcus mitis isolate 0123W_40_11 0123W_scaffold_1041, whole genome shotgun sequence
trimmed_read1_3000886283-DNA.fastq.gz	gtdb_genomes_reps_r220/database/GCF/946/190/145/GCF_946190145.1_genomic.fna.gz	94.14	0.199	93.05-94.94	0.199	0.15-0.28	1	1.232	254/9123	89.09	NZ_CAMHZM010000001.1 Streptococcus mitis isolate Streptococcus mitis NODE_1_length_492142_cov_74.508555, whole genome shotgun sequence
trimmed_read1_3000886283-DNA.fastq.gz	gtdb_genomes_reps_r220/database/GCF/013/305/725/GCF_013305725.1_genomic.fna.gz	94.13	0.205	93.18-95.31	0.205	0.13-0.30	1	1.101	248/8720	89.15	NZ_CP047883.1 Streptococcus mitis strain S022-V3-A4 chromosome, complete genome
trimmed_read1_3000886283-DNA.fastq.gz	gtdb_genomes_reps_r220/database/GCF/000/722/775/GCF_000722775.1_genomic.fna.gz	94.12	0.194	93.14-95.45	0.194	0.11-0.28	1	1.105	239/8856	89.00	NZ_JPFZ01000001.1 Streptococcus mitis strain SK608 gsmSK608.contig.0_1, whole genome shotgun sequence
trimmed_read1_3000886283-DNA.fastq.gz	gtdb_genomes_reps_r220/database/GCA/943/914/425/GCA_943914425.1_genomic.fna.gz	94.11	0.190	92.91-95.45	0.190	0.12-0.31	1	1.106	198/7525	88.93	CALUBZ010000001.1 MAG: uncultured Streptococcus sp. isolate aroCPJTBUv_bin.11.MAG genome assembly, contig: NODE_96_length_79274_cov_20.784913, whole genome shotgun sequence
trimmed_read1_3000886283-DNA.fastq.gz	gtdb_genomes_reps_r220/database/GCF/003/942/685/GCF_003942685.1_genomic.fna.gz	94.10	0.226	93.16-95.11	0.226	0.16-0.31	1	1.257	268/8731	89.37	NZ_RJNR01000001.1 Streptococcus mitis strain BCA12 D8855_contig001, whole genome shotgun sequence
trimmed_read1_3000886283-DNA.fastq.gz	gtdb_genomes_reps_r220/database/GCF/001/650/315/GCF_001650315.1_genomic.fna.gz	94.08	0.239	93.09-95.10	0.239	0.17-0.34	1	1.236	263/8172	89.51	NZ_LVJM01000001.1 Streptococcus sp. CCUG 49591 contig_1, whole genome shotgun sequence
trimmed_read1_3000886283-DNA.fastq.gz	gtdb_genomes_reps_r220/database/GCF/003/942/965/GCF_003942965.1_genomic.fna.gz	94.06	0.236	93.05-95.05	0.236	0.16-0.33	1	1.188	255/8015	89.47	NZ_RJOG01000001.1 Streptococcus mitis strain BCC07 D8837_contig001, whole genome shotgun sequence
trimmed_read1_3000886283-DNA.fastq.gz	gtdb_genomes_reps_r220/database/GCF/020/102/855/GCF_020102855.1_genomic.fna.gz	94.06	0.138	93.12-95.25	0.138	0.09-0.19	1	1.138	378/19529	88.05	NZ_JADHZD010000001.1 Nocardioides lacusdianchii strain JXJ CY 38 NODE_1, whole genome shotgun sequence
trimmed_read1_3000886283-DNA.fastq.gz	gtdb_genomes_reps_r220/database/GCF/002/096/815/GCF_002096815.1_genomic.fna.gz	94.05	0.215	92.99-94.94	0.215	0.14-0.30	1	1.194	247/8476	89.22	NZ_NCVJ01000021.1 Streptococcus mitis strain RH_12363_08 s_mitis_RH_12363_08_ID_1, whole genome shotgun sequence
trimmed_read1_3000886283-DNA.fastq.gz	gtdb_genomes_reps_r220/database/GCF/009/496/295/GCF_009496295.1_genomic.fna.gz	94.04	0.286	93.09-94.75	0.286	0.22-0.38	1	1.204	323/8682	89.93	NZ_WIJL01000010.1 Streptococcus mitis strain SM15 NODE_10_length_116604_cov_16.980606, whole genome shotgun sequence
trimmed_read1_3000886283-DNA.fastq.gz	gtdb_genomes_reps_r220/database/GCF/002/096/855/GCF_002096855.1_genomic.fna.gz	94.04	0.224	93.07-94.93	0.224	0.15-0.30	1	1.198	248/8240	89.31	NZ_NCVH01000033.1 Streptococcus mitis strain RH_17439_08 s_mitis_RH_17439_08_ID_1, whole genome shotgun sequence
trimmed_read1_3000886283-DNA.fastq.gz	gtdb_genomes_reps_r220/database/GCF/905/187/495/GCF_905187495.1_genomic.fna.gz	94.01	0.250	93.03-94.78	0.250	0.19-0.34	1	1.241	270/8287	89.54	NZ_CAJJIB010000001.1 Streptococcus mitis isolate Streptococcus mitis, whole genome shotgun sequence
trimmed_read1_3000886283-DNA.fastq.gz	gtdb_genomes_reps_r220/database/GCF/000/148/525/GCF_000148525.1_genomic.fna.gz	94.01	0.202	92.81-95.17	0.202	0.13-0.30	1	1.108	231/8584	88.99	NZ_AEDU01000035.1 Streptococcus mitis SK564 contigB3, whole genome shotgun sequence
trimmed_read1_3000886283-DNA.fastq.gz	gtdb_genomes_reps_r220/database/GCF/003/942/995/GCF_003942995.1_genomic.fna.gz	93.99	0.283	93.19-94.87	0.283	0.19-0.36	1	1.178	325/8973	89.85	NZ_RJOH01000001.1 Streptococcus mitis strain BCC06 D8836_contig001, whole genome shotgun sequence
trimmed_read1_3000886283-DNA.fastq.gz	gtdb_genomes_reps_r220/database/GCF/946/188/375/GCF_946188375.1_genomic.fna.gz	93.97	0.252	93.06-94.65	0.252	0.19-0.34	1	1.197	289/8818	89.56	NZ_CAMHUS010000001.1 Streptococcus mitis isolate Streptococcus mitis NODE_1_length_514561_cov_115.905146, whole genome shotgun sequence
trimmed_read1_3000886283-DNA.fastq.gz	gtdb_genomes_reps_r220/database/GCF/943/912/555/GCF_943912555.1_genomic.fna.gz	93.94	0.195	92.71-95.54	0.195	0.11-0.30	1	1.112	205/8048	88.83	NZ_CALTUR010000001.1 MAG: uncultured Streptococcus sp. isolate WUFO5OxywB_bin.3.MAG NODE_36_length_53999_cov_11.507230, whole genome shotgun sequence
trimmed_read1_3000886283-DNA.fastq.gz	gtdb_genomes_reps_r220/database/GCF/002/096/925/GCF_002096925.1_genomic.fna.gz	93.94	0.254	92.84-94.63	0.254	0.19-0.36	1	1.199	276/8477	89.54	NZ_NCVN01000085.1 Streptococcus mitis strain B_009152_10 s_mitis_RS_009152_10_ID_1, whole genome shotgun sequence
trimmed_read1_3000886283-DNA.fastq.gz	gtdb_genomes_reps_r220/database/GCF/946/188/685/GCF_946188685.1_genomic.fna.gz	93.94	0.274	93.12-94.75	0.274	0.20-0.37	1	1.200	310/8937	89.72	NZ_CAMHWH010000001.1 Streptococcus mitis isolate Streptococcus mitis NODE_1_length_368939_cov_97.626665, whole genome shotgun sequence
trimmed_read1_3000886283-DNA.fastq.gz	gtdb_genomes_reps_r220/database/GCA/927/910/965/GCA_927910965.1_genomic.fna.gz	93.93	0.215	92.82-94.78	0.215	0.15-0.31	1	1.218	248/8896	89.09	CAKMOM010000001.1 MAG TPA_asm: uncultured Streptococcus sp. isolate ERR3827222_bin.1_metaWRAP_v1.1_MAG genome assembly, contig: ERZ4768407.87, whole genome shotgun sequence
trimmed_read1_3000886283-DNA.fastq.gz	gtdb_genomes_reps_r220/database/GCF/000/027/165/GCF_000027165.1_genomic.fna.gz	93.92	0.210	92.86-94.93	0.210	0.15-0.32	1	1.131	236/8732	89.00	NC_013853.1 Streptococcus mitis B6, complete sequence
trimmed_read1_3000886283-DNA.fastq.gz	gtdb_genomes_reps_r220/database/GCF/024/346/585/GCF_024346585.1_genomic.fna.gz	93.90	0.270	92.89-94.71	0.270	0.20-0.36	1	1.155	291/8660	89.63	NZ_AP024523.1 Streptococcus toyakuensis strain TP1632 chromosome, complete genome
trimmed_read1_3000886283-DNA.fastq.gz	gtdb_genomes_reps_r220/database/GCF/946/190/155/GCF_946190155.1_genomic.fna.gz	93.89	0.234	92.92-94.86	0.234	0.16-0.32	1	1.223	247/8327	89.27	NZ_CAMHZL010000001.1 Streptococcus mitis isolate Streptococcus mitis NODE_1_length_388548_cov_94.757163, whole genome shotgun sequence
trimmed_read1_3000886283-DNA.fastq.gz	gtdb_genomes_reps_r220/database/GCF/019/929/545/GCF_019929545.1_genomic.fna.gz	93.89	0.250	92.82-94.65	0.250	0.18-0.35	1	1.252	262/8371	89.43	NZ_JAHZPT010000001.1 Streptococcus mitis strain CR123 Smitis_CR123_NinaOddballs_Sia_NO_1, whole genome shotgun sequence
trimmed_read1_3000886283-DNA.fastq.gz	gtdb_genomes_reps_r220/database/GCF/000/257/905/GCF_000257905.1_genomic.fna.gz	93.88	0.207	92.80-94.91	0.207	0.14-0.30	1	1.272	224/8469	88.94	NZ_AJJL01000001.1 Streptococcus mitis SK579 contig00033, whole genome shotgun sequence
trimmed_read1_3000886283-DNA.fastq.gz	gtdb_genomes_reps_r220/database/GCF/001/074/635/GCF_001074635.1_genomic.fna.gz	93.86	0.240	92.76-94.77	0.240	0.17-0.33	1	1.196	271/8979	89.32	NZ_JUQO01000001.1 Streptococcus mitis strain 850_SMIT 0_226_2877, whole genome shotgun sequence
trimmed_read1_3000886283-DNA.fastq.gz	gtdb_genomes_reps_r220/database/GCF/000/220/045/GCF_000220045.1_genomic.fna.gz	93.85	0.206	92.82-95.35	0.206	0.13-0.29	1	1.102	226/8681	88.90	NZ_AFQT01000054.1 Streptococcus mitis SK1073 ctg1129645355399, whole genome shotgun sequence
trimmed_read1_3000886283-DNA.fastq.gz	gtdb_genomes_reps_r220/database/GCF/022/347/205/GCF_022347205.1_genomic.fna.gz	93.82	0.172	92.74-94.96	0.172	0.11-0.26	1	1.188	223/10164	88.41	NZ_JAKRNE010000010.1 Corynebacterium sp. ACRPO NODE_10_length_90094_cov_17.272148_pilon, whole genome shotgun sequence
trimmed_read1_3000886283-DNA.fastq.gz	gtdb_genomes_reps_r220/database/GCF/946/188/615/GCF_946188615.1_genomic.fna.gz	93.81	0.305	92.94-94.51	0.305	0.23-0.40	1	1.246	313/8605	89.86	NZ_CAMHVK010000001.1 Streptococcus mitis isolate Streptococcus mitis NODE_1_length_383254_cov_94.802522, whole genome shotgun sequence
trimmed_read1_3000886283-DNA.fastq.gz	gtdb_genomes_reps_r220/database/GCF/001/560/895/GCF_001560895.1_genomic.fna.gz	93.79	0.180	92.61-95.64	0.180	0.09-0.29	1	1.107	196/8692	88.49	NZ_CP014326.1 Streptococcus mitis strain SVGS_061 chromosome, complete genome
trimmed_read1_3000886283-DNA.fastq.gz	gtdb_genomes_reps_r220/database/GCF/005/144/795/GCF_005144795.1_genomic.fna.gz	93.78	0.229	92.70-94.69	0.229	0.16-0.33	1	1.266	237/8446	89.11	NZ_SWFJ01000010.1 Streptococcus mitis strain ColumbLawn NODE_10_length_101543_cov_167.293110, whole genome shotgun sequence
trimmed_read1_3000886283-DNA.fastq.gz	gtdb_genomes_reps_r220/database/GCF/946/190/285/GCF_946190285.1_genomic.fna.gz	93.77	0.255	92.79-94.54	0.255	0.19-0.34	1	1.219	260/8428	89.39	NZ_CAMHZX010000001.1 Streptococcus mitis isolate Streptococcus mitis NODE_1_length_750225_cov_136.047748, whole genome shotgun sequence
trimmed_read1_3000886283-DNA.fastq.gz	gtdb_genomes_reps_r220/database/GCA/934/216/185/GCA_934216185.1_genomic.fna.gz	93.76	0.184	92.66-95.06	0.184	0.12-0.27	1	1.208	197/8588	88.54	CAKQBM010000001.1 MAG: uncultured Streptococcus sp. isolate REFINED_METABAT215_TOP10_CONTIGS_1500_ASSEMBLY_K77_MERGED__Hadza_MoBio_hadza-E-H_O_24_1936.13 genome assembly, contig: Hadza_MoBio_hadza-E-H_O_24_1936__NODE_170_length_36231_cov_7.962355, whole genome shotgun sequence
trimmed_read1_3000886283-DNA.fastq.gz	gtdb_genomes_reps_r220/database/GCF/915/066/115/GCF_915066115.1_genomic.fna.gz	93.76	0.245	92.72-94.82	0.245	0.17-0.36	1	1.113	231/7792	89.27	NZ_CAJZDT010000001.1 MAG: uncultured Streptococcus sp. isolate SRR1045100_bin.1_metaWRAP_v1.1_MAG, whole genome shotgun sequence
trimmed_read1_3000886283-DNA.fastq.gz	gtdb_genomes_reps_r220/database/GCF/003/942/865/GCF_003942865.1_genomic.fna.gz	93.75	0.229	92.67-94.99	0.229	0.15-0.33	1	1.253	233/8424	89.07	NZ_RJNZ01000001.1 Streptococcus mitis strain BCC55 D8845_contig001, whole genome shotgun sequence
trimmed_read1_3000886283-DNA.fastq.gz	gtdb_genomes_reps_r220/database/GCF/000/148/585/GCF_000148585.2_genomic.fna.gz	93.75	0.297	92.86-94.62	0.297	0.21-0.39	1	1.177	277/7991	89.72	NZ_CP028414.1 Streptococcus mitis NCTC 12261 chromosome, complete genome
trimmed_read1_3000886283-DNA.fastq.gz	gtdb_genomes_reps_r220/database/GCF/003/491/325/GCF_003491325.1_genomic.fna.gz	93.72	0.079	91.71-95.21	0.079	0.05-0.16	1	1.038	105/10285	86.25	NZ_CP022881.1 Staphylococcus sp. M0911 chromosome, complete genome
trimmed_read1_3000886283-DNA.fastq.gz	gtdb_genomes_reps_r220/database/GCA/905/221/285/GCA_905221285.1_genomic.fna.gz	93.72	0.275	92.70-94.46	0.275	0.20-0.38	1	1.207	275/8485	89.53	CAJNCM010000001.1 unidentified bacterium isolate Streptococcus species genome assembly, contig: NODE_1_length_380604_cov_54.0563, whole genome shotgun sequence
trimmed_read1_3000886283-DNA.fastq.gz	gtdb_genomes_reps_r220/database/GCF/013/276/795/GCF_013276795.1_genomic.fna.gz	93.71	0.222	92.70-94.85	0.222	0.15-0.32	1	1.192	229/8538	88.98	NZ_VMLR01000001.1 Streptococcus sp. 2342 2342_S22_L001_R1_001_(paired)_contig_1, whole genome shotgun sequence
trimmed_read1_3000886283-DNA.fastq.gz	gtdb_genomes_reps_r220/database/GCA/000/430/305/GCA_000430305.1_genomic.fna.gz	93.70	0.193	92.50-95.21	0.193	0.11-0.29	1	1.195	190/8074	88.61	ASZZ01000001.1 Streptococcus mitis 17/34 contig00001, whole genome shotgun sequence
trimmed_read1_3000886283-DNA.fastq.gz	gtdb_genomes_reps_r220/database/GCF/019/414/905/GCF_019414905.1_genomic.fna.gz	93.69	0.236	92.53-94.79	0.236	0.16-0.38	1	1.119	202/7206	89.11	NZ_DXLC01000001.1 MAG: Streptococcus sp. isolate HRGM_Genome_0314 HRGM_Genome_0314_1, whole genome shotgun sequence
trimmed_read1_3000886283-DNA.fastq.gz	gtdb_genomes_reps_r220/database/GCF/002/096/895/GCF_002096895.1_genomic.fna.gz	93.67	0.290	92.94-94.47	0.290	0.21-0.38	1	1.203	261/7832	89.61	NZ_NCVI01000020.1 Streptococcus mitis strain RH_17024_08 s_mitis_RH_17024_08_ID_1, whole genome shotgun sequence
