Sample_file	Genome_file	Adjusted_ANI	Eff_cov	ANI_5-95_percentile	Eff_lambda	Lambda_5-95_percentile	Median_cov	Mean_cov_geq1	Containment_ind	Naive_ANI	Contig_name
trimmed_read1_3001428260-DNA.fastq.gz	gtdb_genomes_reps_r220/database/GCF/001/679/005/GCF_001679005.1_genomic.fna.gz	98.34	0.801	98.18-98.56	0.801	0.73-0.85	1	1.518	3227/9834	96.47	NZ_LXTW01000001.1 Moraxella nonliquefaciens strain CCUG 348 contig_1, whole genome shotgun sequence
trimmed_read1_3001428260-DNA.fastq.gz	gtdb_genomes_reps_r220/database/GCF/900/475/755/GCF_900475755.1_genomic.fna.gz	98.10	0.225	97.53-98.60	0.225	0.19-0.27	1	1.110	873/7845	93.16	NZ_LS483411.1 Haemophilus influenzae strain NCTC11426 chromosome 1, complete sequence
trimmed_read1_3001428260-DNA.fastq.gz	gtdb_genomes_reps_r220/database/GCF/000/245/815/GCF_000245815.1_genomic.fna.gz	97.66	0.185	96.99-98.30	0.185	0.14-0.23	1	1.098	633/7821	92.21	NZ_JH601103.1 Dolosigranulum pigrum ATCC 51524 supercont1.1, whole genome shotgun sequence
trimmed_read1_3001428260-DNA.fastq.gz	gtdb_genomes_reps_r220/database/GCF/002/984/305/GCF_002984305.1_genomic.fna.gz	95.64	0.221	94.67-96.40	0.221	0.17-0.30	1	1.127	425/8528	90.78	NZ_NEAA01000096.1 Haemophilus influenzae strain 135P16H1 N135P16H1_100_1, whole genome shotgun sequence
trimmed_read1_3001428260-DNA.fastq.gz	gtdb_genomes_reps_r220/database/GCF/003/030/305/GCF_003030305.1_genomic.fna.gz	95.59	0.057	93.12-96.90	0.057	0.04-0.12	1	1.041	145/10561	87.08	NZ_CP023676.1 Cutibacterium acnes strain ATCC 6919 chromosome, complete genome
trimmed_read1_3001428260-DNA.fastq.gz	gtdb_genomes_reps_r220/database/GCF/001/457/655/GCF_001457655.1_genomic.fna.gz	95.37	0.259	94.61-95.99	0.259	0.20-0.33	1	1.115	419/7983	90.93	NZ_LN831035.1 Haemophilus influenzae strain NCTC8143 chromosome 1, complete sequence
trimmed_read1_3001428260-DNA.fastq.gz	gtdb_genomes_reps_r220/database/GCF/019/703/545/GCF_019703545.1_genomic.fna.gz	95.32	0.250	94.47-95.99	0.250	0.19-0.32	1	1.111	405/8083	90.79	NZ_AP018771.1 Haemophilus influenzae strain CHBN-II-8 isolate 10H27 chromosome, complete genome
trimmed_read1_3001428260-DNA.fastq.gz	gtdb_genomes_reps_r220/database/GCF/005/888/195/GCF_005888195.1_genomic.fna.gz	94.61	0.253	93.85-95.23	0.253	0.20-0.34	1	1.112	330/8234	90.14	NZ_LNKR01000001.1 Haemophilus influenzae biotype aegyptius strain KC1018 contig_001, whole genome shotgun sequence
trimmed_read1_3001428260-DNA.fastq.gz	gtdb_genomes_reps_r220/database/GCF/000/222/025/GCF_000222025.1_genomic.fna.gz	93.80	0.274	92.68-94.55	0.274	0.20-0.40	1	1.120	249/7558	89.58	NZ_AFQO01000022.1 Haemophilus haemolyticus M19501 M19501_022, whole genome shotgun sequence
trimmed_read1_3001428260-DNA.fastq.gz	gtdb_genomes_reps_r220/database/GCF/001/276/515/GCF_001276515.1_genomic.fna.gz	93.67	0.242	92.69-94.59	0.242	0.18-0.33	1	1.160	244/8635	89.13	NZ_LDVZ01000082.1 Haemophilus sp. C1 contig398, whole genome shotgun sequence
trimmed_read1_3001428260-DNA.fastq.gz	gtdb_genomes_reps_r220/database/GCF/003/493/605/GCF_003493605.1_genomic.fna.gz	93.57	0.273	92.68-94.60	0.273	0.19-0.38	1	1.197	239/7850	89.35	NZ_QQKA01000001.1 Haemophilus haemolyticus strain M19187 M19187_HUY4190A139_cleaned_ctg_3530, whole genome shotgun sequence
trimmed_read1_3001428260-DNA.fastq.gz	gtdb_genomes_reps_r220/database/GCF/003/490/595/GCF_003490595.1_genomic.fna.gz	93.32	0.196	92.03-94.82	0.196	0.12-0.31	1	1.169	183/8755	88.27	NZ_QQGY01000001.1 Haemophilus haemolyticus strain M19079 M19079_HUY4190A121_cleaned_ctg_3577, whole genome shotgun sequence
trimmed_read1_3001428260-DNA.fastq.gz	gtdb_genomes_reps_r220/database/GCF/003/490/935/GCF_003490935.1_genomic.fna.gz	93.06	0.249	91.81-94.24	0.249	0.16-0.36	1	1.176	193/8148	88.63	NZ_QQGD01000001.1 Haemophilus haemolyticus strain M19099 M19099_HUY4190A124_cleaned_ctg_3040, whole genome shotgun sequence
trimmed_read1_3001428260-DNA.fastq.gz	gtdb_genomes_reps_r220/database/GCF/003/352/385/GCF_003352385.1_genomic.fna.gz	92.58	0.284	91.58-93.64	0.284	0.18-0.43	1	1.124	193/8521	88.50	NZ_CP031243.1 Haemophilus haemolyticus strain M19346 chromosome, complete genome
trimmed_read1_3001428260-DNA.fastq.gz	gtdb_genomes_reps_r220/database/GCF/001/632/285/GCF_001632285.1_genomic.fna.gz	92.56	0.475	91.91-93.22	0.475	0.34-0.60	1	1.569	281/8176	89.70	NZ_LWAH01000001.1 Moraxella catarrhalis strain CCUG 353 contig_1, whole genome shotgun sequence
trimmed_read1_3001428260-DNA.fastq.gz	gtdb_genomes_reps_r220/database/GCF/002/027/545/GCF_002027545.1_genomic.fna.gz	92.52	0.869	92.08-92.86	0.869	0.73-1.05	1	1.627	635/12181	90.91	NZ_MXAN01000001.1 Moraxella lacunata strain CCUG 4441 CCUG_4441T_0000001, whole genome shotgun sequence
trimmed_read1_3001428260-DNA.fastq.gz	gtdb_genomes_reps_r220/database/GCA/001/752/465/GCA_001752465.1_genomic.fna.gz	92.41	0.272	91.29-93.29	0.272	0.19-0.40	1	1.197	188/9119	88.23	MDJB01000001.1 Haemophilus quentini strain K068 K068_S8_L001_R1_001_(paired)_contig_1, whole genome shotgun sequence
trimmed_read1_3001428260-DNA.fastq.gz	gtdb_genomes_reps_r220/database/GCF/003/493/685/GCF_003493685.1_genomic.fna.gz	92.29	0.311	91.20-93.14	0.311	0.23-0.44	1	1.208	197/8850	88.45	NZ_QQJW01000001.1 Haemophilus haemolyticus strain M26161 M26161_HUY4190A151_cleaned_ctg_3559, whole genome shotgun sequence
trimmed_read1_3001428260-DNA.fastq.gz	gtdb_genomes_reps_r220/database/GCF/001/679/045/GCF_001679045.1_genomic.fna.gz	92.24	0.296	91.07-93.31	0.296	0.20-0.45	1	1.216	167/7971	88.28	NZ_LYCK01000001.1 Haemophilus haemolyticus strain CCUG 12834 contig_1, whole genome shotgun sequence
trimmed_read1_3001428260-DNA.fastq.gz	gtdb_genomes_reps_r220/database/GCF/015/223/095/GCF_015223095.1_genomic.fna.gz	92.22	0.971	91.81-92.53	0.971	0.82-1.14	1	1.622	590/11687	90.82	NZ_JADFBZ010000001.1 Moraxella sp. K127 Contig_001, whole genome shotgun sequence
trimmed_read1_3001428260-DNA.fastq.gz	gtdb_genomes_reps_r220/database/GCF/003/351/405/GCF_003351405.1_genomic.fna.gz	92.20	0.286	90.95-93.39	0.286	0.18-0.43	1	1.148	162/8082	88.15	NZ_CP031240.1 Haemophilus haemolyticus strain M19345 chromosome, complete genome
trimmed_read1_3001428260-DNA.fastq.gz	gtdb_genomes_reps_r220/database/GCF/002/096/815/GCF_002096815.1_genomic.fna.gz	91.96	0.105	89.65-92.60	0.105	0.09-0.24	1	1.222	63/8476	85.37	NZ_NCVJ01000021.1 Streptococcus mitis strain RH_12363_08 s_mitis_RH_12363_08_ID_1, whole genome shotgun sequence
trimmed_read1_3001428260-DNA.fastq.gz	gtdb_genomes_reps_r220/database/GCF/019/448/275/GCF_019448275.1_genomic.fna.gz	91.87	0.105	89.45-92.29	0.105	0.10-0.21	1	1.210	62/8602	85.29	NZ_JAHXBZ010000001.1 Streptococcus humanilactis strain IMAU99125 IMAU99125, whole genome shotgun sequence
trimmed_read1_3001428260-DNA.fastq.gz	gtdb_genomes_reps_r220/database/GCF/002/860/905/GCF_002860905.1_genomic.fna.gz	91.76	0.105	89.30-92.40	0.105	0.09-0.24	1	1.210	62/8928	85.19	NZ_PKIG01000001.1 Streptococcus oralis subsp. dentisani strain UMB0832 .16933_8_21.1, whole genome shotgun sequence
trimmed_read1_3001428260-DNA.fastq.gz	gtdb_genomes_reps_r220/database/GCF/000/722/705/GCF_000722705.1_genomic.fna.gz	91.76	0.105	89.20-92.32	0.105	0.09-0.25	1	1.050	60/8646	85.19	NZ_JPFW01000001.1 Streptococcus mitis strain SK642 gsmSK642.contig.0_1, whole genome shotgun sequence
trimmed_read1_3001428260-DNA.fastq.gz	gtdb_genomes_reps_r220/database/GCF/946/190/115/GCF_946190115.1_genomic.fna.gz	91.72	0.109	89.14-92.39	0.109	0.10-0.25	1	1.197	61/8454	85.29	NZ_CAMHZG010000001.1 Streptococcus mitis isolate Streptococcus mitis NODE_1_length_220291_cov_95.818490, whole genome shotgun sequence
trimmed_read1_3001428260-DNA.fastq.gz	gtdb_genomes_reps_r220/database/GCF/946/190/145/GCF_946190145.1_genomic.fna.gz	91.69	0.105	89.60-92.47	0.105	0.09-0.21	1	1.190	63/9123	85.17	NZ_CAMHZM010000001.1 Streptococcus mitis isolate Streptococcus mitis NODE_1_length_492142_cov_74.508555, whole genome shotgun sequence
trimmed_read1_3001428260-DNA.fastq.gz	gtdb_genomes_reps_r220/database/GCF/946/190/155/GCF_946190155.1_genomic.fna.gz	91.67	0.111	89.18-91.97	0.111	0.11-0.25	1	1.200	60/8327	85.29	NZ_CAMHZL010000001.1 Streptococcus mitis isolate Streptococcus mitis NODE_1_length_388548_cov_94.757163, whole genome shotgun sequence
trimmed_read1_3001428260-DNA.fastq.gz	gtdb_genomes_reps_r220/database/GCF/001/810/785/GCF_001810785.1_genomic.fna.gz	91.63	0.113	88.70-92.36	0.113	0.10-0.27	1	1.172	58/8148	85.26	NZ_KV802678.1 Streptococcus sp. HMSC073F11 Scaffold1, whole genome shotgun sequence
trimmed_read1_3001428260-DNA.fastq.gz	gtdb_genomes_reps_r220/database/GCF/023/110/115/GCF_023110115.1_genomic.fna.gz	91.52	0.120	88.82-92.10	0.120	0.10-0.29	1	1.250	56/7733	85.30	NZ_JALDVP010000010.1 Streptococcus sp. oral taxon 431 strain S05 NODE_10_length_23192_cov_50.135195, whole genome shotgun sequence
trimmed_read1_3001428260-DNA.fastq.gz	gtdb_genomes_reps_r220/database/GCF/006/384/255/GCF_006384255.1_genomic.fna.gz	91.48	0.295	90.18-92.96	0.295	0.18-0.45	1	1.229	144/8908	87.54	NZ_VCED01000001.1 Haemophilus seminalis strain SZY H1 Scaffold1, whole genome shotgun sequence
trimmed_read1_3001428260-DNA.fastq.gz	gtdb_genomes_reps_r220/database/GCA/905/221/195/GCA_905221195.1_genomic.fna.gz	91.40	0.118	88.57-91.71	0.118	0.11-0.29	1	1.232	56/8196	85.14	CAJNCF010000001.1 unidentified bacterium isolate Streptococcus species genome assembly, contig: NODE_1_length_351178_cov_24.3909, whole genome shotgun sequence
trimmed_read1_3001428260-DNA.fastq.gz	gtdb_genomes_reps_r220/database/GCA/946/190/245/GCA_946190245.1_genomic.fna.gz	91.34	0.111	88.80-91.91	0.111	0.10-0.26	1	1.306	62/9601	84.99	CAMIAC010000001.1 Streptococcus mitis genome assembly, contig: NODE_1_length_204978_cov_120.810372, whole genome shotgun sequence
trimmed_read1_3001428260-DNA.fastq.gz	gtdb_genomes_reps_r220/database/GCF/000/257/865/GCF_000257865.1_genomic.fna.gz	91.29	0.115	88.99-91.98	0.115	0.10-0.26	1	1.228	57/8814	84.99	NZ_AICU01000001.1 Streptococcus mitis SK575 contig00033, whole genome shotgun sequence
trimmed_read1_3001428260-DNA.fastq.gz	gtdb_genomes_reps_r220/database/GCF/946/190/285/GCF_946190285.1_genomic.fna.gz	91.26	0.120	88.71-92.12	0.120	0.10-0.31	1	1.250	56/8428	85.07	NZ_CAMHZX010000001.1 Streptococcus mitis isolate Streptococcus mitis NODE_1_length_750225_cov_136.047748, whole genome shotgun sequence
trimmed_read1_3001428260-DNA.fastq.gz	gtdb_genomes_reps_r220/database/GCA/000/385/835/GCA_000385835.1_genomic.fna.gz	91.23	0.118	88.68-91.88	0.118	0.10-0.30	1	1.246	57/8836	84.99	AQTU01000001.1 Streptococcus mitis 13/39 contig00001, whole genome shotgun sequence
trimmed_read1_3001428260-DNA.fastq.gz	gtdb_genomes_reps_r220/database/GCF/026/782/895/GCF_026782895.1_genomic.fna.gz	91.21	0.138	88.80-92.51	0.138	0.09-0.27	1	1.219	64/8605	85.38	NZ_JAKUXJ010000010.1 Streptococcus mitis strain D13054009 D13054009_S15_contig_10_consensus, whole genome shotgun sequence
trimmed_read1_3001428260-DNA.fastq.gz	gtdb_genomes_reps_r220/database/GCF/003/942/865/GCF_003942865.1_genomic.fna.gz	91.18	0.140	89.17-92.75	0.140	0.09-0.29	1	1.222	63/8424	85.39	NZ_RJNZ01000001.1 Streptococcus mitis strain BCC55 D8845_contig001, whole genome shotgun sequence
trimmed_read1_3001428260-DNA.fastq.gz	gtdb_genomes_reps_r220/database/GCF/000/148/525/GCF_000148525.1_genomic.fna.gz	91.16	0.118	88.61-91.97	0.118	0.10-0.26	1	1.056	54/8584	84.92	NZ_AEDU01000035.1 Streptococcus mitis SK564 contigB3, whole genome shotgun sequence
trimmed_read1_3001428260-DNA.fastq.gz	gtdb_genomes_reps_r220/database/GCF/003/942/685/GCF_003942685.1_genomic.fna.gz	91.11	0.120	88.89-91.78	0.120	0.10-0.25	1	1.236	55/8731	84.92	NZ_RJNR01000001.1 Streptococcus mitis strain BCA12 D8855_contig001, whole genome shotgun sequence
trimmed_read1_3001428260-DNA.fastq.gz	gtdb_genomes_reps_r220/database/GCF/946/188/585/GCF_946188585.1_genomic.fna.gz	91.07	0.125	88.56-91.45	0.125	0.12-0.29	1	1.236	55/8349	85.04	NZ_CAMHVI010000001.1 Streptococcus mitis isolate Streptococcus mitis NODE_1_length_551605_cov_126.496499, whole genome shotgun sequence
trimmed_read1_3001428260-DNA.fastq.gz	gtdb_genomes_reps_r220/database/GCF/002/096/895/GCF_002096895.1_genomic.fna.gz	91.03	0.130	88.41-91.26	0.130	0.12-0.32	1	1.269	52/7832	85.06	NZ_NCVI01000020.1 Streptococcus mitis strain RH_17024_08 s_mitis_RH_17024_08_ID_1, whole genome shotgun sequence
trimmed_read1_3001428260-DNA.fastq.gz	gtdb_genomes_reps_r220/database/GCF/003/942/765/GCF_003942765.1_genomic.fna.gz	91.01	0.143	88.81-92.00	0.143	0.10-0.31	1	1.254	63/8775	85.28	NZ_RJNW01000001.1 Streptococcus mitis strain KLC01 D8849_contig001, whole genome shotgun sequence
trimmed_read1_3001428260-DNA.fastq.gz	gtdb_genomes_reps_r220/database/GCF/013/276/955/GCF_013276955.1_genomic.fna.gz	90.92	0.122	88.70-91.39	0.122	0.11-0.29	1	1.255	55/9123	84.80	NZ_VMLZ01000001.1 Streptococcus sp. 1453 1453_S31_L001_R1_001_(paired)_contig_1, whole genome shotgun sequence
trimmed_read1_3001428260-DNA.fastq.gz	gtdb_genomes_reps_r220/database/GCF/003/943/935/GCF_003943935.1_genomic.fna.gz	90.89	0.128	88.51-91.33	0.128	0.11-0.30	1	1.264	53/8544	84.88	NZ_RJOB01000001.1 Streptococcus mitis strain BCC45 D8842_contig001, whole genome shotgun sequence
trimmed_read1_3001428260-DNA.fastq.gz	gtdb_genomes_reps_r220/database/GCF/013/277/205/GCF_013277205.1_genomic.fna.gz	90.87	0.120	88.41-91.68	0.120	0.10-0.27	1	1.236	55/9465	84.70	NZ_VMMO01000001.1 Streptococcus sp. 202 202_S24_L001_R1_001_(paired)_contig_1, whole genome shotgun sequence
trimmed_read1_3001428260-DNA.fastq.gz	gtdb_genomes_reps_r220/database/GCF/001/074/635/GCF_001074635.1_genomic.fna.gz	90.86	0.125	88.25-91.44	0.125	0.10-0.29	1	1.259	54/8979	84.79	NZ_JUQO01000001.1 Streptococcus mitis strain 850_SMIT 0_226_2877, whole genome shotgun sequence
trimmed_read1_3001428260-DNA.fastq.gz	gtdb_genomes_reps_r220/database/GCF/008/763/935/GCF_008763935.1_genomic.fna.gz	90.83	0.140	88.99-92.09	0.140	0.09-0.27	1	1.097	62/9346	85.06	NZ_VTQF01000017.1 Streptococcus mitis strain DE0498 NODE_100_length_5450_cov_55.629293, whole genome shotgun sequence
trimmed_read1_3001428260-DNA.fastq.gz	gtdb_genomes_reps_r220/database/GCF/001/074/155/GCF_001074155.1_genomic.fna.gz	90.81	0.157	88.88-91.87	0.157	0.11-0.31	1	1.073	55/7515	85.33	NZ_JUUZ01000016.1 Streptococcus pseudopneumoniae strain 74_SPSE 102_2370_37597, whole genome shotgun sequence
trimmed_read1_3001428260-DNA.fastq.gz	gtdb_genomes_reps_r220/database/GCF/009/496/165/GCF_009496165.1_genomic.fna.gz	90.81	0.151	88.66-91.80	0.151	0.11-0.35	1	1.250	60/8510	85.23	NZ_WIJQ01000010.1 Streptococcus mitis strain SM08 NODE_10_length_53743_cov_22.439328, whole genome shotgun sequence
trimmed_read1_3001428260-DNA.fastq.gz	gtdb_genomes_reps_r220/database/GCA/905/221/115/GCA_905221115.1_genomic.fna.gz	90.78	0.151	88.68-92.14	0.151	0.10-0.34	1	1.237	59/8441	85.21	CAJNBX010000001.1 unidentified bacterium isolate Streptococcus species genome assembly, contig: NODE_1_length_385792_cov_41.2882, whole genome shotgun sequence
trimmed_read1_3001428260-DNA.fastq.gz	gtdb_genomes_reps_r220/database/GCF/002/005/545/GCF_002005545.1_genomic.fna.gz	90.77	0.125	88.55-91.63	0.125	0.10-0.28	1	1.059	51/8727	84.71	NZ_LBMT01000001.1 Streptococcus mitis strain 321A Scaffold1, whole genome shotgun sequence
trimmed_read1_3001428260-DNA.fastq.gz	gtdb_genomes_reps_r220/database/GCF/023/110/375/GCF_023110375.1_genomic.fna.gz	90.76	0.151	88.65-91.65	0.151	0.11-0.33	1	1.237	59/8511	85.18	NZ_JALDVV010000010.1 Streptococcus mitis strain O7-1 NODE_10_length_62925_cov_19.542213, whole genome shotgun sequence
trimmed_read1_3001428260-DNA.fastq.gz	gtdb_genomes_reps_r220/database/GCF/013/277/515/GCF_013277515.1_genomic.fna.gz	90.63	0.130	87.72-91.64	0.130	0.11-0.34	1	1.269	52/8972	84.69	NZ_VMNB01000001.1 Streptococcus sp. k-402 k-402_R1_(paired)_contig_1, whole genome shotgun sequence
trimmed_read1_3001428260-DNA.fastq.gz	gtdb_genomes_reps_r220/database/GCF/946/188/695/GCF_946188695.1_genomic.fna.gz	90.61	0.154	88.58-91.61	0.154	0.11-0.32	1	1.233	60/8785	85.14	NZ_CAMHWI010000001.1 Streptococcus mitis isolate Streptococcus mitis NODE_1_length_308064_cov_63.601548, whole genome shotgun sequence
trimmed_read1_3001428260-DNA.fastq.gz	gtdb_genomes_reps_r220/database/GCF/019/929/545/GCF_019929545.1_genomic.fna.gz	90.60	0.157	88.56-91.95	0.157	0.10-0.35	1	1.246	57/8371	85.13	NZ_JAHZPT010000001.1 Streptococcus mitis strain CR123 Smitis_CR123_NinaOddballs_Sia_NO_1, whole genome shotgun sequence
trimmed_read1_3001428260-DNA.fastq.gz	gtdb_genomes_reps_r220/database/GCF/003/944/325/GCF_003944325.1_genomic.fna.gz	90.55	0.148	88.38-91.76	0.148	0.10-0.31	1	1.183	60/9459	84.94	NZ_RJPX01000001.1 Streptococcus mitis strain BCC17 D8787_contig001, whole genome shotgun sequence
trimmed_read1_3001428260-DNA.fastq.gz	gtdb_genomes_reps_r220/database/GCF/002/860/865/GCF_002860865.1_genomic.fna.gz	90.54	0.133	88.08-90.99	0.133	0.11-0.35	1	1.275	51/8904	84.66	NZ_PKIE01000001.1 Streptococcus mitis strain UMB1341 .21837_8_64.1, whole genome shotgun sequence
trimmed_read1_3001428260-DNA.fastq.gz	gtdb_genomes_reps_r220/database/GCF/019/929/665/GCF_019929665.1_genomic.fna.gz	90.53	0.185	88.44-92.50	0.185	0.10-0.38	1	1.281	64/8023	85.57	NZ_JAHZPZ010000001.1 Streptococcus infantis strain STn400 Sinfantis_STn400_NinaOddballs_Sia_NO_1, whole genome shotgun sequence
trimmed_read1_3001428260-DNA.fastq.gz	gtdb_genomes_reps_r220/database/GCF/015/546/995/GCF_015546995.1_genomic.fna.gz	90.53	0.146	87.59-91.02	0.146	0.12-0.39	1	1.283	46/7392	84.89	NZ_JADMUH010000010.1 Streptococcus infantis strain D6t1_180914_B1 NODE_10_length_64276_cov_32.8629, whole genome shotgun sequence
trimmed_read1_3001428260-DNA.fastq.gz	gtdb_genomes_reps_r220/database/GCF/002/096/845/GCF_002096845.1_genomic.fna.gz	90.52	0.157	88.42-91.72	0.157	0.11-0.35	1	1.259	58/8758	85.06	NZ_NCVK01000060.1 Streptococcus mitis strain OD_317805_11 s_mitis_OD_317805_11_ID_1, whole genome shotgun sequence
trimmed_read1_3001428260-DNA.fastq.gz	gtdb_genomes_reps_r220/database/GCA/905/221/285/GCA_905221285.1_genomic.fna.gz	90.51	0.160	88.34-91.66	0.160	0.11-0.38	1	1.263	57/8485	85.10	CAJNCM010000001.1 unidentified bacterium isolate Streptococcus species genome assembly, contig: NODE_1_length_380604_cov_54.0563, whole genome shotgun sequence
trimmed_read1_3001428260-DNA.fastq.gz	gtdb_genomes_reps_r220/database/GCF/903/645/285/GCF_903645285.1_genomic.fna.gz	90.50	0.133	87.72-91.19	0.133	0.11-0.32	1	1.062	48/8493	84.62	NZ_CAHJXN010000001.1 Streptococcus sp. Marseille-Q2617, whole genome shotgun sequence
trimmed_read1_3001428260-DNA.fastq.gz	gtdb_genomes_reps_r220/database/GCF/013/276/795/GCF_013276795.1_genomic.fna.gz	90.49	0.160	88.24-91.79	0.160	0.11-0.38	1	1.263	57/8538	85.08	NZ_VMLR01000001.1 Streptococcus sp. 2342 2342_S22_L001_R1_001_(paired)_contig_1, whole genome shotgun sequence
trimmed_read1_3001428260-DNA.fastq.gz	gtdb_genomes_reps_r220/database/GCA/905/221/235/GCA_905221235.1_genomic.fna.gz	90.48	0.160	88.12-91.58	0.160	0.11-0.37	1	1.263	57/8581	85.07	CAJNCJ010000001.1 unidentified bacterium isolate Streptococcus species genome assembly, contig: NODE_1_length_257994_cov_14.1844, whole genome shotgun sequence
trimmed_read1_3001428260-DNA.fastq.gz	gtdb_genomes_reps_r220/database/GCA/001/070/715/GCA_001070715.1_genomic.fna.gz	90.46	0.133	87.81-90.97	0.133	0.12-0.32	1	1.275	51/9137	84.59	JVRR01000136.1 Streptococcus pseudopneumoniae strain 163_SPSE 1000_987_21661_898_,304+,902_, whole genome shotgun sequence
trimmed_read1_3001428260-DNA.fastq.gz	gtdb_genomes_reps_r220/database/GCF/013/277/455/GCF_013277455.1_genomic.fna.gz	90.46	0.157	88.04-91.90	0.157	0.10-0.32	1	1.246	57/8788	85.00	NZ_VMMY01000001.1 Streptococcus sp. 5346 5346-99_S28_L001_R1_001_(paired)_contig_1, whole genome shotgun sequence
trimmed_read1_3001428260-DNA.fastq.gz	gtdb_genomes_reps_r220/database/GCF/905/187/535/GCF_905187535.1_genomic.fna.gz	90.46	0.136	88.42-90.98	0.136	0.12-0.28	1	1.265	49/8616	84.64	NZ_CAJJIE010000001.1 Streptococcus mitis isolate Streptococcus mitis, whole genome shotgun sequence
trimmed_read1_3001428260-DNA.fastq.gz	gtdb_genomes_reps_r220/database/GCA/905/221/225/GCA_905221225.1_genomic.fna.gz	90.45	0.185	88.49-91.95	0.185	0.11-0.41	1	1.246	61/8095	85.41	CAJNCH010000001.1 unidentified bacterium isolate Streptococcus species genome assembly, contig: NODE_1_length_211129_cov_38.585, whole genome shotgun sequence
trimmed_read1_3001428260-DNA.fastq.gz	gtdb_genomes_reps_r220/database/GCF/028/156/745/GCF_028156745.1_genomic.fna.gz	90.45	0.136	87.90-91.27	0.136	0.12-0.32	1	1.042	48/8273	84.69	NZ_JAODJG010000009.1 Streptococcus gwangjuense strain DP4_6_2 107, whole genome shotgun sequence
trimmed_read1_3001428260-DNA.fastq.gz	gtdb_genomes_reps_r220/database/GCA/905/221/375/GCA_905221375.1_genomic.fna.gz	90.44	0.157	88.13-92.12	0.157	0.10-0.37	1	1.246	57/8833	84.99	CAJNCY010000001.1 unidentified bacterium isolate Streptococcus species genome assembly, contig: NODE_1_length_291870_cov_37.7718, whole genome shotgun sequence
trimmed_read1_3001428260-DNA.fastq.gz	gtdb_genomes_reps_r220/database/GCA/905/221/105/GCA_905221105.1_genomic.fna.gz	90.44	0.143	87.95-91.11	0.143	0.12-0.31	1	1.152	46/7784	84.75	CAJNBW010000001.1 unidentified bacterium isolate Streptococcus species genome assembly, contig: NODE_1_length_546383_cov_52.4209, whole genome shotgun sequence
trimmed_read1_3001428260-DNA.fastq.gz	gtdb_genomes_reps_r220/database/GCF/003/942/965/GCF_003942965.1_genomic.fna.gz	90.43	0.189	88.10-92.36	0.189	0.10-0.41	1	1.262	61/8015	85.44	NZ_RJOG01000001.1 Streptococcus mitis strain BCC07 D8837_contig001, whole genome shotgun sequence
trimmed_read1_3001428260-DNA.fastq.gz	gtdb_genomes_reps_r220/database/GCA/905/221/185/GCA_905221185.1_genomic.fna.gz	90.40	0.140	87.56-90.94	0.140	0.12-0.30	1	1.271	48/8418	84.65	CAJNCE010000001.1 unidentified bacterium isolate Streptococcus species genome assembly, contig: NODE_1_length_320457_cov_53.7269, whole genome shotgun sequence
trimmed_read1_3001428260-DNA.fastq.gz	gtdb_genomes_reps_r220/database/GCF/001/076/775/GCF_001076775.1_genomic.fna.gz	90.39	0.133	88.17-91.19	0.133	0.11-0.30	1	1.062	48/8803	84.53	NZ_JVGV01000002.1 Streptococcus pseudopneumoniae strain 445_SPSE 160_1845_293894, whole genome shotgun sequence
trimmed_read1_3001428260-DNA.fastq.gz	gtdb_genomes_reps_r220/database/GCF/002/871/495/GCF_002871495.1_genomic.fna.gz	90.39	0.151	87.88-91.38	0.151	0.10-0.33	1	1.237	59/9651	84.84	NZ_PNGD01000001.1 Streptococcus sp. UMB0029 ERR1203613.17957_1_25.1, whole genome shotgun sequence
trimmed_read1_3001428260-DNA.fastq.gz	gtdb_genomes_reps_r220/database/GCA/001/171/885/GCA_001171885.1_genomic.fna.gz	90.35	0.160	87.97-91.98	0.160	0.10-0.35	1	1.263	57/8974	84.94	CKQD01000001.1 Streptococcus pneumoniae genome assembly 6680_6#10, scaffold ERS020456SCcontig000001, whole genome shotgun sequence
trimmed_read1_3001428260-DNA.fastq.gz	gtdb_genomes_reps_r220/database/GCF/000/960/005/GCF_000960005.1_genomic.fna.gz	90.34	0.163	87.92-91.63	0.163	0.11-0.34	1	1.075	53/8198	84.99	NZ_JYGP01000001.1 Streptococcus mitis strain OT25 TZ90_contig000001, whole genome shotgun sequence
trimmed_read1_3001428260-DNA.fastq.gz	gtdb_genomes_reps_r220/database/GCF/022/137/125/GCF_022137125.1_genomic.fna.gz	90.33	0.189	88.30-92.07	0.189	0.10-0.38	1	1.250	60/8173	85.34	NZ_JAKNEQ010000001.1 Streptococcus mitis strain DFI.2.96 NNOOAJHE_1, whole genome shotgun sequence
trimmed_read1_3001428260-DNA.fastq.gz	gtdb_genomes_reps_r220/database/GCF/946/190/275/GCF_946190275.1_genomic.fna.gz	90.32	0.157	88.51-91.62	0.157	0.10-0.33	1	1.246	57/9210	84.87	NZ_CAMHZQ010000001.1 Streptococcus mitis isolate Streptococcus mitis NODE_1_length_295642_cov_144.812041, whole genome shotgun sequence
trimmed_read1_3001428260-DNA.fastq.gz	gtdb_genomes_reps_r220/database/GCA/905/221/145/GCA_905221145.1_genomic.fna.gz	90.31	0.170	87.68-91.59	0.170	0.11-0.38	1	1.278	54/8115	85.07	CAJNCA010000001.1 unidentified bacterium isolate Streptococcus species genome assembly, contig: NODE_1_length_542150_cov_74.7743, whole genome shotgun sequence
trimmed_read1_3001428260-DNA.fastq.gz	gtdb_genomes_reps_r220/database/GCA/018/372/995/GCA_018372995.1_genomic.fna.gz	90.31	0.430	89.45-91.25	0.430	0.30-0.65	1	1.191	131/8819	87.30	JAHAHX010000023.1 MAG: Haemophilus haemolyticus isolate L3_098_047G1_dasL3_098_047G1_concoct_31 L3_098_047G1_scaffold_1020, whole genome shotgun sequence
trimmed_read1_3001428260-DNA.fastq.gz	gtdb_genomes_reps_r220/database/GCF/030/439/915/GCF_030439915.1_genomic.fna.gz	90.26	0.167	88.35-92.07	0.167	0.10-0.37	1	1.259	54/8418	84.97	NZ_JAQFJG010000010.1 Streptococcus sp. SPS1 NODE_10_length_71805_cov_189.924538, whole genome shotgun sequence
trimmed_read1_3001428260-DNA.fastq.gz	gtdb_genomes_reps_r220/database/GCF/000/257/905/GCF_000257905.1_genomic.fna.gz	90.25	0.167	87.96-91.20	0.167	0.12-0.37	1	1.259	54/8469	84.95	NZ_AJJL01000001.1 Streptococcus mitis SK579 contig00033, whole genome shotgun sequence
trimmed_read1_3001428260-DNA.fastq.gz	gtdb_genomes_reps_r220/database/GCF/946/190/335/GCF_946190335.1_genomic.fna.gz	90.23	0.170	88.00-91.24	0.170	0.12-0.37	1	1.264	53/8196	84.99	NZ_CAMHZN010000001.1 Streptococcus mitis isolate Streptococcus mitis NODE_1_length_678925_cov_140.780463, whole genome shotgun sequence
trimmed_read1_3001428260-DNA.fastq.gz	gtdb_genomes_reps_r220/database/GCF/001/650/315/GCF_001650315.1_genomic.fna.gz	90.23	0.192	88.31-92.03	0.192	0.10-0.38	1	1.233	60/8172	85.34	NZ_LVJM01000001.1 Streptococcus sp. CCUG 49591 contig_1, whole genome shotgun sequence
trimmed_read1_3001428260-DNA.fastq.gz	gtdb_genomes_reps_r220/database/GCF/009/496/295/GCF_009496295.1_genomic.fna.gz	90.23	0.167	88.07-91.33	0.167	0.11-0.35	1	1.273	55/8682	84.94	NZ_WIJL01000010.1 Streptococcus mitis strain SM15 NODE_10_length_116604_cov_16.980606, whole genome shotgun sequence
trimmed_read1_3001428260-DNA.fastq.gz	gtdb_genomes_reps_r220/database/GCA/905/221/245/GCA_905221245.1_genomic.fna.gz	90.23	0.192	88.30-91.85	0.192	0.11-0.39	1	1.267	60/8315	85.29	CAJNCK010000001.1 unidentified bacterium isolate Streptococcus species genome assembly, contig: NODE_1_length_394086_cov_61.6465, whole genome shotgun sequence
