trimmed_read1_3001425825-DNA.fastq.gz	gtdb_genomes_reps_r220/database/GCF/001/813/675/GCF_001813675.1_genomic.fna.gz	91.60	0.250	90.45-92.64	0.250	0.15-0.40	1	1.312	138/9397	87.27	NZ_KV813650.1 Streptococcus sp. HMSC078D09 Scaffold2, whole genome shotgun sequence
trimmed_read1_3001425825-DNA.fastq.gz	gtdb_genomes_reps_r220/database/GCA/902/488/495/GCA_902488495.1_genomic.fna.gz	91.60	0.227	90.03-93.75	0.227	0.11-0.40	1	1.158	101/7545	87.01	CABTWF010000001.1 MAG TPA_asm: uncultured Streptococcus sp. isolate MGYG-HGUT-03717 genome assembly, contig: GUT_GENOME242920_1, whole genome shotgun sequence
trimmed_read1_3001425825-DNA.fastq.gz	gtdb_genomes_reps_r220/database/GCF/002/027/545/GCF_002027545.1_genomic.fna.gz	91.56	0.533	90.88-92.09	0.533	0.44-0.68	1	1.410	327/12181	88.99	NZ_MXAN01000001.1 Moraxella lacunata strain CCUG 4441 CCUG_4441T_0000001, whole genome shotgun sequence
trimmed_read1_3001425825-DNA.fastq.gz	gtdb_genomes_reps_r220/database/GCF/000/411/475/GCF_000411475.1_genomic.fna.gz	91.55	0.161	89.54-93.02	0.161	0.09-0.32	1	1.208	72/7457	86.10	NZ_KE150464.1 Streptococcus sp. HPH0090 aczIp-supercont1.1, whole genome shotgun sequence
trimmed_read1_3001425825-DNA.fastq.gz	gtdb_genomes_reps_r220/database/GCF/937/976/295/GCF_937976295.1_genomic.fna.gz	91.54	0.190	89.96-93.28	0.190	0.10-0.33	1	1.205	117/10435	86.51	NZ_CALJRY010000001.1 MAG: uncultured Rothia sp. isolate ERR1474580_bin.38_CONCOCT_v1.1_MAG ERZ651106.13415, whole genome shotgun sequence
trimmed_read1_3001425825-DNA.fastq.gz	gtdb_genomes_reps_r220/database/GCF/023/051/165/GCF_023051165.1_genomic.fna.gz	91.54	0.100	88.91-92.03	0.100	0.09-0.23	1	1.152	66/10583	84.89	NZ_JALKIG010000001.1 Veillonella sp. KGMB01456 KGMB01456_contig00001, whole genome shotgun sequence
trimmed_read1_3001425825-DNA.fastq.gz	gtdb_genomes_reps_r220/database/GCF/008/011/855/GCF_008011855.1_genomic.fna.gz	91.53	0.067	89.13-92.15	0.067	0.06-0.14	1	1.103	97/23123	83.81	NZ_VOUX01000007.1 Serratia bockelmannii strain S3 NODE_10_length_142946_cov_63.032722, whole genome shotgun sequence
trimmed_read1_3001425825-DNA.fastq.gz	gtdb_genomes_reps_r220/database/GCA/018/366/675/GCA_018366675.1_genomic.fna.gz	91.53	0.160	89.66-93.22	0.160	0.08-0.32	1	1.120	83/8721	86.06	JAGZHQ010000167.1 MAG: Streptococcus parasanguinis isolate L3_129_093G1_dasL3_129_093G1_concoct_22 L3_129_093G1_scaffold_10046, whole genome shotgun sequence
trimmed_read1_3001425825-DNA.fastq.gz	gtdb_genomes_reps_r220/database/GCF/003/942/695/GCF_003942695.1_genomic.fna.gz	91.49	0.233	90.05-93.19	0.233	0.12-0.38	1	1.405	111/8354	86.99	NZ_RJNU01000001.1 Streptococcus mitis strain KLC11 D8852_contig001, whole genome shotgun sequence
trimmed_read1_3001425825-DNA.fastq.gz	gtdb_genomes_reps_r220/database/GCA/905/221/325/GCA_905221325.1_genomic.fna.gz	91.47	0.260	90.26-92.82	0.260	0.15-0.41	1	1.362	127/8738	87.24	CAJNCS010000001.1 unidentified bacterium isolate Streptococcus species genome assembly, contig: NODE_1_length_297277_cov_28.1291, whole genome shotgun sequence
trimmed_read1_3001425825-DNA.fastq.gz	gtdb_genomes_reps_r220/database/GCF/000/235/485/GCF_000235485.1_genomic.fna.gz	91.46	0.270	90.04-92.87	0.270	0.16-0.45	1	1.542	118/7947	87.30	NZ_JH378872.1 Streptococcus sp. oral taxon 058 str. F0407 Scfld1, whole genome shotgun sequence
trimmed_read1_3001425825-DNA.fastq.gz	gtdb_genomes_reps_r220/database/GCA/905/221/415/GCA_905221415.1_genomic.fna.gz	91.44	0.258	90.22-92.81	0.258	0.14-0.41	1	1.500	120/8451	87.18	CAJNDC010000001.1 unidentified bacterium isolate Streptococcus species genome assembly, contig: NODE_1_length_277523_cov_61.3921, whole genome shotgun sequence
trimmed_read1_3001425825-DNA.fastq.gz	gtdb_genomes_reps_r220/database/GCF/016/648/855/GCF_016648855.1_genomic.fna.gz	91.44	0.240	90.16-92.98	0.240	0.15-0.37	1	1.344	125/9315	87.02	NZ_JACLQU010000001.1 Streptococcus parasanguinis strain 6.1 SB3743_S33_contig_1, whole genome shotgun sequence
trimmed_read1_3001425825-DNA.fastq.gz	gtdb_genomes_reps_r220/database/GCF/000/279/535/GCF_000279535.1_genomic.fna.gz	91.43	0.228	89.96-93.36	0.228	0.11-0.36	1	1.234	94/7425	86.85	NZ_ALCH01000001.1 Streptococcus infantis SPAR10 GA06201.contig.0, whole genome shotgun sequence
trimmed_read1_3001425825-DNA.fastq.gz	gtdb_genomes_reps_r220/database/GCA/027/659/245/GCA_027659245.1_genomic.fna.gz	91.42	0.268	90.01-92.78	0.268	0.16-0.44	1	1.389	126/8572	87.27	JAQDPW010000001.1 Streptococcaceae bacterium AM104-57 HF3HH24005.Scaf1, whole genome shotgun sequence
trimmed_read1_3001425825-DNA.fastq.gz	gtdb_genomes_reps_r220/database/GCF/021/497/885/GCF_021497885.1_genomic.fna.gz	91.42	0.244	90.20-93.04	0.244	0.13-0.39	1	1.231	108/8030	87.02	NZ_CP046523.1 Streptococcus oralis strain SOD chromosome, complete genome
trimmed_read1_3001425825-DNA.fastq.gz	gtdb_genomes_reps_r220/database/GCA/000/831/085/GCA_000831085.1_genomic.fna.gz	91.39	0.280	90.14-92.47	0.280	0.19-0.44	1	1.380	129/8545	87.35	JXRG01000001.1 Streptococcus sp. DBCMS contig_1, whole genome shotgun sequence
trimmed_read1_3001425825-DNA.fastq.gz	gtdb_genomes_reps_r220/database/GCF/007/475/365/GCF_007475365.1_genomic.fna.gz	91.39	0.220	90.21-93.56	0.220	0.11-0.32	1	1.245	98/8116	86.72	NZ_CP034442.1 Streptococcus oralis subsp. dentisani strain F0392 chromosome, complete genome
trimmed_read1_3001425825-DNA.fastq.gz	gtdb_genomes_reps_r220/database/GCA/916/050/345/GCA_916050345.1_genomic.fna.gz	91.38	0.133	89.29-92.42	0.133	0.09-0.27	1	1.062	64/8374	85.45	CAJZKN010000001.1 MAG TPA_asm: Haemophilus parainfluenzae isolate ERR2764919_bin.2_metaWRAP_v1.1_MAG genome assembly, contig: ERZ1674051.3, whole genome shotgun sequence
trimmed_read1_3001425825-DNA.fastq.gz	gtdb_genomes_reps_r220/database/GCA/905/221/255/GCA_905221255.1_genomic.fna.gz	91.38	0.298	90.06-92.89	0.298	0.18-0.45	1	1.570	128/8128	87.47	CAJNCL010000001.1 unidentified bacterium isolate Streptococcus species genome assembly, contig: NODE_1_length_645483_cov_44.8514, whole genome shotgun sequence
trimmed_read1_3001425825-DNA.fastq.gz	gtdb_genomes_reps_r220/database/GCA/905/221/435/GCA_905221435.1_genomic.fna.gz	91.37	0.256	89.83-92.68	0.256	0.14-0.43	1	1.411	112/8058	87.12	CAJNDD010000001.1 unidentified bacterium isolate Streptococcus species genome assembly, contig: NODE_1_length_207485_cov_48.3812, whole genome shotgun sequence
trimmed_read1_3001425825-DNA.fastq.gz	gtdb_genomes_reps_r220/database/GCF/002/096/335/GCF_002096335.1_genomic.fna.gz	91.37	0.200	89.53-93.00	0.200	0.10-0.35	1	1.194	93/8414	86.47	NZ_NCUW01000030.1 Streptococcus oralis subsp. dentisani strain Y_5914_11 s_oralis_RS_5914_11_ID_1, whole genome shotgun sequence
trimmed_read1_3001425825-DNA.fastq.gz	gtdb_genomes_reps_r220/database/GCF/024/295/825/GCF_024295825.1_genomic.fna.gz	91.36	0.288	90.06-92.64	0.288	0.17-0.46	1	1.500	136/8934	87.37	NZ_JANCPQ010000001.1 Streptococcus sp. CF10-1 10-1_1, whole genome shotgun sequence
trimmed_read1_3001425825-DNA.fastq.gz	gtdb_genomes_reps_r220/database/GCA/959/020/685/GCA_959020685.1_genomic.fna.gz	91.32	0.140	89.14-92.55	0.140	0.10-0.28	1	1.066	61/7764	85.53	CAUETL010000001.1 MAG TPA_asm: Haemophilus parainfluenzae isolate DRR221346_bin.14_MetaWRAP_v1.3_MAG genome assembly, contig: ERZ19210964.221, whole genome shotgun sequence
trimmed_read1_3001425825-DNA.fastq.gz	gtdb_genomes_reps_r220/database/GCF/013/276/505/GCF_013276505.1_genomic.fna.gz	91.32	0.282	89.90-92.57	0.282	0.17-0.44	1	1.586	116/7864	87.28	NZ_VMLC01000001.1 Streptococcus sp. 5905 5905_S30_L001_R1_001_(paired)_contig_1, whole genome shotgun sequence
trimmed_read1_3001425825-DNA.fastq.gz	gtdb_genomes_reps_r220/database/GCF/000/253/155/GCF_000253155.1_genomic.fna.gz	91.32	0.200	89.51-93.37	0.200	0.10-0.36	1	1.154	91/8390	86.42	NC_015291.1 Streptococcus oralis Uo5, complete sequence
trimmed_read1_3001425825-DNA.fastq.gz	gtdb_genomes_reps_r220/database/GCA/905/221/365/GCA_905221365.1_genomic.fna.gz	91.32	0.283	89.71-92.70	0.283	0.16-0.46	1	1.529	121/8215	87.28	CAJNCX010000001.1 unidentified bacterium isolate Streptococcus species genome assembly, contig: NODE_1_length_497507_cov_52.0569, whole genome shotgun sequence
trimmed_read1_3001425825-DNA.fastq.gz	gtdb_genomes_reps_r220/database/GCF/901/543/815/GCF_901543815.1_genomic.fna.gz	91.31	0.238	90.14-93.18	0.238	0.12-0.38	1	1.255	102/8066	86.85	NZ_CABEIU010000001.1 Streptococcus oralis strain NCTC10232, whole genome shotgun sequence
trimmed_read1_3001425825-DNA.fastq.gz	gtdb_genomes_reps_r220/database/GCF/023/109/005/GCF_023109005.1_genomic.fna.gz	91.30	0.280	90.09-92.47	0.280	0.17-0.43	1	1.508	122/8404	87.24	NZ_JALDTU010000010.1 Streptococcus oralis strain S66 NODE_10_length_47603_cov_133.865463, whole genome shotgun sequence
trimmed_read1_3001425825-DNA.fastq.gz	gtdb_genomes_reps_r220/database/GCA/905/221/355/GCA_905221355.1_genomic.fna.gz	91.28	0.267	89.90-92.67	0.267	0.17-0.42	1	1.513	117/8463	87.10	CAJNCU010000001.1 unidentified bacterium isolate Streptococcus species genome assembly, contig: NODE_1_length_643085_cov_49.6772, whole genome shotgun sequence
trimmed_read1_3001425825-DNA.fastq.gz	gtdb_genomes_reps_r220/database/GCA/016/839/165/GCA_016839165.1_genomic.fna.gz	91.27	0.101	89.66-92.96	0.101	0.05-0.17	1	1.069	189/33139	84.65	CP069300.1 Bradyrhizobium sp. PSBB068 chromosome, complete genome
trimmed_read1_3001425825-DNA.fastq.gz	gtdb_genomes_reps_r220/database/GCF/001/579/525/GCF_001579525.1_genomic.fna.gz	91.26	0.295	89.83-92.60	0.295	0.19-0.47	1	1.571	119/7913	87.34	NZ_CM003838.1 Streptococcus oralis strain DD25 plasmid unnamed, whole genome shotgun sequence
trimmed_read1_3001425825-DNA.fastq.gz	gtdb_genomes_reps_r220/database/GCF/016/648/925/GCF_016648925.1_genomic.fna.gz	91.25	0.253	90.06-93.35	0.253	0.11-0.40	1	1.432	118/9021	86.95	NZ_JACLQX010000001.1 Streptococcus parasanguinis strain 1.1 SB3740_S30_contig_1, whole genome shotgun sequence
trimmed_read1_3001425825-DNA.fastq.gz	gtdb_genomes_reps_r220/database/GCF/019/929/365/GCF_019929365.1_genomic.fna.gz	91.25	0.289	89.82-92.53	0.289	0.16-0.48	1	1.542	120/8186	87.27	NZ_JAHZPH010000001.1 Streptococcus oralis strain KK26 Soralis_KK26_NinaOddballs_Sia_NO_1, whole genome shotgun sequence
trimmed_read1_3001425825-DNA.fastq.gz	gtdb_genomes_reps_r220/database/GCF/000/257/845/GCF_000257845.1_genomic.fna.gz	91.21	0.299	89.97-92.38	0.299	0.18-0.48	1	1.580	119/7987	87.31	NZ_AICT01000001.1 Streptococcus oralis SK1074 contig00011, whole genome shotgun sequence
trimmed_read1_3001425825-DNA.fastq.gz	gtdb_genomes_reps_r220/database/GCF/001/069/785/GCF_001069785.1_genomic.fna.gz	91.20	0.213	89.70-92.98	0.213	0.11-0.37	1	1.150	107/9717	86.46	NZ_JVSR01000007.1 Streptococcus parasanguinis strain 139.rep2_SPAR 102_16358_239263, whole genome shotgun sequence
trimmed_read1_3001425825-DNA.fastq.gz	gtdb_genomes_reps_r220/database/GCF/002/096/435/GCF_002096435.1_genomic.fna.gz	91.19	0.283	89.88-92.40	0.283	0.18-0.45	1	1.508	120/8492	87.16	NZ_NCUI01000025.1 Streptococcus oralis subsp. oralis strain Y_11577_11 s_oralis_RS_11577_11_ID_1, whole genome shotgun sequence
trimmed_read1_3001425825-DNA.fastq.gz	gtdb_genomes_reps_r220/database/GCF/000/222/705/GCF_000222705.1_genomic.fna.gz	91.16	0.270	89.90-92.50	0.270	0.16-0.45	1	1.441	118/8711	87.04	NZ_AFUB01000066.1 Streptococcus mitis bv. 2 str. SK95 contig00005, whole genome shotgun sequence
trimmed_read1_3001425825-DNA.fastq.gz	gtdb_genomes_reps_r220/database/GCA/905/188/195/GCA_905188195.1_genomic.fna.gz	91.16	0.237	89.95-92.69	0.237	0.13-0.40	1	1.124	105/8790	86.69	CAJJKY010000001.1 MAG TPA_asm: Streptococcus parasanguinis isolate SRR413738-bin.5 genome assembly, contig: NODE_11_length_258081_cov_12.938033, whole genome shotgun sequence
trimmed_read1_3001425825-DNA.fastq.gz	gtdb_genomes_reps_r220/database/GCF/001/061/665/GCF_001061665.1_genomic.fna.gz	91.13	0.111	89.01-91.91	0.111	0.09-0.24	1	1.053	57/9638	84.75	NZ_JVSP01000001.1 Rothia mucilaginosa strain 141_RMUC, whole genome shotgun sequence
trimmed_read1_3001425825-DNA.fastq.gz	gtdb_genomes_reps_r220/database/GCF/002/096/445/GCF_002096445.1_genomic.fna.gz	91.13	0.273	89.87-92.56	0.273	0.17-0.45	1	1.417	115/8498	87.04	NZ_NCUK01000013.1 Streptococcus oralis subsp. oralis strain RH_57980_07 s_oralis_RH_57980_07_ID_1, whole genome shotgun sequence
trimmed_read1_3001425825-DNA.fastq.gz	gtdb_genomes_reps_r220/database/GCF/003/943/825/GCF_003943825.1_genomic.fna.gz	91.11	0.297	89.82-92.43	0.297	0.17-0.48	1	1.368	133/9064	87.27	NZ_RJNJ01000001.1 Streptococcus oralis strain BCC63 D8863_contig001, whole genome shotgun sequence
trimmed_read1_3001425825-DNA.fastq.gz	gtdb_genomes_reps_r220/database/GCF/002/096/675/GCF_002096675.1_genomic.fna.gz	91.11	0.344	90.00-92.17	0.344	0.22-0.51	1	1.559	127/7824	87.55	NZ_NCUZ01000020.1 Streptococcus oralis subsp. dentisani strain RH_55407_11 s_oralis_RH_55407_11_ID_1, whole genome shotgun sequence
trimmed_read1_3001425825-DNA.fastq.gz	gtdb_genomes_reps_r220/database/GCF/001/813/105/GCF_001813105.1_genomic.fna.gz	91.11	0.258	89.81-92.56	0.258	0.14-0.42	1	1.453	117/9233	86.86	NZ_KV811485.1 Streptococcus sp. HMSC072C09 Scaffold0, whole genome shotgun sequence
trimmed_read1_3001425825-DNA.fastq.gz	gtdb_genomes_reps_r220/database/GCF/003/944/205/GCF_003944205.1_genomic.fna.gz	91.10	0.259	89.69-92.86	0.259	0.11-0.41	1	1.308	107/8363	86.88	NZ_RJPH01000001.1 Streptococcus oralis subsp. dentisani strain BCA2 D8805_contig001, whole genome shotgun sequence
trimmed_read1_3001425825-DNA.fastq.gz	gtdb_genomes_reps_r220/database/GCF/023/110/435/GCF_023110435.1_genomic.fna.gz	91.10	0.347	89.85-92.27	0.347	0.21-0.53	1	1.388	129/7858	87.58	NZ_JALDWB010000010.1 Streptococcus oralis strain O3-1 NODE_10_length_4654_cov_654.235962, whole genome shotgun sequence
trimmed_read1_3001425825-DNA.fastq.gz	gtdb_genomes_reps_r220/database/GCF/016/028/255/GCF_016028255.1_genomic.fna.gz	91.08	0.228	89.68-93.25	0.228	0.10-0.34	1	1.242	95/8438	86.53	NZ_CP065707.1 Streptococcus oralis strain FDAARGOS_885 chromosome, complete genome
trimmed_read1_3001425825-DNA.fastq.gz	gtdb_genomes_reps_r220/database/GCA/018/366/115/GCA_018366115.1_genomic.fna.gz	91.08	0.156	89.13-92.50	0.156	0.08-0.29	1	1.072	69/8636	85.57	JAGZIS010000009.1 MAG: Haemophilus parainfluenzae isolate L3_128_037G1_dasL3_128_037G1_concoct_24 L3_128_037G1_scaffold_101, whole genome shotgun sequence
trimmed_read1_3001425825-DNA.fastq.gz	gtdb_genomes_reps_r220/database/GCF/026/782/285/GCF_026782285.1_genomic.fna.gz	91.07	0.263	89.85-92.40	0.263	0.15-0.43	1	1.651	106/8313	86.87	NZ_JAKUWG010000010.1 Streptococcus oralis strain A15000880 A15000880_S23_contig_10_consensus, whole genome shotgun sequence
trimmed_read1_3001425825-DNA.fastq.gz	gtdb_genomes_reps_r220/database/GCF/000/257/455/GCF_000257455.1_genomic.fna.gz	91.06	0.312	89.89-92.16	0.312	0.20-0.48	1	1.397	126/8480	87.30	NZ_AJKQ01000001.1 Streptococcus oralis SK610 contig00011, whole genome shotgun sequence
trimmed_read1_3001425825-DNA.fastq.gz	gtdb_genomes_reps_r220/database/GCF/003/253/005/GCF_003253005.1_genomic.fna.gz	91.04	0.145	88.75-92.12	0.145	0.10-0.32	1	1.238	63/8417	85.39	NZ_QEPZ01000001.1 Haemophilus parainfluenzae strain C2008003258 C2008003258_S23_ctg_1017, whole genome shotgun sequence
trimmed_read1_3001425825-DNA.fastq.gz	gtdb_genomes_reps_r220/database/GCF/001/811/505/GCF_001811505.1_genomic.fna.gz	91.04	0.295	89.49-92.21	0.295	0.20-0.49	1	1.445	128/9148	87.13	NZ_KV804908.1 Streptococcus sp. HMSC034E03 Scaffold3, whole genome shotgun sequence
trimmed_read1_3001425825-DNA.fastq.gz	gtdb_genomes_reps_r220/database/GCA/959/600/045/GCA_959600045.1_genomic.fna.gz	91.03	0.154	88.32-91.69	0.154	0.13-0.39	1	1.071	42/5432	85.48	CAUGKJ010000001.1 MAG TPA_asm: uncultured Haemophilus sp. isolate SRR16280121_bin.13_MetaWRAP_v1.3_MAG genome assembly, contig: ERZ19289413.2069, whole genome shotgun sequence
trimmed_read1_3001425825-DNA.fastq.gz	gtdb_genomes_reps_r220/database/GCF/026/782/235/GCF_026782235.1_genomic.fna.gz	91.03	0.304	89.75-92.43	0.304	0.19-0.48	1	1.525	122/8576	87.18	NZ_JAKUWE010000010.1 Streptococcus oralis strain A16000295 A16000295_S17_contig_10_consensus, whole genome shotgun sequence
trimmed_read1_3001425825-DNA.fastq.gz	gtdb_genomes_reps_r220/database/GCF/002/925/905/GCF_002925905.1_genomic.fna.gz	91.02	0.140	89.82-92.56	0.140	0.08-0.22	1	1.066	183/25814	85.24	NZ_PRDB01000030.1 Klebsiella michiganensis strain DSM 25444 map unlocalized plasmid unnamed1 contig_30, whole genome shotgun sequence
trimmed_read1_3001425825-DNA.fastq.gz	gtdb_genomes_reps_r220/database/GCA/905/221/385/GCA_905221385.1_genomic.fna.gz	91.02	0.326	89.83-92.10	0.326	0.21-0.53	1	1.528	123/8169	87.34	CAJNCV010000001.1 unidentified bacterium isolate Streptococcus species genome assembly, contig: NODE_1_length_280235_cov_54.4977, whole genome shotgun sequence
trimmed_read1_3001425825-DNA.fastq.gz	gtdb_genomes_reps_r220/database/GCF/019/458/035/GCF_019458035.1_genomic.fna.gz	91.00	0.330	89.50-92.33	0.330	0.20-0.55	1	1.350	140/8929	87.46	NZ_JAHZTX010000100.1 Streptococcus oralis strain E665 NODE_100_length_416_cov_1.035191, whole genome shotgun sequence
trimmed_read1_3001425825-DNA.fastq.gz	gtdb_genomes_reps_r220/database/GCF/006/175/905/GCF_006175905.1_genomic.fna.gz	91.00	0.262	89.59-92.78	0.262	0.13-0.43	1	1.173	98/7917	86.79	NZ_SSNB01000001.1 Streptococcus oralis strain ATCC 9811 Contig1, whole genome shotgun sequence
trimmed_read1_3001425825-DNA.fastq.gz	gtdb_genomes_reps_r220/database/GCF/031/191/205/GCF_031191205.1_genomic.fna.gz	90.99	0.118	88.78-91.71	0.118	0.10-0.25	1	1.056	54/9074	84.76	NZ_CP133470.1 Haemophilus parainfluenzae ATCC 33392 strain DSM 8978 chromosome, complete genome
trimmed_read1_3001425825-DNA.fastq.gz	gtdb_genomes_reps_r220/database/GCF/009/738/225/GCF_009738225.1_genomic.fna.gz	90.99	0.162	89.27-92.82	0.162	0.08-0.31	1	1.122	82/10219	85.59	NZ_CP018187.1 Streptococcus salivarius strain ICDC2 chromosome, complete genome
trimmed_read1_3001425825-DNA.fastq.gz	gtdb_genomes_reps_r220/database/GCF/001/042/615/GCF_001042615.1_genomic.fna.gz	90.99	0.162	89.32-92.69	0.162	0.09-0.31	1	1.075	80/9973	85.58	NZ_AP012327.1 Bifidobacterium catenulatum subsp. kashiwanohense JCM 15439 = DSM 21854 strain JCM 15439 chromosome, complete genome
trimmed_read1_3001425825-DNA.fastq.gz	gtdb_genomes_reps_r220/database/GCF/015/556/095/GCF_015556095.1_genomic.fna.gz	90.99	0.294	89.81-92.15	0.294	0.19-0.45	1	1.341	129/9393	87.08	NZ_JADNLT010000010.1 Streptococcus parasanguinis strain 1001095IJ_161003_H11 NODE_10_length_40155_cov_28.2716, whole genome shotgun sequence
trimmed_read1_3001425825-DNA.fastq.gz	gtdb_genomes_reps_r220/database/GCF/009/496/285/GCF_009496285.1_genomic.fna.gz	90.98	0.272	89.71-92.52	0.272	0.13-0.45	1	1.459	109/8523	86.88	NZ_WIJK01000010.1 Streptococcus mitis strain SM16 NODE_10_length_75357_cov_22.067048, whole genome shotgun sequence
trimmed_read1_3001425825-DNA.fastq.gz	gtdb_genomes_reps_r220/database/GCA/905/221/335/GCA_905221335.1_genomic.fna.gz	90.95	0.333	89.49-92.37	0.333	0.18-0.55	1	1.595	116/7744	87.33	CAJNCT010000001.1 unidentified bacterium isolate Streptococcus species genome assembly, contig: NODE_1_length_806898_cov_52.5296, whole genome shotgun sequence
trimmed_read1_3001425825-DNA.fastq.gz	gtdb_genomes_reps_r220/database/GCF/001/808/705/GCF_001808705.1_genomic.fna.gz	90.95	0.340	89.59-92.06	0.340	0.22-0.54	1	1.360	139/9017	87.41	NZ_KV794218.1 Streptococcus sp. HMSC074B11 Scaffold5, whole genome shotgun sequence
trimmed_read1_3001425825-DNA.fastq.gz	gtdb_genomes_reps_r220/database/GCF/024/295/625/GCF_024295625.1_genomic.fna.gz	90.95	0.306	89.65-92.06	0.306	0.19-0.48	1	1.480	127/9126	87.12	NZ_JANCOJ010000001.1 Streptococcus sp. CF8_St5-11 CF8.St5.11_1, whole genome shotgun sequence
trimmed_read1_3001425825-DNA.fastq.gz	gtdb_genomes_reps_r220/database/GCF/001/579/025/GCF_001579025.1_genomic.fna.gz	90.94	0.323	89.58-92.21	0.323	0.19-0.51	1	1.387	124/8397	87.29	NZ_KQ970235.1 Streptococcus oralis strain DD27 scaffold00001, whole genome shotgun sequence
trimmed_read1_3001425825-DNA.fastq.gz	gtdb_genomes_reps_r220/database/GCA/916/439/135/GCA_916439135.1_genomic.fna.gz	90.93	0.273	88.95-93.06	0.273	0.12-0.49	1	1.309	55/4388	86.83	CAKAHR010000001.1 MAG TPA_asm: uncultured Streptococcus sp. isolate DRR214962_bin.7_metaWRAP_v1.1_MAG genome assembly, contig: BNJV01000782, whole genome shotgun sequence
trimmed_read1_3001425825-DNA.fastq.gz	gtdb_genomes_reps_r220/database/GCF/023/147/855/GCF_023147855.1_genomic.fna.gz	90.92	0.329	89.76-91.93	0.329	0.21-0.53	1	1.578	116/7893	87.27	NZ_JAHXOP010000001.1 Streptococcus halitosis strain EYE_82 Seq_1, whole genome shotgun sequence
trimmed_read1_3001425825-DNA.fastq.gz	gtdb_genomes_reps_r220/database/GCA/905/372/585/GCA_905372585.1_genomic.fna.gz	90.91	0.276	89.73-92.58	0.276	0.14-0.43	1	1.176	102/8124	86.83	CAJPPL010000001.1 MAG: Streptococcus oralis isolate SRR9217422-mag-bin.1 genome assembly, contig: SRR9217422-mag-bin.1_3, whole genome shotgun sequence
trimmed_read1_3001425825-DNA.fastq.gz	gtdb_genomes_reps_r220/database/GCF/000/963/255/GCF_000963255.1_genomic.fna.gz	90.90	0.219	89.16-93.07	0.219	0.11-0.39	1	1.230	87/8518	86.25	NZ_JYOV01000001.1 Streptococcus infantis strain UC6950A TZ96_contig000001, whole genome shotgun sequence
trimmed_read1_3001425825-DNA.fastq.gz	gtdb_genomes_reps_r220/database/GCF/016/127/915/GCF_016127915.1_genomic.fna.gz	90.90	0.237	89.56-92.52	0.237	0.13-0.38	1	1.191	89/8139	86.44	NZ_CP066059.1 Streptococcus oralis strain FDAARGOS_1021 chromosome, complete genome
trimmed_read1_3001425825-DNA.fastq.gz	gtdb_genomes_reps_r220/database/GCF/900/637/025/GCF_900637025.1_genomic.fna.gz	90.89	0.250	89.61-92.61	0.250	0.14-0.39	1	1.191	94/8203	86.57	NZ_LR134336.1 Streptococcus oralis ATCC 35037 strain NCTC 11427 chromosome 1, complete sequence
trimmed_read1_3001425825-DNA.fastq.gz	gtdb_genomes_reps_r220/database/GCA/916/048/115/GCA_916048115.1_genomic.fna.gz	90.89	0.227	89.10-92.38	0.227	0.13-0.49	1	1.140	50/4750	86.34	CAJZGQ010000001.1 MAG TPA_asm: uncultured Streptococcus sp. isolate ERR2764892_bin.1_metaWRAP_v1.1_MAG genome assembly, contig: ERZ1674116.197, whole genome shotgun sequence
trimmed_read1_3001425825-DNA.fastq.gz	gtdb_genomes_reps_r220/database/GCF/001/068/775/GCF_001068775.1_genomic.fna.gz	90.88	0.289	89.74-92.73	0.289	0.16-0.48	1	1.455	112/8567	86.94	NZ_JWAJ01000067.1 Streptococcus pseudopneumoniae strain 1172_SPSE 1004_652_31816_433_,389+,842_, whole genome shotgun sequence
trimmed_read1_3001425825-DNA.fastq.gz	gtdb_genomes_reps_r220/database/GCF/010/120/595/GCF_010120595.1_genomic.fna.gz	90.88	0.128	88.31-91.15	0.128	0.12-0.30	1	1.170	53/8584	84.86	NZ_CP038020.1 Streptococcus thermophilus strain ATCC 19258 chromosome, complete genome
trimmed_read1_3001425825-DNA.fastq.gz	gtdb_genomes_reps_r220/database/GCA/001/579/015/GCA_001579015.1_genomic.fna.gz	90.87	0.260	89.43-92.28	0.260	0.15-0.43	1	1.559	102/8678	86.65	KQ970181.1 Streptococcus oralis strain DD21 genomic scaffold scaffold00001, whole genome shotgun sequence
trimmed_read1_3001425825-DNA.fastq.gz	gtdb_genomes_reps_r220/database/GCF/003/944/215/GCF_003944215.1_genomic.fna.gz	90.86	0.310	89.61-92.22	0.310	0.18-0.50	1	1.545	112/8200	87.07	NZ_RJVZ01000001.1 Streptococcus oralis strain BCA1 D8804_contig001, whole genome shotgun sequence
trimmed_read1_3001425825-DNA.fastq.gz	gtdb_genomes_reps_r220/database/GCA/905/221/465/GCA_905221465.1_genomic.fna.gz	90.85	0.317	89.63-92.06	0.317	0.16-0.53	1	1.459	111/7924	87.14	CAJNDG010000001.1 unidentified bacterium isolate Streptococcus species genome assembly, contig: NODE_1_length_1041469_cov_20.6802, whole genome shotgun sequence
trimmed_read1_3001425825-DNA.fastq.gz	gtdb_genomes_reps_r220/database/GCF/023/110/055/GCF_023110055.1_genomic.fna.gz	90.85	0.364	89.60-91.80	0.364	0.24-0.54	1	1.414	133/8490	87.45	NZ_JALDVG010000001.1 Streptococcus oralis strain S14 NODE_1_length_1539913_cov_136.781490, whole genome shotgun sequence
trimmed_read1_3001425825-DNA.fastq.gz	gtdb_genomes_reps_r220/database/GCF/023/110/115/GCF_023110115.1_genomic.fna.gz	90.84	0.304	89.45-92.40	0.304	0.17-0.55	1	1.495	103/7733	87.00	NZ_JALDVP010000010.1 Streptococcus sp. oral taxon 431 strain S05 NODE_10_length_23192_cov_50.135195, whole genome shotgun sequence
trimmed_read1_3001425825-DNA.fastq.gz	gtdb_genomes_reps_r220/database/GCA/015/259/235/GCA_015259235.1_genomic.fna.gz	90.83	0.193	89.23-93.33	0.193	0.07-0.35	1	1.088	91/10219	85.87	JABZGM010000100.1 MAG: Alloprevotella sp. isolate JCVI_44_bin.23 NODE_100_length_7555_cov_4.890211, whole genome shotgun sequence
trimmed_read1_3001425825-DNA.fastq.gz	gtdb_genomes_reps_r220/database/GCA/905/372/925/GCA_905372925.1_genomic.fna.gz	90.83	0.293	89.26-92.40	0.293	0.15-0.53	1	1.211	90/6991	86.90	CAJPRB010000001.1 MAG: uncultured Streptococcus sp. isolate SRR9217433-mag-bin.4 genome assembly, contig: SRR9217433-mag-bin.4_71, whole genome shotgun sequence
trimmed_read1_3001425825-DNA.fastq.gz	gtdb_genomes_reps_r220/database/GCF/001/578/705/GCF_001578705.1_genomic.fna.gz	90.83	0.282	89.51-92.23	0.282	0.16-0.45	1	1.467	107/8440	86.86	NZ_KQ969037.1 Streptococcus oralis strain DD05 scaffold00001, whole genome shotgun sequence
trimmed_read1_3001425825-DNA.fastq.gz	gtdb_genomes_reps_r220/database/GCF/001/075/675/GCF_001075675.1_genomic.fna.gz	90.82	0.362	89.51-92.05	0.362	0.23-0.58	1	1.504	125/8137	87.40	NZ_JUNW01000025.1 Streptococcus oralis strain 918_SORA 100_384_5216, whole genome shotgun sequence
trimmed_read1_3001425825-DNA.fastq.gz	gtdb_genomes_reps_r220/database/GCF/023/109/155/GCF_023109155.1_genomic.fna.gz	90.81	0.337	89.39-91.84	0.337	0.22-0.55	1	1.392	125/8596	87.24	NZ_JALDUA010000010.1 Streptococcus oralis strain S57 NODE_10_length_3919_cov_87.832639, whole genome shotgun sequence
trimmed_read1_3001425825-DNA.fastq.gz	gtdb_genomes_reps_r220/database/GCA/027/682/205/GCA_027682205.1_genomic.fna.gz	90.81	0.321	89.62-91.97	0.321	0.19-0.52	1	1.595	111/8025	87.10	JAQDAD010000001.1 Streptococcaceae bacterium AF54-32pH5A AF54-32pH5A.Scaf1, whole genome shotgun sequence
