trimmed_read1_3001221246-DNA.fastq.gz	gtdb_genomes_reps_r220/database/GCF/019/218/685/GCF_019218685.1_genomic.fna.gz	91.57	0.378	90.48-92.59	0.378	0.27-0.57	1	1.193	176/8424	88.27	NZ_JAHUZC010000010.1 Streptococcus vulneris strain DM3B3 NODE_10_length_85275_cov_315.799702, whole genome shotgun sequence
trimmed_read1_3001221246-DNA.fastq.gz	gtdb_genomes_reps_r220/database/GCF/029/691/405/GCF_029691405.1_genomic.fna.gz	91.57	0.147	89.67-92.62	0.147	0.09-0.30	1	1.095	74/8294	85.88	NZ_CP121467.1 Streptococcus sp. D7B5 chromosome, complete genome
trimmed_read1_3001221246-DNA.fastq.gz	gtdb_genomes_reps_r220/database/GCF/023/109/005/GCF_023109005.1_genomic.fna.gz	91.53	0.205	90.19-93.54	0.205	0.11-0.33	1	1.144	104/8404	86.79	NZ_JALDTU010000010.1 Streptococcus oralis strain S66 NODE_10_length_47603_cov_133.865463, whole genome shotgun sequence
trimmed_read1_3001221246-DNA.fastq.gz	gtdb_genomes_reps_r220/database/GCF/015/561/235/GCF_015561235.1_genomic.fna.gz	91.45	0.184	89.66-93.27	0.184	0.09-0.33	1	1.178	90/8250	86.44	NZ_JADMTC010000001.1 Streptococcus oralis strain 1001095IJ_161003_A5 NODE_1_length_1483818_cov_29.5294, whole genome shotgun sequence
trimmed_read1_3001221246-DNA.fastq.gz	gtdb_genomes_reps_r220/database/GCF/022/749/195/GCF_022749195.1_genomic.fna.gz	91.45	0.154	89.74-93.30	0.154	0.08-0.29	1	1.071	70/7844	85.88	NZ_CP094226.1 Streptococcus oralis strain 1648 chromosome, complete genome
trimmed_read1_3001221246-DNA.fastq.gz	gtdb_genomes_reps_r220/database/GCF/005/844/455/GCF_005844455.1_genomic.fna.gz	91.42	0.336	90.46-92.34	0.336	0.23-0.49	1	1.180	167/9232	87.86	NZ_SPGF01000100.1 Streptococcus mitis strain 1001175st1_H6 NODE_100_length_2854_cov_77.3046, whole genome shotgun sequence
trimmed_read1_3001221246-DNA.fastq.gz	gtdb_genomes_reps_r220/database/GCF/900/637/025/GCF_900637025.1_genomic.fna.gz	91.40	0.152	89.45-92.54	0.152	0.09-0.30	1	1.070	71/8203	85.79	NZ_LR134336.1 Streptococcus oralis ATCC 35037 strain NCTC 11427 chromosome 1, complete sequence
trimmed_read1_3001221246-DNA.fastq.gz	gtdb_genomes_reps_r220/database/GCF/030/528/045/GCF_030528045.1_genomic.fna.gz	91.39	0.118	88.87-92.20	0.118	0.10-0.27	1	1.091	55/8071	85.14	NZ_JAUMZR010000070.1 MAG: Streptococcus sp. isolate S18M_Sa_11 NODE_1002_length_3947_cov_36.132580, whole genome shotgun sequence
trimmed_read1_3001221246-DNA.fastq.gz	gtdb_genomes_reps_r220/database/GCF/000/259/505/GCF_000259505.1_genomic.fna.gz	91.37	0.250	90.13-93.43	0.250	0.11-0.42	1	1.150	113/8154	87.11	NZ_AJMM01000001.1 Streptococcus sp. SK643 contig00011, whole genome shotgun sequence
trimmed_read1_3001221246-DNA.fastq.gz	gtdb_genomes_reps_r220/database/GCF/000/375/525/GCF_000375525.1_genomic.fna.gz	91.33	1.374	90.95-91.63	1.374	1.10-1.67	2	2.101	473/10520	90.48	NZ_AQXC01000001.1 Corynebacterium propinquum DSM 44285 B142DRAFT_scaffold_0.1_C, whole genome shotgun sequence
trimmed_read1_3001221246-DNA.fastq.gz	gtdb_genomes_reps_r220/database/GCF/001/411/485/GCF_001411485.1_genomic.fna.gz	91.30	0.171	89.36-93.40	0.171	0.08-0.35	1	1.136	81/8317	86.12	NZ_LKPC01000001.1 Streptococcus oralis strain 89a contig_1, whole genome shotgun sequence
trimmed_read1_3001221246-DNA.fastq.gz	gtdb_genomes_reps_r220/database/GCF/003/428/885/GCF_003428885.1_genomic.fna.gz	91.29	0.368	90.10-92.15	0.368	0.27-0.54	1	1.187	155/8283	87.96	NZ_QQRU01000001.1 Streptococcus sp. LQJ-218 scaffold1, whole genome shotgun sequence
trimmed_read1_3001221246-DNA.fastq.gz	gtdb_genomes_reps_r220/database/GCF/002/356/415/GCF_002356415.1_genomic.fna.gz	91.23	0.192	89.73-93.28	0.192	0.09-0.37	1	1.111	81/7993	86.23	NZ_AP018338.1 Streptococcus oralis subsp. tigurinus strain osk_001 chromosome, complete genome
trimmed_read1_3001221246-DNA.fastq.gz	gtdb_genomes_reps_r220/database/GCF/019/458/035/GCF_019458035.1_genomic.fna.gz	91.22	0.182	89.26-93.45	0.182	0.08-0.33	1	1.086	93/8929	86.31	NZ_JAHZTX010000100.1 Streptococcus oralis strain E665 NODE_100_length_416_cov_1.035191, whole genome shotgun sequence
trimmed_read1_3001221246-DNA.fastq.gz	gtdb_genomes_reps_r220/database/GCF/901/875/575/GCF_901875575.1_genomic.fna.gz	91.12	0.291	89.83-92.45	0.291	0.16-0.48	1	1.177	124/8547	87.24	NZ_CABFMF010000001.1 Uncultured Streptococcus sp., whole genome shotgun sequence
trimmed_read1_3001221246-DNA.fastq.gz	gtdb_genomes_reps_r220/database/GCF/002/093/575/GCF_002093575.1_genomic.fna.gz	91.12	0.189	89.34-92.92	0.189	0.09-0.38	1	1.161	87/8700	86.20	NZ_LNVH01000001.1 Streptococcus oralis subsp. tigurinus strain 859 S.tigurinus-859_Contig001, whole genome shotgun sequence
trimmed_read1_3001221246-DNA.fastq.gz	gtdb_genomes_reps_r220/database/GCF/002/093/545/GCF_002093545.1_genomic.fna.gz	91.10	0.169	89.38-93.23	0.169	0.08-0.32	1	1.134	82/9155	85.89	NZ_LNVF01000001.1 Streptococcus oralis subsp. tigurinus strain AZ_8 S.tigurinus-AZ8_Contig001, whole genome shotgun sequence
trimmed_read1_3001221246-DNA.fastq.gz	gtdb_genomes_reps_r220/database/GCF/003/943/905/GCF_003943905.1_genomic.fna.gz	91.06	0.213	89.46-93.00	0.213	0.09-0.36	1	1.189	90/8263	86.43	NZ_RJNS01000001.1 Streptococcus mitis strain BCA11 D8854_contig001, whole genome shotgun sequence
trimmed_read1_3001221246-DNA.fastq.gz	gtdb_genomes_reps_r220/database/GCF/001/983/955/GCF_001983955.1_genomic.fna.gz	91.06	0.143	88.87-92.19	0.143	0.09-0.30	1	1.098	61/8365	85.32	NZ_CP019562.1 Streptococcus oralis strain S.MIT/ORALIS-351 chromosome, complete genome
trimmed_read1_3001221246-DNA.fastq.gz	gtdb_genomes_reps_r220/database/GCF/030/826/625/GCF_030826625.1_genomic.fna.gz	91.04	1.384	90.66-91.37	1.384	1.07-1.75	2	2.035	395/9660	90.20	NZ_JAPJNQ010000054.1 MAG: Corynebacterium sp. isolate RAGGC_12 NODE_1032_length_14664_cov_8.518995, whole genome shotgun sequence
trimmed_read1_3001221246-DNA.fastq.gz	gtdb_genomes_reps_r220/database/GCA/905/372/585/GCA_905372585.1_genomic.fna.gz	91.04	0.145	88.60-92.28	0.145	0.09-0.30	1	1.100	60/8124	85.36	CAJPPL010000001.1 MAG: Streptococcus oralis isolate SRR9217422-mag-bin.1 genome assembly, contig: SRR9217422-mag-bin.1_3, whole genome shotgun sequence
trimmed_read1_3001221246-DNA.fastq.gz	gtdb_genomes_reps_r220/database/GCF/000/253/155/GCF_000253155.1_genomic.fna.gz	91.00	0.182	89.21-92.61	0.182	0.09-0.35	1	1.160	75/8390	85.88	NC_015291.1 Streptococcus oralis Uo5, complete sequence
trimmed_read1_3001221246-DNA.fastq.gz	gtdb_genomes_reps_r220/database/GCF/003/943/395/GCF_003943395.1_genomic.fna.gz	91.00	0.213	89.52-93.39	0.213	0.09-0.38	1	1.135	89/8235	86.41	NZ_RJPJ01000001.1 Streptococcus oralis strain BCC12 D8802_contig001, whole genome shotgun sequence
trimmed_read1_3001221246-DNA.fastq.gz	gtdb_genomes_reps_r220/database/GCF/003/942/795/GCF_003942795.1_genomic.fna.gz	90.98	0.235	89.65-92.70	0.235	0.13-0.39	1	1.139	101/8678	86.62	NZ_RJNY01000001.1 Streptococcus mitis strain BCC60 D8847_contig001, whole genome shotgun sequence
trimmed_read1_3001221246-DNA.fastq.gz	gtdb_genomes_reps_r220/database/GCF/004/353/325/GCF_004353325.1_genomic.fna.gz	90.97	0.216	89.55-93.28	0.216	0.10-0.39	1	1.170	88/8224	86.38	NZ_MZNX01000001.1 Streptococcus downii strain CECT 9732 contig_1, whole genome shotgun sequence
trimmed_read1_3001221246-DNA.fastq.gz	gtdb_genomes_reps_r220/database/GCF/026/782/345/GCF_026782345.1_genomic.fna.gz	90.97	0.231	89.32-92.61	0.231	0.12-0.40	1	1.191	94/8318	86.54	NZ_JAKUWI010000010.1 Streptococcus oralis strain A15000389 A15000389_S21_contig_10_consensus, whole genome shotgun sequence
trimmed_read1_3001221246-DNA.fastq.gz	gtdb_genomes_reps_r220/database/GCF/019/685/515/GCF_019685515.1_genomic.fna.gz	90.91	0.188	89.13-93.21	0.188	0.09-0.36	1	1.139	72/8071	85.88	NZ_JABFFN010000001.1 Streptococcus cristatus strain SS-1725 1, whole genome shotgun sequence
trimmed_read1_3001221246-DNA.fastq.gz	gtdb_genomes_reps_r220/database/GCF/002/014/765/GCF_002014765.1_genomic.fna.gz	90.90	3.175	NA-NA	HIGH	NA-NA	3	3.175	464/8926	90.90	NZ_MUYT01000001.1 Moraxella lincolnii strain CCUG 9405 CCUG9405T_R1__paired__trimmed__paired__contig_1, whole genome shotgun sequence
trimmed_read1_3001221246-DNA.fastq.gz	gtdb_genomes_reps_r220/database/GCF/027/691/175/GCF_027691175.1_genomic.fna.gz	90.89	0.185	89.05-92.60	0.185	0.10-0.37	1	1.169	77/8481	85.93	NZ_JAQFBD010000001.1 Streptococcus halitosis strain OM18-31A OM18-31A.Scaf1, whole genome shotgun sequence
trimmed_read1_3001221246-DNA.fastq.gz	gtdb_genomes_reps_r220/database/GCF/901/543/815/GCF_901543815.1_genomic.fna.gz	90.89	0.169	89.02-92.39	0.169	0.09-0.33	1	1.108	65/8066	85.60	NZ_CABEIU010000001.1 Streptococcus oralis strain NCTC10232, whole genome shotgun sequence
trimmed_read1_3001221246-DNA.fastq.gz	gtdb_genomes_reps_r220/database/GCF/000/194/175/GCF_000194175.1_genomic.fna.gz	90.81	0.107	88.81-92.39	0.107	0.06-0.19	1	1.051	118/23097	84.35	NZ_AEZI02000028.1 Escherichia coli 1.2741 Contig1651129016, whole genome shotgun sequence
trimmed_read1_3001221246-DNA.fastq.gz	gtdb_genomes_reps_r220/database/GCF/018/448/765/GCF_018448765.1_genomic.fna.gz	90.76	0.240	89.24-93.00	0.240	0.10-0.41	1	1.144	90/8145	86.47	NZ_JAHCMC010000010.1 Streptococcus oralis strain E728 NODE_10_length_49189_cov_343.546932, whole genome shotgun sequence
trimmed_read1_3001221246-DNA.fastq.gz	gtdb_genomes_reps_r220/database/GCF/000/287/715/GCF_000287715.1_genomic.fna.gz	90.74	0.167	88.89-92.20	0.167	0.10-0.31	1	1.090	67/8738	85.46	NZ_ALJN01000001.1 Streptococcus oralis SK304 ctg120008662247, whole genome shotgun sequence
trimmed_read1_3001221246-DNA.fastq.gz	gtdb_genomes_reps_r220/database/GCF/001/074/565/GCF_001074565.1_genomic.fna.gz	90.66	0.250	89.37-92.29	0.250	0.15-0.40	1	1.184	98/8877	86.47	NZ_JUQX01000008.1 Streptococcus pseudopneumoniae strain 843_SPSE 105_10838_197946, whole genome shotgun sequence
trimmed_read1_3001221246-DNA.fastq.gz	gtdb_genomes_reps_r220/database/GCF/002/386/345/GCF_002386345.1_genomic.fna.gz	90.63	0.172	88.72-92.19	0.172	0.10-0.34	1	1.109	64/8523	85.40	NZ_CP023507.1 Streptococcus oralis strain FDAARGOS_367 chromosome, complete genome
trimmed_read1_3001221246-DNA.fastq.gz	gtdb_genomes_reps_r220/database/GCF/001/579/025/GCF_001579025.1_genomic.fna.gz	90.62	0.229	89.02-92.66	0.229	0.11-0.41	1	1.165	85/8397	86.23	NZ_KQ970235.1 Streptococcus oralis strain DD27 scaffold00001, whole genome shotgun sequence
trimmed_read1_3001221246-DNA.fastq.gz	gtdb_genomes_reps_r220/database/GCA/905/372/925/GCA_905372925.1_genomic.fna.gz	90.59	0.214	88.84-92.47	0.214	0.11-0.42	1	1.127	63/6991	85.91	CAJPRB010000001.1 MAG: uncultured Streptococcus sp. isolate SRR9217433-mag-bin.4 genome assembly, contig: SRR9217433-mag-bin.4_71, whole genome shotgun sequence
trimmed_read1_3001221246-DNA.fastq.gz	gtdb_genomes_reps_r220/database/GCA/905/221/415/GCA_905221415.1_genomic.fna.gz	90.57	0.194	88.64-92.44	0.194	0.10-0.38	1	1.110	73/8451	85.79	CAJNDC010000001.1 unidentified bacterium isolate Streptococcus species genome assembly, contig: NODE_1_length_277523_cov_61.3921, whole genome shotgun sequence
trimmed_read1_3001221246-DNA.fastq.gz	gtdb_genomes_reps_r220/database/GCF/900/546/335/GCF_900546335.1_genomic.fna.gz	90.54	0.214	88.85-92.18	0.214	0.12-0.43	1	1.138	65/7230	85.90	NZ_URCN01000001.1 Uncultured Streptococcus sp. isolate UMGS867, whole genome shotgun sequence
trimmed_read1_3001221246-DNA.fastq.gz	gtdb_genomes_reps_r220/database/GCF/000/959/945/GCF_000959945.1_genomic.fna.gz	90.53	0.182	88.37-91.93	0.182	0.11-0.39	1	1.083	60/7876	85.44	NZ_JYGM01000001.1 Streptococcus oralis subsp. oralis strain COL85/1862 TZ87_contig000001, whole genome shotgun sequence
trimmed_read1_3001221246-DNA.fastq.gz	gtdb_genomes_reps_r220/database/GCA/927/911/535/GCA_927911535.1_genomic.fna.gz	90.51	0.419	89.29-91.53	0.419	0.25-0.67	1	1.190	105/6752	87.43	CAKMQC010000001.1 MAG TPA_asm: Streptococcus mitis isolate ERR3827286_bin.1_metaWRAP_v1.1_MAG genome assembly, contig: ERZ4768129.98, whole genome shotgun sequence
trimmed_read1_3001221246-DNA.fastq.gz	gtdb_genomes_reps_r220/database/GCA/905/221/305/GCA_905221305.1_genomic.fna.gz	90.42	0.242	88.46-92.33	0.242	0.11-0.46	1	1.165	79/8022	86.15	CAJNCO010000001.1 unidentified bacterium isolate Streptococcus species genome assembly, contig: NODE_1_length_1197725_cov_51.4509, whole genome shotgun sequence
trimmed_read1_3001221246-DNA.fastq.gz	gtdb_genomes_reps_r220/database/GCF/003/143/695/GCF_003143695.2_genomic.fna.gz	90.42	0.239	88.78-91.87	0.239	0.12-0.42	1	1.125	80/8131	86.15	NZ_QEMY02000008.1 Streptococcus halitosis strain VT-4 NODE_11_length_816_cov_397.199, whole genome shotgun sequence
trimmed_read1_3001221246-DNA.fastq.gz	gtdb_genomes_reps_r220/database/GCF/016/028/255/GCF_016028255.1_genomic.fna.gz	90.40	0.200	88.50-92.02	0.200	0.11-0.38	1	1.119	67/8438	85.56	NZ_CP065707.1 Streptococcus oralis strain FDAARGOS_885 chromosome, complete genome
trimmed_read1_3001221246-DNA.fastq.gz	gtdb_genomes_reps_r220/database/GCF/021/497/945/GCF_021497945.1_genomic.fna.gz	90.39	0.203	88.62-92.44	0.203	0.09-0.41	1	1.149	67/8357	85.58	NZ_CP046524.1 Streptococcus oralis strain SOT chromosome, complete genome
trimmed_read1_3001221246-DNA.fastq.gz	gtdb_genomes_reps_r220/database/GCF/002/096/355/GCF_002096355.1_genomic.fna.gz	90.34	0.230	88.84-92.18	0.230	0.10-0.42	1	1.149	74/7974	85.99	NZ_NCUF01000010.1 Streptococcus oralis subsp. tigurinus strain OD_326128_08 s_oralis_OD_326128_08_ID_1, whole genome shotgun sequence
trimmed_read1_3001221246-DNA.fastq.gz	gtdb_genomes_reps_r220/database/GCF/013/276/505/GCF_013276505.1_genomic.fna.gz	90.33	0.265	88.64-92.05	0.265	0.14-0.46	1	1.134	82/7864	86.31	NZ_VMLC01000001.1 Streptococcus sp. 5905 5905_S30_L001_R1_001_(paired)_contig_1, whole genome shotgun sequence
trimmed_read1_3001221246-DNA.fastq.gz	gtdb_genomes_reps_r220/database/GCF/023/109/195/GCF_023109195.1_genomic.fna.gz	90.27	0.239	88.74-91.95	0.239	0.12-0.40	1	1.148	81/8648	86.01	NZ_JALDUB010000010.1 Streptococcus oralis strain S56 NODE_10_length_1933_cov_133.105065, whole genome shotgun sequence
trimmed_read1_3001221246-DNA.fastq.gz	gtdb_genomes_reps_r220/database/GCF/026/782/235/GCF_026782235.1_genomic.fna.gz	90.26	0.239	88.68-91.89	0.239	0.11-0.43	1	1.125	80/8576	86.00	NZ_JAKUWE010000010.1 Streptococcus oralis strain A16000295 A16000295_S17_contig_10_consensus, whole genome shotgun sequence
trimmed_read1_3001221246-DNA.fastq.gz	gtdb_genomes_reps_r220/database/GCA/905/221/345/GCA_905221345.1_genomic.fna.gz	90.22	0.269	88.86-92.02	0.269	0.14-0.46	1	1.145	83/8042	86.28	CAJNCW010000001.1 unidentified bacterium isolate Streptococcus species genome assembly, contig: NODE_1_length_381041_cov_38.7504, whole genome shotgun sequence
trimmed_read1_3001221246-DNA.fastq.gz	gtdb_genomes_reps_r220/database/GCF/002/096/685/GCF_002096685.1_genomic.fna.gz	90.21	0.237	88.51-92.14	0.237	0.10-0.46	1	1.153	72/7857	85.95	NZ_NCVA01000041.1 Streptococcus oralis subsp. dentisani strain RH_13585_10 s_oralis_RH_13585_10_ID_1, whole genome shotgun sequence
trimmed_read1_3001221246-DNA.fastq.gz	gtdb_genomes_reps_r220/database/GCF/023/109/315/GCF_023109315.1_genomic.fna.gz	90.21	0.261	88.73-92.35	0.261	0.12-0.46	1	1.155	84/8510	86.16	NZ_JALDUF010000010.1 Streptococcus oralis strain S50 NODE_10_length_46385_cov_60.582901, whole genome shotgun sequence
trimmed_read1_3001221246-DNA.fastq.gz	gtdb_genomes_reps_r220/database/GCF/934/229/205/GCF_934229205.1_genomic.fna.gz	90.20	0.178	88.17-91.83	0.178	0.11-0.36	1	1.082	49/7350	85.08	NZ_CAKQDJ010000001.1 MAG: uncultured Streptococcus sp. isolate REFINED_METABAT215_TOP10_CONTIGS_1500_ASSEMBLY_K77_MERGED__Nepal_MoBio_Fiber-Hadza-Nepal_J_9_THA0062YZ.55, whole genome shotgun sequence
trimmed_read1_3001221246-DNA.fastq.gz	gtdb_genomes_reps_r220/database/GCF/006/175/905/GCF_006175905.1_genomic.fna.gz	90.13	0.218	88.18-91.92	0.218	0.11-0.44	1	1.129	62/7917	85.52	NZ_SSNB01000001.1 Streptococcus oralis strain ATCC 9811 Contig1, whole genome shotgun sequence
trimmed_read1_3001221246-DNA.fastq.gz	gtdb_genomes_reps_r220/database/GCF/008/326/345/GCF_008326345.1_genomic.fna.gz	90.12	0.211	88.76-92.22	0.211	0.09-0.36	1	1.149	87/11390	85.45	NZ_BJEN01000001.1 Cutibacterium modestum strain M12 contig01, whole genome shotgun sequence
trimmed_read1_3001221246-DNA.fastq.gz	gtdb_genomes_reps_r220/database/GCA/902/488/495/GCA_902488495.1_genomic.fna.gz	90.11	0.267	88.46-91.85	0.267	0.12-0.48	1	1.171	70/7545	85.99	CABTWF010000001.1 MAG TPA_asm: uncultured Streptococcus sp. isolate MGYG-HGUT-03717 genome assembly, contig: GUT_GENOME242920_1, whole genome shotgun sequence
trimmed_read1_3001221246-DNA.fastq.gz	gtdb_genomes_reps_r220/database/GCF/003/943/385/GCF_003943385.1_genomic.fna.gz	90.07	0.273	88.65-92.19	0.273	0.12-0.47	1	1.175	80/8265	86.10	NZ_RJPI01000001.1 Streptococcus oralis strain BCC26 D8803_contig001, whole genome shotgun sequence
trimmed_read1_3001221246-DNA.fastq.gz	gtdb_genomes_reps_r220/database/GCF/001/579/525/GCF_001579525.1_genomic.fna.gz	90.04	0.286	88.64-91.71	0.286	0.16-0.48	1	1.212	80/7913	86.23	NZ_CM003838.1 Streptococcus oralis strain DD25 plasmid unnamed, whole genome shotgun sequence
