Sample_file	Genome_file	Adjusted_ANI	Eff_cov	ANI_5-95_percentile	Eff_lambda	Lambda_5-95_percentile	Median_cov	Mean_cov_geq1	Containment_ind	Naive_ANI	Contig_name
trimmed_read1_3001212756-DNA.fastq.gz	gtdb_genomes_reps_r220/database/GCF/002/014/765/GCF_002014765.1_genomic.fna.gz	99.22	0.944	99.09-99.35	0.944	0.89-1.00	1	1.677	4279/8926	97.66	NZ_MUYT01000001.1 Moraxella lincolnii strain CCUG 9405 CCUG9405T_R1__paired__trimmed__paired__contig_1, whole genome shotgun sequence
trimmed_read1_3001212756-DNA.fastq.gz	gtdb_genomes_reps_r220/database/GCF/001/457/655/GCF_001457655.1_genomic.fna.gz	98.68	0.463	98.40-98.95	0.463	0.41-0.51	1	1.268	1958/7983	95.57	NZ_LN831035.1 Haemophilus influenzae strain NCTC8143 chromosome 1, complete sequence
trimmed_read1_3001212756-DNA.fastq.gz	gtdb_genomes_reps_r220/database/GCF/001/632/285/GCF_001632285.1_genomic.fna.gz	98.35	0.295	97.80-98.76	0.295	0.26-0.35	1	1.245	1247/8176	94.11	NZ_LWAH01000001.1 Moraxella catarrhalis strain CCUG 353 contig_1, whole genome shotgun sequence
trimmed_read1_3001212756-DNA.fastq.gz	gtdb_genomes_reps_r220/database/GCF/000/245/815/GCF_000245815.1_genomic.fna.gz	98.22	0.617	97.99-98.41	0.617	0.57-0.67	1	1.375	2065/7821	95.80	NZ_JH601103.1 Dolosigranulum pigrum ATCC 51524 supercont1.1, whole genome shotgun sequence
trimmed_read1_3001212756-DNA.fastq.gz	gtdb_genomes_reps_r220/database/GCF/002/984/305/GCF_002984305.1_genomic.fna.gz	97.84	0.469	97.52-98.12	0.469	0.42-0.52	1	1.310	1625/8528	94.79	NZ_NEAA01000096.1 Haemophilus influenzae strain 135P16H1 N135P16H1_100_1, whole genome shotgun sequence
trimmed_read1_3001212756-DNA.fastq.gz	gtdb_genomes_reps_r220/database/GCF/019/703/545/GCF_019703545.1_genomic.fna.gz	97.79	0.466	97.51-98.08	0.466	0.41-0.51	1	1.273	1509/8083	94.73	NZ_AP018771.1 Haemophilus influenzae strain CHBN-II-8 isolate 10H27 chromosome, complete genome
trimmed_read1_3001212756-DNA.fastq.gz	gtdb_genomes_reps_r220/database/GCF/005/888/195/GCF_005888195.1_genomic.fna.gz	97.65	0.481	97.35-97.95	0.481	0.42-0.53	1	1.289	1503/8234	94.66	NZ_LNKR01000001.1 Haemophilus influenzae biotype aegyptius strain KC1018 contig_001, whole genome shotgun sequence
trimmed_read1_3001212756-DNA.fastq.gz	gtdb_genomes_reps_r220/database/GCF/001/679/005/GCF_001679005.1_genomic.fna.gz	97.27	0.334	96.80-97.74	0.334	0.28-0.38	1	1.257	1185/9834	93.40	NZ_LXTW01000001.1 Moraxella nonliquefaciens strain CCUG 348 contig_1, whole genome shotgun sequence
trimmed_read1_3001212756-DNA.fastq.gz	gtdb_genomes_reps_r220/database/GCF/000/688/415/GCF_000688415.1_genomic.fna.gz	97.06	0.126	95.96-98.04	0.126	0.09-0.17	1	1.068	459/9809	90.59	NZ_JIAH01000001.1 Corynebacterium pseudodiphtheriticum DSM 44287 O146DRAFT_scaffold00010.10_C, whole genome shotgun sequence
trimmed_read1_3001212756-DNA.fastq.gz	gtdb_genomes_reps_r220/database/GCF/900/475/755/GCF_900475755.1_genomic.fna.gz	96.30	0.472	95.86-96.69	0.472	0.42-0.54	1	1.276	918/7845	93.31	NZ_LS483411.1 Haemophilus influenzae strain NCTC11426 chromosome 1, complete sequence
trimmed_read1_3001212756-DNA.fastq.gz	gtdb_genomes_reps_r220/database/GCF/003/493/605/GCF_003493605.1_genomic.fna.gz	95.06	0.443	94.58-95.51	0.443	0.37-0.53	1	1.312	586/7850	91.97	NZ_QQKA01000001.1 Haemophilus haemolyticus strain M19187 M19187_HUY4190A139_cleaned_ctg_3530, whole genome shotgun sequence
trimmed_read1_3001212756-DNA.fastq.gz	gtdb_genomes_reps_r220/database/GCF/000/222/025/GCF_000222025.1_genomic.fna.gz	94.99	0.456	94.49-95.49	0.456	0.37-0.55	1	1.258	563/7558	91.96	NZ_AFQO01000022.1 Haemophilus haemolyticus M19501 M19501_022, whole genome shotgun sequence
trimmed_read1_3001212756-DNA.fastq.gz	gtdb_genomes_reps_r220/database/GCF/003/493/685/GCF_003493685.1_genomic.fna.gz	94.34	0.446	93.77-94.72	0.446	0.37-0.54	1	1.290	525/8850	91.29	NZ_QQJW01000001.1 Haemophilus haemolyticus strain M26161 M26161_HUY4190A151_cleaned_ctg_3559, whole genome shotgun sequence
trimmed_read1_3001212756-DNA.fastq.gz	gtdb_genomes_reps_r220/database/GCF/003/490/935/GCF_003490935.1_genomic.fna.gz	94.30	0.456	93.76-94.70	0.456	0.39-0.56	1	1.288	486/8148	91.31	NZ_QQGD01000001.1 Haemophilus haemolyticus strain M19099 M19099_HUY4190A124_cleaned_ctg_3040, whole genome shotgun sequence
trimmed_read1_3001212756-DNA.fastq.gz	gtdb_genomes_reps_r220/database/GCF/003/352/385/GCF_003352385.1_genomic.fna.gz	94.23	0.485	93.67-94.61	0.485	0.41-0.58	1	1.264	519/8521	91.37	NZ_CP031243.1 Haemophilus haemolyticus strain M19346 chromosome, complete genome
trimmed_read1_3001212756-DNA.fastq.gz	gtdb_genomes_reps_r220/database/GCF/003/490/595/GCF_003490595.1_genomic.fna.gz	94.23	0.433	93.60-94.72	0.433	0.35-0.54	1	1.284	489/8755	91.11	NZ_QQGY01000001.1 Haemophilus haemolyticus strain M19079 M19079_HUY4190A121_cleaned_ctg_3577, whole genome shotgun sequence
trimmed_read1_3001212756-DNA.fastq.gz	gtdb_genomes_reps_r220/database/GCF/001/276/515/GCF_001276515.1_genomic.fna.gz	94.17	0.507	93.69-94.66	0.507	0.41-0.60	1	1.310	535/8635	91.42	NZ_LDVZ01000082.1 Haemophilus sp. C1 contig398, whole genome shotgun sequence
trimmed_read1_3001212756-DNA.fastq.gz	gtdb_genomes_reps_r220/database/GCF/001/679/045/GCF_001679045.1_genomic.fna.gz	94.13	0.485	93.58-94.60	0.485	0.40-0.58	1	1.321	471/7971	91.28	NZ_LYCK01000001.1 Haemophilus haemolyticus strain CCUG 12834 contig_1, whole genome shotgun sequence
trimmed_read1_3001212756-DNA.fastq.gz	gtdb_genomes_reps_r220/database/GCF/003/351/405/GCF_003351405.1_genomic.fna.gz	94.09	0.407	93.34-94.66	0.407	0.32-0.53	1	1.232	409/8082	90.82	NZ_CP031240.1 Haemophilus haemolyticus strain M19345 chromosome, complete genome
trimmed_read1_3001212756-DNA.fastq.gz	gtdb_genomes_reps_r220/database/GCA/001/752/465/GCA_001752465.1_genomic.fna.gz	93.54	0.506	93.07-94.01	0.506	0.43-0.62	1	1.331	459/9119	90.81	MDJB01000001.1 Haemophilus quentini strain K068 K068_S8_L001_R1_001_(paired)_contig_1, whole genome shotgun sequence
trimmed_read1_3001212756-DNA.fastq.gz	gtdb_genomes_reps_r220/database/GCF/006/384/255/GCF_006384255.1_genomic.fna.gz	93.36	0.457	92.73-93.88	0.457	0.37-0.57	1	1.274	390/8908	90.40	NZ_VCED01000001.1 Haemophilus seminalis strain SZY H1 Scaffold1, whole genome shotgun sequence
trimmed_read1_3001212756-DNA.fastq.gz	gtdb_genomes_reps_r220/database/GCA/018/372/995/GCA_018372995.1_genomic.fna.gz	93.30	0.456	92.65-93.79	0.456	0.38-0.56	1	1.249	377/8819	90.33	JAHAHX010000023.1 MAG: Haemophilus haemolyticus isolate L3_098_047G1_dasL3_098_047G1_concoct_31 L3_098_047G1_scaffold_1020, whole genome shotgun sequence
trimmed_read1_3001212756-DNA.fastq.gz	gtdb_genomes_reps_r220/database/GCF/001/656/295/GCF_001656295.1_genomic.fna.gz	92.69	0.444	91.94-93.33	0.444	0.32-0.57	1	1.274	317/9300	89.67	NZ_LXHE01000009.1 Moraxella catarrhalis strain Z7574 Z7574_ctg-0, whole genome shotgun sequence
trimmed_read1_3001212756-DNA.fastq.gz	gtdb_genomes_reps_r220/database/GCA/000/430/305/GCA_000430305.1_genomic.fna.gz	91.67	0.131	89.33-92.57	0.131	0.09-0.28	1	1.269	67/8074	85.68	ASZZ01000001.1 Streptococcus mitis 17/34 contig00001, whole genome shotgun sequence
trimmed_read1_3001212756-DNA.fastq.gz	gtdb_genomes_reps_r220/database/GCF/030/826/625/GCF_030826625.1_genomic.fna.gz	91.32	0.141	89.24-92.99	0.141	0.08-0.27	1	1.066	76/9660	85.53	NZ_JAPJNQ010000054.1 MAG: Corynebacterium sp. isolate RAGGC_12 NODE_1032_length_14664_cov_8.518995, whole genome shotgun sequence
trimmed_read1_3001212756-DNA.fastq.gz	gtdb_genomes_reps_r220/database/GCF/015/223/095/GCF_015223095.1_genomic.fna.gz	91.31	0.425	90.39-92.03	0.425	0.32-0.57	1	1.484	244/11687	88.27	NZ_JADFBZ010000001.1 Moraxella sp. K127 Contig_001, whole genome shotgun sequence
trimmed_read1_3001212756-DNA.fastq.gz	gtdb_genomes_reps_r220/database/GCF/006/385/785/GCF_006385785.1_genomic.fna.gz	91.16	0.138	89.01-92.51	0.138	0.09-0.28	1	1.109	64/8626	85.37	NZ_VFSH01000001.1 Streptococcus shenyangsis strain D19 Scaffold1, whole genome shotgun sequence
trimmed_read1_3001212756-DNA.fastq.gz	gtdb_genomes_reps_r220/database/GCF/000/257/865/GCF_000257865.1_genomic.fna.gz	91.02	0.120	88.43-91.50	0.120	0.11-0.26	1	1.109	55/8814	84.89	NZ_AICU01000001.1 Streptococcus mitis SK575 contig00033, whole genome shotgun sequence
trimmed_read1_3001212756-DNA.fastq.gz	gtdb_genomes_reps_r220/database/GCF/003/942/965/GCF_003942965.1_genomic.fna.gz	90.91	0.130	87.94-91.14	0.130	0.11-0.33	1	1.333	51/8015	84.95	NZ_RJOG01000001.1 Streptococcus mitis strain BCC07 D8837_contig001, whole genome shotgun sequence
trimmed_read1_3001212756-DNA.fastq.gz	gtdb_genomes_reps_r220/database/GCF/009/496/085/GCF_009496085.1_genomic.fna.gz	90.90	0.122	88.61-91.68	0.122	0.10-0.26	1	1.315	54/9024	84.78	NZ_WIJN01000100.1 Streptococcus mitis strain SM13 NODE_100_length_642_cov_0.945631, whole genome shotgun sequence
trimmed_read1_3001212756-DNA.fastq.gz	gtdb_genomes_reps_r220/database/GCF/003/942/765/GCF_003942765.1_genomic.fna.gz	90.87	0.128	88.49-91.30	0.128	0.12-0.30	1	1.382	55/8775	84.91	NZ_RJNW01000001.1 Streptococcus mitis strain KLC01 D8849_contig001, whole genome shotgun sequence
trimmed_read1_3001212756-DNA.fastq.gz	gtdb_genomes_reps_r220/database/GCF/001/074/635/GCF_001074635.1_genomic.fna.gz	90.80	0.125	88.20-91.49	0.125	0.11-0.28	1	1.321	53/8979	84.74	NZ_JUQO01000001.1 Streptococcus mitis strain 850_SMIT 0_226_2877, whole genome shotgun sequence
trimmed_read1_3001212756-DNA.fastq.gz	gtdb_genomes_reps_r220/database/GCA/905/221/125/GCA_905221125.1_genomic.fna.gz	90.77	0.130	88.23-91.17	0.130	0.12-0.34	1	1.333	51/8383	84.82	CAJNBY010000001.1 unidentified bacterium isolate Streptococcus species genome assembly, contig: NODE_1_length_225877_cov_55.373, whole genome shotgun sequence
trimmed_read1_3001212756-DNA.fastq.gz	gtdb_genomes_reps_r220/database/GCF/002/005/545/GCF_002005545.1_genomic.fna.gz	90.77	0.125	88.55-91.63	0.125	0.10-0.28	1	1.059	51/8727	84.71	NZ_LBMT01000001.1 Streptococcus mitis strain 321A Scaffold1, whole genome shotgun sequence
trimmed_read1_3001212756-DNA.fastq.gz	gtdb_genomes_reps_r220/database/GCF/002/027/545/GCF_002027545.1_genomic.fna.gz	90.62	0.571	89.89-91.20	0.571	0.43-0.75	1	1.542	253/12181	88.25	NZ_MXAN01000001.1 Moraxella lacunata strain CCUG 4441 CCUG_4441T_0000001, whole genome shotgun sequence
trimmed_read1_3001212756-DNA.fastq.gz	gtdb_genomes_reps_r220/database/GCA/905/221/115/GCA_905221115.1_genomic.fna.gz	90.58	0.133	88.16-91.26	0.133	0.11-0.32	1	1.120	50/8441	84.75	CAJNBX010000001.1 unidentified bacterium isolate Streptococcus species genome assembly, contig: NODE_1_length_385792_cov_41.2882, whole genome shotgun sequence
trimmed_read1_3001212756-DNA.fastq.gz	gtdb_genomes_reps_r220/database/GCA/946/190/245/GCA_946190245.1_genomic.fna.gz	90.55	0.128	87.73-91.20	0.128	0.11-0.32	1	1.407	54/9601	84.61	CAMIAC010000001.1 Streptococcus mitis genome assembly, contig: NODE_1_length_204978_cov_120.810372, whole genome shotgun sequence
trimmed_read1_3001212756-DNA.fastq.gz	gtdb_genomes_reps_r220/database/GCA/905/221/195/GCA_905221195.1_genomic.fna.gz	90.54	0.136	87.79-91.18	0.136	0.11-0.34	1	1.122	49/8196	84.78	CAJNCF010000001.1 unidentified bacterium isolate Streptococcus species genome assembly, contig: NODE_1_length_351178_cov_24.3909, whole genome shotgun sequence
trimmed_read1_3001212756-DNA.fastq.gz	gtdb_genomes_reps_r220/database/GCF/000/222/785/GCF_000222785.1_genomic.fna.gz	90.51	0.136	87.47-91.13	0.136	0.12-0.33	1	1.125	48/8285	84.69	NZ_AFUF01000054.1 Streptococcus mitis SK569 ctg1129913977589, whole genome shotgun sequence
trimmed_read1_3001212756-DNA.fastq.gz	gtdb_genomes_reps_r220/database/GCA/905/221/035/GCA_905221035.1_genomic.fna.gz	90.42	0.140	87.56-91.08	0.140	0.11-0.33	1	1.354	48/8375	84.66	CAJNBP010000001.1 unidentified bacterium isolate Streptococcus species genome assembly, contig: NODE_1_length_294953_cov_49.9758, whole genome shotgun sequence
trimmed_read1_3001212756-DNA.fastq.gz	gtdb_genomes_reps_r220/database/GCF/003/942/865/GCF_003942865.1_genomic.fna.gz	90.34	0.140	88.05-90.82	0.140	0.12-0.32	1	1.125	48/8424	84.65	NZ_RJNZ01000001.1 Streptococcus mitis strain BCC55 D8845_contig001, whole genome shotgun sequence
trimmed_read1_3001212756-DNA.fastq.gz	gtdb_genomes_reps_r220/database/GCF/000/722/705/GCF_000722705.1_genomic.fna.gz	90.32	0.136	87.84-91.24	0.136	0.11-0.32	1	1.064	47/8646	84.52	NZ_JPFW01000001.1 Streptococcus mitis strain SK642 gsmSK642.contig.0_1, whole genome shotgun sequence
trimmed_read1_3001212756-DNA.fastq.gz	gtdb_genomes_reps_r220/database/GCF/003/943/935/GCF_003943935.1_genomic.fna.gz	90.30	0.185	88.51-91.79	0.185	0.10-0.38	1	1.311	61/8544	85.26	NZ_RJOB01000001.1 Streptococcus mitis strain BCC45 D8842_contig001, whole genome shotgun sequence
trimmed_read1_3001212756-DNA.fastq.gz	gtdb_genomes_reps_r220/database/GCF/946/190/285/GCF_946190285.1_genomic.fna.gz	90.27	0.143	88.23-90.93	0.143	0.13-0.33	1	1.362	47/8428	84.59	NZ_CAMHZX010000001.1 Streptococcus mitis isolate Streptococcus mitis NODE_1_length_750225_cov_136.047748, whole genome shotgun sequence
trimmed_read1_3001212756-DNA.fastq.gz	gtdb_genomes_reps_r220/database/GCF/002/860/865/GCF_002860865.1_genomic.fna.gz	90.24	0.140	88.12-90.83	0.140	0.11-0.29	1	1.354	48/8904	84.49	NZ_PKIE01000001.1 Streptococcus mitis strain UMB1341 .21837_8_64.1, whole genome shotgun sequence
trimmed_read1_3001212756-DNA.fastq.gz	gtdb_genomes_reps_r220/database/GCF/002/096/735/GCF_002096735.1_genomic.fna.gz	90.20	0.146	87.47-90.70	0.146	0.13-0.39	1	1.370	46/8264	84.58	NZ_NCVC01000017.1 Streptococcus mitis strain RH_8961_10 s_mitis_RH_8961_10_ID_1, whole genome shotgun sequence
trimmed_read1_3001212756-DNA.fastq.gz	gtdb_genomes_reps_r220/database/GCF/020/089/495/GCF_020089495.2_genomic.fna.gz	90.20	0.143	87.35-90.75	0.143	0.12-0.35	1	1.104	48/8470	84.63	NZ_JAIRCA020000001.1 Streptococcus sp. IMAU 99199 IMAU99199, whole genome shotgun sequence
trimmed_read1_3001212756-DNA.fastq.gz	gtdb_genomes_reps_r220/database/GCF/001/072/315/GCF_001072315.1_genomic.fna.gz	90.17	0.136	87.23-90.84	0.136	0.11-0.31	1	1.122	49/9310	84.43	NZ_JVLI01000001.1 Streptococcus pseudopneumoniae strain 330_SPSE 0_919_132734, whole genome shotgun sequence
trimmed_read1_3001212756-DNA.fastq.gz	gtdb_genomes_reps_r220/database/GCA/905/221/235/GCA_905221235.1_genomic.fna.gz	90.15	0.170	87.59-91.47	0.170	0.11-0.40	1	1.370	54/8581	84.92	CAJNCJ010000001.1 unidentified bacterium isolate Streptococcus species genome assembly, contig: NODE_1_length_257994_cov_14.1844, whole genome shotgun sequence
trimmed_read1_3001212756-DNA.fastq.gz	gtdb_genomes_reps_r220/database/GCF/946/188/615/GCF_946188615.1_genomic.fna.gz	90.15	0.143	87.67-91.10	0.143	0.12-0.33	1	1.104	48/8605	84.59	NZ_CAMHVK010000001.1 Streptococcus mitis isolate Streptococcus mitis NODE_1_length_383254_cov_94.802522, whole genome shotgun sequence
trimmed_read1_3001212756-DNA.fastq.gz	gtdb_genomes_reps_r220/database/GCF/905/187/535/GCF_905187535.1_genomic.fna.gz	90.15	0.143	87.85-90.92	0.143	0.12-0.32	1	1.128	47/8616	84.53	NZ_CAJJIE010000001.1 Streptococcus mitis isolate Streptococcus mitis, whole genome shotgun sequence
trimmed_read1_3001212756-DNA.fastq.gz	gtdb_genomes_reps_r220/database/GCA/902/489/265/GCA_902489265.1_genomic.fna.gz	90.12	0.158	87.97-90.72	0.158	0.14-0.32	1	1.143	42/7235	84.70	CABTZI010000001.1 MAG TPA_asm: uncultured Streptococcus sp. isolate MGYG-HGUT-03797 genome assembly, contig: GUT_GENOME244205_1, whole genome shotgun sequence
trimmed_read1_3001212756-DNA.fastq.gz	gtdb_genomes_reps_r220/database/GCF/030/439/915/GCF_030439915.1_genomic.fna.gz	90.08	0.146	87.27-90.59	0.146	0.13-0.33	1	1.130	46/8418	84.53	NZ_JAQFJG010000010.1 Streptococcus sp. SPS1 NODE_10_length_71805_cov_189.924538, whole genome shotgun sequence
trimmed_read1_3001212756-DNA.fastq.gz	gtdb_genomes_reps_r220/database/GCA/927/910/965/GCA_927910965.1_genomic.fna.gz	90.04	0.174	87.89-91.23	0.174	0.12-0.36	1	1.386	57/8896	84.97	CAKMOM010000001.1 MAG TPA_asm: uncultured Streptococcus sp. isolate ERR3827222_bin.1_metaWRAP_v1.1_MAG genome assembly, contig: ERZ4768407.87, whole genome shotgun sequence
trimmed_read1_3001212756-DNA.fastq.gz	gtdb_genomes_reps_r220/database/GCF/003/942/685/GCF_003942685.1_genomic.fna.gz	90.04	0.146	87.32-90.65	0.146	0.12-0.31	1	1.191	47/8731	84.49	NZ_RJNR01000001.1 Streptococcus mitis strain BCA12 D8855_contig001, whole genome shotgun sequence
