Sample_file	Genome_file	Taxonomic_abundance	Sequence_abundance	Adjusted_ANI	Eff_cov	ANI_5-95_percentile	Eff_lambda	Lambda_5-95_percentile	Median_cov	Mean_cov_geq1	Containment_ind	Naive_ANI	kmers_reassigned	Contig_name
trimmed_read1_3001421330-DNA.fastq.gz	gtdb_genomes_reps_r220/database/GCF/001/457/635/GCF_001457635.1_genomic.fna.gz	68.8376	71.0776	98.94	0.776	98.80-99.13	0.776	0.72-0.83	1	1.475	3330/8578	96.99	0	NZ_LN831051.1 Streptococcus pneumoniae strain NCTC7465 chromosome 1, complete sequence
trimmed_read1_3001421330-DNA.fastq.gz	gtdb_genomes_reps_r220/database/GCF/000/187/585/GCF_000187585.1_genomic.fna.gz	10.2300	8.2058	97.71	0.115	96.50-98.67	0.115	0.08-0.17	1	1.084	371/6993	90.96	103	NZ_GL732463.1 Streptococcus peroris ATCC 700780 SCAFFOLD1, whole genome shotgun sequence
trimmed_read1_3001421330-DNA.fastq.gz	gtdb_genomes_reps_r220/database/GCF/000/245/815/GCF_000245815.1_genomic.fna.gz	5.9411	5.4113	97.72	0.067	95.84-99.93	0.067	0.03-0.12	1	1.036	249/7821	89.48	0	NZ_JH601103.1 Dolosigranulum pigrum ATCC 51524 supercont1.1, whole genome shotgun sequence
trimmed_read1_3001421330-DNA.fastq.gz	gtdb_genomes_reps_r220/database/GCF/001/632/285/GCF_001632285.1_genomic.fna.gz	5.7627	5.3133	98.48	0.065	96.83-100.32	0.065	0.03-0.11	1	1.059	320/8176	90.07	0	NZ_LWAH01000001.1 Moraxella catarrhalis strain CCUG 353 contig_1, whole genome shotgun sequence
trimmed_read1_3001421330-DNA.fastq.gz	gtdb_genomes_reps_r220/database/GCF/024/294/905/GCF_024294905.1_genomic.fna.gz	4.7542	5.0022	95.51	0.054	92.91-96.07	0.054	0.05-0.12	1	1.043	116/9248	86.83	1	NZ_JANCOC010000001.1 Rothia sp. P3C3.S176 c_000000000001, whole genome shotgun sequence
trimmed_read1_3001421330-DNA.fastq.gz	gtdb_genomes_reps_r220/database/GCF/001/679/005/GCF_001679005.1_genomic.fna.gz	4.4745	4.9898	95.65	0.050	93.05-96.05	0.050	0.05-0.11	1	1.025	122/9834	86.80	18	NZ_LXTW01000001.1 Moraxella nonliquefaciens strain CCUG 348 contig_1, whole genome shotgun sequence
