trimmed_read1_3001328919-DNA.fastq.gz	gtdb_genomes_reps_r220/database/GCF/905/187/535/GCF_905187535.1_genomic.fna.gz	92.59	0.521	91.94-93.15	0.521	0.40-0.66	1	1.325	323/8616	89.95	NZ_CAJJIE010000001.1 Streptococcus mitis isolate Streptococcus mitis, whole genome shotgun sequence
trimmed_read1_3001328919-DNA.fastq.gz	gtdb_genomes_reps_r220/database/GCF/003/944/325/GCF_003944325.1_genomic.fna.gz	92.59	0.424	91.83-93.25	0.424	0.33-0.53	1	1.269	301/9459	89.47	NZ_RJPX01000001.1 Streptococcus mitis strain BCC17 D8787_contig001, whole genome shotgun sequence
trimmed_read1_3001328919-DNA.fastq.gz	gtdb_genomes_reps_r220/database/GCF/002/096/815/GCF_002096815.1_genomic.fna.gz	92.58	0.521	91.96-93.17	0.521	0.43-0.66	1	1.320	316/8476	89.93	NZ_NCVJ01000021.1 Streptococcus mitis strain RH_12363_08 s_mitis_RH_12363_08_ID_1, whole genome shotgun sequence
trimmed_read1_3001328919-DNA.fastq.gz	gtdb_genomes_reps_r220/database/GCF/003/942/865/GCF_003942865.1_genomic.fna.gz	92.55	0.528	91.94-93.09	0.528	0.40-0.68	1	1.325	314/8424	89.93	NZ_RJNZ01000001.1 Streptococcus mitis strain BCC55 D8845_contig001, whole genome shotgun sequence
trimmed_read1_3001328919-DNA.fastq.gz	gtdb_genomes_reps_r220/database/GCF/003/428/885/GCF_003428885.1_genomic.fna.gz	92.52	0.429	91.90-93.35	0.429	0.30-0.55	1	1.354	260/8283	89.44	NZ_QQRU01000001.1 Streptococcus sp. LQJ-218 scaffold1, whole genome shotgun sequence
trimmed_read1_3001328919-DNA.fastq.gz	gtdb_genomes_reps_r220/database/GCF/009/731/465/GCF_009731465.1_genomic.fna.gz	92.49	0.448	91.82-93.20	0.448	0.33-0.56	1	1.231	264/8228	89.50	NZ_AP021887.1 Streptococcus sp. 116-D4 chromosome, complete genome
trimmed_read1_3001328919-DNA.fastq.gz	gtdb_genomes_reps_r220/database/GCA/927/911/535/GCA_927911535.1_genomic.fna.gz	92.48	0.415	91.58-93.37	0.415	0.30-0.56	1	1.222	203/6752	89.31	CAKMQC010000001.1 MAG TPA_asm: Streptococcus mitis isolate ERR3827286_bin.1_metaWRAP_v1.1_MAG genome assembly, contig: ERZ4768129.98, whole genome shotgun sequence
trimmed_read1_3001328919-DNA.fastq.gz	gtdb_genomes_reps_r220/database/GCA/905/221/145/GCA_905221145.1_genomic.fna.gz	92.41	0.521	91.82-93.09	0.521	0.39-0.66	1	1.353	286/8115	89.77	CAJNCA010000001.1 unidentified bacterium isolate Streptococcus species genome assembly, contig: NODE_1_length_542150_cov_74.7743, whole genome shotgun sequence
trimmed_read1_3001328919-DNA.fastq.gz	gtdb_genomes_reps_r220/database/GCF/901/875/575/GCF_901875575.1_genomic.fna.gz	92.15	0.393	91.34-93.06	0.393	0.27-0.52	1	1.357	221/8547	88.88	NZ_CABFMF010000001.1 Uncultured Streptococcus sp., whole genome shotgun sequence
trimmed_read1_3001328919-DNA.fastq.gz	gtdb_genomes_reps_r220/database/GCF/000/259/505/GCF_000259505.1_genomic.fna.gz	91.25	0.556	90.48-91.98	0.556	0.40-0.74	1	1.422	204/8154	88.78	NZ_AJMM01000001.1 Streptococcus sp. SK643 contig00011, whole genome shotgun sequence
trimmed_read1_3001328919-DNA.fastq.gz	gtdb_genomes_reps_r220/database/GCF/002/386/345/GCF_002386345.1_genomic.fna.gz	90.91	0.355	89.74-91.93	0.355	0.24-0.57	1	1.256	133/8523	87.44	NZ_CP023507.1 Streptococcus oralis strain FDAARGOS_367 chromosome, complete genome
trimmed_read1_3001328919-DNA.fastq.gz	gtdb_genomes_reps_r220/database/GCA/905/221/365/GCA_905221365.1_genomic.fna.gz	90.74	0.492	89.96-91.47	0.492	0.35-0.65	1	1.354	158/8215	88.03	CAJNCX010000001.1 unidentified bacterium isolate Streptococcus species genome assembly, contig: NODE_1_length_497507_cov_52.0569, whole genome shotgun sequence
trimmed_read1_3001328919-DNA.fastq.gz	gtdb_genomes_reps_r220/database/GCF/003/943/395/GCF_003943395.1_genomic.fna.gz	90.67	0.468	89.58-91.53	0.468	0.32-0.68	1	1.383	149/8235	87.86	NZ_RJPJ01000001.1 Streptococcus oralis strain BCC12 D8802_contig001, whole genome shotgun sequence
trimmed_read1_3001328919-DNA.fastq.gz	gtdb_genomes_reps_r220/database/GCA/905/371/745/GCA_905371745.1_genomic.fna.gz	90.66	0.400	89.61-91.75	0.400	0.27-0.60	1	1.267	120/7604	87.47	CAJPMK010000001.1 MAG: uncultured Streptococcus sp. isolate SRR9217389-mag-bin.1 genome assembly, contig: SRR9217389-mag-bin.1_17, whole genome shotgun sequence
trimmed_read1_3001328919-DNA.fastq.gz	gtdb_genomes_reps_r220/database/GCA/905/221/435/GCA_905221435.1_genomic.fna.gz	90.65	0.440	89.52-91.60	0.440	0.28-0.64	1	1.449	138/8058	87.70	CAJNDD010000001.1 unidentified bacterium isolate Streptococcus species genome assembly, contig: NODE_1_length_207485_cov_48.3812, whole genome shotgun sequence
trimmed_read1_3001328919-DNA.fastq.gz	gtdb_genomes_reps_r220/database/GCF/002/096/675/GCF_002096675.1_genomic.fna.gz	90.63	0.500	89.67-91.43	0.500	0.34-0.71	1	1.395	147/7824	87.97	NZ_NCUZ01000020.1 Streptococcus oralis subsp. dentisani strain RH_55407_11 s_oralis_RH_55407_11_ID_1, whole genome shotgun sequence
trimmed_read1_3001328919-DNA.fastq.gz	gtdb_genomes_reps_r220/database/GCF/022/749/195/GCF_022749195.1_genomic.fna.gz	90.62	0.400	89.34-91.72	0.400	0.28-0.62	1	1.295	122/7844	87.43	NZ_CP094226.1 Streptococcus oralis strain 1648 chromosome, complete genome
trimmed_read1_3001328919-DNA.fastq.gz	gtdb_genomes_reps_r220/database/GCF/000/253/155/GCF_000253155.1_genomic.fna.gz	90.57	0.380	89.49-91.76	0.380	0.25-0.57	1	1.228	123/8390	87.27	NC_015291.1 Streptococcus oralis Uo5, complete sequence
trimmed_read1_3001328919-DNA.fastq.gz	gtdb_genomes_reps_r220/database/GCF/019/929/365/GCF_019929365.1_genomic.fna.gz	90.54	0.509	89.55-91.45	0.509	0.35-0.72	1	1.411	151/8186	87.91	NZ_JAHZPH010000001.1 Streptococcus oralis strain KK26 Soralis_KK26_NinaOddballs_Sia_NO_1, whole genome shotgun sequence
trimmed_read1_3001328919-DNA.fastq.gz	gtdb_genomes_reps_r220/database/GCF/023/110/055/GCF_023110055.1_genomic.fna.gz	90.54	0.491	89.54-91.53	0.491	0.32-0.69	1	1.414	152/8490	87.83	NZ_JALDVG010000001.1 Streptococcus oralis strain S14 NODE_1_length_1539913_cov_136.781490, whole genome shotgun sequence
trimmed_read1_3001328919-DNA.fastq.gz	gtdb_genomes_reps_r220/database/GCF/016/028/255/GCF_016028255.1_genomic.fna.gz	90.48	0.392	89.28-91.52	0.392	0.25-0.58	1	1.293	123/8438	87.25	NZ_CP065707.1 Streptococcus oralis strain FDAARGOS_885 chromosome, complete genome
trimmed_read1_3001328919-DNA.fastq.gz	gtdb_genomes_reps_r220/database/GCA/905/221/335/GCA_905221335.1_genomic.fna.gz	90.48	0.519	89.51-91.32	0.519	0.37-0.73	1	1.380	142/7744	87.90	CAJNCT010000001.1 unidentified bacterium isolate Streptococcus species genome assembly, contig: NODE_1_length_806898_cov_52.5296, whole genome shotgun sequence
trimmed_read1_3001328919-DNA.fastq.gz	gtdb_genomes_reps_r220/database/GCF/003/943/905/GCF_003943905.1_genomic.fna.gz	90.44	0.433	89.28-91.29	0.433	0.29-0.66	1	1.392	130/8263	87.46	NZ_RJNS01000001.1 Streptococcus mitis strain BCA11 D8854_contig001, whole genome shotgun sequence
trimmed_read1_3001328919-DNA.fastq.gz	gtdb_genomes_reps_r220/database/GCA/000/831/085/GCA_000831085.1_genomic.fna.gz	90.44	0.544	89.53-91.29	0.544	0.38-0.77	1	1.419	160/8545	87.96	JXRG01000001.1 Streptococcus sp. DBCMS contig_1, whole genome shotgun sequence
trimmed_read1_3001328919-DNA.fastq.gz	gtdb_genomes_reps_r220/database/GCA/905/221/265/GCA_905221265.1_genomic.fna.gz	90.43	0.559	89.54-91.23	0.559	0.36-0.74	1	1.413	155/8141	88.00	CAJNCQ010000001.1 unidentified bacterium isolate Streptococcus species genome assembly, contig: NODE_1_length_363116_cov_65.4984, whole genome shotgun sequence
trimmed_read1_3001328919-DNA.fastq.gz	gtdb_genomes_reps_r220/database/GCF/003/942/875/GCF_003942875.1_genomic.fna.gz	90.40	0.463	89.38-91.31	0.463	0.32-0.68	1	1.352	145/8877	87.57	NZ_RMVK01000001.1 Streptococcus oralis strain BCC52 D8844_contig001, whole genome shotgun sequence
trimmed_read1_3001328919-DNA.fastq.gz	gtdb_genomes_reps_r220/database/GCF/001/075/675/GCF_001075675.1_genomic.fna.gz	90.40	0.495	89.39-91.41	0.495	0.32-0.75	1	1.421	140/8137	87.72	NZ_JUNW01000025.1 Streptococcus oralis strain 918_SORA 100_384_5216, whole genome shotgun sequence
trimmed_read1_3001328919-DNA.fastq.gz	gtdb_genomes_reps_r220/database/GCF/001/983/955/GCF_001983955.1_genomic.fna.gz	90.36	0.412	89.25-91.26	0.412	0.28-0.59	1	1.254	122/8365	87.25	NZ_CP019562.1 Streptococcus oralis strain S.MIT/ORALIS-351 chromosome, complete genome
trimmed_read1_3001328919-DNA.fastq.gz	gtdb_genomes_reps_r220/database/GCF/023/109/005/GCF_023109005.1_genomic.fna.gz	90.36	0.471	89.44-91.30	0.471	0.33-0.68	1	1.372	137/8404	87.56	NZ_JALDTU010000010.1 Streptococcus oralis strain S66 NODE_10_length_47603_cov_133.865463, whole genome shotgun sequence
trimmed_read1_3001328919-DNA.fastq.gz	gtdb_genomes_reps_r220/database/GCA/000/296/995/GCA_000296995.1_genomic.fna.gz	90.34	0.455	89.35-91.23	0.455	0.31-0.68	1	1.401	137/8680	87.47	AJRA01000001.1 Streptococcus sp. GMD2S Contig_001, whole genome shotgun sequence
trimmed_read1_3001328919-DNA.fastq.gz	gtdb_genomes_reps_r220/database/GCF/029/691/405/GCF_029691405.1_genomic.fna.gz	90.33	0.364	89.13-91.69	0.364	0.22-0.58	1	1.231	108/8294	86.93	NZ_CP121467.1 Streptococcus sp. D7B5 chromosome, complete genome
trimmed_read1_3001328919-DNA.fastq.gz	gtdb_genomes_reps_r220/database/GCF/901/543/175/GCF_901543175.1_genomic.fna.gz	90.33	0.444	89.29-91.31	0.444	0.31-0.70	1	1.248	125/8156	87.39	NZ_LR594040.1 Streptococcus australis strain NCTC5338 chromosome 1
trimmed_read1_3001328919-DNA.fastq.gz	gtdb_genomes_reps_r220/database/GCF/007/475/365/GCF_007475365.1_genomic.fna.gz	90.32	0.490	89.37-91.08	0.490	0.36-0.74	1	1.299	134/8116	87.60	NZ_CP034442.1 Streptococcus oralis subsp. dentisani strain F0392 chromosome, complete genome
trimmed_read1_3001328919-DNA.fastq.gz	gtdb_genomes_reps_r220/database/GCF/002/096/595/GCF_002096595.1_genomic.fna.gz	90.30	0.469	89.22-91.33	0.469	0.32-0.71	1	1.406	133/8321	87.51	NZ_NCUR01000010.1 Streptococcus oralis subsp. oralis strain OD_311844-09 s_oralis_OD_311844_09_ID_1, whole genome shotgun sequence
trimmed_read1_3001328919-DNA.fastq.gz	gtdb_genomes_reps_r220/database/GCF/900/546/335/GCF_900546335.1_genomic.fna.gz	90.30	0.472	89.15-91.33	0.472	0.32-0.71	1	1.278	115/7230	87.50	NZ_URCN01000001.1 Uncultured Streptococcus sp. isolate UMGS867, whole genome shotgun sequence
trimmed_read1_3001328919-DNA.fastq.gz	gtdb_genomes_reps_r220/database/GCF/006/175/905/GCF_006175905.1_genomic.fna.gz	90.27	0.418	89.36-91.67	0.418	0.26-0.62	1	1.230	113/7917	87.19	NZ_SSNB01000001.1 Streptococcus oralis strain ATCC 9811 Contig1, whole genome shotgun sequence
trimmed_read1_3001328919-DNA.fastq.gz	gtdb_genomes_reps_r220/database/GCF/004/353/325/GCF_004353325.1_genomic.fna.gz	90.26	0.544	89.33-91.12	0.544	0.38-0.75	1	1.428	145/8224	87.79	NZ_MZNX01000001.1 Streptococcus downii strain CECT 9732 contig_1, whole genome shotgun sequence
trimmed_read1_3001328919-DNA.fastq.gz	gtdb_genomes_reps_r220/database/GCF/026/782/375/GCF_026782375.1_genomic.fna.gz	90.24	0.516	89.12-90.98	0.516	0.34-0.78	1	1.443	131/7785	87.65	NZ_JAKUWJ010000001.1 Streptococcus oralis strain A15000254 A15000254_S13_contig_1_consensus, whole genome shotgun sequence
trimmed_read1_3001328919-DNA.fastq.gz	gtdb_genomes_reps_r220/database/GCA/905/373/305/GCA_905373305.1_genomic.fna.gz	90.23	0.388	89.05-91.53	0.388	0.21-0.61	1	1.302	86/6466	86.99	CAJPSM010000001.1 MAG: uncultured Streptococcus sp. isolate SRR9217463-mag-bin.9 genome assembly, contig: SRR9217463-mag-bin.9_11, whole genome shotgun sequence
trimmed_read1_3001328919-DNA.fastq.gz	gtdb_genomes_reps_r220/database/GCF/002/096/615/GCF_002096615.1_genomic.fna.gz	90.23	0.524	89.09-91.00	0.524	0.39-0.77	1	1.371	140/8242	87.68	NZ_NCUX01000033.1 Streptococcus oralis subsp. dentisani strain RH_9883_08 s_oralis_RH_9883_08_ID_1, whole genome shotgun sequence
trimmed_read1_3001328919-DNA.fastq.gz	gtdb_genomes_reps_r220/database/GCA/905/372/925/GCA_905372925.1_genomic.fna.gz	90.23	0.425	89.10-91.30	0.425	0.28-0.70	1	1.230	100/6991	87.20	CAJPRB010000001.1 MAG: uncultured Streptococcus sp. isolate SRR9217433-mag-bin.4 genome assembly, contig: SRR9217433-mag-bin.4_71, whole genome shotgun sequence
trimmed_read1_3001328919-DNA.fastq.gz	gtdb_genomes_reps_r220/database/GCF/001/411/485/GCF_001411485.1_genomic.fna.gz	90.22	0.593	89.40-91.07	0.593	0.42-0.81	1	1.435	154/8317	87.93	NZ_LKPC01000001.1 Streptococcus oralis strain 89a contig_1, whole genome shotgun sequence
trimmed_read1_3001328919-DNA.fastq.gz	gtdb_genomes_reps_r220/database/GCA/905/221/325/GCA_905221325.1_genomic.fna.gz	90.21	0.509	89.38-91.23	0.509	0.34-0.72	1	1.375	144/8738	87.60	CAJNCS010000001.1 unidentified bacterium isolate Streptococcus species genome assembly, contig: NODE_1_length_297277_cov_28.1291, whole genome shotgun sequence
trimmed_read1_3001328919-DNA.fastq.gz	gtdb_genomes_reps_r220/database/GCF/000/959/945/GCF_000959945.1_genomic.fna.gz	90.20	0.427	89.11-91.37	0.427	0.27-0.67	1	1.250	112/7876	87.18	NZ_JYGM01000001.1 Streptococcus oralis subsp. oralis strain COL85/1862 TZ87_contig000001, whole genome shotgun sequence
trimmed_read1_3001328919-DNA.fastq.gz	gtdb_genomes_reps_r220/database/GCF/026/782/235/GCF_026782235.1_genomic.fna.gz	90.20	0.515	89.30-91.02	0.515	0.35-0.78	1	1.451	142/8576	87.61	NZ_JAKUWE010000010.1 Streptococcus oralis strain A16000295 A16000295_S17_contig_10_consensus, whole genome shotgun sequence
trimmed_read1_3001328919-DNA.fastq.gz	gtdb_genomes_reps_r220/database/GCF/023/109/155/GCF_023109155.1_genomic.fna.gz	90.20	0.500	89.24-91.08	0.500	0.34-0.72	1	1.424	139/8596	87.54	NZ_JALDUA010000010.1 Streptococcus oralis strain S57 NODE_10_length_3919_cov_87.832639, whole genome shotgun sequence
trimmed_read1_3001328919-DNA.fastq.gz	gtdb_genomes_reps_r220/database/GCF/003/944/215/GCF_003944215.1_genomic.fna.gz	90.19	0.585	89.33-91.27	0.585	0.39-0.83	1	1.423	149/8200	87.87	NZ_RJVZ01000001.1 Streptococcus oralis strain BCA1 D8804_contig001, whole genome shotgun sequence
trimmed_read1_3001328919-DNA.fastq.gz	gtdb_genomes_reps_r220/database/GCF/003/943/825/GCF_003943825.1_genomic.fna.gz	90.19	0.536	89.18-90.99	0.536	0.41-0.76	1	1.385	156/9064	87.72	NZ_RJNJ01000001.1 Streptococcus oralis strain BCC63 D8863_contig001, whole genome shotgun sequence
trimmed_read1_3001328919-DNA.fastq.gz	gtdb_genomes_reps_r220/database/GCA/905/221/345/GCA_905221345.1_genomic.fna.gz	90.19	0.596	89.44-91.12	0.596	0.40-0.81	1	1.453	148/8042	87.91	CAJNCW010000001.1 unidentified bacterium isolate Streptococcus species genome assembly, contig: NODE_1_length_381041_cov_38.7504, whole genome shotgun sequence
trimmed_read1_3001328919-DNA.fastq.gz	gtdb_genomes_reps_r220/database/GCF/001/074/565/GCF_001074565.1_genomic.fna.gz	90.18	0.523	89.21-91.16	0.523	0.34-0.74	1	1.399	148/8877	87.63	NZ_JUQX01000008.1 Streptococcus pseudopneumoniae strain 843_SPSE 105_10838_197946, whole genome shotgun sequence
trimmed_read1_3001328919-DNA.fastq.gz	gtdb_genomes_reps_r220/database/GCF/003/143/695/GCF_003143695.2_genomic.fna.gz	90.18	0.590	89.30-91.03	0.590	0.40-0.86	1	1.426	148/8131	87.88	NZ_QEMY02000008.1 Streptococcus halitosis strain VT-4 NODE_11_length_816_cov_397.199, whole genome shotgun sequence
trimmed_read1_3001328919-DNA.fastq.gz	gtdb_genomes_reps_r220/database/GCF/016/127/915/GCF_016127915.1_genomic.fna.gz	90.17	0.435	89.06-91.17	0.435	0.28-0.67	1	1.250	116/8139	87.19	NZ_CP066059.1 Streptococcus oralis strain FDAARGOS_1021 chromosome, complete genome
trimmed_read1_3001328919-DNA.fastq.gz	gtdb_genomes_reps_r220/database/GCF/026/782/125/GCF_026782125.1_genomic.fna.gz	90.16	0.515	89.37-91.14	0.515	0.35-0.77	1	1.464	138/8446	87.57	NZ_JAKUVY010000010.1 Streptococcus oralis strain B17021755 B17021755_S20_trimmed_(paired)_contig_10_consensus, whole genome shotgun sequence
trimmed_read1_3001328919-DNA.fastq.gz	gtdb_genomes_reps_r220/database/GCF/901/543/815/GCF_901543815.1_genomic.fna.gz	90.16	0.452	89.00-91.13	0.452	0.29-0.72	1	1.246	118/8066	87.26	NZ_CABEIU010000001.1 Streptococcus oralis strain NCTC10232, whole genome shotgun sequence
trimmed_read1_3001328919-DNA.fastq.gz	gtdb_genomes_reps_r220/database/GCA/905/221/295/GCA_905221295.1_genomic.fna.gz	90.14	0.566	89.25-91.05	0.566	0.37-0.82	1	1.472	142/8167	87.75	CAJNCP010000001.1 unidentified bacterium isolate Streptococcus species genome assembly, contig: NODE_1_length_540321_cov_70.6145, whole genome shotgun sequence
trimmed_read1_3001328919-DNA.fastq.gz	gtdb_genomes_reps_r220/database/GCF/001/578/945/GCF_001578945.1_genomic.fna.gz	90.12	0.489	88.96-91.09	0.489	0.31-0.74	1	1.435	131/8438	87.43	NZ_KQ969550.1 Streptococcus oralis strain DD16 scaffold00001, whole genome shotgun sequence
trimmed_read1_3001328919-DNA.fastq.gz	gtdb_genomes_reps_r220/database/GCF/003/942/585/GCF_003942585.1_genomic.fna.gz	90.11	0.606	89.23-91.02	0.606	0.41-0.83	1	1.458	142/7821	87.87	NZ_RJNK01000001.1 Streptococcus oralis strain BCC59 D8862_contig001, whole genome shotgun sequence
trimmed_read1_3001328919-DNA.fastq.gz	gtdb_genomes_reps_r220/database/GCF/000/146/585/GCF_000146585.1_genomic.fna.gz	90.11	0.526	89.06-91.16	0.526	0.35-0.80	1	1.405	131/8024	87.57	NZ_GL397179.1 Streptococcus mitis ATCC 6249 SCAFFOLD1, whole genome shotgun sequence
trimmed_read1_3001328919-DNA.fastq.gz	gtdb_genomes_reps_r220/database/GCF/001/578/935/GCF_001578935.1_genomic.fna.gz	90.09	0.484	89.05-90.96	0.484	0.33-0.74	1	1.420	131/8613	87.37	NZ_KQ969521.1 Streptococcus oralis strain DD15 scaffold00001, whole genome shotgun sequence
trimmed_read1_3001328919-DNA.fastq.gz	gtdb_genomes_reps_r220/database/GCF/000/960/035/GCF_000960035.1_genomic.fna.gz	90.08	0.559	89.23-91.17	0.559	0.35-0.81	1	1.496	135/7966	87.67	NZ_JYGR01000001.1 Streptococcus oralis subsp. oralis strain SK141 TZ92_contig000001, whole genome shotgun sequence
trimmed_read1_3001328919-DNA.fastq.gz	gtdb_genomes_reps_r220/database/GCF/001/579/525/GCF_001579525.1_genomic.fna.gz	90.08	0.553	89.06-90.89	0.553	0.40-0.79	1	1.436	133/7913	87.65	NZ_CM003838.1 Streptococcus oralis strain DD25 plasmid unnamed, whole genome shotgun sequence
trimmed_read1_3001328919-DNA.fastq.gz	gtdb_genomes_reps_r220/database/GCF/002/356/415/GCF_002356415.1_genomic.fna.gz	90.08	0.478	89.06-91.00	0.478	0.35-0.69	1	1.277	119/7993	87.31	NZ_AP018338.1 Streptococcus oralis subsp. tigurinus strain osk_001 chromosome, complete genome
trimmed_read1_3001328919-DNA.fastq.gz	gtdb_genomes_reps_r220/database/GCF/002/096/685/GCF_002096685.1_genomic.fna.gz	90.07	0.562	89.07-90.91	0.562	0.38-0.81	1	1.398	133/7857	87.67	NZ_NCVA01000041.1 Streptococcus oralis subsp. dentisani strain RH_13585_10 s_oralis_RH_13585_10_ID_1, whole genome shotgun sequence
trimmed_read1_3001328919-DNA.fastq.gz	gtdb_genomes_reps_r220/database/GCF/019/458/035/GCF_019458035.1_genomic.fna.gz	90.06	0.595	89.24-90.94	0.595	0.41-0.82	1	1.354	161/8929	87.85	NZ_JAHZTX010000100.1 Streptococcus oralis strain E665 NODE_100_length_416_cov_1.035191, whole genome shotgun sequence
trimmed_read1_3001328919-DNA.fastq.gz	gtdb_genomes_reps_r220/database/GCF/002/096/275/GCF_002096275.1_genomic.fna.gz	90.06	0.551	89.01-90.87	0.551	0.40-0.80	1	1.431	137/8243	87.62	NZ_NCUG01000018.1 Streptococcus oralis subsp. tigurinus strain OD_314165_09 s_oralis_OD_314165_09_ID_1, whole genome shotgun sequence
trimmed_read1_3001328919-DNA.fastq.gz	gtdb_genomes_reps_r220/database/GCF/900/637/025/GCF_900637025.1_genomic.fna.gz	90.05	0.468	88.91-90.89	0.468	0.33-0.74	1	1.244	119/8203	87.24	NZ_LR134336.1 Streptococcus oralis ATCC 35037 strain NCTC 11427 chromosome 1, complete sequence
trimmed_read1_3001328919-DNA.fastq.gz	gtdb_genomes_reps_r220/database/GCF/003/942/795/GCF_003942795.1_genomic.fna.gz	90.04	0.554	89.10-91.00	0.554	0.37-0.78	1	1.472	144/8678	87.62	NZ_RJNY01000001.1 Streptococcus mitis strain BCC60 D8847_contig001, whole genome shotgun sequence
trimmed_read1_3001328919-DNA.fastq.gz	gtdb_genomes_reps_r220/database/GCF/026/782/345/GCF_026782345.1_genomic.fna.gz	90.04	0.600	89.20-90.81	0.600	0.42-0.85	1	1.473	146/8318	87.77	NZ_JAKUWI010000010.1 Streptococcus oralis strain A15000389 A15000389_S21_contig_10_consensus, whole genome shotgun sequence
trimmed_read1_3001328919-DNA.fastq.gz	gtdb_genomes_reps_r220/database/GCF/003/944/205/GCF_003944205.1_genomic.fna.gz	90.04	0.531	89.00-90.92	0.531	0.35-0.80	1	1.351	134/8363	87.52	NZ_RJPH01000001.1 Streptococcus oralis subsp. dentisani strain BCA2 D8805_contig001, whole genome shotgun sequence
trimmed_read1_3001328919-DNA.fastq.gz	gtdb_genomes_reps_r220/database/GCA/902/488/495/GCA_902488495.1_genomic.fna.gz	90.02	0.533	89.00-90.92	0.533	0.36-0.82	1	1.308	120/7545	87.50	CABTWF010000001.1 MAG TPA_asm: uncultured Streptococcus sp. isolate MGYG-HGUT-03717 genome assembly, contig: GUT_GENOME242920_1, whole genome shotgun sequence
trimmed_read1_3001328919-DNA.fastq.gz	gtdb_genomes_reps_r220/database/GCF/000/287/715/GCF_000287715.1_genomic.fna.gz	90.02	0.452	89.01-90.90	0.452	0.31-0.63	1	1.352	122/8738	87.13	NZ_ALJN01000001.1 Streptococcus oralis SK304 ctg120008662247, whole genome shotgun sequence
trimmed_read1_3001328919-DNA.fastq.gz	gtdb_genomes_reps_r220/database/GCF/003/943/415/GCF_003943415.1_genomic.fna.gz	90.02	0.522	89.00-90.85	0.522	0.33-0.75	1	1.409	127/8069	87.47	NZ_RJPK01000001.1 Streptococcus oralis strain BCC10 D8801_contig001, whole genome shotgun sequence
