Sample_file	Genome_file	Adjusted_ANI	Eff_cov	ANI_5-95_percentile	Eff_lambda	Lambda_5-95_percentile	Median_cov	Mean_cov_geq1	Containment_ind	Naive_ANI	Contig_name
trimmed_read1_3001425825-DNA.fastq.gz	gtdb_genomes_reps_r220/database/GCF/001/679/005/GCF_001679005.1_genomic.fna.gz	98.02	0.448	97.70-98.34	0.448	0.40-0.49	1	1.269	1910/9834	94.85	NZ_LXTW01000001.1 Moraxella nonliquefaciens strain CCUG 348 contig_1, whole genome shotgun sequence
trimmed_read1_3001425825-DNA.fastq.gz	gtdb_genomes_reps_r220/database/GCA/016/025/055/GCA_016025055.1_genomic.fna.gz	97.78	0.285	97.50-98.03	0.285	0.26-0.31	1	1.154	2585/20859	93.49	CP065590.1 Chryseobacterium indologenes strain DSM 16777 chromosome, complete genome
trimmed_read1_3001425825-DNA.fastq.gz	gtdb_genomes_reps_r220/database/GCF/003/030/305/GCF_003030305.1_genomic.fna.gz	97.48	0.135	96.56-98.15	0.135	0.11-0.18	1	1.066	603/10561	91.18	NZ_CP023676.1 Cutibacterium acnes strain ATCC 6919 chromosome, complete genome
trimmed_read1_3001425825-DNA.fastq.gz	gtdb_genomes_reps_r220/database/GCF/000/269/965/GCF_000269965.1_genomic.fna.gz	96.45	0.235	95.81-96.94	0.235	0.20-0.29	1	1.114	822/12027	91.71	NC_017219.1 Bifidobacterium longum subsp. infantis ATCC 15697 = JCM 1222 = DSM 20088, complete sequence
trimmed_read1_3001425825-DNA.fastq.gz	gtdb_genomes_reps_r220/database/GCF/900/475/755/GCF_900475755.1_genomic.fna.gz	96.06	0.323	95.56-96.53	0.323	0.26-0.38	1	1.180	623/7845	92.15	NZ_LS483411.1 Haemophilus influenzae strain NCTC11426 chromosome 1, complete sequence
trimmed_read1_3001425825-DNA.fastq.gz	gtdb_genomes_reps_r220/database/GCF/019/703/545/GCF_019703545.1_genomic.fna.gz	96.04	0.224	95.38-96.65	0.224	0.18-0.28	1	1.134	464/8083	91.19	NZ_AP018771.1 Haemophilus influenzae strain CHBN-II-8 isolate 10H27 chromosome, complete genome
trimmed_read1_3001425825-DNA.fastq.gz	gtdb_genomes_reps_r220/database/GCA/947/253/175/GCA_947253175.1_genomic.fna.gz	95.94	0.208	94.93-96.91	0.208	0.14-0.27	1	1.115	287/5429	90.95	CAMXYG010000001.1 MAG TPA_asm: uncultured Streptococcus sp. isolate SRR17635508_bin.2_metaWRAP_v1.3_MAG genome assembly, contig: ERZ14212505.19, whole genome shotgun sequence
trimmed_read1_3001425825-DNA.fastq.gz	gtdb_genomes_reps_r220/database/GCA/916/050/595/GCA_916050595.1_genomic.fna.gz	95.80	0.213	94.87-96.69	0.213	0.15-0.29	1	1.117	283/5573	90.83	CAJZLM010000001.1 MAG TPA_asm: Streptococcus mitis isolate ERR2765141_bin.1_metaWRAP_v1.1_MAG genome assembly, contig: ERZ1674214.1, whole genome shotgun sequence
trimmed_read1_3001425825-DNA.fastq.gz	gtdb_genomes_reps_r220/database/GCF/000/220/085/GCF_000220085.1_genomic.fna.gz	95.79	0.268	95.03-96.39	0.268	0.22-0.34	1	1.163	503/8111	91.42	NZ_AFQV01000034.1 Streptococcus mitis SK1080 ctg1129645366110, whole genome shotgun sequence
trimmed_read1_3001425825-DNA.fastq.gz	gtdb_genomes_reps_r220/database/GCA/001/113/365/GCA_001113365.1_genomic.fna.gz	95.71	0.187	94.84-96.56	0.187	0.14-0.24	1	1.227	431/9843	90.40	CKYA01000001.1 Streptococcus pneumoniae genome assembly 6823_7#22, scaffold ERS021524SCcontig000001, whole genome shotgun sequence
trimmed_read1_3001425825-DNA.fastq.gz	gtdb_genomes_reps_r220/database/GCF/013/277/415/GCF_013277415.1_genomic.fna.gz	95.68	0.209	94.77-96.68	0.209	0.15-0.27	1	1.226	433/9052	90.66	NZ_VMMX01000001.1 Streptococcus sp. 68 68_S3_L001_R1_001_(paired)_contig_1, whole genome shotgun sequence
trimmed_read1_3001425825-DNA.fastq.gz	gtdb_genomes_reps_r220/database/GCF/013/276/795/GCF_013276795.1_genomic.fna.gz	95.60	0.230	94.73-96.51	0.230	0.16-0.31	1	1.221	435/8538	90.84	NZ_VMLR01000001.1 Streptococcus sp. 2342 2342_S22_L001_R1_001_(paired)_contig_1, whole genome shotgun sequence
trimmed_read1_3001425825-DNA.fastq.gz	gtdb_genomes_reps_r220/database/GCF/030/439/915/GCF_030439915.1_genomic.fna.gz	95.58	0.241	94.79-96.19	0.241	0.19-0.29	1	1.189	444/8418	90.95	NZ_JAQFJG010000010.1 Streptococcus sp. SPS1 NODE_10_length_71805_cov_189.924538, whole genome shotgun sequence
trimmed_read1_3001425825-DNA.fastq.gz	gtdb_genomes_reps_r220/database/GCF/013/277/455/GCF_013277455.1_genomic.fna.gz	95.49	0.279	94.73-96.16	0.279	0.22-0.35	1	1.216	513/8788	91.24	NZ_VMMY01000001.1 Streptococcus sp. 5346 5346-99_S28_L001_R1_001_(paired)_contig_1, whole genome shotgun sequence
trimmed_read1_3001425825-DNA.fastq.gz	gtdb_genomes_reps_r220/database/GCA/001/096/185/GCA_001096185.1_genomic.fna.gz	95.49	0.199	94.59-96.45	0.199	0.14-0.27	1	1.248	387/8989	90.35	CRPU01000001.1 Streptococcus pneumoniae genome assembly 6775_1#8, scaffold ERS020334SCcontig000001, whole genome shotgun sequence
trimmed_read1_3001425825-DNA.fastq.gz	gtdb_genomes_reps_r220/database/GCF/001/072/315/GCF_001072315.1_genomic.fna.gz	95.48	0.236	94.64-96.15	0.236	0.18-0.30	1	1.203	467/9310	90.80	NZ_JVLI01000001.1 Streptococcus pseudopneumoniae strain 330_SPSE 0_919_132734, whole genome shotgun sequence
trimmed_read1_3001425825-DNA.fastq.gz	gtdb_genomes_reps_r220/database/GCF/001/457/655/GCF_001457655.1_genomic.fna.gz	95.46	0.277	94.80-96.13	0.277	0.21-0.35	1	1.148	458/7983	91.19	NZ_LN831035.1 Haemophilus influenzae strain NCTC8143 chromosome 1, complete sequence
trimmed_read1_3001425825-DNA.fastq.gz	gtdb_genomes_reps_r220/database/GCA/905/221/245/GCA_905221245.1_genomic.fna.gz	95.46	0.209	94.65-96.50	0.209	0.14-0.27	1	1.259	371/8315	90.46	CAJNCK010000001.1 unidentified bacterium isolate Streptococcus species genome assembly, contig: NODE_1_length_394086_cov_61.6465, whole genome shotgun sequence
trimmed_read1_3001425825-DNA.fastq.gz	gtdb_genomes_reps_r220/database/GCF/002/984/305/GCF_002984305.1_genomic.fna.gz	95.45	0.275	94.72-96.05	0.275	0.22-0.34	1	1.192	484/8528	91.16	NZ_NEAA01000096.1 Haemophilus influenzae strain 135P16H1 N135P16H1_100_1, whole genome shotgun sequence
trimmed_read1_3001425825-DNA.fastq.gz	gtdb_genomes_reps_r220/database/GCF/000/148/585/GCF_000148585.2_genomic.fna.gz	95.44	0.196	94.46-96.34	0.196	0.14-0.26	1	1.146	335/7991	90.27	NZ_CP028414.1 Streptococcus mitis NCTC 12261 chromosome, complete genome
trimmed_read1_3001425825-DNA.fastq.gz	gtdb_genomes_reps_r220/database/GCF/013/267/835/GCF_013267835.1_genomic.fna.gz	95.44	0.084	93.29-97.63	0.084	0.04-0.16	1	1.040	173/9089	88.00	NZ_CP053939.1 Neisseria mucosa strain FDAARGOS_758 chromosome, complete genome
trimmed_read1_3001425825-DNA.fastq.gz	gtdb_genomes_reps_r220/database/GCF/903/645/285/GCF_903645285.1_genomic.fna.gz	95.42	0.227	94.69-96.12	0.227	0.17-0.29	1	1.149	403/8493	90.64	NZ_CAHJXN010000001.1 Streptococcus sp. Marseille-Q2617, whole genome shotgun sequence
trimmed_read1_3001425825-DNA.fastq.gz	gtdb_genomes_reps_r220/database/GCF/020/089/495/GCF_020089495.2_genomic.fna.gz	95.38	0.223	94.54-96.17	0.223	0.17-0.28	1	1.232	393/8470	90.57	NZ_JAIRCA020000001.1 Streptococcus sp. IMAU 99199 IMAU99199, whole genome shotgun sequence
trimmed_read1_3001425825-DNA.fastq.gz	gtdb_genomes_reps_r220/database/GCA/905/369/855/GCA_905369855.1_genomic.fna.gz	95.38	0.251	94.59-96.14	0.251	0.18-0.33	1	1.170	352/6873	90.86	CAJPJN010000001.1 MAG: Streptococcus oralis isolate DRR046084-mag-bin.1 genome assembly, contig: DRR046084-mag-bin.1_2, whole genome shotgun sequence
trimmed_read1_3001425825-DNA.fastq.gz	gtdb_genomes_reps_r220/database/GCF/024/346/585/GCF_024346585.1_genomic.fna.gz	95.33	0.206	94.34-96.17	0.206	0.15-0.27	1	1.156	366/8660	90.30	NZ_AP024523.1 Streptococcus toyakuensis strain TP1632 chromosome, complete genome
trimmed_read1_3001425825-DNA.fastq.gz	gtdb_genomes_reps_r220/database/GCF/000/148/545/GCF_000148545.1_genomic.fna.gz	95.25	0.247	94.51-95.91	0.247	0.19-0.32	1	1.212	429/8822	90.71	NZ_AEDV01000108.1 Streptococcus mitis SK597 contigB5, whole genome shotgun sequence
trimmed_read1_3001425825-DNA.fastq.gz	gtdb_genomes_reps_r220/database/GCF/019/414/905/GCF_019414905.1_genomic.fna.gz	95.24	0.253	94.47-96.08	0.253	0.18-0.33	1	1.152	356/7206	90.75	NZ_DXLC01000001.1 MAG: Streptococcus sp. isolate HRGM_Genome_0314 HRGM_Genome_0314_1, whole genome shotgun sequence
trimmed_read1_3001425825-DNA.fastq.gz	gtdb_genomes_reps_r220/database/GCA/001/347/015/GCA_001347015.1_genomic.fna.gz	95.21	0.251	94.42-95.87	0.251	0.20-0.33	1	1.205	449/9220	90.71	CFGI01000001.1 Streptococcus pneumoniae genome assembly 6938_6#7, scaffold ERS022181SCcontig000001, whole genome shotgun sequence
trimmed_read1_3001425825-DNA.fastq.gz	gtdb_genomes_reps_r220/database/GCA/905/221/455/GCA_905221455.1_genomic.fna.gz	95.21	0.196	94.20-96.29	0.196	0.13-0.26	1	1.250	332/8554	90.05	CAJNDF010000001.1 unidentified bacterium isolate Streptococcus species genome assembly, contig: NODE_1_length_328888_cov_49.2012, whole genome shotgun sequence
trimmed_read1_3001425825-DNA.fastq.gz	gtdb_genomes_reps_r220/database/GCF/016/658/865/GCF_016658865.1_genomic.fna.gz	95.19	0.178	94.01-96.11	0.178	0.13-0.26	1	1.157	305/8594	89.79	NZ_CP067992.1 Streptococcus mitis strain S022-V7-A3 chromosome, complete genome
trimmed_read1_3001425825-DNA.fastq.gz	gtdb_genomes_reps_r220/database/GCA/905/221/125/GCA_905221125.1_genomic.fna.gz	95.15	0.213	94.34-95.91	0.213	0.15-0.27	1	1.273	344/8383	90.21	CAJNBY010000001.1 unidentified bacterium isolate Streptococcus species genome assembly, contig: NODE_1_length_225877_cov_55.373, whole genome shotgun sequence
trimmed_read1_3001425825-DNA.fastq.gz	gtdb_genomes_reps_r220/database/GCF/002/096/855/GCF_002096855.1_genomic.fna.gz	95.12	0.212	94.17-96.09	0.212	0.15-0.28	1	1.269	334/8240	90.18	NZ_NCVH01000033.1 Streptococcus mitis strain RH_17439_08 s_mitis_RH_17439_08_ID_1, whole genome shotgun sequence
trimmed_read1_3001425825-DNA.fastq.gz	gtdb_genomes_reps_r220/database/GCA/001/171/885/GCA_001171885.1_genomic.fna.gz	95.11	0.226	94.26-96.17	0.226	0.15-0.29	1	1.250	384/8974	90.33	CKQD01000001.1 Streptococcus pneumoniae genome assembly 6680_6#10, scaffold ERS020456SCcontig000001, whole genome shotgun sequence
trimmed_read1_3001425825-DNA.fastq.gz	gtdb_genomes_reps_r220/database/GCF/946/190/045/GCF_946190045.1_genomic.fna.gz	95.10	0.210	94.32-96.02	0.210	0.14-0.27	1	1.217	336/8370	90.15	NZ_CAMHYY010000001.1 Streptococcus mitis isolate Streptococcus mitis NODE_1_length_333422_cov_157.319918, whole genome shotgun sequence
trimmed_read1_3001425825-DNA.fastq.gz	gtdb_genomes_reps_r220/database/GCF/023/109/235/GCF_023109235.1_genomic.fna.gz	95.10	0.256	94.37-95.97	0.256	0.19-0.33	1	1.259	379/7968	90.64	NZ_JALDUC010000010.1 Streptococcus mitis strain S53 NODE_10_length_93322_cov_198.967258, whole genome shotgun sequence
trimmed_read1_3001425825-DNA.fastq.gz	gtdb_genomes_reps_r220/database/GCF/013/277/515/GCF_013277515.1_genomic.fna.gz	95.08	0.257	94.28-95.88	0.257	0.19-0.34	1	1.254	426/8972	90.64	NZ_VMNB01000001.1 Streptococcus sp. k-402 k-402_R1_(paired)_contig_1, whole genome shotgun sequence
trimmed_read1_3001425825-DNA.fastq.gz	gtdb_genomes_reps_r220/database/GCF/023/110/375/GCF_023110375.1_genomic.fna.gz	95.08	0.225	94.18-96.03	0.225	0.15-0.29	1	1.244	360/8511	90.30	NZ_JALDVV010000010.1 Streptococcus mitis strain O7-1 NODE_10_length_62925_cov_19.542213, whole genome shotgun sequence
trimmed_read1_3001425825-DNA.fastq.gz	gtdb_genomes_reps_r220/database/GCF/013/276/955/GCF_013276955.1_genomic.fna.gz	95.07	0.266	94.31-95.78	0.266	0.20-0.34	1	1.240	445/9123	90.72	NZ_VMLZ01000001.1 Streptococcus sp. 1453 1453_S31_L001_R1_001_(paired)_contig_1, whole genome shotgun sequence
trimmed_read1_3001425825-DNA.fastq.gz	gtdb_genomes_reps_r220/database/GCF/000/175/615/GCF_000175615.1_genomic.fna.gz	95.07	0.099	93.20-96.87	0.099	0.05-0.18	1	1.114	193/9767	88.11	NZ_ACVO01000025.1 Rothia mucilaginosa ATCC 25296 contig00004, whole genome shotgun sequence
trimmed_read1_3001425825-DNA.fastq.gz	gtdb_genomes_reps_r220/database/GCF/946/190/155/GCF_946190155.1_genomic.fna.gz	95.07	0.222	94.23-95.93	0.222	0.16-0.28	1	1.207	348/8327	90.26	NZ_CAMHZL010000001.1 Streptococcus mitis isolate Streptococcus mitis NODE_1_length_388548_cov_94.757163, whole genome shotgun sequence
trimmed_read1_3001425825-DNA.fastq.gz	gtdb_genomes_reps_r220/database/GCF/002/860/905/GCF_002860905.1_genomic.fna.gz	95.07	0.239	94.25-95.98	0.239	0.17-0.30	1	1.222	396/8928	90.44	NZ_PKIG01000001.1 Streptococcus oralis subsp. dentisani strain UMB0832 .16933_8_21.1, whole genome shotgun sequence
trimmed_read1_3001425825-DNA.fastq.gz	gtdb_genomes_reps_r220/database/GCF/003/942/965/GCF_003942965.1_genomic.fna.gz	95.05	0.222	94.19-95.86	0.222	0.15-0.29	1	1.278	331/8015	90.23	NZ_RJOG01000001.1 Streptococcus mitis strain BCC07 D8837_contig001, whole genome shotgun sequence
trimmed_read1_3001425825-DNA.fastq.gz	gtdb_genomes_reps_r220/database/GCF/005/888/195/GCF_005888195.1_genomic.fna.gz	95.04	0.291	94.36-95.61	0.291	0.23-0.37	1	1.149	430/8234	90.92	NZ_LNKR01000001.1 Haemophilus influenzae biotype aegyptius strain KC1018 contig_001, whole genome shotgun sequence
trimmed_read1_3001425825-DNA.fastq.gz	gtdb_genomes_reps_r220/database/GCA/905/221/155/GCA_905221155.1_genomic.fna.gz	95.04	0.219	94.20-95.99	0.219	0.15-0.29	1	1.232	345/8454	90.20	CAJNCB010000001.1 unidentified bacterium isolate Streptococcus species genome assembly, contig: NODE_1_length_917501_cov_53.194, whole genome shotgun sequence
trimmed_read1_3001425825-DNA.fastq.gz	gtdb_genomes_reps_r220/database/GCF/946/190/285/GCF_946190285.1_genomic.fna.gz	95.03	0.239	94.23-95.91	0.239	0.17-0.31	1	1.271	369/8428	90.40	NZ_CAMHZX010000001.1 Streptococcus mitis isolate Streptococcus mitis NODE_1_length_750225_cov_136.047748, whole genome shotgun sequence
trimmed_read1_3001425825-DNA.fastq.gz	gtdb_genomes_reps_r220/database/GCF/002/096/895/GCF_002096895.1_genomic.fna.gz	95.03	0.230	94.16-95.90	0.230	0.17-0.30	1	1.286	332/7832	90.31	NZ_NCVI01000020.1 Streptococcus mitis strain RH_17024_08 s_mitis_RH_17024_08_ID_1, whole genome shotgun sequence
trimmed_read1_3001425825-DNA.fastq.gz	gtdb_genomes_reps_r220/database/GCA/001/070/715/GCA_001070715.1_genomic.fna.gz	95.03	0.267	94.32-95.82	0.267	0.19-0.33	1	1.268	441/9137	90.69	JVRR01000136.1 Streptococcus pseudopneumoniae strain 163_SPSE 1000_987_21661_898_,304+,902_, whole genome shotgun sequence
trimmed_read1_3001425825-DNA.fastq.gz	gtdb_genomes_reps_r220/database/GCA/905/221/195/GCA_905221195.1_genomic.fna.gz	95.02	0.205	94.21-96.00	0.205	0.14-0.27	1	1.240	312/8196	89.99	CAJNCF010000001.1 unidentified bacterium isolate Streptococcus species genome assembly, contig: NODE_1_length_351178_cov_24.3909, whole genome shotgun sequence
trimmed_read1_3001425825-DNA.fastq.gz	gtdb_genomes_reps_r220/database/GCF/946/901/205/GCF_946901205.1_genomic.fna.gz	95.00	0.264	94.23-95.57	0.264	0.21-0.35	1	1.157	421/8911	90.62	NZ_CAMPPO010000001.1 Streptococcus sp. Marseille-Q5619 contig00001, whole genome shotgun sequence
trimmed_read1_3001425825-DNA.fastq.gz	gtdb_genomes_reps_r220/database/GCA/905/221/095/GCA_905221095.1_genomic.fna.gz	94.99	0.218	94.11-96.14	0.218	0.14-0.29	1	1.284	338/8478	90.13	CAJNBV010000001.1 unidentified bacterium isolate Streptococcus species genome assembly, contig: NODE_1_length_337823_cov_51.8384, whole genome shotgun sequence
trimmed_read1_3001425825-DNA.fastq.gz	gtdb_genomes_reps_r220/database/GCA/902/489/265/GCA_902489265.1_genomic.fna.gz	94.98	0.228	94.06-95.93	0.228	0.16-0.29	1	1.140	299/7235	90.23	CABTZI010000001.1 MAG TPA_asm: uncultured Streptococcus sp. isolate MGYG-HGUT-03797 genome assembly, contig: GUT_GENOME244205_1, whole genome shotgun sequence
trimmed_read1_3001425825-DNA.fastq.gz	gtdb_genomes_reps_r220/database/GCA/943/914/425/GCA_943914425.1_genomic.fna.gz	94.96	0.184	94.05-95.86	0.184	0.13-0.27	1	1.129	255/7525	89.66	CALUBZ010000001.1 MAG: uncultured Streptococcus sp. isolate aroCPJTBUv_bin.11.MAG genome assembly, contig: NODE_96_length_79274_cov_20.784913, whole genome shotgun sequence
trimmed_read1_3001425825-DNA.fastq.gz	gtdb_genomes_reps_r220/database/GCF/946/190/145/GCF_946190145.1_genomic.fna.gz	94.95	0.224	94.21-95.81	0.224	0.16-0.29	1	1.217	369/9123	90.17	NZ_CAMHZM010000001.1 Streptococcus mitis isolate Streptococcus mitis NODE_1_length_492142_cov_74.508555, whole genome shotgun sequence
trimmed_read1_3001425825-DNA.fastq.gz	gtdb_genomes_reps_r220/database/GCF/009/496/295/GCF_009496295.1_genomic.fna.gz	94.94	0.239	94.14-95.66	0.239	0.18-0.30	1	1.281	370/8682	90.32	NZ_WIJL01000010.1 Streptococcus mitis strain SM15 NODE_10_length_116604_cov_16.980606, whole genome shotgun sequence
trimmed_read1_3001425825-DNA.fastq.gz	gtdb_genomes_reps_r220/database/GCF/002/005/545/GCF_002005545.1_genomic.fna.gz	94.93	0.274	94.19-95.59	0.274	0.21-0.34	1	1.165	417/8727	90.66	NZ_LBMT01000001.1 Streptococcus mitis strain 321A Scaffold1, whole genome shotgun sequence
trimmed_read1_3001425825-DNA.fastq.gz	gtdb_genomes_reps_r220/database/GCF/019/448/275/GCF_019448275.1_genomic.fna.gz	94.92	0.267	94.21-95.58	0.267	0.20-0.35	1	1.226	402/8602	90.59	NZ_JAHXBZ010000001.1 Streptococcus humanilactis strain IMAU99125 IMAU99125, whole genome shotgun sequence
trimmed_read1_3001425825-DNA.fastq.gz	gtdb_genomes_reps_r220/database/GCF/013/276/625/GCF_013276625.1_genomic.fna.gz	94.89	0.275	94.18-95.55	0.275	0.21-0.36	1	1.225	435/9194	90.63	NZ_VMLI01000001.1 Streptococcus sp. 9903 9903_S27_L001_R1_001_(paired)_contig_1, whole genome shotgun sequence
trimmed_read1_3001425825-DNA.fastq.gz	gtdb_genomes_reps_r220/database/GCF/023/109/515/GCF_023109515.1_genomic.fna.gz	94.87	0.252	94.10-95.68	0.252	0.19-0.32	1	1.250	376/8654	90.38	NZ_JALDUM010000010.1 Streptococcus mitis strain S39 NODE_10_length_3920_cov_103.945149, whole genome shotgun sequence
trimmed_read1_3001425825-DNA.fastq.gz	gtdb_genomes_reps_r220/database/GCF/013/305/725/GCF_013305725.1_genomic.fna.gz	94.86	0.223	94.05-95.79	0.223	0.15-0.29	1	1.162	340/8720	90.06	NZ_CP047883.1 Streptococcus mitis strain S022-V3-A4 chromosome, complete genome
trimmed_read1_3001425825-DNA.fastq.gz	gtdb_genomes_reps_r220/database/GCF/001/070/815/GCF_001070815.1_genomic.fna.gz	94.86	0.263	94.04-95.77	0.263	0.18-0.33	1	1.163	362/8046	90.48	NZ_JVLX01000006.1 Streptococcus pseudopneumoniae strain 315_SPSE, whole genome shotgun sequence
trimmed_read1_3001425825-DNA.fastq.gz	gtdb_genomes_reps_r220/database/GCF/002/087/075/GCF_002087075.1_genomic.fna.gz	94.84	0.251	94.02-95.54	0.251	0.18-0.33	1	1.248	395/9171	90.35	NZ_MWSM01000001.1 Streptococcus pseudopneumoniae ATCC BAA-960 = CCUG 49455 CCUG_49455T_0000001, whole genome shotgun sequence
trimmed_read1_3001425825-DNA.fastq.gz	gtdb_genomes_reps_r220/database/GCF/000/220/045/GCF_000220045.1_genomic.fna.gz	94.82	0.221	93.80-95.61	0.221	0.16-0.30	1	1.151	331/8681	90.00	NZ_AFQT01000054.1 Streptococcus mitis SK1073 ctg1129645355399, whole genome shotgun sequence
trimmed_read1_3001425825-DNA.fastq.gz	gtdb_genomes_reps_r220/database/GCF/000/722/775/GCF_000722775.1_genomic.fna.gz	94.82	0.274	94.14-95.40	0.274	0.22-0.35	1	1.171	409/8856	90.56	NZ_JPFZ01000001.1 Streptococcus mitis strain SK608 gsmSK608.contig.0_1, whole genome shotgun sequence
trimmed_read1_3001425825-DNA.fastq.gz	gtdb_genomes_reps_r220/database/GCF/001/579/045/GCF_001579045.1_genomic.fna.gz	94.82	0.278	94.19-95.58	0.278	0.21-0.35	1	1.263	426/9109	90.59	NZ_KQ970261.1 Streptococcus mitis strain DD28 scaffold00001, whole genome shotgun sequence
trimmed_read1_3001425825-DNA.fastq.gz	gtdb_genomes_reps_r220/database/GCF/003/942/775/GCF_003942775.1_genomic.fna.gz	94.82	0.266	94.06-95.47	0.266	0.20-0.33	1	1.198	400/8873	90.49	NZ_RJNX01000001.1 Streptococcus mitis strain BCC65 D8848_contig001, whole genome shotgun sequence
trimmed_read1_3001425825-DNA.fastq.gz	gtdb_genomes_reps_r220/database/GCF/000/257/865/GCF_000257865.1_genomic.fna.gz	94.80	0.291	94.12-95.39	0.291	0.23-0.35	1	1.246	426/8814	90.69	NZ_AICU01000001.1 Streptococcus mitis SK575 contig00033, whole genome shotgun sequence
trimmed_read1_3001425825-DNA.fastq.gz	gtdb_genomes_reps_r220/database/GCF/013/277/205/GCF_013277205.1_genomic.fna.gz	94.80	0.272	94.10-95.42	0.272	0.21-0.34	1	1.234	432/9465	90.52	NZ_VMMO01000001.1 Streptococcus sp. 202 202_S24_L001_R1_001_(paired)_contig_1, whole genome shotgun sequence
trimmed_read1_3001425825-DNA.fastq.gz	gtdb_genomes_reps_r220/database/GCF/001/836/735/GCF_001836735.1_genomic.fna.gz	94.80	0.090	92.86-97.12	0.090	0.04-0.17	1	1.120	166/10129	87.58	NZ_KV830299.1 Rothia sp. HMSC061D12 Scaffold0, whole genome shotgun sequence
trimmed_read1_3001425825-DNA.fastq.gz	gtdb_genomes_reps_r220/database/GCF/019/929/545/GCF_019929545.1_genomic.fna.gz	94.80	0.268	94.02-95.45	0.268	0.20-0.35	1	1.234	376/8371	90.48	NZ_JAHZPT010000001.1 Streptococcus mitis strain CR123 Smitis_CR123_NinaOddballs_Sia_NO_1, whole genome shotgun sequence
trimmed_read1_3001425825-DNA.fastq.gz	gtdb_genomes_reps_r220/database/GCF/000/027/165/GCF_000027165.1_genomic.fna.gz	94.79	0.253	94.07-95.66	0.253	0.19-0.32	1	1.148	372/8732	90.32	NC_013853.1 Streptococcus mitis B6, complete sequence
trimmed_read1_3001425825-DNA.fastq.gz	gtdb_genomes_reps_r220/database/GCA/905/221/225/GCA_905221225.1_genomic.fna.gz	94.79	0.269	93.97-95.73	0.269	0.19-0.36	1	1.228	364/8095	90.48	CAJNCH010000001.1 unidentified bacterium isolate Streptococcus species genome assembly, contig: NODE_1_length_211129_cov_38.585, whole genome shotgun sequence
trimmed_read1_3001425825-DNA.fastq.gz	gtdb_genomes_reps_r220/database/GCA/001/914/195/GCA_001914195.1_genomic.fna.gz	94.78	0.290	94.02-95.29	0.290	0.23-0.37	1	1.176	414/8685	90.65	MKYF01000030.1 MAG: Streptococcus mitis isolate 0123W_40_11 0123W_scaffold_1041, whole genome shotgun sequence
trimmed_read1_3001425825-DNA.fastq.gz	gtdb_genomes_reps_r220/database/GCF/000/722/765/GCF_000722765.2_genomic.fna.gz	94.77	0.254	93.92-95.66	0.254	0.17-0.34	1	1.157	345/8136	90.31	NZ_CP028415.1 Streptococcus mitis strain SK637 chromosome, complete genome
trimmed_read1_3001425825-DNA.fastq.gz	gtdb_genomes_reps_r220/database/GCF/013/277/555/GCF_013277555.1_genomic.fna.gz	94.75	0.257	93.89-95.76	0.257	0.18-0.33	1	1.271	354/8306	90.32	NZ_VMND01000001.1 Streptococcus sp. k-163 k-163_S2_L001_R1_001_(paired)_contig_1, whole genome shotgun sequence
trimmed_read1_3001425825-DNA.fastq.gz	gtdb_genomes_reps_r220/database/GCF/002/096/845/GCF_002096845.1_genomic.fna.gz	94.75	0.285	94.05-95.60	0.285	0.21-0.36	1	1.277	408/8758	90.58	NZ_NCVK01000060.1 Streptococcus mitis strain OD_317805_11 s_mitis_OD_317805_11_ID_1, whole genome shotgun sequence
trimmed_read1_3001425825-DNA.fastq.gz	gtdb_genomes_reps_r220/database/GCF/002/096/735/GCF_002096735.1_genomic.fna.gz	94.75	0.294	93.87-95.51	0.294	0.21-0.37	1	1.309	395/8264	90.66	NZ_NCVC01000017.1 Streptococcus mitis strain RH_8961_10 s_mitis_RH_8961_10_ID_1, whole genome shotgun sequence
trimmed_read1_3001425825-DNA.fastq.gz	gtdb_genomes_reps_r220/database/GCF/009/496/165/GCF_009496165.1_genomic.fna.gz	94.73	0.284	94.05-95.49	0.284	0.21-0.37	1	1.282	393/8510	90.56	NZ_WIJQ01000010.1 Streptococcus mitis strain SM08 NODE_10_length_53743_cov_22.439328, whole genome shotgun sequence
trimmed_read1_3001425825-DNA.fastq.gz	gtdb_genomes_reps_r220/database/GCF/013/277/475/GCF_013277475.1_genomic.fna.gz	94.73	0.298	94.02-95.38	0.298	0.23-0.37	1	1.235	442/9183	90.68	NZ_VMMZ01000001.1 Streptococcus sp. k-628 k-628_S22_L001_R1_001_(paired)_contig_1, whole genome shotgun sequence
trimmed_read1_3001425825-DNA.fastq.gz	gtdb_genomes_reps_r220/database/GCA/905/221/065/GCA_905221065.1_genomic.fna.gz	94.73	0.254	93.94-95.52	0.254	0.18-0.32	1	1.292	343/8205	90.27	CAJNBS010000001.1 unidentified bacterium isolate Streptococcus species genome assembly, contig: NODE_1_length_331008_cov_48.2727, whole genome shotgun sequence
trimmed_read1_3001425825-DNA.fastq.gz	gtdb_genomes_reps_r220/database/GCF/019/334/725/GCF_019334725.1_genomic.fna.gz	94.73	0.070	92.61-95.69	0.070	0.05-0.14	1	1.050	119/9408	86.85	NZ_CP079818.1 Neisseria perflava strain LPB0400 chromosome, complete genome
trimmed_read1_3001425825-DNA.fastq.gz	gtdb_genomes_reps_r220/database/GCF/000/148/525/GCF_000148525.1_genomic.fna.gz	94.73	0.283	94.09-95.37	0.283	0.22-0.36	1	1.162	395/8584	90.55	NZ_AEDU01000035.1 Streptococcus mitis SK564 contigB3, whole genome shotgun sequence
trimmed_read1_3001425825-DNA.fastq.gz	gtdb_genomes_reps_r220/database/GCF/000/960/005/GCF_000960005.1_genomic.fna.gz	94.73	0.237	93.61-95.61	0.237	0.17-0.33	1	1.165	322/8198	90.08	NZ_JYGP01000001.1 Streptococcus mitis strain OT25 TZ90_contig000001, whole genome shotgun sequence
trimmed_read1_3001425825-DNA.fastq.gz	gtdb_genomes_reps_r220/database/GCA/905/221/215/GCA_905221215.1_genomic.fna.gz	94.72	0.256	93.82-95.69	0.256	0.18-0.35	1	1.287	348/8279	90.28	CAJNCI010000001.1 unidentified bacterium isolate Streptococcus species genome assembly, contig: NODE_1_length_434302_cov_36.2817, whole genome shotgun sequence
trimmed_read1_3001425825-DNA.fastq.gz	gtdb_genomes_reps_r220/database/GCF/000/722/705/GCF_000722705.1_genomic.fna.gz	94.71	0.226	93.66-95.52	0.226	0.16-0.32	1	1.160	325/8646	89.96	NZ_JPFW01000001.1 Streptococcus mitis strain SK642 gsmSK642.contig.0_1, whole genome shotgun sequence
trimmed_read1_3001425825-DNA.fastq.gz	gtdb_genomes_reps_r220/database/GCA/905/221/545/GCA_905221545.1_genomic.fna.gz	94.71	0.231	93.68-95.62	0.231	0.15-0.31	1	1.234	308/8034	90.01	CAJNDO010000001.1 unidentified bacterium isolate Streptococcus species genome assembly, contig: NODE_1_length_233977_cov_53.6585, whole genome shotgun sequence
trimmed_read1_3001425825-DNA.fastq.gz	gtdb_genomes_reps_r220/database/GCF/946/190/335/GCF_946190335.1_genomic.fna.gz	94.71	0.272	93.88-95.46	0.272	0.20-0.35	1	1.235	362/8196	90.43	NZ_CAMHZN010000001.1 Streptococcus mitis isolate Streptococcus mitis NODE_1_length_678925_cov_140.780463, whole genome shotgun sequence
trimmed_read1_3001425825-DNA.fastq.gz	gtdb_genomes_reps_r220/database/GCF/946/188/685/GCF_946188685.1_genomic.fna.gz	94.70	0.259	93.85-95.61	0.259	0.19-0.34	1	1.263	377/8937	90.29	NZ_CAMHWH010000001.1 Streptococcus mitis isolate Streptococcus mitis NODE_1_length_368939_cov_97.626665, whole genome shotgun sequence
