Sample_file	Genome_file	Taxonomic_abundance	Sequence_abundance	Adjusted_ANI	Eff_cov	ANI_5-95_percentile	Eff_lambda	Lambda_5-95_percentile	Median_cov	Mean_cov_geq1	Containment_ind	Naive_ANI	kmers_reassigned	Contig_name
trimmed_read1_3001347857-DNA.fastq.gz	gtdb_genomes_reps_r220/database/GCF/000/245/815/GCF_000245815.1_genomic.fna.gz	28.1330	26.0932	97.95	0.376	97.55-98.31	0.376	0.33-0.43	1	1.202	1293/7821	94.36	0	NZ_JH601103.1 Dolosigranulum pigrum ATCC 51524 supercont1.1, whole genome shotgun sequence
trimmed_read1_3001347857-DNA.fastq.gz	gtdb_genomes_reps_r220/database/GCA/959/020/685/GCA_959020685.1_genomic.fna.gz	22.5857	20.2303	97.96	0.302	97.45-98.41	0.302	0.26-0.35	1	1.174	1067/7764	93.80	0	CAUETL010000001.1 MAG TPA_asm: Haemophilus parainfluenzae isolate DRR221346_bin.14_MetaWRAP_v1.3_MAG genome assembly, contig: ERZ19210964.221, whole genome shotgun sequence
trimmed_read1_3001347857-DNA.fastq.gz	gtdb_genomes_reps_r220/database/GCF/000/175/615/GCF_000175615.1_genomic.fna.gz	15.8283	17.7792	95.80	0.212	94.97-96.43	0.212	0.16-0.27	1	1.103	493/9767	90.82	4	NZ_ACVO01000025.1 Rothia mucilaginosa ATCC 25296 contig00004, whole genome shotgun sequence
trimmed_read1_3001347857-DNA.fastq.gz	gtdb_genomes_reps_r220/database/GCF/000/688/415/GCF_000688415.1_genomic.fna.gz	13.0433	14.6889	99.22	0.174	98.63-99.62	0.174	0.15-0.21	1	1.116	1232/9809	93.53	0	NZ_JIAH01000001.1 Corynebacterium pseudodiphtheriticum DSM 44287 O146DRAFT_scaffold00010.10_C, whole genome shotgun sequence
trimmed_read1_3001347857-DNA.fastq.gz	gtdb_genomes_reps_r220/database/GCF/001/679/005/GCF_001679005.1_genomic.fna.gz	9.6000	10.9014	97.56	0.128	96.55-98.45	0.128	0.09-0.18	1	1.083	551/9834	91.12	0	NZ_LXTW01000001.1 Moraxella nonliquefaciens strain CCUG 348 contig_1, whole genome shotgun sequence
trimmed_read1_3001347857-DNA.fastq.gz	gtdb_genomes_reps_r220/database/GCF/000/186/465/GCF_000186465.1_genomic.fna.gz	5.9415	6.3032	95.34	0.079	93.17-97.11	0.079	0.04-0.16	1	1.063	159/9123	87.75	104	NZ_GL636091.1 Streptococcus australis ATCC 700641 SCAFFOLD1, whole genome shotgun sequence
trimmed_read1_3001347857-DNA.fastq.gz	gtdb_genomes_reps_r220/database/GCF/905/372/335/GCF_905372335.1_genomic.fna.gz	4.8683	4.0039	97.80	0.065	95.89-99.77	0.065	0.03-0.12	1	1.032	222/7025	89.45	0	NZ_CAJPOU010000001.1 MAG: Streptococcus sp. A12 isolate SRR9217406-mag-bin.7, whole genome shotgun sequence
