Sample_file	Genome_file	Taxonomic_abundance	Sequence_abundance	Adjusted_ANI	Eff_cov	ANI_5-95_percentile	Eff_lambda	Lambda_5-95_percentile	Median_cov	Mean_cov_geq1	Containment_ind	Naive_ANI	kmers_reassigned	Contig_name
trimmed_read1_3001221282-DNA.fastq.gz	gtdb_genomes_reps_r220/database/GCF/002/014/765/GCF_002014765.1_genomic.fna.gz	44.1814	43.1425	98.53	1.938	98.48-98.61	1.938	1.80-1.99	2	2.391	4826/8926	98.04	195	NZ_MUYT01000001.1 Moraxella lincolnii strain CCUG 9405 CCUG9405T_R1__paired__trimmed__paired__contig_1, whole genome shotgun sequence
trimmed_read1_3001221282-DNA.fastq.gz	gtdb_genomes_reps_r220/database/GCF/001/679/005/GCF_001679005.1_genomic.fna.gz	30.3609	32.5442	98.35	1.332	98.24-98.47	1.332	1.25-1.40	2	1.865	4318/9834	97.38	355	NZ_LXTW01000001.1 Moraxella nonliquefaciens strain CCUG 348 contig_1, whole genome shotgun sequence
trimmed_read1_3001221282-DNA.fastq.gz	gtdb_genomes_reps_r220/database/GCF/001/632/285/GCF_001632285.1_genomic.fna.gz	15.0930	13.3763	99.38	0.662	99.18-99.57	0.662	0.62-0.71	1	1.563	3275/8176	97.09	0	NZ_LWAH01000001.1 Moraxella catarrhalis strain CCUG 353 contig_1, whole genome shotgun sequence
trimmed_read1_3001221282-DNA.fastq.gz	gtdb_genomes_reps_r220/database/GCF/000/688/415/GCF_000688415.1_genomic.fna.gz	7.2621	7.7199	96.08	0.319	95.62-96.53	0.319	0.28-0.37	1	1.178	774/9809	92.13	1	NZ_JIAH01000001.1 Corynebacterium pseudodiphtheriticum DSM 44287 O146DRAFT_scaffold00010.10_C, whole genome shotgun sequence
trimmed_read1_3001221282-DNA.fastq.gz	gtdb_genomes_reps_r220/database/GCF/003/030/305/GCF_003030305.1_genomic.fna.gz	1.6831	1.9744	97.17	0.074	95.61-98.86	0.074	0.04-0.12	1	1.036	309/10561	89.23	0	NZ_CP023676.1 Cutibacterium acnes strain ATCC 6919 chromosome, complete genome
trimmed_read1_3001221282-DNA.fastq.gz	gtdb_genomes_reps_r220/database/GCF/000/245/815/GCF_000245815.1_genomic.fna.gz	1.4194	1.2427	98.17	0.062	96.33-100.28	0.062	0.03-0.11	1	1.034	267/7821	89.68	0	NZ_JH601103.1 Dolosigranulum pigrum ATCC 51524 supercont1.1, whole genome shotgun sequence
