Sample_file	Genome_file	Taxonomic_abundance	Sequence_abundance	Adjusted_ANI	Eff_cov	ANI_5-95_percentile	Eff_lambda	Lambda_5-95_percentile	Median_cov	Mean_cov_geq1	Containment_ind	Naive_ANI	kmers_reassigned	Contig_name
trimmed_read1_3001184953-DNA.fastq.gz	gtdb_genomes_reps_r220/database/GCF/019/703/545/GCF_019703545.1_genomic.fna.gz	37.0903	26.7135	97.96	0.922	97.76-98.15	0.922	0.85-1.01	1	1.613	2567/8083	96.37	1	NZ_AP018771.1 Haemophilus influenzae strain CHBN-II-8 isolate 10H27 chromosome, complete genome
trimmed_read1_3001184953-DNA.fastq.gz	gtdb_genomes_reps_r220/database/GCF/001/027/105/GCF_001027105.1_genomic.fna.gz	34.4593	36.2985	98.18	0.856	98.02-98.31	0.856	0.80-0.92	1	1.575	3869/11892	96.44	0	NZ_CP011526.1 Staphylococcus aureus strain DSM 20231 chromosome, complete genome
trimmed_read1_3001184953-DNA.fastq.gz	gtdb_genomes_reps_r220/database/GCF/001/457/635/GCF_001457635.1_genomic.fna.gz	15.5545	12.4301	98.31	0.386	97.95-98.64	0.386	0.34-0.43	1	1.201	1620/8578	94.77	0	NZ_LN831051.1 Streptococcus pneumoniae strain NCTC7465 chromosome 1, complete sequence
trimmed_read1_3001184953-DNA.fastq.gz	gtdb_genomes_reps_r220/database/GCF/000/742/135/GCF_000742135.1_genomic.fna.gz	11.0455	23.1893	98.60	0.274	98.34-98.84	0.274	0.25-0.30	1	1.155	3691/23841	94.16	0	NZ_KN046818.1 Klebsiella pneumoniae strain ATCC 13883 scaffold1, whole genome shotgun sequence
trimmed_read1_3001184953-DNA.fastq.gz	gtdb_genomes_reps_r220/database/GCF/900/636/475/GCF_900636475.1_genomic.fna.gz	1.8505	1.3686	97.80	0.046	95.39-99.03	0.046	0.03-0.10	1	1.022	178/7893	88.49	6	NZ_LR134283.1 Streptococcus anginosus strain NCTC10713 chromosome 1, complete sequence
