Sample_file	Genome_file	Adjusted_ANI	Eff_cov	ANI_5-95_percentile	Eff_lambda	Lambda_5-95_percentile	Median_cov	Mean_cov_geq1	Containment_ind	Naive_ANI	Contig_name
trimmed_read1_3001097048-DNA.fastq.gz	gtdb_genomes_reps_r220/database/GCF/001/457/655/GCF_001457655.1_genomic.fna.gz	98.77	1.869	98.67-98.84	1.869	1.73-1.97	2	2.534	4605/7983	98.24	NZ_LN831035.1 Haemophilus influenzae strain NCTC8143 chromosome 1, complete sequence
trimmed_read1_3001097048-DNA.fastq.gz	gtdb_genomes_reps_r220/database/GCF/001/632/285/GCF_001632285.1_genomic.fna.gz	98.66	0.130	97.81-99.53	0.130	0.09-0.17	1	1.064	659/8176	92.20	NZ_LWAH01000001.1 Moraxella catarrhalis strain CCUG 353 contig_1, whole genome shotgun sequence
trimmed_read1_3001097048-DNA.fastq.gz	gtdb_genomes_reps_r220/database/GCF/002/984/305/GCF_002984305.1_genomic.fna.gz	97.79	1.771	97.70-97.87	1.771	1.66-1.91	2	2.580	3548/8528	97.21	NZ_NEAA01000096.1 Haemophilus influenzae strain 135P16H1 N135P16H1_100_1, whole genome shotgun sequence
trimmed_read1_3001097048-DNA.fastq.gz	gtdb_genomes_reps_r220/database/GCF/019/703/545/GCF_019703545.1_genomic.fna.gz	97.71	1.854	97.59-97.78	1.854	1.72-1.98	2	2.541	3323/8083	97.17	NZ_AP018771.1 Haemophilus influenzae strain CHBN-II-8 isolate 10H27 chromosome, complete genome
trimmed_read1_3001097048-DNA.fastq.gz	gtdb_genomes_reps_r220/database/GCF/005/888/195/GCF_005888195.1_genomic.fna.gz	97.68	1.839	97.57-97.76	1.839	1.74-1.99	2	2.561	3347/8234	97.14	NZ_LNKR01000001.1 Haemophilus influenzae biotype aegyptius strain KC1018 contig_001, whole genome shotgun sequence
trimmed_read1_3001097048-DNA.fastq.gz	gtdb_genomes_reps_r220/database/GCF/900/475/755/GCF_900475755.1_genomic.fna.gz	96.48	1.808	96.34-96.63	1.808	1.62-1.94	2	2.563	2156/7845	95.92	NZ_LS483411.1 Haemophilus influenzae strain NCTC11426 chromosome 1, complete sequence
trimmed_read1_3001097048-DNA.fastq.gz	gtdb_genomes_reps_r220/database/GCF/002/014/765/GCF_002014765.1_genomic.fna.gz	95.33	0.087	93.39-97.41	0.087	0.04-0.16	1	1.041	171/8926	88.02	NZ_MUYT01000001.1 Moraxella lincolnii strain CCUG 9405 CCUG9405T_R1__paired__trimmed__paired__contig_1, whole genome shotgun sequence
trimmed_read1_3001097048-DNA.fastq.gz	gtdb_genomes_reps_r220/database/GCF/003/493/605/GCF_003493605.1_genomic.fna.gz	94.80	1.890	94.58-94.96	1.890	1.62-2.30	2	2.599	1281/7850	94.32	NZ_QQKA01000001.1 Haemophilus haemolyticus strain M19187 M19187_HUY4190A139_cleaned_ctg_3530, whole genome shotgun sequence
trimmed_read1_3001097048-DNA.fastq.gz	gtdb_genomes_reps_r220/database/GCF/000/222/025/GCF_000222025.1_genomic.fna.gz	94.79	1.862	94.55-94.96	1.862	1.63-2.32	2	2.618	1218/7558	94.28	NZ_AFQO01000022.1 Haemophilus haemolyticus M19501 M19501_022, whole genome shotgun sequence
trimmed_read1_3001097048-DNA.fastq.gz	gtdb_genomes_reps_r220/database/GCF/001/276/515/GCF_001276515.1_genomic.fna.gz	94.25	1.774	94.04-94.44	1.774	1.54-2.01	2	2.619	1154/8635	93.71	NZ_LDVZ01000082.1 Haemophilus sp. C1 contig398, whole genome shotgun sequence
trimmed_read1_3001097048-DNA.fastq.gz	gtdb_genomes_reps_r220/database/GCF/003/493/685/GCF_003493685.1_genomic.fna.gz	94.24	1.718	94.04-94.43	1.718	1.47-1.96	2	2.609	1160/8850	93.66	NZ_QQJW01000001.1 Haemophilus haemolyticus strain M26161 M26161_HUY4190A151_cleaned_ctg_3559, whole genome shotgun sequence
trimmed_read1_3001097048-DNA.fastq.gz	gtdb_genomes_reps_r220/database/GCF/003/352/385/GCF_003352385.1_genomic.fna.gz	94.04	2.075	93.88-94.26	2.075	1.73-2.26	2	2.663	1108/8521	93.63	NZ_CP031243.1 Haemophilus haemolyticus strain M19346 chromosome, complete genome
trimmed_read1_3001097048-DNA.fastq.gz	gtdb_genomes_reps_r220/database/GCF/001/679/045/GCF_001679045.1_genomic.fna.gz	93.99	1.868	93.76-94.23	1.868	1.63-2.13	2	2.609	995/7971	93.51	NZ_LYCK01000001.1 Haemophilus haemolyticus strain CCUG 12834 contig_1, whole genome shotgun sequence
trimmed_read1_3001097048-DNA.fastq.gz	gtdb_genomes_reps_r220/database/GCF/003/490/935/GCF_003490935.1_genomic.fna.gz	93.95	1.822	93.66-94.17	1.822	1.54-2.25	2	2.633	996/8148	93.44	NZ_QQGD01000001.1 Haemophilus haemolyticus strain M19099 M19099_HUY4190A124_cleaned_ctg_3040, whole genome shotgun sequence
trimmed_read1_3001097048-DNA.fastq.gz	gtdb_genomes_reps_r220/database/GCF/003/490/595/GCF_003490595.1_genomic.fna.gz	93.90	2.078	93.75-94.12	2.078	1.72-2.24	2	2.649	1095/8755	93.51	NZ_QQGY01000001.1 Haemophilus haemolyticus strain M19079 M19079_HUY4190A121_cleaned_ctg_3577, whole genome shotgun sequence
trimmed_read1_3001097048-DNA.fastq.gz	gtdb_genomes_reps_r220/database/GCF/003/351/405/GCF_003351405.1_genomic.fna.gz	93.87	1.833	93.72-94.11	1.833	1.57-1.97	2	2.585	956/8082	93.35	NZ_CP031240.1 Haemophilus haemolyticus strain M19345 chromosome, complete genome
trimmed_read1_3001097048-DNA.fastq.gz	gtdb_genomes_reps_r220/database/GCA/001/752/465/GCA_001752465.1_genomic.fna.gz	93.64	1.944	93.44-93.84	1.944	1.74-2.14	2	2.611	1025/9119	93.19	MDJB01000001.1 Haemophilus quentini strain K068 K068_S8_L001_R1_001_(paired)_contig_1, whole genome shotgun sequence
trimmed_read1_3001097048-DNA.fastq.gz	gtdb_genomes_reps_r220/database/GCF/006/384/255/GCF_006384255.1_genomic.fna.gz	93.17	1.909	92.94-93.41	1.909	1.60-2.14	2	2.580	851/8908	92.70	NZ_VCED01000001.1 Haemophilus seminalis strain SZY H1 Scaffold1, whole genome shotgun sequence
trimmed_read1_3001097048-DNA.fastq.gz	gtdb_genomes_reps_r220/database/GCA/018/372/995/GCA_018372995.1_genomic.fna.gz	93.14	1.694	92.85-93.42	1.694	1.41-1.96	2	2.558	795/8819	92.53	JAHAHX010000023.1 MAG: Haemophilus haemolyticus isolate L3_098_047G1_dasL3_098_047G1_concoct_31 L3_098_047G1_scaffold_1020, whole genome shotgun sequence
trimmed_read1_3001097048-DNA.fastq.gz	gtdb_genomes_reps_r220/database/GCF/001/679/005/GCF_001679005.1_genomic.fna.gz	92.32	0.140	90.41-94.52	0.140	0.06-0.25	1	1.064	110/9834	86.51	NZ_LXTW01000001.1 Moraxella nonliquefaciens strain CCUG 348 contig_1, whole genome shotgun sequence
trimmed_read1_3001097048-DNA.fastq.gz	gtdb_genomes_reps_r220/database/GCF/001/656/295/GCF_001656295.1_genomic.fna.gz	90.79	0.247	89.45-92.84	0.247	0.12-0.42	1	1.147	102/9300	86.45	NZ_LXHE01000009.1 Moraxella catarrhalis strain Z7574 Z7574_ctg-0, whole genome shotgun sequence
