trimmed_read1_3001221246-DNA.fastq.gz	gtdb_genomes_reps_r220/database/GCF/946/188/585/GCF_946188585.1_genomic.fna.gz	92.70	0.240	91.40-94.25	0.240	0.13-0.37	1	1.120	175/8349	88.28	NZ_CAMHVI010000001.1 Streptococcus mitis isolate Streptococcus mitis NODE_1_length_551605_cov_126.496499, whole genome shotgun sequence
trimmed_read1_3001221246-DNA.fastq.gz	gtdb_genomes_reps_r220/database/GCA/905/221/225/GCA_905221225.1_genomic.fna.gz	92.70	0.309	91.75-93.74	0.309	0.21-0.43	1	1.168	208/8095	88.86	CAJNCH010000001.1 unidentified bacterium isolate Streptococcus species genome assembly, contig: NODE_1_length_211129_cov_38.585, whole genome shotgun sequence
trimmed_read1_3001221246-DNA.fastq.gz	gtdb_genomes_reps_r220/database/GCA/905/221/375/GCA_905221375.1_genomic.fna.gz	92.70	0.239	91.49-93.95	0.239	0.15-0.37	1	1.121	182/8833	88.23	CAJNCY010000001.1 unidentified bacterium isolate Streptococcus species genome assembly, contig: NODE_1_length_291870_cov_37.7718, whole genome shotgun sequence
trimmed_read1_3001221246-DNA.fastq.gz	gtdb_genomes_reps_r220/database/GCF/002/027/545/GCF_002027545.1_genomic.fna.gz	92.70	3.108	NA-NA	HIGH	NA-NA	3	3.108	1160/12181	92.70	NZ_MXAN01000001.1 Moraxella lacunata strain CCUG 4441 CCUG_4441T_0000001, whole genome shotgun sequence
trimmed_read1_3001221246-DNA.fastq.gz	gtdb_genomes_reps_r220/database/GCF/002/096/895/GCF_002096895.1_genomic.fna.gz	92.69	0.328	91.70-93.54	0.328	0.22-0.46	1	1.156	212/7832	89.01	NZ_NCVI01000020.1 Streptococcus mitis strain RH_17024_08 s_mitis_RH_17024_08_ID_1, whole genome shotgun sequence
trimmed_read1_3001221246-DNA.fastq.gz	gtdb_genomes_reps_r220/database/GCF/002/096/855/GCF_002096855.1_genomic.fna.gz	92.67	0.301	91.77-93.64	0.301	0.20-0.41	1	1.160	206/8240	88.78	NZ_NCVH01000033.1 Streptococcus mitis strain RH_17439_08 s_mitis_RH_17439_08_ID_1, whole genome shotgun sequence
trimmed_read1_3001221246-DNA.fastq.gz	gtdb_genomes_reps_r220/database/GCA/018/364/455/GCA_018364455.1_genomic.fna.gz	92.67	0.263	91.65-93.78	0.263	0.17-0.39	1	1.126	199/9113	88.39	JAGZLW010000001.1 MAG: Streptococcus mitis isolate L3_114_025G1_dasL3_114_025G1_concoct_29 L3_114_025G1_scaffold_0, whole genome shotgun sequence
trimmed_read1_3001221246-DNA.fastq.gz	gtdb_genomes_reps_r220/database/GCF/003/942/865/GCF_003942865.1_genomic.fna.gz	92.65	0.270	91.44-93.95	0.270	0.16-0.41	1	1.142	190/8424	88.49	NZ_RJNZ01000001.1 Streptococcus mitis strain BCC55 D8845_contig001, whole genome shotgun sequence
trimmed_read1_3001221246-DNA.fastq.gz	gtdb_genomes_reps_r220/database/GCA/905/221/235/GCA_905221235.1_genomic.fna.gz	92.65	0.282	91.53-93.55	0.282	0.20-0.43	1	1.153	203/8581	88.62	CAJNCJ010000001.1 unidentified bacterium isolate Streptococcus species genome assembly, contig: NODE_1_length_257994_cov_14.1844, whole genome shotgun sequence
trimmed_read1_3001221246-DNA.fastq.gz	gtdb_genomes_reps_r220/database/GCF/000/027/165/GCF_000027165.1_genomic.fna.gz	92.62	0.267	91.60-93.78	0.267	0.17-0.40	1	1.147	190/8732	88.38	NC_013853.1 Streptococcus mitis B6, complete sequence
trimmed_read1_3001221246-DNA.fastq.gz	gtdb_genomes_reps_r220/database/GCF/016/658/865/GCF_016658865.1_genomic.fna.gz	92.61	0.233	91.26-94.18	0.233	0.13-0.38	1	1.127	165/8594	88.03	NZ_CP067992.1 Streptococcus mitis strain S022-V7-A3 chromosome, complete genome
trimmed_read1_3001221246-DNA.fastq.gz	gtdb_genomes_reps_r220/database/GCF/019/929/545/GCF_019929545.1_genomic.fna.gz	92.60	0.296	91.59-93.51	0.296	0.21-0.43	1	1.169	201/8371	88.67	NZ_JAHZPT010000001.1 Streptococcus mitis strain CR123 Smitis_CR123_NinaOddballs_Sia_NO_1, whole genome shotgun sequence
trimmed_read1_3001221246-DNA.fastq.gz	gtdb_genomes_reps_r220/database/GCF/006/385/165/GCF_006385165.1_genomic.fna.gz	92.60	0.260	91.32-94.06	0.260	0.16-0.40	1	1.140	150/7122	88.29	NZ_VFJA01000001.1 Streptococcus symci strain C17 Scaffold1, whole genome shotgun sequence
trimmed_read1_3001221246-DNA.fastq.gz	gtdb_genomes_reps_r220/database/GCA/934/216/185/GCA_934216185.1_genomic.fna.gz	92.56	0.245	91.26-93.80	0.245	0.17-0.38	1	1.163	172/8588	88.15	CAKQBM010000001.1 MAG: uncultured Streptococcus sp. isolate REFINED_METABAT215_TOP10_CONTIGS_1500_ASSEMBLY_K77_MERGED__Hadza_MoBio_hadza-E-H_O_24_1936.13 genome assembly, contig: Hadza_MoBio_hadza-E-H_O_24_1936__NODE_170_length_36231_cov_7.962355, whole genome shotgun sequence
trimmed_read1_3001221246-DNA.fastq.gz	gtdb_genomes_reps_r220/database/GCF/005/144/795/GCF_005144795.1_genomic.fna.gz	92.56	0.277	91.54-93.69	0.277	0.19-0.38	1	1.180	189/8446	88.46	NZ_SWFJ01000010.1 Streptococcus mitis strain ColumbLawn NODE_10_length_101543_cov_167.293110, whole genome shotgun sequence
trimmed_read1_3001221246-DNA.fastq.gz	gtdb_genomes_reps_r220/database/GCA/905/221/035/GCA_905221035.1_genomic.fna.gz	92.55	0.293	91.52-93.49	0.293	0.20-0.42	1	1.178	197/8375	88.61	CAJNBP010000001.1 unidentified bacterium isolate Streptococcus species genome assembly, contig: NODE_1_length_294953_cov_49.9758, whole genome shotgun sequence
trimmed_read1_3001221246-DNA.fastq.gz	gtdb_genomes_reps_r220/database/GCA/902/482/895/GCA_902482895.1_genomic.fna.gz	92.55	0.250	91.31-93.88	0.250	0.14-0.38	1	1.123	154/7666	88.16	CABTAV010000001.1 MAG TPA_asm: uncultured Streptococcus sp. isolate MGYG-HGUT-03136 genome assembly, contig: GUT_GENOME207866_1, whole genome shotgun sequence
trimmed_read1_3001221246-DNA.fastq.gz	gtdb_genomes_reps_r220/database/GCF/000/222/785/GCF_000222785.1_genomic.fna.gz	92.53	0.271	91.56-93.42	0.271	0.18-0.39	1	1.130	177/8285	88.33	NZ_AFUF01000054.1 Streptococcus mitis SK569 ctg1129913977589, whole genome shotgun sequence
trimmed_read1_3001221246-DNA.fastq.gz	gtdb_genomes_reps_r220/database/GCF/000/148/585/GCF_000148585.2_genomic.fna.gz	92.52	0.293	91.42-93.54	0.293	0.21-0.44	1	1.148	182/7991	88.51	NZ_CP028414.1 Streptococcus mitis NCTC 12261 chromosome, complete genome
trimmed_read1_3001221246-DNA.fastq.gz	gtdb_genomes_reps_r220/database/GCF/009/496/295/GCF_009496295.1_genomic.fna.gz	92.51	0.313	91.61-93.50	0.313	0.23-0.45	1	1.150	213/8682	88.73	NZ_WIJL01000010.1 Streptococcus mitis strain SM15 NODE_10_length_116604_cov_16.980606, whole genome shotgun sequence
trimmed_read1_3001221246-DNA.fastq.gz	gtdb_genomes_reps_r220/database/GCF/023/110/245/GCF_023110245.1_genomic.fna.gz	92.51	0.326	91.52-93.62	0.326	0.23-0.45	1	1.164	214/8455	88.82	NZ_JALDVR010000010.1 Streptococcus mitis strain S03 NODE_10_length_52279_cov_241.670492, whole genome shotgun sequence
trimmed_read1_3001221246-DNA.fastq.gz	gtdb_genomes_reps_r220/database/GCA/905/221/245/GCA_905221245.1_genomic.fna.gz	92.50	0.330	91.40-93.36	0.330	0.23-0.48	1	1.165	212/8315	88.84	CAJNCK010000001.1 unidentified bacterium isolate Streptococcus species genome assembly, contig: NODE_1_length_394086_cov_61.6465, whole genome shotgun sequence
trimmed_read1_3001221246-DNA.fastq.gz	gtdb_genomes_reps_r220/database/GCF/003/626/515/GCF_003626515.1_genomic.fna.gz	92.49	0.243	91.16-93.89	0.243	0.14-0.38	1	1.136	162/8292	88.08	NZ_RBCK01000001.1 Streptococcus chosunense strain ChDC B353 KCOM1699_1, whole genome shotgun sequence
trimmed_read1_3001221246-DNA.fastq.gz	gtdb_genomes_reps_r220/database/GCF/943/912/555/GCF_943912555.1_genomic.fna.gz	92.48	0.280	91.34-93.67	0.280	0.19-0.42	1	1.155	174/8048	88.37	NZ_CALTUR010000001.1 MAG: uncultured Streptococcus sp. isolate WUFO5OxywB_bin.3.MAG NODE_36_length_53999_cov_11.507230, whole genome shotgun sequence
trimmed_read1_3001221246-DNA.fastq.gz	gtdb_genomes_reps_r220/database/GCF/000/722/755/GCF_000722755.1_genomic.fna.gz	92.45	0.260	91.41-93.60	0.260	0.16-0.41	1	1.126	175/8714	88.16	NZ_JPFY01000001.1 Streptococcus mitis strain SK578 gsmSK578.contig.0_1, whole genome shotgun sequence
trimmed_read1_3001221246-DNA.fastq.gz	gtdb_genomes_reps_r220/database/GCA/019/414/935/GCA_019414935.1_genomic.fna.gz	92.45	0.290	91.25-93.52	0.290	0.20-0.43	1	1.163	153/6922	88.43	DXLD01000001.1 MAG TPA_asm: Streptococcus sp. isolate HRGM_Genome_0315 HRGM_Genome_0315_1, whole genome shotgun sequence
trimmed_read1_3001221246-DNA.fastq.gz	gtdb_genomes_reps_r220/database/GCF/013/305/725/GCF_013305725.1_genomic.fna.gz	92.45	0.277	91.37-93.54	0.277	0.19-0.40	1	1.162	185/8720	88.31	NZ_CP047883.1 Streptococcus mitis strain S022-V3-A4 chromosome, complete genome
trimmed_read1_3001221246-DNA.fastq.gz	gtdb_genomes_reps_r220/database/GCA/902/489/265/GCA_902489265.1_genomic.fna.gz	92.42	0.292	91.25-93.57	0.292	0.18-0.45	1	1.151	159/7235	88.41	CABTZI010000001.1 MAG TPA_asm: uncultured Streptococcus sp. isolate MGYG-HGUT-03797 genome assembly, contig: GUT_GENOME244205_1, whole genome shotgun sequence
trimmed_read1_3001221246-DNA.fastq.gz	gtdb_genomes_reps_r220/database/GCF/008/763/935/GCF_008763935.1_genomic.fna.gz	92.41	0.308	91.30-93.12	0.308	0.23-0.44	1	1.171	217/9346	88.57	NZ_VTQF01000017.1 Streptococcus mitis strain DE0498 NODE_100_length_5450_cov_55.629293, whole genome shotgun sequence
trimmed_read1_3001221246-DNA.fastq.gz	gtdb_genomes_reps_r220/database/GCF/946/188/375/GCF_946188375.1_genomic.fna.gz	92.39	0.324	91.32-93.23	0.324	0.23-0.48	1	1.149	215/8818	88.71	NZ_CAMHUS010000001.1 Streptococcus mitis isolate Streptococcus mitis NODE_1_length_514561_cov_115.905146, whole genome shotgun sequence
trimmed_read1_3001221246-DNA.fastq.gz	gtdb_genomes_reps_r220/database/GCF/028/156/745/GCF_028156745.1_genomic.fna.gz	92.39	0.264	91.24-93.70	0.264	0.16-0.40	1	1.133	166/8273	88.15	NZ_JAODJG010000009.1 Streptococcus gwangjuense strain DP4_6_2 107, whole genome shotgun sequence
trimmed_read1_3001221246-DNA.fastq.gz	gtdb_genomes_reps_r220/database/GCF/946/190/145/GCF_946190145.1_genomic.fna.gz	92.39	0.307	91.35-93.26	0.307	0.24-0.44	1	1.166	211/9123	88.56	NZ_CAMHZM010000001.1 Streptococcus mitis isolate Streptococcus mitis NODE_1_length_492142_cov_74.508555, whole genome shotgun sequence
trimmed_read1_3001221246-DNA.fastq.gz	gtdb_genomes_reps_r220/database/GCF/946/190/285/GCF_946190285.1_genomic.fna.gz	92.39	0.339	91.33-93.31	0.339	0.23-0.48	1	1.151	212/8428	88.80	NZ_CAMHZX010000001.1 Streptococcus mitis isolate Streptococcus mitis NODE_1_length_750225_cov_136.047748, whole genome shotgun sequence
trimmed_read1_3001221246-DNA.fastq.gz	gtdb_genomes_reps_r220/database/GCF/003/942/765/GCF_003942765.1_genomic.fna.gz	92.38	0.280	91.32-93.33	0.280	0.19-0.41	1	1.214	187/8775	88.33	NZ_RJNW01000001.1 Streptococcus mitis strain KLC01 D8849_contig001, whole genome shotgun sequence
trimmed_read1_3001221246-DNA.fastq.gz	gtdb_genomes_reps_r220/database/GCF/009/496/155/GCF_009496155.1_genomic.fna.gz	92.38	0.305	91.35-93.14	0.305	0.22-0.43	1	1.171	211/9227	88.53	NZ_WIJP01000010.1 Streptococcus mitis strain SM10 NODE_10_length_108696_cov_24.038307, whole genome shotgun sequence
trimmed_read1_3001221246-DNA.fastq.gz	gtdb_genomes_reps_r220/database/GCA/946/190/245/GCA_946190245.1_genomic.fna.gz	92.38	0.277	91.37-93.34	0.277	0.18-0.40	1	1.132	205/9601	88.33	CAMIAC010000001.1 Streptococcus mitis genome assembly, contig: NODE_1_length_204978_cov_120.810372, whole genome shotgun sequence
trimmed_read1_3001221246-DNA.fastq.gz	gtdb_genomes_reps_r220/database/GCF/003/943/935/GCF_003943935.1_genomic.fna.gz	92.38	0.268	91.17-93.66	0.268	0.15-0.41	1	1.148	176/8544	88.23	NZ_RJOB01000001.1 Streptococcus mitis strain BCC45 D8842_contig001, whole genome shotgun sequence
trimmed_read1_3001221246-DNA.fastq.gz	gtdb_genomes_reps_r220/database/GCF/003/942/995/GCF_003942995.1_genomic.fna.gz	92.36	0.309	91.43-93.44	0.309	0.21-0.44	1	1.146	206/8973	88.54	NZ_RJOH01000001.1 Streptococcus mitis strain BCC06 D8836_contig001, whole genome shotgun sequence
trimmed_read1_3001221246-DNA.fastq.gz	gtdb_genomes_reps_r220/database/GCF/946/190/155/GCF_946190155.1_genomic.fna.gz	92.36	0.311	91.27-93.26	0.311	0.21-0.48	1	1.161	193/8327	88.56	NZ_CAMHZL010000001.1 Streptococcus mitis isolate Streptococcus mitis NODE_1_length_388548_cov_94.757163, whole genome shotgun sequence
trimmed_read1_3001221246-DNA.fastq.gz	gtdb_genomes_reps_r220/database/GCF/002/096/845/GCF_002096845.1_genomic.fna.gz	92.35	0.348	91.40-93.22	0.348	0.25-0.48	1	1.162	222/8758	88.82	NZ_NCVK01000060.1 Streptococcus mitis strain OD_317805_11 s_mitis_OD_317805_11_ID_1, whole genome shotgun sequence
trimmed_read1_3001221246-DNA.fastq.gz	gtdb_genomes_reps_r220/database/GCF/023/109/235/GCF_023109235.1_genomic.fna.gz	92.35	0.347	91.22-93.17	0.347	0.25-0.52	1	1.169	201/7968	88.81	NZ_JALDUC010000010.1 Streptococcus mitis strain S53 NODE_10_length_93322_cov_198.967258, whole genome shotgun sequence
trimmed_read1_3001221246-DNA.fastq.gz	gtdb_genomes_reps_r220/database/GCA/905/221/065/GCA_905221065.1_genomic.fna.gz	92.35	0.306	91.28-93.22	0.306	0.21-0.45	1	1.150	187/8205	88.52	CAJNBS010000001.1 unidentified bacterium isolate Streptococcus species genome assembly, contig: NODE_1_length_331008_cov_48.2727, whole genome shotgun sequence
trimmed_read1_3001221246-DNA.fastq.gz	gtdb_genomes_reps_r220/database/GCF/001/074/825/GCF_001074825.1_genomic.fna.gz	92.31	0.287	91.25-93.30	0.287	0.19-0.43	1	1.149	188/8835	88.32	NZ_JUPG01000023.1 Streptococcus pseudopneumoniae strain 888_SPSE 103_811_16199, whole genome shotgun sequence
trimmed_read1_3001221246-DNA.fastq.gz	gtdb_genomes_reps_r220/database/GCF/015/223/095/GCF_015223095.1_genomic.fna.gz	92.30	3.153	NA-NA	HIGH	NA-NA	3	3.153	975/11687	92.30	NZ_JADFBZ010000001.1 Moraxella sp. K127 Contig_001, whole genome shotgun sequence
trimmed_read1_3001221246-DNA.fastq.gz	gtdb_genomes_reps_r220/database/GCF/946/188/685/GCF_946188685.1_genomic.fna.gz	92.29	0.310	91.38-93.09	0.310	0.23-0.46	1	1.168	202/8937	88.49	NZ_CAMHWH010000001.1 Streptococcus mitis isolate Streptococcus mitis NODE_1_length_368939_cov_97.626665, whole genome shotgun sequence
trimmed_read1_3001221246-DNA.fastq.gz	gtdb_genomes_reps_r220/database/GCA/905/221/215/GCA_905221215.1_genomic.fna.gz	92.29	0.323	91.25-93.24	0.323	0.23-0.47	1	1.165	194/8279	88.60	CAJNCI010000001.1 unidentified bacterium isolate Streptococcus species genome assembly, contig: NODE_1_length_434302_cov_36.2817, whole genome shotgun sequence
trimmed_read1_3001221246-DNA.fastq.gz	gtdb_genomes_reps_r220/database/GCA/905/221/545/GCA_905221545.1_genomic.fna.gz	92.27	0.321	91.15-93.21	0.321	0.23-0.45	1	1.151	185/8034	88.55	CAJNDO010000001.1 unidentified bacterium isolate Streptococcus species genome assembly, contig: NODE_1_length_233977_cov_53.6585, whole genome shotgun sequence
trimmed_read1_3001221246-DNA.fastq.gz	gtdb_genomes_reps_r220/database/GCA/905/221/125/GCA_905221125.1_genomic.fna.gz	92.25	0.293	91.17-93.31	0.293	0.20-0.44	1	1.156	179/8383	88.33	CAJNBY010000001.1 unidentified bacterium isolate Streptococcus species genome assembly, contig: NODE_1_length_225877_cov_55.373, whole genome shotgun sequence
trimmed_read1_3001221246-DNA.fastq.gz	gtdb_genomes_reps_r220/database/GCF/013/277/115/GCF_013277115.1_genomic.fna.gz	92.24	0.303	91.09-93.31	0.303	0.20-0.49	1	1.177	181/8331	88.38	NZ_VMMH01000001.1 Streptococcus sp. 714 714_S30_L001_R1_001_(paired)_contig_1, whole genome shotgun sequence
trimmed_read1_3001221246-DNA.fastq.gz	gtdb_genomes_reps_r220/database/GCA/905/221/155/GCA_905221155.1_genomic.fna.gz	92.24	0.327	91.35-93.19	0.327	0.23-0.45	1	1.153	196/8454	88.57	CAJNCB010000001.1 unidentified bacterium isolate Streptococcus species genome assembly, contig: NODE_1_length_917501_cov_53.194, whole genome shotgun sequence
trimmed_read1_3001221246-DNA.fastq.gz	gtdb_genomes_reps_r220/database/GCF/001/808/665/GCF_001808665.1_genomic.fna.gz	92.23	0.301	91.15-93.28	0.301	0.21-0.43	1	1.147	197/9115	88.37	NZ_KV794125.1 Streptococcus sp. HMSC070B10 Scaffold0, whole genome shotgun sequence
trimmed_read1_3001221246-DNA.fastq.gz	gtdb_genomes_reps_r220/database/GCF/905/187/535/GCF_905187535.1_genomic.fna.gz	92.20	0.341	91.11-93.02	0.341	0.25-0.49	1	1.167	204/8616	88.63	NZ_CAJJIE010000001.1 Streptococcus mitis isolate Streptococcus mitis, whole genome shotgun sequence
trimmed_read1_3001221246-DNA.fastq.gz	gtdb_genomes_reps_r220/database/GCA/905/221/105/GCA_905221105.1_genomic.fna.gz	92.20	0.331	91.15-93.12	0.331	0.23-0.49	1	1.156	180/7784	88.56	CAJNBW010000001.1 unidentified bacterium isolate Streptococcus species genome assembly, contig: NODE_1_length_546383_cov_52.4209, whole genome shotgun sequence
trimmed_read1_3001221246-DNA.fastq.gz	gtdb_genomes_reps_r220/database/GCF/001/650/315/GCF_001650315.1_genomic.fna.gz	92.19	0.346	91.19-93.15	0.346	0.24-0.51	1	1.163	196/8172	88.66	NZ_LVJM01000001.1 Streptococcus sp. CCUG 49591 contig_1, whole genome shotgun sequence
trimmed_read1_3001221246-DNA.fastq.gz	gtdb_genomes_reps_r220/database/GCF/946/190/335/GCF_946190335.1_genomic.fna.gz	92.16	0.361	91.23-93.12	0.361	0.26-0.53	1	1.174	201/8196	88.73	NZ_CAMHZN010000001.1 Streptococcus mitis isolate Streptococcus mitis NODE_1_length_678925_cov_140.780463, whole genome shotgun sequence
trimmed_read1_3001221246-DNA.fastq.gz	gtdb_genomes_reps_r220/database/GCF/003/942/965/GCF_003942965.1_genomic.fna.gz	92.16	0.306	91.07-93.09	0.306	0.21-0.47	1	1.151	172/8015	88.34	NZ_RJOG01000001.1 Streptococcus mitis strain BCC07 D8837_contig001, whole genome shotgun sequence
trimmed_read1_3001221246-DNA.fastq.gz	gtdb_genomes_reps_r220/database/GCA/905/221/145/GCA_905221145.1_genomic.fna.gz	92.16	0.327	91.17-93.15	0.327	0.22-0.48	1	1.158	184/8115	88.50	CAJNCA010000001.1 unidentified bacterium isolate Streptococcus species genome assembly, contig: NODE_1_length_542150_cov_74.7743, whole genome shotgun sequence
trimmed_read1_3001221246-DNA.fastq.gz	gtdb_genomes_reps_r220/database/GCF/002/096/815/GCF_002096815.1_genomic.fna.gz	92.16	0.303	91.20-93.11	0.303	0.22-0.43	1	1.139	180/8476	88.32	NZ_NCVJ01000021.1 Streptococcus mitis strain RH_12363_08 s_mitis_RH_12363_08_ID_1, whole genome shotgun sequence
trimmed_read1_3001221246-DNA.fastq.gz	gtdb_genomes_reps_r220/database/GCA/905/221/095/GCA_905221095.1_genomic.fna.gz	92.16	0.341	91.29-92.96	0.341	0.25-0.47	1	1.171	199/8478	88.60	CAJNBV010000001.1 unidentified bacterium isolate Streptococcus species genome assembly, contig: NODE_1_length_337823_cov_51.8384, whole genome shotgun sequence
trimmed_read1_3001221246-DNA.fastq.gz	gtdb_genomes_reps_r220/database/GCF/013/277/555/GCF_013277555.1_genomic.fna.gz	92.15	0.359	91.24-93.11	0.359	0.26-0.51	1	1.167	203/8306	88.72	NZ_VMND01000001.1 Streptococcus sp. k-163 k-163_S2_L001_R1_001_(paired)_contig_1, whole genome shotgun sequence
trimmed_read1_3001221246-DNA.fastq.gz	gtdb_genomes_reps_r220/database/GCF/946/188/695/GCF_946188695.1_genomic.fna.gz	92.12	0.343	91.01-93.00	0.343	0.25-0.51	1	1.156	205/8785	88.58	NZ_CAMHWI010000001.1 Streptococcus mitis isolate Streptococcus mitis NODE_1_length_308064_cov_63.601548, whole genome shotgun sequence
trimmed_read1_3001221246-DNA.fastq.gz	gtdb_genomes_reps_r220/database/GCA/905/221/165/GCA_905221165.1_genomic.fna.gz	92.11	0.338	91.06-93.08	0.338	0.23-0.53	1	1.162	179/7799	88.54	CAJNCC010000001.1 unidentified bacterium isolate Streptococcus species genome assembly, contig: NODE_1_length_337881_cov_61.2048, whole genome shotgun sequence
trimmed_read1_3001221246-DNA.fastq.gz	gtdb_genomes_reps_r220/database/GCF/023/110/375/GCF_023110375.1_genomic.fna.gz	92.10	0.367	91.22-92.87	0.367	0.28-0.52	1	1.193	207/8511	88.70	NZ_JALDVV010000010.1 Streptococcus mitis strain O7-1 NODE_10_length_62925_cov_19.542213, whole genome shotgun sequence
trimmed_read1_3001221246-DNA.fastq.gz	gtdb_genomes_reps_r220/database/GCF/003/944/325/GCF_003944325.1_genomic.fna.gz	92.10	0.303	91.08-93.04	0.303	0.22-0.44	1	1.163	196/9459	88.25	NZ_RJPX01000001.1 Streptococcus mitis strain BCC17 D8787_contig001, whole genome shotgun sequence
trimmed_read1_3001221246-DNA.fastq.gz	gtdb_genomes_reps_r220/database/GCF/000/257/905/GCF_000257905.1_genomic.fna.gz	92.08	0.346	91.07-93.07	0.346	0.24-0.48	1	1.169	195/8469	88.55	NZ_AJJL01000001.1 Streptococcus mitis SK579 contig00033, whole genome shotgun sequence
trimmed_read1_3001221246-DNA.fastq.gz	gtdb_genomes_reps_r220/database/GCF/001/560/895/GCF_001560895.1_genomic.fna.gz	92.07	0.282	90.99-93.24	0.282	0.16-0.43	1	1.158	165/8692	88.00	NZ_CP014326.1 Streptococcus mitis strain SVGS_061 chromosome, complete genome
trimmed_read1_3001221246-DNA.fastq.gz	gtdb_genomes_reps_r220/database/GCF/026/782/865/GCF_026782865.1_genomic.fna.gz	92.07	0.365	91.10-92.95	0.365	0.25-0.51	1	1.170	194/8047	88.68	NZ_JAKUXK010000010.1 Streptococcus mitis strain B15023435 B15023435_S12_contig_10_consensus, whole genome shotgun sequence
trimmed_read1_3001221246-DNA.fastq.gz	gtdb_genomes_reps_r220/database/GCF/009/496/085/GCF_009496085.1_genomic.fna.gz	92.06	0.327	91.08-92.87	0.327	0.25-0.48	1	1.157	198/9024	88.41	NZ_WIJN01000100.1 Streptococcus mitis strain SM13 NODE_100_length_642_cov_0.945631, whole genome shotgun sequence
trimmed_read1_3001221246-DNA.fastq.gz	gtdb_genomes_reps_r220/database/GCF/030/232/885/GCF_030232885.1_genomic.fna.gz	92.05	1.300	91.67-92.35	1.300	1.11-1.53	2	2.129	565/10137	91.11	NZ_JASPGD010000010.1 Corynebacterium sp. MSK297 NODE_10_length_83137_cov_46.783265, whole genome shotgun sequence
trimmed_read1_3001221246-DNA.fastq.gz	gtdb_genomes_reps_r220/database/GCA/905/221/195/GCA_905221195.1_genomic.fna.gz	92.02	0.317	90.93-92.94	0.317	0.21-0.48	1	1.151	172/8196	88.28	CAJNCF010000001.1 unidentified bacterium isolate Streptococcus species genome assembly, contig: NODE_1_length_351178_cov_24.3909, whole genome shotgun sequence
trimmed_read1_3001221246-DNA.fastq.gz	gtdb_genomes_reps_r220/database/GCF/006/385/785/GCF_006385785.1_genomic.fna.gz	92.00	0.369	90.95-92.82	0.369	0.26-0.55	1	1.176	204/8626	88.62	NZ_VFSH01000001.1 Streptococcus shenyangsis strain D19 Scaffold1, whole genome shotgun sequence
trimmed_read1_3001221246-DNA.fastq.gz	gtdb_genomes_reps_r220/database/GCF/027/570/055/GCF_027570055.1_genomic.fna.gz	91.98	0.143	90.13-94.20	0.143	0.06-0.26	1	1.147	109/10831	86.21	NZ_JAKMUR010000001.1 Corynebacterium lehmanniae strain c8Ua_144 8Ua_144_A_contig_1, whole genome shotgun sequence
trimmed_read1_3001221246-DNA.fastq.gz	gtdb_genomes_reps_r220/database/GCF/002/871/495/GCF_002871495.1_genomic.fna.gz	91.95	0.329	91.11-92.77	0.329	0.23-0.47	1	1.172	204/9651	88.30	NZ_PNGD01000001.1 Streptococcus sp. UMB0029 ERR1203613.17957_1_25.1, whole genome shotgun sequence
trimmed_read1_3001221246-DNA.fastq.gz	gtdb_genomes_reps_r220/database/GCF/023/109/105/GCF_023109105.1_genomic.fna.gz	91.95	0.310	90.93-93.17	0.310	0.18-0.45	1	1.160	169/8403	88.16	NZ_JALDTZ010000010.1 Streptococcus mitis strain S61 NODE_10_length_74443_cov_182.654775, whole genome shotgun sequence
trimmed_read1_3001221246-DNA.fastq.gz	gtdb_genomes_reps_r220/database/GCA/905/221/205/GCA_905221205.1_genomic.fna.gz	91.94	0.312	90.84-93.09	0.312	0.19-0.46	1	1.161	168/8340	88.16	CAJNCG010000001.1 unidentified bacterium isolate Streptococcus species genome assembly, contig: NODE_1_length_670333_cov_54.9381, whole genome shotgun sequence
trimmed_read1_3001221246-DNA.fastq.gz	gtdb_genomes_reps_r220/database/GCF/002/238/115/GCF_002238115.1_genomic.fna.gz	91.90	0.312	90.88-92.72	0.312	0.23-0.44	1	1.158	190/9550	88.13	NZ_NGVM01000099.1 Streptococcus sp. KR NODE_100_length_653_cov_34.199, whole genome shotgun sequence
trimmed_read1_3001221246-DNA.fastq.gz	gtdb_genomes_reps_r220/database/GCF/003/942/685/GCF_003942685.1_genomic.fna.gz	91.90	0.313	90.95-92.87	0.313	0.22-0.47	1	1.149	174/8731	88.13	NZ_RJNR01000001.1 Streptococcus mitis strain BCA12 D8855_contig001, whole genome shotgun sequence
trimmed_read1_3001221246-DNA.fastq.gz	gtdb_genomes_reps_r220/database/GCF/002/096/925/GCF_002096925.1_genomic.fna.gz	91.89	0.380	91.02-92.74	0.380	0.28-0.52	1	1.166	199/8477	88.60	NZ_NCVN01000085.1 Streptococcus mitis strain B_009152_10 s_mitis_RS_009152_10_ID_1, whole genome shotgun sequence
trimmed_read1_3001221246-DNA.fastq.gz	gtdb_genomes_reps_r220/database/GCF/009/731/465/GCF_009731465.1_genomic.fna.gz	91.84	0.276	90.54-93.48	0.276	0.15-0.45	1	1.148	142/8228	87.73	NZ_AP021887.1 Streptococcus sp. 116-D4 chromosome, complete genome
trimmed_read1_3001221246-DNA.fastq.gz	gtdb_genomes_reps_r220/database/GCF/946/902/915/GCF_946902915.1_genomic.fna.gz	91.84	0.237	90.65-93.28	0.237	0.14-0.37	1	1.120	133/8827	87.34	NZ_CAMPPY010000001.1 Streptococcus sp. Marseille-Q5986 contig00001, whole genome shotgun sequence
trimmed_read1_3001221246-DNA.fastq.gz	gtdb_genomes_reps_r220/database/GCA/000/385/835/GCA_000385835.1_genomic.fna.gz	91.82	0.308	90.94-92.77	0.308	0.20-0.45	1	1.141	170/8836	88.03	AQTU01000001.1 Streptococcus mitis 13/39 contig00001, whole genome shotgun sequence
trimmed_read1_3001221246-DNA.fastq.gz	gtdb_genomes_reps_r220/database/GCA/000/430/305/GCA_000430305.1_genomic.fna.gz	91.82	0.343	90.74-92.83	0.343	0.23-0.52	1	1.165	170/8074	88.29	ASZZ01000001.1 Streptococcus mitis 17/34 contig00001, whole genome shotgun sequence
trimmed_read1_3001221246-DNA.fastq.gz	gtdb_genomes_reps_r220/database/GCF/009/496/205/GCF_009496205.1_genomic.fna.gz	91.79	0.366	90.74-92.69	0.366	0.27-0.53	1	1.187	187/8560	88.40	NZ_WIJO01000100.1 Streptococcus mitis strain SM11 NODE_100_length_1969_cov_22.233985, whole genome shotgun sequence
trimmed_read1_3001221246-DNA.fastq.gz	gtdb_genomes_reps_r220/database/GCA/016/839/165/GCA_016839165.1_genomic.fna.gz	91.67	0.119	90.46-93.30	0.119	0.06-0.17	1	1.048	252/33139	85.44	CP069300.1 Bradyrhizobium sp. PSBB068 chromosome, complete genome
trimmed_read1_3001221246-DNA.fastq.gz	gtdb_genomes_reps_r220/database/GCA/905/371/745/GCA_905371745.1_genomic.fna.gz	91.62	0.115	88.95-92.61	0.115	0.10-0.28	1	1.055	55/7604	85.30	CAJPMK010000001.1 MAG: uncultured Streptococcus sp. isolate SRR9217389-mag-bin.1 genome assembly, contig: SRR9217389-mag-bin.1_17, whole genome shotgun sequence
trimmed_read1_3001221246-DNA.fastq.gz	gtdb_genomes_reps_r220/database/GCF/021/497/885/GCF_021497885.1_genomic.fna.gz	91.59	0.149	89.97-92.64	0.149	0.09-0.27	1	1.096	73/8030	85.93	NZ_CP046523.1 Streptococcus oralis strain SOD chromosome, complete genome
