Sample_file	Genome_file	Adjusted_ANI	Eff_cov	ANI_5-95_percentile	Eff_lambda	Lambda_5-95_percentile	Median_cov	Mean_cov_geq1	Containment_ind	Naive_ANI	Contig_name
trimmed_read1_3001221246-DNA.fastq.gz	gtdb_genomes_reps_r220/database/GCF/001/632/285/GCF_001632285.1_genomic.fna.gz	99.16	1.162	99.06-99.26	1.162	1.09-1.24	2	2.499	4343/8176	97.98	NZ_LWAH01000001.1 Moraxella catarrhalis strain CCUG 353 contig_1, whole genome shotgun sequence
trimmed_read1_3001221246-DNA.fastq.gz	gtdb_genomes_reps_r220/database/GCF/001/679/005/GCF_001679005.1_genomic.fna.gz	98.37	3.039	NA-NA	HIGH	NA-NA	3	3.039	5914/9834	98.37	NZ_LXTW01000001.1 Moraxella nonliquefaciens strain CCUG 348 contig_1, whole genome shotgun sequence
trimmed_read1_3001221246-DNA.fastq.gz	gtdb_genomes_reps_r220/database/GCF/000/245/815/GCF_000245815.1_genomic.fna.gz	98.22	1.577	98.08-98.30	1.577	1.48-1.71	2	2.318	3555/7821	97.49	NZ_JH601103.1 Dolosigranulum pigrum ATCC 51524 supercont1.1, whole genome shotgun sequence
trimmed_read1_3001221246-DNA.fastq.gz	gtdb_genomes_reps_r220/database/GCF/002/087/075/GCF_002087075.1_genomic.fna.gz	97.50	0.276	96.99-97.91	0.276	0.23-0.32	1	1.151	1010/9171	93.13	NZ_MWSM01000001.1 Streptococcus pseudopneumoniae ATCC BAA-960 = CCUG 49455 CCUG_49455T_0000001, whole genome shotgun sequence
trimmed_read1_3001221246-DNA.fastq.gz	gtdb_genomes_reps_r220/database/GCF/000/688/415/GCF_000688415.1_genomic.fna.gz	96.97	1.235	96.82-97.13	1.235	1.13-1.33	2	1.908	2677/9809	95.90	NZ_JIAH01000001.1 Corynebacterium pseudodiphtheriticum DSM 44287 O146DRAFT_scaffold00010.10_C, whole genome shotgun sequence
trimmed_read1_3001221246-DNA.fastq.gz	gtdb_genomes_reps_r220/database/GCF/003/030/305/GCF_003030305.1_genomic.fna.gz	96.84	0.204	96.18-97.29	0.204	0.17-0.25	1	1.114	720/10561	91.70	NZ_CP023676.1 Cutibacterium acnes strain ATCC 6919 chromosome, complete genome
trimmed_read1_3001221246-DNA.fastq.gz	gtdb_genomes_reps_r220/database/GCF/001/656/295/GCF_001656295.1_genomic.fna.gz	95.23	2.214	95.12-95.44	2.214	1.78-2.36	2	2.839	1819/9300	94.87	NZ_LXHE01000009.1 Moraxella catarrhalis strain Z7574 Z7574_ctg-0, whole genome shotgun sequence
trimmed_read1_3001221246-DNA.fastq.gz	gtdb_genomes_reps_r220/database/GCF/001/457/635/GCF_001457635.1_genomic.fna.gz	94.47	0.278	93.61-95.08	0.278	0.22-0.36	1	1.151	357/8578	90.25	NZ_LN831051.1 Streptococcus pneumoniae strain NCTC7465 chromosome 1, complete sequence
trimmed_read1_3001221246-DNA.fastq.gz	gtdb_genomes_reps_r220/database/GCA/001/914/195/GCA_001914195.1_genomic.fna.gz	94.47	0.154	93.21-96.10	0.154	0.08-0.23	1	1.090	212/8685	88.71	MKYF01000030.1 MAG: Streptococcus mitis isolate 0123W_40_11 0123W_scaffold_1041, whole genome shotgun sequence
trimmed_read1_3001221246-DNA.fastq.gz	gtdb_genomes_reps_r220/database/GCF/000/220/085/GCF_000220085.1_genomic.fna.gz	94.45	0.207	93.28-95.32	0.207	0.15-0.31	1	1.109	258/8111	89.47	NZ_AFQV01000034.1 Streptococcus mitis SK1080 ctg1129645366110, whole genome shotgun sequence
trimmed_read1_3001221246-DNA.fastq.gz	gtdb_genomes_reps_r220/database/GCF/946/901/205/GCF_946901205.1_genomic.fna.gz	94.35	0.231	93.22-95.05	0.231	0.17-0.34	1	1.129	303/8911	89.67	NZ_CAMPPO010000001.1 Streptococcus sp. Marseille-Q5619 contig00001, whole genome shotgun sequence
trimmed_read1_3001221246-DNA.fastq.gz	gtdb_genomes_reps_r220/database/GCF/903/645/285/GCF_903645285.1_genomic.fna.gz	94.33	0.242	93.48-95.06	0.242	0.18-0.33	1	1.130	299/8493	89.77	NZ_CAHJXN010000001.1 Streptococcus sp. Marseille-Q2617, whole genome shotgun sequence
trimmed_read1_3001221246-DNA.fastq.gz	gtdb_genomes_reps_r220/database/GCA/916/050/595/GCA_916050595.1_genomic.fna.gz	94.31	0.193	92.98-96.19	0.193	0.10-0.31	1	1.088	159/5573	89.16	CAJZLM010000001.1 MAG TPA_asm: Streptococcus mitis isolate ERR2765141_bin.1_metaWRAP_v1.1_MAG genome assembly, contig: ERZ1674214.1, whole genome shotgun sequence
trimmed_read1_3001221246-DNA.fastq.gz	gtdb_genomes_reps_r220/database/GCF/003/627/155/GCF_003627155.1_genomic.fna.gz	94.18	0.146	92.76-95.69	0.146	0.08-0.24	1	1.090	178/8376	88.32	NZ_CP032621.1 Streptococcus gwangjuense strain KCOM 1679 (=ChDC B345) chromosome, complete genome
trimmed_read1_3001221246-DNA.fastq.gz	gtdb_genomes_reps_r220/database/GCF/002/005/545/GCF_002005545.1_genomic.fna.gz	94.14	0.174	92.92-95.52	0.174	0.11-0.28	1	1.107	215/8727	88.74	NZ_LBMT01000001.1 Streptococcus mitis strain 321A Scaffold1, whole genome shotgun sequence
trimmed_read1_3001221246-DNA.fastq.gz	gtdb_genomes_reps_r220/database/GCA/001/347/015/GCA_001347015.1_genomic.fna.gz	94.12	0.274	93.27-94.82	0.274	0.20-0.37	1	1.155	341/9220	89.91	CFGI01000001.1 Streptococcus pneumoniae genome assembly 6938_6#7, scaffold ERS022181SCcontig000001, whole genome shotgun sequence
trimmed_read1_3001221246-DNA.fastq.gz	gtdb_genomes_reps_r220/database/GCA/001/070/715/GCA_001070715.1_genomic.fna.gz	93.95	0.242	92.85-94.72	0.242	0.17-0.35	1	1.149	288/9137	89.45	JVRR01000136.1 Streptococcus pseudopneumoniae strain 163_SPSE 1000_987_21661_898_,304+,902_, whole genome shotgun sequence
trimmed_read1_3001221246-DNA.fastq.gz	gtdb_genomes_reps_r220/database/GCF/003/697/165/GCF_003697165.2_genomic.fna.gz	93.94	0.045	91.37-94.10	0.045	0.04-0.10	1	1.044	136/21223	84.97	NZ_CP033092.2 Escherichia coli DSM 30083 = JCM 1649 = ATCC 11775 chromosome, complete genome
trimmed_read1_3001221246-DNA.fastq.gz	gtdb_genomes_reps_r220/database/GCF/900/411/395/GCF_900411395.1_genomic.fna.gz	93.94	0.279	93.05-94.70	0.279	0.21-0.37	1	1.147	334/9460	89.78	NZ_OXCQ01000050.1 Streptococcus sp. 596553, whole genome shotgun sequence
trimmed_read1_3001221246-DNA.fastq.gz	gtdb_genomes_reps_r220/database/GCF/030/439/915/GCF_030439915.1_genomic.fna.gz	93.91	0.264	92.95-94.75	0.264	0.19-0.37	1	1.156	282/8418	89.62	NZ_JAQFJG010000010.1 Streptococcus sp. SPS1 NODE_10_length_71805_cov_189.924538, whole genome shotgun sequence
trimmed_read1_3001221246-DNA.fastq.gz	gtdb_genomes_reps_r220/database/GCF/013/277/205/GCF_013277205.1_genomic.fna.gz	93.85	0.283	92.92-94.52	0.283	0.21-0.38	1	1.146	329/9465	89.73	NZ_VMMO01000001.1 Streptococcus sp. 202 202_S24_L001_R1_001_(paired)_contig_1, whole genome shotgun sequence
trimmed_read1_3001221246-DNA.fastq.gz	gtdb_genomes_reps_r220/database/GCF/013/277/415/GCF_013277415.1_genomic.fna.gz	93.80	0.298	92.96-94.61	0.298	0.22-0.40	1	1.157	325/9052	89.82	NZ_VMMX01000001.1 Streptococcus sp. 68 68_S3_L001_R1_001_(paired)_contig_1, whole genome shotgun sequence
trimmed_read1_3001221246-DNA.fastq.gz	gtdb_genomes_reps_r220/database/GCF/000/722/775/GCF_000722775.1_genomic.fna.gz	93.77	0.190	92.69-95.56	0.190	0.10-0.28	1	1.105	209/8856	88.62	NZ_JPFZ01000001.1 Streptococcus mitis strain SK608 gsmSK608.contig.0_1, whole genome shotgun sequence
trimmed_read1_3001221246-DNA.fastq.gz	gtdb_genomes_reps_r220/database/GCF/013/277/475/GCF_013277475.1_genomic.fna.gz	93.75	0.318	92.86-94.41	0.318	0.25-0.42	1	1.161	342/9183	89.93	NZ_VMMZ01000001.1 Streptococcus sp. k-628 k-628_S22_L001_R1_001_(paired)_contig_1, whole genome shotgun sequence
trimmed_read1_3001221246-DNA.fastq.gz	gtdb_genomes_reps_r220/database/GCA/001/113/365/GCA_001113365.1_genomic.fna.gz	93.73	0.310	92.94-94.28	0.310	0.22-0.41	1	1.143	356/9843	89.85	CKYA01000001.1 Streptococcus pneumoniae genome assembly 6823_7#22, scaffold ERS021524SCcontig000001, whole genome shotgun sequence
trimmed_read1_3001221246-DNA.fastq.gz	gtdb_genomes_reps_r220/database/GCA/001/171/885/GCA_001171885.1_genomic.fna.gz	93.67	0.324	92.92-94.40	0.324	0.24-0.43	1	1.160	331/8974	89.90	CKQD01000001.1 Streptococcus pneumoniae genome assembly 6680_6#10, scaffold ERS020456SCcontig000001, whole genome shotgun sequence
trimmed_read1_3001221246-DNA.fastq.gz	gtdb_genomes_reps_r220/database/GCF/013/276/795/GCF_013276795.1_genomic.fna.gz	93.61	0.305	92.64-94.30	0.305	0.23-0.42	1	1.150	294/8538	89.70	NZ_VMLR01000001.1 Streptococcus sp. 2342 2342_S22_L001_R1_001_(paired)_contig_1, whole genome shotgun sequence
trimmed_read1_3001221246-DNA.fastq.gz	gtdb_genomes_reps_r220/database/GCA/947/253/175/GCA_947253175.1_genomic.fna.gz	93.60	0.261	92.56-94.82	0.261	0.16-0.37	1	1.145	166/5429	89.36	CAMXYG010000001.1 MAG TPA_asm: uncultured Streptococcus sp. isolate SRR17635508_bin.2_metaWRAP_v1.3_MAG genome assembly, contig: ERZ14212505.19, whole genome shotgun sequence
trimmed_read1_3001221246-DNA.fastq.gz	gtdb_genomes_reps_r220/database/GCF/019/448/275/GCF_019448275.1_genomic.fna.gz	93.59	0.240	92.57-94.47	0.240	0.18-0.36	1	1.134	239/8602	89.08	NZ_JAHXBZ010000001.1 Streptococcus humanilactis strain IMAU99125 IMAU99125, whole genome shotgun sequence
trimmed_read1_3001221246-DNA.fastq.gz	gtdb_genomes_reps_r220/database/GCA/001/096/185/GCA_001096185.1_genomic.fna.gz	93.58	0.325	92.69-94.41	0.325	0.23-0.43	1	1.155	322/8989	89.82	CRPU01000001.1 Streptococcus pneumoniae genome assembly 6775_1#8, scaffold ERS020334SCcontig000001, whole genome shotgun sequence
trimmed_read1_3001221246-DNA.fastq.gz	gtdb_genomes_reps_r220/database/GCF/000/220/045/GCF_000220045.1_genomic.fna.gz	93.57	0.193	92.50-94.83	0.193	0.12-0.28	1	1.098	194/8681	88.46	NZ_AFQT01000054.1 Streptococcus mitis SK1073 ctg1129645355399, whole genome shotgun sequence
trimmed_read1_3001221246-DNA.fastq.gz	gtdb_genomes_reps_r220/database/GCF/001/810/785/GCF_001810785.1_genomic.fna.gz	93.55	0.233	92.37-94.92	0.233	0.15-0.36	1	1.134	217/8148	88.96	NZ_KV802678.1 Streptococcus sp. HMSC073F11 Scaffold1, whole genome shotgun sequence
trimmed_read1_3001221246-DNA.fastq.gz	gtdb_genomes_reps_r220/database/GCF/013/277/515/GCF_013277515.1_genomic.fna.gz	93.54	0.310	92.65-94.21	0.310	0.22-0.40	1	1.160	306/8972	89.68	NZ_VMNB01000001.1 Streptococcus sp. k-402 k-402_R1_(paired)_contig_1, whole genome shotgun sequence
trimmed_read1_3001221246-DNA.fastq.gz	gtdb_genomes_reps_r220/database/GCF/013/277/455/GCF_013277455.1_genomic.fna.gz	93.51	0.283	92.41-94.32	0.283	0.21-0.38	1	1.161	274/8788	89.42	NZ_VMMY01000001.1 Streptococcus sp. 5346 5346-99_S28_L001_R1_001_(paired)_contig_1, whole genome shotgun sequence
trimmed_read1_3001221246-DNA.fastq.gz	gtdb_genomes_reps_r220/database/GCA/927/911/355/GCA_927911355.1_genomic.fna.gz	93.51	0.228	92.27-95.02	0.228	0.13-0.35	1	1.113	177/6958	88.83	CAKMPG010000001.1 MAG TPA_asm: Streptococcus mitis isolate ERR3827238_bin.2_metaWRAP_v1.1_MAG genome assembly, contig: ERZ4768210.2, whole genome shotgun sequence
trimmed_read1_3001221246-DNA.fastq.gz	gtdb_genomes_reps_r220/database/GCF/000/722/705/GCF_000722705.1_genomic.fna.gz	93.46	0.170	92.23-95.08	0.170	0.09-0.26	1	1.078	166/8646	88.03	NZ_JPFW01000001.1 Streptococcus mitis strain SK642 gsmSK642.contig.0_1, whole genome shotgun sequence
trimmed_read1_3001221246-DNA.fastq.gz	gtdb_genomes_reps_r220/database/GCF/013/276/955/GCF_013276955.1_genomic.fna.gz	93.43	0.301	92.43-94.04	0.301	0.23-0.41	1	1.164	292/9123	89.49	NZ_VMLZ01000001.1 Streptococcus sp. 1453 1453_S31_L001_R1_001_(paired)_contig_1, whole genome shotgun sequence
trimmed_read1_3001221246-DNA.fastq.gz	gtdb_genomes_reps_r220/database/GCF/001/579/045/GCF_001579045.1_genomic.fna.gz	93.39	0.273	92.31-94.12	0.273	0.20-0.38	1	1.135	266/9109	89.23	NZ_KQ970261.1 Streptococcus mitis strain DD28 scaffold00001, whole genome shotgun sequence
trimmed_read1_3001221246-DNA.fastq.gz	gtdb_genomes_reps_r220/database/GCF/000/148/525/GCF_000148525.1_genomic.fna.gz	93.37	0.238	92.28-94.42	0.238	0.17-0.36	1	1.115	217/8584	88.81	NZ_AEDU01000035.1 Streptococcus mitis SK564 contigB3, whole genome shotgun sequence
trimmed_read1_3001221246-DNA.fastq.gz	gtdb_genomes_reps_r220/database/GCF/001/070/815/GCF_001070815.1_genomic.fna.gz	93.34	0.255	92.34-94.38	0.255	0.17-0.35	1	1.131	214/8046	88.96	NZ_JVLX01000006.1 Streptococcus pseudopneumoniae strain 315_SPSE, whole genome shotgun sequence
trimmed_read1_3001221246-DNA.fastq.gz	gtdb_genomes_reps_r220/database/GCF/000/722/765/GCF_000722765.2_genomic.fna.gz	93.32	0.230	92.17-94.67	0.230	0.14-0.34	1	1.122	196/8136	88.68	NZ_CP028415.1 Streptococcus mitis strain SK637 chromosome, complete genome
trimmed_read1_3001221246-DNA.fastq.gz	gtdb_genomes_reps_r220/database/GCA/905/221/115/GCA_905221115.1_genomic.fna.gz	93.30	0.273	92.37-94.30	0.273	0.19-0.38	1	1.139	238/8441	89.13	CAJNBX010000001.1 unidentified bacterium isolate Streptococcus species genome assembly, contig: NODE_1_length_385792_cov_41.2882, whole genome shotgun sequence
trimmed_read1_3001221246-DNA.fastq.gz	gtdb_genomes_reps_r220/database/GCA/905/369/855/GCA_905369855.1_genomic.fna.gz	93.29	0.274	92.19-94.54	0.274	0.17-0.40	1	1.120	191/6873	89.08	CAJPJN010000001.1 MAG: Streptococcus oralis isolate DRR046084-mag-bin.1 genome assembly, contig: DRR046084-mag-bin.1_2, whole genome shotgun sequence
trimmed_read1_3001221246-DNA.fastq.gz	gtdb_genomes_reps_r220/database/GCF/946/190/045/GCF_946190045.1_genomic.fna.gz	93.28	0.229	92.15-94.35	0.229	0.16-0.35	1	1.129	202/8370	88.68	NZ_CAMHYY010000001.1 Streptococcus mitis isolate Streptococcus mitis NODE_1_length_333422_cov_157.319918, whole genome shotgun sequence
trimmed_read1_3001221246-DNA.fastq.gz	gtdb_genomes_reps_r220/database/GCF/946/190/115/GCF_946190115.1_genomic.fna.gz	93.26	0.246	92.17-94.37	0.246	0.17-0.36	1	1.125	216/8454	88.84	NZ_CAMHZG010000001.1 Streptococcus mitis isolate Streptococcus mitis NODE_1_length_220291_cov_95.818490, whole genome shotgun sequence
trimmed_read1_3001221246-DNA.fastq.gz	gtdb_genomes_reps_r220/database/GCF/000/148/545/GCF_000148545.1_genomic.fna.gz	93.26	0.291	92.23-94.03	0.291	0.22-0.42	1	1.158	259/8822	89.24	NZ_AEDV01000108.1 Streptococcus mitis SK597 contigB5, whole genome shotgun sequence
trimmed_read1_3001221246-DNA.fastq.gz	gtdb_genomes_reps_r220/database/GCF/001/579/035/GCF_001579035.1_genomic.fna.gz	93.21	0.317	92.39-93.88	0.317	0.24-0.42	1	1.190	273/8717	89.43	NZ_KQ970285.1 Streptococcus mitis strain DD26 scaffold00001, whole genome shotgun sequence
trimmed_read1_3001221246-DNA.fastq.gz	gtdb_genomes_reps_r220/database/GCA/943/914/425/GCA_943914425.1_genomic.fna.gz	93.19	0.208	92.06-94.78	0.208	0.13-0.32	1	1.094	159/7525	88.30	CALUBZ010000001.1 MAG: uncultured Streptococcus sp. isolate aroCPJTBUv_bin.11.MAG genome assembly, contig: NODE_96_length_79274_cov_20.784913, whole genome shotgun sequence
trimmed_read1_3001221246-DNA.fastq.gz	gtdb_genomes_reps_r220/database/GCF/022/137/125/GCF_022137125.1_genomic.fna.gz	93.19	0.278	92.14-94.20	0.278	0.19-0.41	1	1.142	226/8173	89.07	NZ_JAKNEQ010000001.1 Streptococcus mitis strain DFI.2.96 NNOOAJHE_1, whole genome shotgun sequence
trimmed_read1_3001221246-DNA.fastq.gz	gtdb_genomes_reps_r220/database/GCF/946/190/375/GCF_946190375.1_genomic.fna.gz	93.19	0.229	92.23-94.30	0.229	0.16-0.34	1	1.122	222/9452	88.60	NZ_CAMIAF010000001.1 Streptococcus mitis isolate Streptococcus mitis NODE_1_length_232215_cov_64.623009, whole genome shotgun sequence
trimmed_read1_3001221246-DNA.fastq.gz	gtdb_genomes_reps_r220/database/GCF/019/414/905/GCF_019414905.1_genomic.fna.gz	93.17	0.267	92.10-94.23	0.267	0.19-0.43	1	1.122	189/7206	88.92	NZ_DXLC01000001.1 MAG: Streptococcus sp. isolate HRGM_Genome_0314 HRGM_Genome_0314_1, whole genome shotgun sequence
trimmed_read1_3001221246-DNA.fastq.gz	gtdb_genomes_reps_r220/database/GCF/030/217/725/GCF_030217725.1_genomic.fna.gz	93.14	0.260	92.06-94.20	0.260	0.17-0.39	1	1.122	205/7951	88.87	NZ_JASOOK010000010.1 Streptococcus sp. UMB1203 NODE_10_length_57271_cov_7.437389, whole genome shotgun sequence
trimmed_read1_3001221246-DNA.fastq.gz	gtdb_genomes_reps_r220/database/GCA/905/221/455/GCA_905221455.1_genomic.fna.gz	93.14	0.225	91.77-94.37	0.225	0.14-0.35	1	1.119	194/8554	88.50	CAJNDF010000001.1 unidentified bacterium isolate Streptococcus species genome assembly, contig: NODE_1_length_328888_cov_49.2012, whole genome shotgun sequence
trimmed_read1_3001221246-DNA.fastq.gz	gtdb_genomes_reps_r220/database/GCF/020/089/495/GCF_020089495.2_genomic.fna.gz	93.13	0.269	92.21-94.05	0.269	0.18-0.38	1	1.120	225/8470	88.96	NZ_JAIRCA020000001.1 Streptococcus sp. IMAU 99199 IMAU99199, whole genome shotgun sequence
trimmed_read1_3001221246-DNA.fastq.gz	gtdb_genomes_reps_r220/database/GCA/905/221/085/GCA_905221085.1_genomic.fna.gz	93.12	0.254	91.97-94.26	0.254	0.17-0.36	1	1.144	201/8047	88.78	CAJNBT010000001.1 unidentified bacterium isolate Streptococcus species genome assembly, contig: NODE_1_length_604251_cov_44.5148, whole genome shotgun sequence
trimmed_read1_3001221246-DNA.fastq.gz	gtdb_genomes_reps_r220/database/GCF/013/276/625/GCF_013276625.1_genomic.fna.gz	93.11	0.364	92.16-93.86	0.364	0.26-0.51	1	1.168	310/9194	89.64	NZ_VMLI01000001.1 Streptococcus sp. 9903 9903_S27_L001_R1_001_(paired)_contig_1, whole genome shotgun sequence
trimmed_read1_3001221246-DNA.fastq.gz	gtdb_genomes_reps_r220/database/GCF/000/187/745/GCF_000187745.1_genomic.fna.gz	93.09	0.228	92.15-94.44	0.228	0.13-0.32	1	1.113	212/9331	88.51	NZ_GL732486.1 Streptococcus sp. M334 supercont1.1, whole genome shotgun sequence
trimmed_read1_3001221246-DNA.fastq.gz	gtdb_genomes_reps_r220/database/GCF/001/642/025/GCF_001642025.1_genomic.fna.gz	93.09	0.168	91.72-94.40	0.168	0.11-0.26	1	1.105	172/10208	87.66	NZ_LWHO01000002.1 Cutibacterium namnetense strain NTS 31307302 contig_1, whole genome shotgun sequence
trimmed_read1_3001221246-DNA.fastq.gz	gtdb_genomes_reps_r220/database/GCA/927/910/965/GCA_927910965.1_genomic.fna.gz	93.08	0.242	92.05-94.10	0.242	0.17-0.35	1	1.133	211/8896	88.63	CAKMOM010000001.1 MAG TPA_asm: uncultured Streptococcus sp. isolate ERR3827222_bin.1_metaWRAP_v1.1_MAG genome assembly, contig: ERZ4768407.87, whole genome shotgun sequence
trimmed_read1_3001221246-DNA.fastq.gz	gtdb_genomes_reps_r220/database/GCF/001/074/975/GCF_001074975.1_genomic.fna.gz	93.07	0.254	92.05-94.13	0.254	0.18-0.37	1	1.142	219/8932	88.73	NZ_JUUO01000013.1 Streptococcus pseudopneumoniae strain 75_SPSE, whole genome shotgun sequence
trimmed_read1_3001221246-DNA.fastq.gz	gtdb_genomes_reps_r220/database/GCF/001/076/775/GCF_001076775.1_genomic.fna.gz	93.07	0.225	91.95-94.26	0.225	0.13-0.35	1	1.131	191/8803	88.38	NZ_JVGV01000002.1 Streptococcus pseudopneumoniae strain 445_SPSE 160_1845_293894, whole genome shotgun sequence
trimmed_read1_3001221246-DNA.fastq.gz	gtdb_genomes_reps_r220/database/GCF/003/942/775/GCF_003942775.1_genomic.fna.gz	93.06	0.267	92.11-93.96	0.267	0.20-0.37	1	1.142	225/8873	88.82	NZ_RJNX01000001.1 Streptococcus mitis strain BCC65 D8848_contig001, whole genome shotgun sequence
trimmed_read1_3001221246-DNA.fastq.gz	gtdb_genomes_reps_r220/database/GCF/002/860/865/GCF_002860865.1_genomic.fna.gz	93.05	0.273	92.03-93.95	0.273	0.20-0.39	1	1.142	232/8904	88.90	NZ_PKIE01000001.1 Streptococcus mitis strain UMB1341 .21837_8_64.1, whole genome shotgun sequence
trimmed_read1_3001221246-DNA.fastq.gz	gtdb_genomes_reps_r220/database/GCF/002/096/755/GCF_002096755.1_genomic.fna.gz	93.05	0.237	92.05-94.08	0.237	0.16-0.37	1	1.113	203/8803	88.55	NZ_NCVF01000026.1 Streptococcus mitis strain RH_50275_09 s_mitis_RH_50275_09_ID_1, whole genome shotgun sequence
trimmed_read1_3001221246-DNA.fastq.gz	gtdb_genomes_reps_r220/database/GCA/905/221/285/GCA_905221285.1_genomic.fna.gz	93.04	0.262	91.94-93.97	0.262	0.18-0.38	1	1.131	213/8485	88.79	CAJNCM010000001.1 unidentified bacterium isolate Streptococcus species genome assembly, contig: NODE_1_length_380604_cov_54.0563, whole genome shotgun sequence
trimmed_read1_3001221246-DNA.fastq.gz	gtdb_genomes_reps_r220/database/GCA/905/221/185/GCA_905221185.1_genomic.fna.gz	93.04	0.277	91.91-94.04	0.277	0.19-0.40	1	1.150	220/8418	88.91	CAJNCE010000001.1 unidentified bacterium isolate Streptococcus species genome assembly, contig: NODE_1_length_320457_cov_53.7269, whole genome shotgun sequence
trimmed_read1_3001221246-DNA.fastq.gz	gtdb_genomes_reps_r220/database/GCF/000/722/685/GCF_000722685.1_genomic.fna.gz	92.97	0.249	91.77-93.98	0.249	0.17-0.38	1	1.139	202/8785	88.54	NZ_JPFV01000001.1 Streptococcus mitis strain SK667 gsmSK667.contig.0_1, whole genome shotgun sequence
trimmed_read1_3001221246-DNA.fastq.gz	gtdb_genomes_reps_r220/database/GCF/946/190/325/GCF_946190325.1_genomic.fna.gz	92.97	0.263	91.83-94.11	0.263	0.18-0.38	1	1.127	205/8293	88.75	NZ_CAMHZR010000001.1 Streptococcus mitis isolate Streptococcus mitis NODE_1_length_621990_cov_122.773401, whole genome shotgun sequence
trimmed_read1_3001221246-DNA.fastq.gz	gtdb_genomes_reps_r220/database/GCF/905/187/495/GCF_905187495.1_genomic.fna.gz	92.95	0.271	91.87-93.96	0.271	0.20-0.39	1	1.150	207/8287	88.78	NZ_CAJJIB010000001.1 Streptococcus mitis isolate Streptococcus mitis, whole genome shotgun sequence
trimmed_read1_3001221246-DNA.fastq.gz	gtdb_genomes_reps_r220/database/GCF/000/257/865/GCF_000257865.1_genomic.fna.gz	92.94	0.297	91.94-93.72	0.297	0.22-0.43	1	1.148	237/8814	88.99	NZ_AICU01000001.1 Streptococcus mitis SK575 contig00033, whole genome shotgun sequence
trimmed_read1_3001221246-DNA.fastq.gz	gtdb_genomes_reps_r220/database/GCF/026/782/895/GCF_026782895.1_genomic.fna.gz	92.94	0.265	91.75-93.97	0.265	0.19-0.41	1	1.138	210/8605	88.71	NZ_JAKUXJ010000010.1 Streptococcus mitis strain D13054009 D13054009_S15_contig_10_consensus, whole genome shotgun sequence
trimmed_read1_3001221246-DNA.fastq.gz	gtdb_genomes_reps_r220/database/GCF/901/542/415/GCF_901542415.1_genomic.fna.gz	92.92	0.251	92.00-94.37	0.251	0.16-0.38	1	1.131	199/8708	88.52	NZ_CABEHV010000001.1 Streptococcus mitis strain NCTC11189, whole genome shotgun sequence
trimmed_read1_3001221246-DNA.fastq.gz	gtdb_genomes_reps_r220/database/GCF/001/281/025/GCF_001281025.1_genomic.fna.gz	92.89	0.240	91.56-94.24	0.240	0.14-0.38	1	1.140	171/7893	88.37	NZ_CP012646.1 Streptococcus mitis strain KCOM 1350 (= ChDC B183) chromosome, complete genome
trimmed_read1_3001221246-DNA.fastq.gz	gtdb_genomes_reps_r220/database/GCF/946/190/275/GCF_946190275.1_genomic.fna.gz	92.89	0.276	91.86-93.87	0.276	0.19-0.39	1	1.140	228/9210	88.75	NZ_CAMHZQ010000001.1 Streptococcus mitis isolate Streptococcus mitis NODE_1_length_295642_cov_144.812041, whole genome shotgun sequence
trimmed_read1_3001221246-DNA.fastq.gz	gtdb_genomes_reps_r220/database/GCF/024/346/585/GCF_024346585.1_genomic.fna.gz	92.88	0.297	91.85-93.79	0.297	0.21-0.42	1	1.146	226/8660	88.90	NZ_AP024523.1 Streptococcus toyakuensis strain TP1632 chromosome, complete genome
trimmed_read1_3001221246-DNA.fastq.gz	gtdb_genomes_reps_r220/database/GCF/023/109/515/GCF_023109515.1_genomic.fna.gz	92.87	0.261	91.86-94.10	0.261	0.17-0.36	1	1.132	205/8654	88.63	NZ_JALDUM010000010.1 Streptococcus mitis strain S39 NODE_10_length_3920_cov_103.945149, whole genome shotgun sequence
trimmed_read1_3001221246-DNA.fastq.gz	gtdb_genomes_reps_r220/database/GCF/946/188/615/GCF_946188615.1_genomic.fna.gz	92.86	0.281	91.76-93.78	0.281	0.21-0.43	1	1.130	216/8605	88.79	NZ_CAMHVK010000001.1 Streptococcus mitis isolate Streptococcus mitis NODE_1_length_383254_cov_94.802522, whole genome shotgun sequence
trimmed_read1_3001221246-DNA.fastq.gz	gtdb_genomes_reps_r220/database/GCF/002/860/905/GCF_002860905.1_genomic.fna.gz	92.85	0.296	91.83-93.67	0.296	0.22-0.42	1	1.164	232/8928	88.89	NZ_PKIG01000001.1 Streptococcus oralis subsp. dentisani strain UMB0832 .16933_8_21.1, whole genome shotgun sequence
trimmed_read1_3001221246-DNA.fastq.gz	gtdb_genomes_reps_r220/database/GCF/001/072/315/GCF_001072315.1_genomic.fna.gz	92.84	0.330	91.96-93.66	0.330	0.24-0.45	1	1.151	265/9310	89.15	NZ_JVLI01000001.1 Streptococcus pseudopneumoniae strain 330_SPSE 0_919_132734, whole genome shotgun sequence
trimmed_read1_3001221246-DNA.fastq.gz	gtdb_genomes_reps_r220/database/GCF/915/066/115/GCF_915066115.1_genomic.fna.gz	92.84	0.273	91.73-93.78	0.273	0.18-0.41	1	1.144	187/7792	88.66	NZ_CAJZDT010000001.1 MAG: uncultured Streptococcus sp. isolate SRR1045100_bin.1_metaWRAP_v1.1_MAG, whole genome shotgun sequence
trimmed_read1_3001221246-DNA.fastq.gz	gtdb_genomes_reps_r220/database/GCA/905/221/505/GCA_905221505.1_genomic.fna.gz	92.82	0.274	91.80-94.03	0.274	0.19-0.40	1	1.137	205/8433	88.70	CAJNDL010000001.1 unidentified bacterium isolate Streptococcus species genome assembly, contig: NODE_1_length_223941_cov_38.0438, whole genome shotgun sequence
trimmed_read1_3001221246-DNA.fastq.gz	gtdb_genomes_reps_r220/database/GCF/946/190/065/GCF_946190065.1_genomic.fna.gz	92.81	0.261	91.55-93.89	0.261	0.18-0.39	1	1.142	211/8981	88.60	NZ_CAMHZD010000001.1 Streptococcus mitis isolate Streptococcus mitis NODE_1_length_218173_cov_162.355963, whole genome shotgun sequence
trimmed_read1_3001221246-DNA.fastq.gz	gtdb_genomes_reps_r220/database/GCF/002/096/735/GCF_002096735.1_genomic.fna.gz	92.79	0.292	91.76-93.80	0.292	0.19-0.42	1	1.143	210/8264	88.83	NZ_NCVC01000017.1 Streptococcus mitis strain RH_8961_10 s_mitis_RH_8961_10_ID_1, whole genome shotgun sequence
trimmed_read1_3001221246-DNA.fastq.gz	gtdb_genomes_reps_r220/database/GCF/009/496/165/GCF_009496165.1_genomic.fna.gz	92.79	0.307	91.84-93.77	0.307	0.21-0.44	1	1.156	225/8510	88.94	NZ_WIJQ01000010.1 Streptococcus mitis strain SM08 NODE_10_length_53743_cov_22.439328, whole genome shotgun sequence
trimmed_read1_3001221246-DNA.fastq.gz	gtdb_genomes_reps_r220/database/GCF/002/096/835/GCF_002096835.1_genomic.fna.gz	92.76	0.282	91.63-93.93	0.282	0.18-0.43	1	1.156	192/7905	88.70	NZ_NCVG01000023.1 Streptococcus mitis strain RH_43861_09 s_mitis_RH_43861_09_ID_1, whole genome shotgun sequence
trimmed_read1_3001221246-DNA.fastq.gz	gtdb_genomes_reps_r220/database/GCF/001/074/635/GCF_001074635.1_genomic.fna.gz	92.74	0.305	91.81-93.58	0.305	0.23-0.43	1	1.138	232/8979	88.88	NZ_JUQO01000001.1 Streptococcus mitis strain 850_SMIT 0_226_2877, whole genome shotgun sequence
trimmed_read1_3001221246-DNA.fastq.gz	gtdb_genomes_reps_r220/database/GCF/000/960/005/GCF_000960005.1_genomic.fna.gz	92.74	0.261	91.61-93.85	0.261	0.17-0.40	1	1.115	182/8198	88.44	NZ_JYGP01000001.1 Streptococcus mitis strain OT25 TZ90_contig000001, whole genome shotgun sequence
trimmed_read1_3001221246-DNA.fastq.gz	gtdb_genomes_reps_r220/database/GCF/000/722/695/GCF_000722695.1_genomic.fna.gz	92.71	0.240	91.61-94.04	0.240	0.14-0.36	1	1.117	188/9219	88.20	NZ_JPFU01000001.1 Streptococcus mitis strain SK629 gsmSK629.contig.0_1, whole genome shotgun sequence
