Sample_file	Genome_file	Taxonomic_abundance	Sequence_abundance	Adjusted_ANI	Eff_cov	ANI_5-95_percentile	Eff_lambda	Lambda_5-95_percentile	Median_cov	Mean_cov_geq1	Containment_ind	Naive_ANI	kmers_reassigned	Contig_name
trimmed_read1_3001221254-DNA.fastq.gz	gtdb_genomes_reps_r220/database/GCF/002/014/765/GCF_002014765.1_genomic.fna.gz	52.8773	52.9899	98.62	43.000	NA-NA	HIGH	NA-NA	43	43.446	5806/8926	98.62	198	NZ_MUYT01000001.1 Moraxella lincolnii strain CCUG 9405 CCUG9405T_R1__paired__trimmed__paired__contig_1, whole genome shotgun sequence
trimmed_read1_3001221254-DNA.fastq.gz	gtdb_genomes_reps_r220/database/GCF/001/632/285/GCF_001632285.1_genomic.fna.gz	22.1347	20.1322	97.93	18.000	NA-NA	HIGH	NA-NA	18	16.043	4278/8176	97.93	439	NZ_LWAH01000001.1 Moraxella catarrhalis strain CCUG 353 contig_1, whole genome shotgun sequence
trimmed_read1_3001221254-DNA.fastq.gz	gtdb_genomes_reps_r220/database/GCF/001/679/005/GCF_001679005.1_genomic.fna.gz	18.4456	20.2912	98.75	15.000	NA-NA	HIGH	NA-NA	15	15.155	6669/9834	98.75	2	NZ_LXTW01000001.1 Moraxella nonliquefaciens strain CCUG 348 contig_1, whole genome shotgun sequence
trimmed_read1_3001221254-DNA.fastq.gz	gtdb_genomes_reps_r220/database/GCF/000/688/415/GCF_000688415.1_genomic.fna.gz	3.6053	3.9332	96.63	2.932	NA-NA	HIGH	NA-NA	3	2.932	3388/9809	96.63	2	NZ_JIAH01000001.1 Corynebacterium pseudodiphtheriticum DSM 44287 O146DRAFT_scaffold00010.10_C, whole genome shotgun sequence
trimmed_read1_3001221254-DNA.fastq.gz	gtdb_genomes_reps_r220/database/GCF/000/245/815/GCF_000245815.1_genomic.fna.gz	2.8402	2.5519	98.11	2.310	98.03-98.23	2.310	2.00-2.47	2	2.784	3903/7821	97.78	0	NZ_JH601103.1 Dolosigranulum pigrum ATCC 51524 supercont1.1, whole genome shotgun sequence
trimmed_read1_3001221254-DNA.fastq.gz	gtdb_genomes_reps_r220/database/GCF/002/087/075/GCF_002087075.1_genomic.fna.gz	0.0969	0.1015	98.79	0.079	97.50-100.32	0.079	0.04-0.12	1	1.048	479/9171	90.92	0	NZ_MWSM01000001.1 Streptococcus pseudopneumoniae ATCC BAA-960 = CCUG 49455 CCUG_49455T_0000001, whole genome shotgun sequence
