Sample_file	Genome_file	Adjusted_ANI	Eff_cov	ANI_5-95_percentile	Eff_lambda	Lambda_5-95_percentile	Median_cov	Mean_cov_geq1	Containment_ind	Naive_ANI	Contig_name
trimmed_read1_3001328919-DNA.fastq.gz	gtdb_genomes_reps_r220/database/GCF/002/014/765/GCF_002014765.1_genomic.fna.gz	99.59	3.309	NA-NA	HIGH	NA-NA	3	3.309	7859/8926	99.59	NZ_MUYT01000001.1 Moraxella lincolnii strain CCUG 9405 CCUG9405T_R1__paired__trimmed__paired__contig_1, whole genome shotgun sequence
trimmed_read1_3001328919-DNA.fastq.gz	gtdb_genomes_reps_r220/database/GCF/001/457/635/GCF_001457635.1_genomic.fna.gz	98.55	0.362	98.21-98.86	0.362	0.32-0.40	1	1.207	1655/8578	94.83	NZ_LN831051.1 Streptococcus pneumoniae strain NCTC7465 chromosome 1, complete sequence
trimmed_read1_3001328919-DNA.fastq.gz	gtdb_genomes_reps_r220/database/GCF/005/888/195/GCF_005888195.1_genomic.fna.gz	97.43	0.266	96.96-98.02	0.266	0.22-0.31	1	1.180	859/8234	92.97	NZ_LNKR01000001.1 Haemophilus influenzae biotype aegyptius strain KC1018 contig_001, whole genome shotgun sequence
trimmed_read1_3001328919-DNA.fastq.gz	gtdb_genomes_reps_r220/database/GCF/001/457/655/GCF_001457655.1_genomic.fna.gz	97.41	0.292	96.91-97.82	0.292	0.25-0.35	1	1.174	898/7983	93.19	NZ_LN831035.1 Haemophilus influenzae strain NCTC8143 chromosome 1, complete sequence
trimmed_read1_3001328919-DNA.fastq.gz	gtdb_genomes_reps_r220/database/GCF/019/703/545/GCF_019703545.1_genomic.fna.gz	97.10	0.306	96.64-97.59	0.306	0.25-0.36	1	1.159	856/8083	93.01	NZ_AP018771.1 Haemophilus influenzae strain CHBN-II-8 isolate 10H27 chromosome, complete genome
trimmed_read1_3001328919-DNA.fastq.gz	gtdb_genomes_reps_r220/database/GCF/002/984/305/GCF_002984305.1_genomic.fna.gz	96.64	0.335	96.18-97.11	0.335	0.27-0.39	1	1.211	843/8528	92.81	NZ_NEAA01000096.1 Haemophilus influenzae strain 135P16H1 N135P16H1_100_1, whole genome shotgun sequence
trimmed_read1_3001328919-DNA.fastq.gz	gtdb_genomes_reps_r220/database/GCF/900/475/755/GCF_900475755.1_genomic.fna.gz	95.80	0.290	95.12-96.36	0.290	0.23-0.35	1	1.159	522/7845	91.63	NZ_LS483411.1 Haemophilus influenzae strain NCTC11426 chromosome 1, complete sequence
trimmed_read1_3001328919-DNA.fastq.gz	gtdb_genomes_reps_r220/database/GCF/002/087/075/GCF_002087075.1_genomic.fna.gz	95.64	0.382	95.20-96.07	0.382	0.31-0.45	1	1.260	732/9171	92.17	NZ_MWSM01000001.1 Streptococcus pseudopneumoniae ATCC BAA-960 = CCUG 49455 CCUG_49455T_0000001, whole genome shotgun sequence
trimmed_read1_3001328919-DNA.fastq.gz	gtdb_genomes_reps_r220/database/GCA/001/347/015/GCA_001347015.1_genomic.fna.gz	94.94	0.370	94.38-95.34	0.370	0.31-0.45	1	1.285	571/9220	91.42	CFGI01000001.1 Streptococcus pneumoniae genome assembly 6938_6#7, scaffold ERS022181SCcontig000001, whole genome shotgun sequence
trimmed_read1_3001328919-DNA.fastq.gz	gtdb_genomes_reps_r220/database/GCF/013/277/475/GCF_013277475.1_genomic.fna.gz	94.83	0.337	94.17-95.37	0.337	0.27-0.41	1	1.254	507/9183	91.08	NZ_VMMZ01000001.1 Streptococcus sp. k-628 k-628_S22_L001_R1_001_(paired)_contig_1, whole genome shotgun sequence
trimmed_read1_3001328919-DNA.fastq.gz	gtdb_genomes_reps_r220/database/GCF/003/493/605/GCF_003493605.1_genomic.fna.gz	94.78	0.241	93.90-95.70	0.241	0.17-0.30	1	1.202	321/7850	90.20	NZ_QQKA01000001.1 Haemophilus haemolyticus strain M19187 M19187_HUY4190A139_cleaned_ctg_3530, whole genome shotgun sequence
trimmed_read1_3001328919-DNA.fastq.gz	gtdb_genomes_reps_r220/database/GCF/030/439/915/GCF_030439915.1_genomic.fna.gz	94.66	0.385	94.11-95.19	0.385	0.31-0.47	1	1.278	492/8418	91.25	NZ_JAQFJG010000010.1 Streptococcus sp. SPS1 NODE_10_length_71805_cov_189.924538, whole genome shotgun sequence
trimmed_read1_3001328919-DNA.fastq.gz	gtdb_genomes_reps_r220/database/GCA/001/113/365/GCA_001113365.1_genomic.fna.gz	94.66	0.379	94.00-95.11	0.379	0.32-0.47	1	1.264	568/9843	91.21	CKYA01000001.1 Streptococcus pneumoniae genome assembly 6823_7#22, scaffold ERS021524SCcontig000001, whole genome shotgun sequence
trimmed_read1_3001328919-DNA.fastq.gz	gtdb_genomes_reps_r220/database/GCA/905/369/855/GCA_905369855.1_genomic.fna.gz	94.66	0.305	93.94-95.44	0.305	0.23-0.40	1	1.209	330/6873	90.67	CAJPJN010000001.1 MAG: Streptococcus oralis isolate DRR046084-mag-bin.1 genome assembly, contig: DRR046084-mag-bin.1_2, whole genome shotgun sequence
trimmed_read1_3001328919-DNA.fastq.gz	gtdb_genomes_reps_r220/database/GCF/003/352/385/GCF_003352385.1_genomic.fna.gz	94.58	0.208	93.69-95.54	0.208	0.14-0.28	1	1.158	284/8521	89.61	NZ_CP031243.1 Haemophilus haemolyticus strain M19346 chromosome, complete genome
trimmed_read1_3001328919-DNA.fastq.gz	gtdb_genomes_reps_r220/database/GCA/001/171/885/GCA_001171885.1_genomic.fna.gz	94.57	0.379	93.85-95.01	0.379	0.32-0.48	1	1.268	503/8974	91.12	CKQD01000001.1 Streptococcus pneumoniae genome assembly 6680_6#10, scaffold ERS020456SCcontig000001, whole genome shotgun sequence
trimmed_read1_3001328919-DNA.fastq.gz	gtdb_genomes_reps_r220/database/GCF/900/411/395/GCF_900411395.1_genomic.fna.gz	94.57	0.357	93.90-95.18	0.357	0.29-0.45	1	1.272	504/9460	90.97	NZ_OXCQ01000050.1 Streptococcus sp. 596553, whole genome shotgun sequence
trimmed_read1_3001328919-DNA.fastq.gz	gtdb_genomes_reps_r220/database/GCF/903/645/285/GCF_903645285.1_genomic.fna.gz	94.48	0.387	93.84-95.07	0.387	0.31-0.49	1	1.267	469/8493	91.08	NZ_CAHJXN010000001.1 Streptococcus sp. Marseille-Q2617, whole genome shotgun sequence
trimmed_read1_3001328919-DNA.fastq.gz	gtdb_genomes_reps_r220/database/GCF/001/579/035/GCF_001579035.1_genomic.fna.gz	94.44	0.382	93.68-95.02	0.382	0.31-0.47	1	1.299	472/8717	91.02	NZ_KQ970285.1 Streptococcus mitis strain DD26 scaffold00001, whole genome shotgun sequence
trimmed_read1_3001328919-DNA.fastq.gz	gtdb_genomes_reps_r220/database/GCF/000/220/085/GCF_000220085.1_genomic.fna.gz	94.42	0.376	93.70-95.01	0.376	0.30-0.47	1	1.236	428/8111	90.95	NZ_AFQV01000034.1 Streptococcus mitis SK1080 ctg1129645366110, whole genome shotgun sequence
trimmed_read1_3001328919-DNA.fastq.gz	gtdb_genomes_reps_r220/database/GCF/013/277/455/GCF_013277455.1_genomic.fna.gz	94.39	0.352	93.62-95.04	0.352	0.27-0.45	1	1.261	436/8788	90.77	NZ_VMMY01000001.1 Streptococcus sp. 5346 5346-99_S28_L001_R1_001_(paired)_contig_1, whole genome shotgun sequence
trimmed_read1_3001328919-DNA.fastq.gz	gtdb_genomes_reps_r220/database/GCF/013/277/415/GCF_013277415.1_genomic.fna.gz	94.35	0.394	93.68-94.85	0.394	0.33-0.51	1	1.275	487/9052	91.00	NZ_VMMX01000001.1 Streptococcus sp. 68 68_S3_L001_R1_001_(paired)_contig_1, whole genome shotgun sequence
trimmed_read1_3001328919-DNA.fastq.gz	gtdb_genomes_reps_r220/database/GCF/013/276/625/GCF_013276625.1_genomic.fna.gz	94.33	0.389	93.66-94.88	0.389	0.31-0.46	1	1.270	485/9194	90.95	NZ_VMLI01000001.1 Streptococcus sp. 9903 9903_S27_L001_R1_001_(paired)_contig_1, whole genome shotgun sequence
trimmed_read1_3001328919-DNA.fastq.gz	gtdb_genomes_reps_r220/database/GCF/013/277/515/GCF_013277515.1_genomic.fna.gz	94.32	0.438	93.67-94.72	0.438	0.37-0.53	1	1.281	520/8972	91.22	NZ_VMNB01000001.1 Streptococcus sp. k-402 k-402_R1_(paired)_contig_1, whole genome shotgun sequence
trimmed_read1_3001328919-DNA.fastq.gz	gtdb_genomes_reps_r220/database/GCA/001/096/185/GCA_001096185.1_genomic.fna.gz	94.29	0.456	93.70-94.70	0.456	0.38-0.57	1	1.306	532/8989	91.28	CRPU01000001.1 Streptococcus pneumoniae genome assembly 6775_1#8, scaffold ERS020334SCcontig000001, whole genome shotgun sequence
trimmed_read1_3001328919-DNA.fastq.gz	gtdb_genomes_reps_r220/database/GCF/013/277/205/GCF_013277205.1_genomic.fna.gz	94.25	0.430	93.71-94.69	0.430	0.36-0.52	1	1.278	528/9465	91.11	NZ_VMMO01000001.1 Streptococcus sp. 202 202_S24_L001_R1_001_(paired)_contig_1, whole genome shotgun sequence
trimmed_read1_3001328919-DNA.fastq.gz	gtdb_genomes_reps_r220/database/GCF/013/276/795/GCF_013276795.1_genomic.fna.gz	94.23	0.451	93.70-94.68	0.451	0.38-0.55	1	1.298	493/8538	91.21	NZ_VMLR01000001.1 Streptococcus sp. 2342 2342_S22_L001_R1_001_(paired)_contig_1, whole genome shotgun sequence
trimmed_read1_3001328919-DNA.fastq.gz	gtdb_genomes_reps_r220/database/GCF/001/074/635/GCF_001074635.1_genomic.fna.gz	94.18	0.360	93.46-94.74	0.360	0.29-0.46	1	1.245	424/8979	90.62	NZ_JUQO01000001.1 Streptococcus mitis strain 850_SMIT 0_226_2877, whole genome shotgun sequence
trimmed_read1_3001328919-DNA.fastq.gz	gtdb_genomes_reps_r220/database/GCF/000/148/525/GCF_000148525.1_genomic.fna.gz	94.15	0.338	93.56-94.77	0.338	0.26-0.41	1	1.213	380/8584	90.43	NZ_AEDU01000035.1 Streptococcus mitis SK564 contigB3, whole genome shotgun sequence
trimmed_read1_3001328919-DNA.fastq.gz	gtdb_genomes_reps_r220/database/GCF/013/276/955/GCF_013276955.1_genomic.fna.gz	94.15	0.426	93.55-94.63	0.426	0.36-0.53	1	1.297	489/9123	90.99	NZ_VMLZ01000001.1 Streptococcus sp. 1453 1453_S31_L001_R1_001_(paired)_contig_1, whole genome shotgun sequence
trimmed_read1_3001328919-DNA.fastq.gz	gtdb_genomes_reps_r220/database/GCF/946/901/205/GCF_946901205.1_genomic.fna.gz	94.13	0.422	93.53-94.69	0.422	0.34-0.51	1	1.251	471/8911	90.95	NZ_CAMPPO010000001.1 Streptococcus sp. Marseille-Q5619 contig00001, whole genome shotgun sequence
trimmed_read1_3001328919-DNA.fastq.gz	gtdb_genomes_reps_r220/database/GCA/947/253/175/GCA_947253175.1_genomic.fna.gz	94.13	0.391	93.26-94.94	0.391	0.30-0.52	1	1.230	274/5429	90.82	CAMXYG010000001.1 MAG TPA_asm: uncultured Streptococcus sp. isolate SRR17635508_bin.2_metaWRAP_v1.3_MAG genome assembly, contig: ERZ14212505.19, whole genome shotgun sequence
trimmed_read1_3001328919-DNA.fastq.gz	gtdb_genomes_reps_r220/database/GCF/000/222/025/GCF_000222025.1_genomic.fna.gz	93.96	0.311	93.17-94.75	0.311	0.22-0.39	1	1.208	293/7558	90.05	NZ_AFQO01000022.1 Haemophilus haemolyticus M19501 M19501_022, whole genome shotgun sequence
trimmed_read1_3001328919-DNA.fastq.gz	gtdb_genomes_reps_r220/database/GCA/001/070/715/GCA_001070715.1_genomic.fna.gz	93.94	0.423	93.39-94.43	0.423	0.33-0.50	1	1.290	455/9137	90.78	JVRR01000136.1 Streptococcus pseudopneumoniae strain 163_SPSE 1000_987_21661_898_,304+,902_, whole genome shotgun sequence
trimmed_read1_3001328919-DNA.fastq.gz	gtdb_genomes_reps_r220/database/GCF/003/490/935/GCF_003490935.1_genomic.fna.gz	93.94	0.247	93.03-94.85	0.247	0.16-0.34	1	1.209	258/8148	89.46	NZ_QQGD01000001.1 Haemophilus haemolyticus strain M19099 M19099_HUY4190A124_cleaned_ctg_3040, whole genome shotgun sequence
trimmed_read1_3001328919-DNA.fastq.gz	gtdb_genomes_reps_r220/database/GCF/003/493/685/GCF_003493685.1_genomic.fna.gz	93.92	0.270	92.97-94.73	0.270	0.18-0.36	1	1.226	301/8850	89.67	NZ_QQJW01000001.1 Haemophilus haemolyticus strain M26161 M26161_HUY4190A151_cleaned_ctg_3559, whole genome shotgun sequence
trimmed_read1_3001328919-DNA.fastq.gz	gtdb_genomes_reps_r220/database/GCF/001/579/045/GCF_001579045.1_genomic.fna.gz	93.91	0.389	93.31-94.38	0.389	0.32-0.50	1	1.297	421/9109	90.56	NZ_KQ970261.1 Streptococcus mitis strain DD28 scaffold00001, whole genome shotgun sequence
trimmed_read1_3001328919-DNA.fastq.gz	gtdb_genomes_reps_r220/database/GCF/002/005/545/GCF_002005545.1_genomic.fna.gz	93.86	0.361	93.14-94.60	0.361	0.27-0.46	1	1.210	371/8727	90.31	NZ_LBMT01000001.1 Streptococcus mitis strain 321A Scaffold1, whole genome shotgun sequence
trimmed_read1_3001328919-DNA.fastq.gz	gtdb_genomes_reps_r220/database/GCF/006/385/785/GCF_006385785.1_genomic.fna.gz	93.79	0.378	93.11-94.48	0.378	0.29-0.48	1	1.282	373/8626	90.36	NZ_VFSH01000001.1 Streptococcus shenyangsis strain D19 Scaffold1, whole genome shotgun sequence
trimmed_read1_3001328919-DNA.fastq.gz	gtdb_genomes_reps_r220/database/GCF/019/448/275/GCF_019448275.1_genomic.fna.gz	93.78	0.369	93.17-94.51	0.369	0.28-0.46	1	1.294	364/8602	90.30	NZ_JAHXBZ010000001.1 Streptococcus humanilactis strain IMAU99125 IMAU99125, whole genome shotgun sequence
trimmed_read1_3001328919-DNA.fastq.gz	gtdb_genomes_reps_r220/database/GCA/916/050/595/GCA_916050595.1_genomic.fna.gz	93.76	0.427	92.97-94.40	0.427	0.34-0.55	1	1.228	263/5573	90.62	CAJZLM010000001.1 MAG TPA_asm: Streptococcus mitis isolate ERR2765141_bin.1_metaWRAP_v1.1_MAG genome assembly, contig: ERZ1674214.1, whole genome shotgun sequence
trimmed_read1_3001328919-DNA.fastq.gz	gtdb_genomes_reps_r220/database/GCF/000/722/775/GCF_000722775.1_genomic.fna.gz	93.73	0.378	93.03-94.19	0.378	0.31-0.47	1	1.211	375/8856	90.30	NZ_JPFZ01000001.1 Streptococcus mitis strain SK608 gsmSK608.contig.0_1, whole genome shotgun sequence
trimmed_read1_3001328919-DNA.fastq.gz	gtdb_genomes_reps_r220/database/GCA/905/221/105/GCA_905221105.1_genomic.fna.gz	93.72	0.386	93.05-94.40	0.386	0.29-0.48	1	1.293	334/7784	90.34	CAJNBW010000001.1 unidentified bacterium isolate Streptococcus species genome assembly, contig: NODE_1_length_546383_cov_52.4209, whole genome shotgun sequence
trimmed_read1_3001328919-DNA.fastq.gz	gtdb_genomes_reps_r220/database/GCF/002/096/895/GCF_002096895.1_genomic.fna.gz	93.70	0.401	92.92-94.24	0.401	0.32-0.51	1	1.275	346/7832	90.43	NZ_NCVI01000020.1 Streptococcus mitis strain RH_17024_08 s_mitis_RH_17024_08_ID_1, whole genome shotgun sequence
trimmed_read1_3001328919-DNA.fastq.gz	gtdb_genomes_reps_r220/database/GCA/905/221/235/GCA_905221235.1_genomic.fna.gz	93.70	0.366	93.12-94.25	0.366	0.29-0.46	1	1.288	351/8581	90.20	CAJNCJ010000001.1 unidentified bacterium isolate Streptococcus species genome assembly, contig: NODE_1_length_257994_cov_14.1844, whole genome shotgun sequence
trimmed_read1_3001328919-DNA.fastq.gz	gtdb_genomes_reps_r220/database/GCF/024/346/585/GCF_024346585.1_genomic.fna.gz	93.68	0.355	92.84-94.28	0.355	0.29-0.44	1	1.211	342/8660	90.10	NZ_AP024523.1 Streptococcus toyakuensis strain TP1632 chromosome, complete genome
trimmed_read1_3001328919-DNA.fastq.gz	gtdb_genomes_reps_r220/database/GCF/019/414/905/GCF_019414905.1_genomic.fna.gz	93.68	0.440	92.99-94.26	0.440	0.34-0.54	1	1.244	340/7206	90.62	NZ_DXLC01000001.1 MAG: Streptococcus sp. isolate HRGM_Genome_0314 HRGM_Genome_0314_1, whole genome shotgun sequence
trimmed_read1_3001328919-DNA.fastq.gz	gtdb_genomes_reps_r220/database/GCF/003/627/155/GCF_003627155.1_genomic.fna.gz	93.67	0.346	92.92-94.30	0.346	0.27-0.44	1	1.214	323/8376	90.03	NZ_CP032621.1 Streptococcus gwangjuense strain KCOM 1679 (=ChDC B345) chromosome, complete genome
trimmed_read1_3001328919-DNA.fastq.gz	gtdb_genomes_reps_r220/database/GCA/905/221/505/GCA_905221505.1_genomic.fna.gz	93.65	0.360	92.86-94.26	0.360	0.27-0.48	1	1.275	334/8433	90.11	CAJNDL010000001.1 unidentified bacterium isolate Streptococcus species genome assembly, contig: NODE_1_length_223941_cov_38.0438, whole genome shotgun sequence
trimmed_read1_3001328919-DNA.fastq.gz	gtdb_genomes_reps_r220/database/GCA/902/489/265/GCA_902489265.1_genomic.fna.gz	93.63	0.355	92.94-94.31	0.355	0.25-0.45	1	1.214	281/7235	90.05	CABTZI010000001.1 MAG TPA_asm: uncultured Streptococcus sp. isolate MGYG-HGUT-03797 genome assembly, contig: GUT_GENOME244205_1, whole genome shotgun sequence
trimmed_read1_3001328919-DNA.fastq.gz	gtdb_genomes_reps_r220/database/GCF/001/072/315/GCF_001072315.1_genomic.fna.gz	93.62	0.467	92.98-94.15	0.467	0.39-0.56	1	1.302	451/9310	90.70	NZ_JVLI01000001.1 Streptococcus pseudopneumoniae strain 330_SPSE 0_919_132734, whole genome shotgun sequence
trimmed_read1_3001328919-DNA.fastq.gz	gtdb_genomes_reps_r220/database/GCF/013/277/555/GCF_013277555.1_genomic.fna.gz	93.61	0.358	92.88-94.49	0.358	0.27-0.46	1	1.290	324/8306	90.06	NZ_VMND01000001.1 Streptococcus sp. k-163 k-163_S2_L001_R1_001_(paired)_contig_1, whole genome shotgun sequence
trimmed_read1_3001328919-DNA.fastq.gz	gtdb_genomes_reps_r220/database/GCA/905/221/125/GCA_905221125.1_genomic.fna.gz	93.61	0.372	92.95-94.25	0.372	0.28-0.46	1	1.273	337/8383	90.15	CAJNBY010000001.1 unidentified bacterium isolate Streptococcus species genome assembly, contig: NODE_1_length_225877_cov_55.373, whole genome shotgun sequence
trimmed_read1_3001328919-DNA.fastq.gz	gtdb_genomes_reps_r220/database/GCF/009/496/165/GCF_009496165.1_genomic.fna.gz	93.60	0.399	92.90-94.17	0.399	0.32-0.51	1	1.305	361/8510	90.31	NZ_WIJQ01000010.1 Streptococcus mitis strain SM08 NODE_10_length_53743_cov_22.439328, whole genome shotgun sequence
trimmed_read1_3001328919-DNA.fastq.gz	gtdb_genomes_reps_r220/database/GCF/001/560/895/GCF_001560895.1_genomic.fna.gz	93.60	0.310	92.72-94.24	0.310	0.24-0.40	1	1.232	298/8692	89.69	NZ_CP014326.1 Streptococcus mitis strain SVGS_061 chromosome, complete genome
trimmed_read1_3001328919-DNA.fastq.gz	gtdb_genomes_reps_r220/database/GCA/905/221/115/GCA_905221115.1_genomic.fna.gz	93.58	0.415	92.86-94.20	0.415	0.32-0.54	1	1.312	368/8441	90.39	CAJNBX010000001.1 unidentified bacterium isolate Streptococcus species genome assembly, contig: NODE_1_length_385792_cov_41.2882, whole genome shotgun sequence
trimmed_read1_3001328919-DNA.fastq.gz	gtdb_genomes_reps_r220/database/GCA/905/221/285/GCA_905221285.1_genomic.fna.gz	93.57	0.397	92.92-94.24	0.397	0.31-0.50	1	1.270	355/8485	90.27	CAJNCM010000001.1 unidentified bacterium isolate Streptococcus species genome assembly, contig: NODE_1_length_380604_cov_54.0563, whole genome shotgun sequence
trimmed_read1_3001328919-DNA.fastq.gz	gtdb_genomes_reps_r220/database/GCF/023/109/235/GCF_023109235.1_genomic.fna.gz	93.56	0.442	93.01-94.10	0.442	0.36-0.55	1	1.273	363/7968	90.52	NZ_JALDUC010000010.1 Streptococcus mitis strain S53 NODE_10_length_93322_cov_198.967258, whole genome shotgun sequence
trimmed_read1_3001328919-DNA.fastq.gz	gtdb_genomes_reps_r220/database/GCF/002/860/905/GCF_002860905.1_genomic.fna.gz	93.56	0.427	92.88-94.10	0.427	0.34-0.55	1	1.284	395/8928	90.43	NZ_PKIG01000001.1 Streptococcus oralis subsp. dentisani strain UMB0832 .16933_8_21.1, whole genome shotgun sequence
trimmed_read1_3001328919-DNA.fastq.gz	gtdb_genomes_reps_r220/database/GCF/946/190/275/GCF_946190275.1_genomic.fna.gz	93.55	0.401	92.88-94.04	0.401	0.32-0.50	1	1.282	386/9210	90.27	NZ_CAMHZQ010000001.1 Streptococcus mitis isolate Streptococcus mitis NODE_1_length_295642_cov_144.812041, whole genome shotgun sequence
trimmed_read1_3001328919-DNA.fastq.gz	gtdb_genomes_reps_r220/database/GCF/000/027/165/GCF_000027165.1_genomic.fna.gz	93.54	0.340	92.87-94.34	0.340	0.25-0.43	1	1.189	317/8732	89.86	NC_013853.1 Streptococcus mitis B6, complete sequence
trimmed_read1_3001328919-DNA.fastq.gz	gtdb_genomes_reps_r220/database/GCF/000/257/865/GCF_000257865.1_genomic.fna.gz	93.54	0.448	92.94-94.06	0.448	0.37-0.56	1	1.311	402/8814	90.52	NZ_AICU01000001.1 Streptococcus mitis SK575 contig00033, whole genome shotgun sequence
trimmed_read1_3001328919-DNA.fastq.gz	gtdb_genomes_reps_r220/database/GCF/946/190/285/GCF_946190285.1_genomic.fna.gz	93.53	0.384	92.82-94.08	0.384	0.31-0.49	1	1.265	339/8428	90.15	NZ_CAMHZX010000001.1 Streptococcus mitis isolate Streptococcus mitis NODE_1_length_750225_cov_136.047748, whole genome shotgun sequence
trimmed_read1_3001328919-DNA.fastq.gz	gtdb_genomes_reps_r220/database/GCF/001/679/045/GCF_001679045.1_genomic.fna.gz	93.52	0.270	92.59-94.33	0.270	0.19-0.37	1	1.223	238/7971	89.29	NZ_LYCK01000001.1 Haemophilus haemolyticus strain CCUG 12834 contig_1, whole genome shotgun sequence
trimmed_read1_3001328919-DNA.fastq.gz	gtdb_genomes_reps_r220/database/GCA/905/221/215/GCA_905221215.1_genomic.fna.gz	93.51	0.413	92.76-94.13	0.413	0.31-0.52	1	1.282	351/8279	90.31	CAJNCI010000001.1 unidentified bacterium isolate Streptococcus species genome assembly, contig: NODE_1_length_434302_cov_36.2817, whole genome shotgun sequence
trimmed_read1_3001328919-DNA.fastq.gz	gtdb_genomes_reps_r220/database/GCF/009/496/205/GCF_009496205.1_genomic.fna.gz	93.51	0.373	92.73-94.11	0.373	0.28-0.47	1	1.263	334/8560	90.07	NZ_WIJO01000100.1 Streptococcus mitis strain SM11 NODE_100_length_1969_cov_22.233985, whole genome shotgun sequence
trimmed_read1_3001328919-DNA.fastq.gz	gtdb_genomes_reps_r220/database/GCF/001/276/515/GCF_001276515.1_genomic.fna.gz	93.51	0.297	92.69-94.52	0.297	0.21-0.39	1	1.247	279/8635	89.52	NZ_LDVZ01000082.1 Haemophilus sp. C1 contig398, whole genome shotgun sequence
trimmed_read1_3001328919-DNA.fastq.gz	gtdb_genomes_reps_r220/database/GCF/001/074/825/GCF_001074825.1_genomic.fna.gz	93.50	0.345	92.76-94.20	0.345	0.27-0.44	1	1.298	322/8835	89.87	NZ_JUPG01000023.1 Streptococcus pseudopneumoniae strain 888_SPSE 103_811_16199, whole genome shotgun sequence
trimmed_read1_3001328919-DNA.fastq.gz	gtdb_genomes_reps_r220/database/GCF/001/281/025/GCF_001281025.1_genomic.fna.gz	93.49	0.405	92.76-94.20	0.405	0.29-0.52	1	1.236	326/7893	90.23	NZ_CP012646.1 Streptococcus mitis strain KCOM 1350 (= ChDC B183) chromosome, complete genome
trimmed_read1_3001328919-DNA.fastq.gz	gtdb_genomes_reps_r220/database/GCA/018/364/455/GCA_018364455.1_genomic.fna.gz	93.49	0.418	92.91-93.96	0.418	0.34-0.52	1	1.251	386/9113	90.30	JAGZLW010000001.1 MAG: Streptococcus mitis isolate L3_114_025G1_dasL3_114_025G1_concoct_29 L3_114_025G1_scaffold_0, whole genome shotgun sequence
trimmed_read1_3001328919-DNA.fastq.gz	gtdb_genomes_reps_r220/database/GCF/000/722/705/GCF_000722705.1_genomic.fna.gz	93.46	0.303	92.60-94.43	0.303	0.21-0.42	1	1.212	278/8646	89.50	NZ_JPFW01000001.1 Streptococcus mitis strain SK642 gsmSK642.contig.0_1, whole genome shotgun sequence
trimmed_read1_3001328919-DNA.fastq.gz	gtdb_genomes_reps_r220/database/GCA/905/221/245/GCA_905221245.1_genomic.fna.gz	93.45	0.403	92.80-94.17	0.403	0.31-0.51	1	1.277	339/8315	90.19	CAJNCK010000001.1 unidentified bacterium isolate Streptococcus species genome assembly, contig: NODE_1_length_394086_cov_61.6465, whole genome shotgun sequence
trimmed_read1_3001328919-DNA.fastq.gz	gtdb_genomes_reps_r220/database/GCF/003/351/405/GCF_003351405.1_genomic.fna.gz	93.44	0.267	92.47-94.35	0.267	0.18-0.38	1	1.139	231/8082	89.17	NZ_CP031240.1 Haemophilus haemolyticus strain M19345 chromosome, complete genome
trimmed_read1_3001328919-DNA.fastq.gz	gtdb_genomes_reps_r220/database/GCA/905/221/085/GCA_905221085.1_genomic.fna.gz	93.42	0.424	92.71-94.04	0.424	0.33-0.53	1	1.290	338/8047	90.28	CAJNBT010000001.1 unidentified bacterium isolate Streptococcus species genome assembly, contig: NODE_1_length_604251_cov_44.5148, whole genome shotgun sequence
trimmed_read1_3001328919-DNA.fastq.gz	gtdb_genomes_reps_r220/database/GCF/000/148/585/GCF_000148585.2_genomic.fna.gz	93.40	0.389	92.70-93.97	0.389	0.31-0.50	1	1.219	310/7991	90.05	NZ_CP028414.1 Streptococcus mitis NCTC 12261 chromosome, complete genome
trimmed_read1_3001328919-DNA.fastq.gz	gtdb_genomes_reps_r220/database/GCF/946/190/335/GCF_946190335.1_genomic.fna.gz	93.39	0.445	92.79-94.04	0.445	0.34-0.56	1	1.301	355/8196	90.37	NZ_CAMHZN010000001.1 Streptococcus mitis isolate Streptococcus mitis NODE_1_length_678925_cov_140.780463, whole genome shotgun sequence
trimmed_read1_3001328919-DNA.fastq.gz	gtdb_genomes_reps_r220/database/GCF/000/148/545/GCF_000148545.1_genomic.fna.gz	93.39	0.471	92.73-93.86	0.471	0.39-0.59	1	1.296	398/8822	90.49	NZ_AEDV01000108.1 Streptococcus mitis SK597 contigB5, whole genome shotgun sequence
trimmed_read1_3001328919-DNA.fastq.gz	gtdb_genomes_reps_r220/database/GCF/002/096/845/GCF_002096845.1_genomic.fna.gz	93.37	0.434	92.76-94.05	0.434	0.33-0.54	1	1.293	368/8758	90.28	NZ_NCVK01000060.1 Streptococcus mitis strain OD_317805_11 s_mitis_OD_317805_11_ID_1, whole genome shotgun sequence
trimmed_read1_3001328919-DNA.fastq.gz	gtdb_genomes_reps_r220/database/GCA/927/910/965/GCA_927910965.1_genomic.fna.gz	93.36	0.400	92.69-93.89	0.400	0.32-0.50	1	1.291	351/8896	90.10	CAKMOM010000001.1 MAG TPA_asm: uncultured Streptococcus sp. isolate ERR3827222_bin.1_metaWRAP_v1.1_MAG genome assembly, contig: ERZ4768407.87, whole genome shotgun sequence
trimmed_read1_3001328919-DNA.fastq.gz	gtdb_genomes_reps_r220/database/GCF/002/860/865/GCF_002860865.1_genomic.fna.gz	93.36	0.417	92.76-93.92	0.417	0.32-0.51	1	1.290	362/8904	90.18	NZ_PKIE01000001.1 Streptococcus mitis strain UMB1341 .21837_8_64.1, whole genome shotgun sequence
trimmed_read1_3001328919-DNA.fastq.gz	gtdb_genomes_reps_r220/database/GCF/943/912/555/GCF_943912555.1_genomic.fna.gz	93.34	0.373	92.54-94.13	0.373	0.28-0.48	1	1.223	296/8048	89.89	NZ_CALTUR010000001.1 MAG: uncultured Streptococcus sp. isolate WUFO5OxywB_bin.3.MAG NODE_36_length_53999_cov_11.507230, whole genome shotgun sequence
trimmed_read1_3001328919-DNA.fastq.gz	gtdb_genomes_reps_r220/database/GCF/000/222/785/GCF_000222785.1_genomic.fna.gz	93.33	0.372	92.62-94.06	0.372	0.27-0.47	1	1.221	303/8285	89.88	NZ_AFUF01000054.1 Streptococcus mitis SK569 ctg1129913977589, whole genome shotgun sequence
trimmed_read1_3001328919-DNA.fastq.gz	gtdb_genomes_reps_r220/database/GCA/934/216/185/GCA_934216185.1_genomic.fna.gz	93.32	0.385	92.63-93.98	0.385	0.30-0.49	1	1.245	322/8588	89.95	CAKQBM010000001.1 MAG: uncultured Streptococcus sp. isolate REFINED_METABAT215_TOP10_CONTIGS_1500_ASSEMBLY_K77_MERGED__Hadza_MoBio_hadza-E-H_O_24_1936.13 genome assembly, contig: Hadza_MoBio_hadza-E-H_O_24_1936__NODE_170_length_36231_cov_7.962355, whole genome shotgun sequence
trimmed_read1_3001328919-DNA.fastq.gz	gtdb_genomes_reps_r220/database/GCF/946/188/685/GCF_946188685.1_genomic.fna.gz	93.32	0.429	92.67-93.86	0.429	0.35-0.55	1	1.272	367/8937	90.21	NZ_CAMHWH010000001.1 Streptococcus mitis isolate Streptococcus mitis NODE_1_length_368939_cov_97.626665, whole genome shotgun sequence
trimmed_read1_3001328919-DNA.fastq.gz	gtdb_genomes_reps_r220/database/GCF/003/490/595/GCF_003490595.1_genomic.fna.gz	93.32	0.310	92.53-94.21	0.310	0.22-0.41	1	1.244	275/8755	89.44	NZ_QQGY01000001.1 Haemophilus haemolyticus strain M19079 M19079_HUY4190A121_cleaned_ctg_3577, whole genome shotgun sequence
trimmed_read1_3001328919-DNA.fastq.gz	gtdb_genomes_reps_r220/database/GCF/946/190/115/GCF_946190115.1_genomic.fna.gz	93.31	0.472	92.68-93.81	0.472	0.38-0.59	1	1.310	374/8454	90.43	NZ_CAMHZG010000001.1 Streptococcus mitis isolate Streptococcus mitis NODE_1_length_220291_cov_95.818490, whole genome shotgun sequence
