Sample_file	Genome_file	Taxonomic_abundance	Sequence_abundance	Adjusted_ANI	Eff_cov	ANI_5-95_percentile	Eff_lambda	Lambda_5-95_percentile	Median_cov	Mean_cov_geq1	Containment_ind	Naive_ANI	kmers_reassigned	Contig_name
trimmed_read1_3001326467-DNA.fastq.gz	gtdb_genomes_reps_r220/database/GCF/000/245/815/GCF_000245815.1_genomic.fna.gz	21.4265	14.8814	97.56	0.214	96.88-98.15	0.214	0.17-0.27	1	1.117	702/7821	92.52	0	NZ_JH601103.1 Dolosigranulum pigrum ATCC 51524 supercont1.1, whole genome shotgun sequence
trimmed_read1_3001326467-DNA.fastq.gz	gtdb_genomes_reps_r220/database/GCF/004/346/925/GCF_004346925.1_genomic.fna.gz	20.2107	34.4076	97.88	0.202	97.60-98.21	0.202	0.18-0.22	1	1.104	1855/19698	92.66	0	NZ_CP031167.1 Stenotrophomonas sp. ASS1 chromosome, complete genome
trimmed_read1_3001326467-DNA.fastq.gz	gtdb_genomes_reps_r220/database/GCF/001/679/005/GCF_001679005.1_genomic.fna.gz	19.7670	16.8087	98.36	0.197	97.83-98.88	0.197	0.17-0.23	1	1.107	1055/9834	93.05	0	NZ_LXTW01000001.1 Moraxella nonliquefaciens strain CCUG 348 contig_1, whole genome shotgun sequence
trimmed_read1_3001326467-DNA.fastq.gz	gtdb_genomes_reps_r220/database/GCA/943/913/655/GCA_943913655.1_genomic.fna.gz	11.3585	6.1282	99.00	0.113	98.02-100.08	0.113	0.08-0.15	1	1.105	522/5936	92.46	0	CALTZA010000001.1 MAG: uncultured Francisella sp. isolate G79AyWT62A_bin.4.MAG genome assembly, contig: NODE_9_length_210779_cov_13.887189, whole genome shotgun sequence
trimmed_read1_3001326467-DNA.fastq.gz	gtdb_genomes_reps_r220/database/GCF/000/688/415/GCF_000688415.1_genomic.fna.gz	10.9811	9.2604	95.58	0.110	94.24-97.30	0.110	0.06-0.17	1	1.064	251/9809	88.85	0	NZ_JIAH01000001.1 Corynebacterium pseudodiphtheriticum DSM 44287 O146DRAFT_scaffold00010.10_C, whole genome shotgun sequence
trimmed_read1_3001326467-DNA.fastq.gz	gtdb_genomes_reps_r220/database/GCF/001/632/285/GCF_001632285.1_genomic.fna.gz	10.5365	7.4079	98.19	0.105	96.93-99.00	0.105	0.08-0.16	1	1.063	463/8176	91.15	68	NZ_LWAH01000001.1 Moraxella catarrhalis strain CCUG 353 contig_1, whole genome shotgun sequence
trimmed_read1_3001326467-DNA.fastq.gz	gtdb_genomes_reps_r220/database/GCF/000/017/405/GCF_000017405.1_genomic.fna.gz	5.7198	11.1058	95.02	0.057	93.33-96.47	0.057	0.03-0.10	1	1.028	252/22098	86.56	1	NC_009667.1 Brucella anthropi ATCC 49188 chromosome 1, complete sequence
