Sample_file	Genome_file	Adjusted_ANI	Eff_cov	ANI_5-95_percentile	Eff_lambda	Lambda_5-95_percentile	Median_cov	Mean_cov_geq1	Containment_ind	Naive_ANI	Contig_name
trimmed_read1_3001172810-DNA.fastq.gz	gtdb_genomes_reps_r220/database/GCF/000/245/815/GCF_000245815.1_genomic.fna.gz	98.83	1.661	98.74-98.93	1.661	1.54-1.78	2	2.755	4407/7821	98.17	NZ_JH601103.1 Dolosigranulum pigrum ATCC 51524 supercont1.1, whole genome shotgun sequence
trimmed_read1_3001172810-DNA.fastq.gz	gtdb_genomes_reps_r220/database/GCF/000/688/415/GCF_000688415.1_genomic.fna.gz	98.73	0.054	97.17-100.64	0.054	0.03-0.09	1	1.032	346/9809	89.77	NZ_JIAH01000001.1 Corynebacterium pseudodiphtheriticum DSM 44287 O146DRAFT_scaffold00010.10_C, whole genome shotgun sequence
trimmed_read1_3001172810-DNA.fastq.gz	gtdb_genomes_reps_r220/database/GCF/001/679/005/GCF_001679005.1_genomic.fna.gz	98.51	1.557	98.42-98.58	1.557	1.47-1.67	2	2.234	4882/9834	97.77	NZ_LXTW01000001.1 Moraxella nonliquefaciens strain CCUG 348 contig_1, whole genome shotgun sequence
trimmed_read1_3001172810-DNA.fastq.gz	gtdb_genomes_reps_r220/database/GCF/023/109/515/GCF_023109515.1_genomic.fna.gz	95.41	0.056	92.57-95.85	0.056	0.05-0.14	1	0.991	114/8654	86.97	NZ_JALDUM010000010.1 Streptococcus mitis strain S39 NODE_10_length_3920_cov_103.945149, whole genome shotgun sequence
trimmed_read1_3001172810-DNA.fastq.gz	gtdb_genomes_reps_r220/database/GCF/000/027/165/GCF_000027165.1_genomic.fna.gz	95.41	0.057	92.44-96.05	0.057	0.05-0.15	1	1.212	113/8732	86.92	NC_013853.1 Streptococcus mitis B6, complete sequence
trimmed_read1_3001172810-DNA.fastq.gz	gtdb_genomes_reps_r220/database/GCF/000/722/765/GCF_000722765.2_genomic.fna.gz	95.30	0.068	92.86-96.68	0.068	0.05-0.13	1	1.033	121/8136	87.31	NZ_CP028415.1 Streptococcus mitis strain SK637 chromosome, complete genome
trimmed_read1_3001172810-DNA.fastq.gz	gtdb_genomes_reps_r220/database/GCF/002/005/545/GCF_002005545.1_genomic.fna.gz	95.27	0.057	92.92-95.82	0.057	0.05-0.12	1	1.028	108/8727	86.79	NZ_LBMT01000001.1 Streptococcus mitis strain 321A Scaffold1, whole genome shotgun sequence
trimmed_read1_3001172810-DNA.fastq.gz	gtdb_genomes_reps_r220/database/GCF/001/074/635/GCF_001074635.1_genomic.fna.gz	95.10	0.058	92.97-95.76	0.058	0.05-0.12	1	1.009	111/8979	86.79	NZ_JUQO01000001.1 Streptococcus mitis strain 850_SMIT 0_226_2877, whole genome shotgun sequence
trimmed_read1_3001172810-DNA.fastq.gz	gtdb_genomes_reps_r220/database/GCA/905/369/855/GCA_905369855.1_genomic.fna.gz	95.09	0.067	92.45-95.66	0.067	0.06-0.16	1	1.032	93/6873	87.04	CAJPJN010000001.1 MAG: Streptococcus oralis isolate DRR046084-mag-bin.1 genome assembly, contig: DRR046084-mag-bin.1_2, whole genome shotgun sequence
trimmed_read1_3001172810-DNA.fastq.gz	gtdb_genomes_reps_r220/database/GCF/002/860/905/GCF_002860905.1_genomic.fna.gz	94.91	0.060	92.64-95.48	0.060	0.05-0.12	1	1.000	106/8928	86.67	NZ_PKIG01000001.1 Streptococcus oralis subsp. dentisani strain UMB0832 .16933_8_21.1, whole genome shotgun sequence
trimmed_read1_3001172810-DNA.fastq.gz	gtdb_genomes_reps_r220/database/GCF/030/439/915/GCF_030439915.1_genomic.fna.gz	94.91	0.062	92.57-95.50	0.062	0.06-0.13	1	1.000	103/8418	86.76	NZ_JAQFJG010000010.1 Streptococcus sp. SPS1 NODE_10_length_71805_cov_189.924538, whole genome shotgun sequence
trimmed_read1_3001172810-DNA.fastq.gz	gtdb_genomes_reps_r220/database/GCF/030/217/725/GCF_030217725.1_genomic.fna.gz	94.84	0.065	91.95-95.56	0.065	0.05-0.15	1	0.990	100/7951	86.84	NZ_JASOOK010000010.1 Streptococcus sp. UMB1203 NODE_10_length_57271_cov_7.437389, whole genome shotgun sequence
trimmed_read1_3001172810-DNA.fastq.gz	gtdb_genomes_reps_r220/database/GCF/002/096/855/GCF_002096855.1_genomic.fna.gz	94.79	0.064	91.99-95.73	0.064	0.05-0.16	1	0.990	101/8240	86.76	NZ_NCVH01000033.1 Streptococcus mitis strain RH_17439_08 s_mitis_RH_17439_08_ID_1, whole genome shotgun sequence
trimmed_read1_3001172810-DNA.fastq.gz	gtdb_genomes_reps_r220/database/GCA/947/253/175/GCA_947253175.1_genomic.fna.gz	94.77	0.080	91.79-95.78	0.080	0.06-0.21	1	1.036	84/5429	87.42	CAMXYG010000001.1 MAG TPA_asm: uncultured Streptococcus sp. isolate SRR17635508_bin.2_metaWRAP_v1.3_MAG genome assembly, contig: ERZ14212505.19, whole genome shotgun sequence
trimmed_read1_3001172810-DNA.fastq.gz	gtdb_genomes_reps_r220/database/GCF/000/722/775/GCF_000722775.1_genomic.fna.gz	94.69	0.062	92.02-95.40	0.062	0.06-0.14	1	1.030	99/8856	86.51	NZ_JPFZ01000001.1 Streptococcus mitis strain SK608 gsmSK608.contig.0_1, whole genome shotgun sequence
trimmed_read1_3001172810-DNA.fastq.gz	gtdb_genomes_reps_r220/database/GCF/013/276/955/GCF_013276955.1_genomic.fna.gz	94.67	0.062	92.33-95.19	0.062	0.05-0.13	1	0.990	104/9123	86.56	NZ_VMLZ01000001.1 Streptococcus sp. 1453 1453_S31_L001_R1_001_(paired)_contig_1, whole genome shotgun sequence
trimmed_read1_3001172810-DNA.fastq.gz	gtdb_genomes_reps_r220/database/GCA/905/221/215/GCA_905221215.1_genomic.fna.gz	94.58	0.066	91.76-95.20	0.066	0.06-0.17	1	0.990	98/8279	86.67	CAJNCI010000001.1 unidentified bacterium isolate Streptococcus species genome assembly, contig: NODE_1_length_434302_cov_36.2817, whole genome shotgun sequence
trimmed_read1_3001172810-DNA.fastq.gz	gtdb_genomes_reps_r220/database/GCF/903/645/285/GCF_903645285.1_genomic.fna.gz	94.51	0.066	91.85-95.12	0.066	0.06-0.15	1	1.032	94/8493	86.48	NZ_CAHJXN010000001.1 Streptococcus sp. Marseille-Q2617, whole genome shotgun sequence
trimmed_read1_3001172810-DNA.fastq.gz	gtdb_genomes_reps_r220/database/GCA/905/221/085/GCA_905221085.1_genomic.fna.gz	94.47	0.068	91.91-95.17	0.068	0.06-0.15	1	1.000	94/8047	86.63	CAJNBT010000001.1 unidentified bacterium isolate Streptococcus species genome assembly, contig: NODE_1_length_604251_cov_44.5148, whole genome shotgun sequence
trimmed_read1_3001172810-DNA.fastq.gz	gtdb_genomes_reps_r220/database/GCF/013/276/625/GCF_013276625.1_genomic.fna.gz	94.46	0.064	91.73-94.94	0.064	0.06-0.14	1	1.000	100/9194	86.43	NZ_VMLI01000001.1 Streptococcus sp. 9903 9903_S27_L001_R1_001_(paired)_contig_1, whole genome shotgun sequence
trimmed_read1_3001172810-DNA.fastq.gz	gtdb_genomes_reps_r220/database/GCF/901/542/415/GCF_901542415.1_genomic.fna.gz	94.40	0.077	92.26-95.82	0.077	0.05-0.15	1	1.037	108/8708	86.80	NZ_CABEHV010000001.1 Streptococcus mitis strain NCTC11189, whole genome shotgun sequence
trimmed_read1_3001172810-DNA.fastq.gz	gtdb_genomes_reps_r220/database/GCA/018/364/455/GCA_018364455.1_genomic.fna.gz	94.34	0.076	92.18-95.50	0.076	0.05-0.15	1	1.073	110/9113	86.72	JAGZLW010000001.1 MAG: Streptococcus mitis isolate L3_114_025G1_dasL3_114_025G1_concoct_29 L3_114_025G1_scaffold_0, whole genome shotgun sequence
trimmed_read1_3001172810-DNA.fastq.gz	gtdb_genomes_reps_r220/database/GCF/013/277/515/GCF_013277515.1_genomic.fna.gz	94.34	0.066	92.06-94.96	0.066	0.06-0.14	1	0.990	98/8972	86.44	NZ_VMNB01000001.1 Streptococcus sp. k-402 k-402_R1_(paired)_contig_1, whole genome shotgun sequence
trimmed_read1_3001172810-DNA.fastq.gz	gtdb_genomes_reps_r220/database/GCF/013/276/795/GCF_013276795.1_genomic.fna.gz	94.23	0.069	91.56-94.93	0.069	0.06-0.17	1	0.989	94/8538	86.46	NZ_VMLR01000001.1 Streptococcus sp. 2342 2342_S22_L001_R1_001_(paired)_contig_1, whole genome shotgun sequence
trimmed_read1_3001172810-DNA.fastq.gz	gtdb_genomes_reps_r220/database/GCF/946/190/045/GCF_946190045.1_genomic.fna.gz	94.22	0.070	91.66-94.74	0.070	0.06-0.15	1	0.989	93/8370	86.49	NZ_CAMHYY010000001.1 Streptococcus mitis isolate Streptococcus mitis NODE_1_length_333422_cov_157.319918, whole genome shotgun sequence
trimmed_read1_3001172810-DNA.fastq.gz	gtdb_genomes_reps_r220/database/GCA/905/221/115/GCA_905221115.1_genomic.fna.gz	94.19	0.070	91.59-95.20	0.070	0.06-0.16	1	1.000	92/8441	86.44	CAJNBX010000001.1 unidentified bacterium isolate Streptococcus species genome assembly, contig: NODE_1_length_385792_cov_41.2882, whole genome shotgun sequence
trimmed_read1_3001172810-DNA.fastq.gz	gtdb_genomes_reps_r220/database/GCF/022/137/125/GCF_022137125.1_genomic.fna.gz	94.13	0.083	91.65-95.30	0.083	0.06-0.18	1	1.010	103/8173	86.84	NZ_JAKNEQ010000001.1 Streptococcus mitis strain DFI.2.96 NNOOAJHE_1, whole genome shotgun sequence
trimmed_read1_3001172810-DNA.fastq.gz	gtdb_genomes_reps_r220/database/GCF/016/658/865/GCF_016658865.1_genomic.fna.gz	94.07	0.071	91.43-94.60	0.071	0.06-0.15	1	1.034	88/8594	86.26	NZ_CP067992.1 Streptococcus mitis strain S022-V7-A3 chromosome, complete genome
trimmed_read1_3001172810-DNA.fastq.gz	gtdb_genomes_reps_r220/database/GCF/013/277/455/GCF_013277455.1_genomic.fna.gz	94.03	0.082	91.65-95.36	0.082	0.06-0.18	1	1.010	105/8788	86.69	NZ_VMMY01000001.1 Streptococcus sp. 5346 5346-99_S28_L001_R1_001_(paired)_contig_1, whole genome shotgun sequence
trimmed_read1_3001172810-DNA.fastq.gz	gtdb_genomes_reps_r220/database/GCF/009/496/155/GCF_009496155.1_genomic.fna.gz	93.99	0.069	91.68-94.57	0.069	0.06-0.14	1	1.000	93/9227	86.22	NZ_WIJP01000010.1 Streptococcus mitis strain SM10 NODE_10_length_108696_cov_24.038307, whole genome shotgun sequence
trimmed_read1_3001172810-DNA.fastq.gz	gtdb_genomes_reps_r220/database/GCF/002/096/845/GCF_002096845.1_genomic.fna.gz	93.98	0.082	91.66-95.49	0.082	0.05-0.18	1	1.000	105/8758	86.70	NZ_NCVK01000060.1 Streptococcus mitis strain OD_317805_11 s_mitis_OD_317805_11_ID_1, whole genome shotgun sequence
trimmed_read1_3001172810-DNA.fastq.gz	gtdb_genomes_reps_r220/database/GCF/002/096/815/GCF_002096815.1_genomic.fna.gz	93.90	0.073	91.44-94.51	0.073	0.06-0.17	1	0.989	89/8476	86.33	NZ_NCVJ01000021.1 Streptococcus mitis strain RH_12363_08 s_mitis_RH_12363_08_ID_1, whole genome shotgun sequence
trimmed_read1_3001172810-DNA.fastq.gz	gtdb_genomes_reps_r220/database/GCF/000/220/045/GCF_000220045.1_genomic.fna.gz	93.90	0.072	91.09-94.63	0.072	0.06-0.17	1	1.035	86/8681	86.17	NZ_AFQT01000054.1 Streptococcus mitis SK1073 ctg1129645355399, whole genome shotgun sequence
trimmed_read1_3001172810-DNA.fastq.gz	gtdb_genomes_reps_r220/database/GCF/001/810/785/GCF_001810785.1_genomic.fna.gz	93.89	0.087	91.76-95.31	0.087	0.06-0.17	1	1.010	99/8148	86.74	NZ_KV802678.1 Streptococcus sp. HMSC073F11 Scaffold1, whole genome shotgun sequence
trimmed_read1_3001172810-DNA.fastq.gz	gtdb_genomes_reps_r220/database/GCF/013/277/415/GCF_013277415.1_genomic.fna.gz	93.88	0.082	91.69-95.27	0.082	0.05-0.17	1	1.000	105/9052	86.61	NZ_VMMX01000001.1 Streptococcus sp. 68 68_S3_L001_R1_001_(paired)_contig_1, whole genome shotgun sequence
trimmed_read1_3001172810-DNA.fastq.gz	gtdb_genomes_reps_r220/database/GCA/905/221/545/GCA_905221545.1_genomic.fna.gz	93.87	0.088	91.67-95.12	0.088	0.06-0.18	1	1.010	98/8034	86.75	CAJNDO010000001.1 unidentified bacterium isolate Streptococcus species genome assembly, contig: NODE_1_length_233977_cov_53.6585, whole genome shotgun sequence
trimmed_read1_3001172810-DNA.fastq.gz	gtdb_genomes_reps_r220/database/GCF/946/190/375/GCF_946190375.1_genomic.fna.gz	93.85	0.070	91.51-94.56	0.070	0.06-0.15	1	0.979	94/9452	86.18	NZ_CAMIAF010000001.1 Streptococcus mitis isolate Streptococcus mitis NODE_1_length_232215_cov_64.623009, whole genome shotgun sequence
trimmed_read1_3001172810-DNA.fastq.gz	gtdb_genomes_reps_r220/database/GCF/000/220/085/GCF_000220085.1_genomic.fna.gz	93.84	0.088	91.43-95.44	0.088	0.06-0.18	1	1.042	95/8111	86.64	NZ_AFQV01000034.1 Streptococcus mitis SK1080 ctg1129645366110, whole genome shotgun sequence
trimmed_read1_3001172810-DNA.fastq.gz	gtdb_genomes_reps_r220/database/GCA/916/050/595/GCA_916050595.1_genomic.fna.gz	93.82	0.092	91.12-94.49	0.092	0.08-0.21	1	1.044	68/5573	86.75	CAJZLM010000001.1 MAG TPA_asm: Streptococcus mitis isolate ERR2765141_bin.1_metaWRAP_v1.1_MAG genome assembly, contig: ERZ1674214.1, whole genome shotgun sequence
trimmed_read1_3001172810-DNA.fastq.gz	gtdb_genomes_reps_r220/database/GCF/946/901/205/GCF_946901205.1_genomic.fna.gz	93.80	0.084	91.43-95.21	0.084	0.05-0.17	1	1.040	99/8911	86.49	NZ_CAMPPO010000001.1 Streptococcus sp. Marseille-Q5619 contig00001, whole genome shotgun sequence
trimmed_read1_3001172810-DNA.fastq.gz	gtdb_genomes_reps_r220/database/GCA/902/482/895/GCA_902482895.1_genomic.fna.gz	93.75	0.092	91.46-95.14	0.092	0.06-0.21	1	1.044	91/7666	86.67	CABTAV010000001.1 MAG TPA_asm: uncultured Streptococcus sp. isolate MGYG-HGUT-03136 genome assembly, contig: GUT_GENOME207866_1, whole genome shotgun sequence
trimmed_read1_3001172810-DNA.fastq.gz	gtdb_genomes_reps_r220/database/GCF/900/411/395/GCF_900411395.1_genomic.fna.gz	93.74	0.082	91.47-95.19	0.082	0.05-0.18	1	1.010	104/9460	86.46	NZ_OXCQ01000050.1 Streptococcus sp. 596553, whole genome shotgun sequence
trimmed_read1_3001172810-DNA.fastq.gz	gtdb_genomes_reps_r220/database/GCF/009/496/165/GCF_009496165.1_genomic.fna.gz	93.74	0.098	91.64-95.29	0.098	0.06-0.19	1	1.009	111/8510	86.94	NZ_WIJQ01000010.1 Streptococcus mitis strain SM08 NODE_10_length_53743_cov_22.439328, whole genome shotgun sequence
trimmed_read1_3001172810-DNA.fastq.gz	gtdb_genomes_reps_r220/database/GCF/000/148/545/GCF_000148545.1_genomic.fna.gz	93.71	0.099	91.98-95.52	0.099	0.06-0.19	1	1.237	114/8822	86.91	NZ_AEDV01000108.1 Streptococcus mitis SK597 contigB5, whole genome shotgun sequence
trimmed_read1_3001172810-DNA.fastq.gz	gtdb_genomes_reps_r220/database/GCF/013/277/205/GCF_013277205.1_genomic.fna.gz	93.71	0.071	91.36-94.55	0.071	0.06-0.16	1	1.000	90/9465	86.06	NZ_VMMO01000001.1 Streptococcus sp. 202 202_S24_L001_R1_001_(paired)_contig_1, whole genome shotgun sequence
trimmed_read1_3001172810-DNA.fastq.gz	gtdb_genomes_reps_r220/database/GCF/000/257/865/GCF_000257865.1_genomic.fna.gz	93.69	0.097	91.77-95.01	0.097	0.06-0.18	1	1.018	111/8814	86.84	NZ_AICU01000001.1 Streptococcus mitis SK575 contig00033, whole genome shotgun sequence
trimmed_read1_3001172810-DNA.fastq.gz	gtdb_genomes_reps_r220/database/GCF/006/385/785/GCF_006385785.1_genomic.fna.gz	93.65	0.089	91.29-94.93	0.089	0.06-0.18	1	1.081	99/8626	86.58	NZ_VFSH01000001.1 Streptococcus shenyangsis strain D19 Scaffold1, whole genome shotgun sequence
trimmed_read1_3001172810-DNA.fastq.gz	gtdb_genomes_reps_r220/database/GCA/927/910/965/GCA_927910965.1_genomic.fna.gz	93.61	0.075	91.30-94.30	0.075	0.07-0.16	1	0.989	87/8896	86.13	CAKMOM010000001.1 MAG TPA_asm: uncultured Streptococcus sp. isolate ERR3827222_bin.1_metaWRAP_v1.1_MAG genome assembly, contig: ERZ4768407.87, whole genome shotgun sequence
trimmed_read1_3001172810-DNA.fastq.gz	gtdb_genomes_reps_r220/database/GCF/006/385/165/GCF_006385165.1_genomic.fna.gz	93.59	0.085	91.23-94.43	0.085	0.07-0.19	1	1.041	74/7122	86.30	NZ_VFJA01000001.1 Streptococcus symci strain C17 Scaffold1, whole genome shotgun sequence
trimmed_read1_3001172810-DNA.fastq.gz	gtdb_genomes_reps_r220/database/GCF/946/190/065/GCF_946190065.1_genomic.fna.gz	93.58	0.075	91.30-94.14	0.075	0.07-0.16	1	0.956	90/8981	86.20	NZ_CAMHZD010000001.1 Streptococcus mitis isolate Streptococcus mitis NODE_1_length_218173_cov_162.355963, whole genome shotgun sequence
trimmed_read1_3001172810-DNA.fastq.gz	gtdb_genomes_reps_r220/database/GCF/009/496/295/GCF_009496295.1_genomic.fna.gz	93.50	0.090	91.18-94.76	0.090	0.06-0.20	1	1.000	97/8682	86.50	NZ_WIJL01000010.1 Streptococcus mitis strain SM15 NODE_10_length_116604_cov_16.980606, whole genome shotgun sequence
trimmed_read1_3001172810-DNA.fastq.gz	gtdb_genomes_reps_r220/database/GCF/003/942/765/GCF_003942765.1_genomic.fna.gz	93.50	0.104	91.36-95.13	0.104	0.06-0.20	1	1.306	111/8775	86.85	NZ_RJNW01000001.1 Streptococcus mitis strain KLC01 D8849_contig001, whole genome shotgun sequence
trimmed_read1_3001172810-DNA.fastq.gz	gtdb_genomes_reps_r220/database/GCA/905/221/195/GCA_905221195.1_genomic.fna.gz	93.48	0.080	91.03-94.00	0.080	0.07-0.17	1	1.000	81/8196	86.16	CAJNCF010000001.1 unidentified bacterium isolate Streptococcus species genome assembly, contig: NODE_1_length_351178_cov_24.3909, whole genome shotgun sequence
trimmed_read1_3001172810-DNA.fastq.gz	gtdb_genomes_reps_r220/database/GCF/005/144/795/GCF_005144795.1_genomic.fna.gz	93.46	0.092	90.93-94.59	0.092	0.06-0.21	1	1.011	94/8446	86.49	NZ_SWFJ01000010.1 Streptococcus mitis strain ColumbLawn NODE_10_length_101543_cov_167.293110, whole genome shotgun sequence
trimmed_read1_3001172810-DNA.fastq.gz	gtdb_genomes_reps_r220/database/GCF/915/066/115/GCF_915066115.1_genomic.fna.gz	93.40	0.083	90.77-93.94	0.083	0.07-0.20	1	1.026	76/7792	86.13	NZ_CAJZDT010000001.1 MAG: uncultured Streptococcus sp. isolate SRR1045100_bin.1_metaWRAP_v1.1_MAG, whole genome shotgun sequence
trimmed_read1_3001172810-DNA.fastq.gz	gtdb_genomes_reps_r220/database/GCA/905/221/145/GCA_905221145.1_genomic.fna.gz	93.36	0.082	90.56-93.89	0.082	0.07-0.20	1	0.988	80/8115	86.16	CAJNCA010000001.1 unidentified bacterium isolate Streptococcus species genome assembly, contig: NODE_1_length_542150_cov_74.7743, whole genome shotgun sequence
trimmed_read1_3001172810-DNA.fastq.gz	gtdb_genomes_reps_r220/database/GCF/003/942/995/GCF_003942995.1_genomic.fna.gz	93.34	0.091	91.34-94.78	0.091	0.06-0.18	1	1.011	95/8973	86.35	NZ_RJOH01000001.1 Streptococcus mitis strain BCC06 D8836_contig001, whole genome shotgun sequence
trimmed_read1_3001172810-DNA.fastq.gz	gtdb_genomes_reps_r220/database/GCF/000/148/585/GCF_000148585.2_genomic.fna.gz	93.33	0.112	91.37-95.22	0.112	0.06-0.21	1	1.330	100/7991	86.82	NZ_CP028414.1 Streptococcus mitis NCTC 12261 chromosome, complete genome
trimmed_read1_3001172810-DNA.fastq.gz	gtdb_genomes_reps_r220/database/GCA/905/221/235/GCA_905221235.1_genomic.fna.gz	93.31	0.094	91.20-94.51	0.094	0.06-0.19	1	1.074	94/8581	86.45	CAJNCJ010000001.1 unidentified bacterium isolate Streptococcus species genome assembly, contig: NODE_1_length_257994_cov_14.1844, whole genome shotgun sequence
trimmed_read1_3001172810-DNA.fastq.gz	gtdb_genomes_reps_r220/database/GCF/946/188/375/GCF_946188375.1_genomic.fna.gz	93.28	0.104	91.24-94.58	0.104	0.07-0.21	1	1.000	106/8818	86.71	NZ_CAMHUS010000001.1 Streptococcus mitis isolate Streptococcus mitis NODE_1_length_514561_cov_115.905146, whole genome shotgun sequence
trimmed_read1_3001172810-DNA.fastq.gz	gtdb_genomes_reps_r220/database/GCF/000/722/695/GCF_000722695.1_genomic.fna.gz	93.28	0.078	91.22-93.99	0.078	0.07-0.16	1	1.038	80/9219	85.80	NZ_JPFU01000001.1 Streptococcus mitis strain SK629 gsmSK629.contig.0_1, whole genome shotgun sequence
trimmed_read1_3001172810-DNA.fastq.gz	gtdb_genomes_reps_r220/database/GCA/905/221/455/GCA_905221455.1_genomic.fna.gz	93.28	0.081	90.58-94.15	0.081	0.07-0.18	1	0.988	81/8554	86.04	CAJNDF010000001.1 unidentified bacterium isolate Streptococcus species genome assembly, contig: NODE_1_length_328888_cov_49.2012, whole genome shotgun sequence
trimmed_read1_3001172810-DNA.fastq.gz	gtdb_genomes_reps_r220/database/GCF/001/650/315/GCF_001650315.1_genomic.fna.gz	93.27	0.109	91.09-94.92	0.109	0.06-0.22	1	1.010	101/8172	86.79	NZ_LVJM01000001.1 Streptococcus sp. CCUG 49591 contig_1, whole genome shotgun sequence
trimmed_read1_3001172810-DNA.fastq.gz	gtdb_genomes_reps_r220/database/GCF/020/089/495/GCF_020089495.2_genomic.fna.gz	93.25	0.108	91.38-94.68	0.108	0.06-0.20	1	1.038	104/8470	86.77	NZ_JAIRCA020000001.1 Streptococcus sp. IMAU 99199 IMAU99199, whole genome shotgun sequence
trimmed_read1_3001172810-DNA.fastq.gz	gtdb_genomes_reps_r220/database/GCF/002/238/115/GCF_002238115.1_genomic.fna.gz	93.25	0.077	91.28-93.53	0.077	0.07-0.15	1	1.000	84/9550	85.84	NZ_NGVM01000099.1 Streptococcus sp. KR NODE_100_length_653_cov_34.199, whole genome shotgun sequence
trimmed_read1_3001172810-DNA.fastq.gz	gtdb_genomes_reps_r220/database/GCA/001/070/715/GCA_001070715.1_genomic.fna.gz	93.22	0.092	91.10-94.22	0.092	0.06-0.20	1	1.000	95/9137	86.30	JVRR01000136.1 Streptococcus pseudopneumoniae strain 163_SPSE 1000_987_21661_898_,304+,902_, whole genome shotgun sequence
trimmed_read1_3001172810-DNA.fastq.gz	gtdb_genomes_reps_r220/database/GCA/905/221/375/GCA_905221375.1_genomic.fna.gz	93.19	0.094	90.52-94.39	0.094	0.06-0.21	1	1.011	92/8833	86.31	CAJNCY010000001.1 unidentified bacterium isolate Streptococcus species genome assembly, contig: NODE_1_length_291870_cov_37.7718, whole genome shotgun sequence
trimmed_read1_3001172810-DNA.fastq.gz	gtdb_genomes_reps_r220/database/GCF/003/944/325/GCF_003944325.1_genomic.fna.gz	93.18	0.091	90.98-94.62	0.091	0.06-0.20	1	1.011	95/9459	86.21	NZ_RJPX01000001.1 Streptococcus mitis strain BCC17 D8787_contig001, whole genome shotgun sequence
trimmed_read1_3001172810-DNA.fastq.gz	gtdb_genomes_reps_r220/database/GCA/905/221/245/GCA_905221245.1_genomic.fna.gz	93.15	0.110	91.16-94.95	0.110	0.06-0.22	1	1.010	100/8315	86.71	CAJNCK010000001.1 unidentified bacterium isolate Streptococcus species genome assembly, contig: NODE_1_length_394086_cov_61.6465, whole genome shotgun sequence
trimmed_read1_3001172810-DNA.fastq.gz	gtdb_genomes_reps_r220/database/GCF/946/190/155/GCF_946190155.1_genomic.fna.gz	93.12	0.085	90.51-93.96	0.085	0.07-0.21	1	0.987	78/8327	86.01	NZ_CAMHZL010000001.1 Streptococcus mitis isolate Streptococcus mitis NODE_1_length_388548_cov_94.757163, whole genome shotgun sequence
trimmed_read1_3001172810-DNA.fastq.gz	gtdb_genomes_reps_r220/database/GCF/002/096/735/GCF_002096735.1_genomic.fna.gz	93.11	0.111	91.00-94.50	0.111	0.07-0.23	1	1.010	99/8264	86.70	NZ_NCVC01000017.1 Streptococcus mitis strain RH_8961_10 s_mitis_RH_8961_10_ID_1, whole genome shotgun sequence
trimmed_read1_3001172810-DNA.fastq.gz	gtdb_genomes_reps_r220/database/GCF/002/096/925/GCF_002096925.1_genomic.fna.gz	93.11	0.098	90.85-94.31	0.098	0.07-0.21	1	1.000	90/8477	86.36	NZ_NCVN01000085.1 Streptococcus mitis strain B_009152_10 s_mitis_RS_009152_10_ID_1, whole genome shotgun sequence
trimmed_read1_3001172810-DNA.fastq.gz	gtdb_genomes_reps_r220/database/GCF/019/414/905/GCF_019414905.1_genomic.fna.gz	93.08	0.107	90.57-94.45	0.107	0.07-0.23	1	1.038	80/7206	86.49	NZ_DXLC01000001.1 MAG: Streptococcus sp. isolate HRGM_Genome_0314 HRGM_Genome_0314_1, whole genome shotgun sequence
trimmed_read1_3001172810-DNA.fastq.gz	gtdb_genomes_reps_r220/database/GCF/023/110/375/GCF_023110375.1_genomic.fna.gz	93.05	0.136	91.24-94.82	0.136	0.07-0.24	1	1.269	119/8511	87.13	NZ_JALDVV010000010.1 Streptococcus mitis strain O7-1 NODE_10_length_62925_cov_19.542213, whole genome shotgun sequence
trimmed_read1_3001172810-DNA.fastq.gz	gtdb_genomes_reps_r220/database/GCA/905/221/155/GCA_905221155.1_genomic.fna.gz	93.04	0.111	91.05-95.19	0.111	0.06-0.21	1	1.020	98/8454	86.61	CAJNCB010000001.1 unidentified bacterium isolate Streptococcus species genome assembly, contig: NODE_1_length_917501_cov_53.194, whole genome shotgun sequence
trimmed_read1_3001172810-DNA.fastq.gz	gtdb_genomes_reps_r220/database/GCF/003/942/965/GCF_003942965.1_genomic.fna.gz	93.01	0.115	90.88-94.55	0.115	0.06-0.23	1	1.010	96/8015	86.70	NZ_RJOG01000001.1 Streptococcus mitis strain BCC07 D8837_contig001, whole genome shotgun sequence
trimmed_read1_3001172810-DNA.fastq.gz	gtdb_genomes_reps_r220/database/GCA/905/221/095/GCA_905221095.1_genomic.fna.gz	92.97	0.112	90.92-94.77	0.112	0.06-0.21	1	1.010	98/8478	86.60	CAJNBV010000001.1 unidentified bacterium isolate Streptococcus species genome assembly, contig: NODE_1_length_337823_cov_51.8384, whole genome shotgun sequence
trimmed_read1_3001172810-DNA.fastq.gz	gtdb_genomes_reps_r220/database/GCF/023/109/235/GCF_023109235.1_genomic.fna.gz	92.96	0.116	90.88-94.23	0.116	0.07-0.21	1	1.021	94/7968	86.66	NZ_JALDUC010000010.1 Streptococcus mitis strain S53 NODE_10_length_93322_cov_198.967258, whole genome shotgun sequence
trimmed_read1_3001172810-DNA.fastq.gz	gtdb_genomes_reps_r220/database/GCF/003/626/515/GCF_003626515.1_genomic.fna.gz	92.96	0.101	90.78-94.11	0.101	0.07-0.22	1	1.012	86/8292	86.30	NZ_RBCK01000001.1 Streptococcus chosunense strain ChDC B353 KCOM1699_1, whole genome shotgun sequence
trimmed_read1_3001172810-DNA.fastq.gz	gtdb_genomes_reps_r220/database/GCF/001/808/665/GCF_001808665.1_genomic.fna.gz	92.94	0.109	90.91-94.64	0.109	0.06-0.20	1	1.010	101/9115	86.48	NZ_KV794125.1 Streptococcus sp. HMSC070B10 Scaffold0, whole genome shotgun sequence
trimmed_read1_3001172810-DNA.fastq.gz	gtdb_genomes_reps_r220/database/GCF/026/782/895/GCF_026782895.1_genomic.fna.gz	92.92	0.112	91.21-94.78	0.112	0.06-0.20	1	1.021	97/8605	86.53	NZ_JAKUXJ010000010.1 Streptococcus mitis strain D13054009 D13054009_S15_contig_10_consensus, whole genome shotgun sequence
trimmed_read1_3001172810-DNA.fastq.gz	gtdb_genomes_reps_r220/database/GCF/019/218/685/GCF_019218685.1_genomic.fna.gz	92.91	0.101	90.93-94.27	0.101	0.07-0.22	1	1.012	86/8424	86.25	NZ_JAHUZC010000010.1 Streptococcus vulneris strain DM3B3 NODE_10_length_85275_cov_315.799702, whole genome shotgun sequence
trimmed_read1_3001172810-DNA.fastq.gz	gtdb_genomes_reps_r220/database/GCF/946/190/145/GCF_946190145.1_genomic.fna.gz	92.88	0.110	90.91-94.48	0.110	0.06-0.21	1	1.010	100/9123	86.45	NZ_CAMHZM010000001.1 Streptococcus mitis isolate Streptococcus mitis NODE_1_length_492142_cov_74.508555, whole genome shotgun sequence
trimmed_read1_3001172810-DNA.fastq.gz	gtdb_genomes_reps_r220/database/GCA/905/221/065/GCA_905221065.1_genomic.fna.gz	92.87	0.116	90.74-94.11	0.116	0.07-0.23	1	1.011	95/8205	86.60	CAJNBS010000001.1 unidentified bacterium isolate Streptococcus species genome assembly, contig: NODE_1_length_331008_cov_48.2727, whole genome shotgun sequence
trimmed_read1_3001172810-DNA.fastq.gz	gtdb_genomes_reps_r220/database/GCA/905/221/205/GCA_905221205.1_genomic.fna.gz	92.87	0.104	90.55-94.13	0.104	0.07-0.24	1	1.093	86/8340	86.28	CAJNCG010000001.1 unidentified bacterium isolate Streptococcus species genome assembly, contig: NODE_1_length_670333_cov_54.9381, whole genome shotgun sequence
trimmed_read1_3001172810-DNA.fastq.gz	gtdb_genomes_reps_r220/database/GCF/946/190/285/GCF_946190285.1_genomic.fna.gz	92.86	0.115	90.79-94.33	0.115	0.07-0.23	1	1.010	96/8428	86.56	NZ_CAMHZX010000001.1 Streptococcus mitis isolate Streptococcus mitis NODE_1_length_750225_cov_136.047748, whole genome shotgun sequence
