trimmed_read1_3001425825-DNA.fastq.gz	gtdb_genomes_reps_r220/database/GCF/946/188/615/GCF_946188615.1_genomic.fna.gz	94.68	0.274	93.92-95.36	0.274	0.20-0.35	1	1.247	381/8605	90.43	NZ_CAMHVK010000001.1 Streptococcus mitis isolate Streptococcus mitis NODE_1_length_383254_cov_94.802522, whole genome shotgun sequence
trimmed_read1_3001425825-DNA.fastq.gz	gtdb_genomes_reps_r220/database/GCF/008/763/935/GCF_008763935.1_genomic.fna.gz	94.67	0.243	93.87-95.39	0.243	0.18-0.31	1	1.222	369/9346	90.10	NZ_VTQF01000017.1 Streptococcus mitis strain DE0498 NODE_100_length_5450_cov_55.629293, whole genome shotgun sequence
trimmed_read1_3001425825-DNA.fastq.gz	gtdb_genomes_reps_r220/database/GCA/905/221/185/GCA_905221185.1_genomic.fna.gz	94.67	0.236	93.86-95.55	0.236	0.16-0.30	1	1.252	325/8418	90.03	CAJNCE010000001.1 unidentified bacterium isolate Streptococcus species genome assembly, contig: NODE_1_length_320457_cov_53.7269, whole genome shotgun sequence
trimmed_read1_3001425825-DNA.fastq.gz	gtdb_genomes_reps_r220/database/GCA/022/739/095/GCA_022739095.1_genomic.fna.gz	94.66	0.199	93.62-95.62	0.199	0.14-0.28	1	1.103	301/9152	89.57	JAIJEI010000009.1 MAG: Bifidobacterium sp. isolate Map_4_007 contig_100_100, whole genome shotgun sequence
trimmed_read1_3001425825-DNA.fastq.gz	gtdb_genomes_reps_r220/database/GCF/006/385/165/GCF_006385165.1_genomic.fna.gz	94.66	0.230	93.55-95.46	0.230	0.17-0.31	1	1.139	267/7122	89.95	NZ_VFJA01000001.1 Streptococcus symci strain C17 Scaffold1, whole genome shotgun sequence
trimmed_read1_3001425825-DNA.fastq.gz	gtdb_genomes_reps_r220/database/GCF/002/238/115/GCF_002238115.1_genomic.fna.gz	94.66	0.227	93.84-95.47	0.227	0.17-0.31	1	1.237	355/9550	89.92	NZ_NGVM01000099.1 Streptococcus sp. KR NODE_100_length_653_cov_34.199, whole genome shotgun sequence
trimmed_read1_3001425825-DNA.fastq.gz	gtdb_genomes_reps_r220/database/GCA/905/221/115/GCA_905221115.1_genomic.fna.gz	94.64	0.295	93.79-95.33	0.295	0.23-0.37	1	1.235	392/8441	90.57	CAJNBX010000001.1 unidentified bacterium isolate Streptococcus species genome assembly, contig: NODE_1_length_385792_cov_41.2882, whole genome shotgun sequence
trimmed_read1_3001425825-DNA.fastq.gz	gtdb_genomes_reps_r220/database/GCF/002/096/755/GCF_002096755.1_genomic.fna.gz	94.63	0.262	93.86-95.38	0.262	0.20-0.33	1	1.278	367/8803	90.26	NZ_NCVF01000026.1 Streptococcus mitis strain RH_50275_09 s_mitis_RH_50275_09_ID_1, whole genome shotgun sequence
trimmed_read1_3001425825-DNA.fastq.gz	gtdb_genomes_reps_r220/database/GCF/000/422/085/GCF_000422085.1_genomic.fna.gz	94.63	0.142	93.78-95.46	0.142	0.10-0.19	1	1.073	546/22877	88.65	NC_021741.1 Serratia liquefaciens ATCC 27592, complete sequence
trimmed_read1_3001425825-DNA.fastq.gz	gtdb_genomes_reps_r220/database/GCF/023/110/245/GCF_023110245.1_genomic.fna.gz	94.62	0.265	93.77-95.45	0.265	0.20-0.34	1	1.287	355/8455	90.28	NZ_JALDVR010000010.1 Streptococcus mitis strain S03 NODE_10_length_52279_cov_241.670492, whole genome shotgun sequence
trimmed_read1_3001425825-DNA.fastq.gz	gtdb_genomes_reps_r220/database/GCF/000/187/745/GCF_000187745.1_genomic.fna.gz	94.61	0.250	93.74-95.37	0.250	0.18-0.33	1	1.258	372/9331	90.13	NZ_GL732486.1 Streptococcus sp. M334 supercont1.1, whole genome shotgun sequence
trimmed_read1_3001425825-DNA.fastq.gz	gtdb_genomes_reps_r220/database/GCF/001/579/035/GCF_001579035.1_genomic.fna.gz	94.60	0.321	93.75-95.17	0.321	0.26-0.42	1	1.228	430/8717	90.75	NZ_KQ970285.1 Streptococcus mitis strain DD26 scaffold00001, whole genome shotgun sequence
trimmed_read1_3001425825-DNA.fastq.gz	gtdb_genomes_reps_r220/database/GCF/943/912/555/GCF_943912555.1_genomic.fna.gz	94.60	0.247	93.72-95.40	0.247	0.18-0.32	1	1.146	315/8048	90.07	NZ_CALTUR010000001.1 MAG: uncultured Streptococcus sp. isolate WUFO5OxywB_bin.3.MAG NODE_36_length_53999_cov_11.507230, whole genome shotgun sequence
trimmed_read1_3001425825-DNA.fastq.gz	gtdb_genomes_reps_r220/database/GCF/001/076/775/GCF_001076775.1_genomic.fna.gz	94.59	0.252	93.80-95.26	0.252	0.19-0.31	1	1.171	350/8803	90.12	NZ_JVGV01000002.1 Streptococcus pseudopneumoniae strain 445_SPSE 160_1845_293894, whole genome shotgun sequence
trimmed_read1_3001425825-DNA.fastq.gz	gtdb_genomes_reps_r220/database/GCF/000/722/755/GCF_000722755.1_genomic.fna.gz	94.58	0.226	93.52-95.39	0.226	0.17-0.30	1	1.156	314/8714	89.83	NZ_JPFY01000001.1 Streptococcus mitis strain SK578 gsmSK578.contig.0_1, whole genome shotgun sequence
trimmed_read1_3001425825-DNA.fastq.gz	gtdb_genomes_reps_r220/database/GCF/005/144/795/GCF_005144795.1_genomic.fna.gz	94.58	0.251	93.69-95.63	0.251	0.17-0.32	1	1.227	335/8446	90.11	NZ_SWFJ01000010.1 Streptococcus mitis strain ColumbLawn NODE_10_length_101543_cov_167.293110, whole genome shotgun sequence
trimmed_read1_3001425825-DNA.fastq.gz	gtdb_genomes_reps_r220/database/GCF/013/277/115/GCF_013277115.1_genomic.fna.gz	94.58	0.232	93.77-95.51	0.232	0.15-0.31	1	1.231	307/8331	89.90	NZ_VMMH01000001.1 Streptococcus sp. 714 714_S30_L001_R1_001_(paired)_contig_1, whole genome shotgun sequence
trimmed_read1_3001425825-DNA.fastq.gz	gtdb_genomes_reps_r220/database/GCF/003/942/865/GCF_003942865.1_genomic.fna.gz	94.58	0.251	93.72-95.50	0.251	0.17-0.33	1	1.237	333/8424	90.10	NZ_RJNZ01000001.1 Streptococcus mitis strain BCC55 D8845_contig001, whole genome shotgun sequence
trimmed_read1_3001425825-DNA.fastq.gz	gtdb_genomes_reps_r220/database/GCA/927/911/355/GCA_927911355.1_genomic.fna.gz	94.57	0.272	93.85-95.37	0.272	0.20-0.35	1	1.184	294/6958	90.30	CAKMPG010000001.1 MAG TPA_asm: Streptococcus mitis isolate ERR3827238_bin.2_metaWRAP_v1.1_MAG genome assembly, contig: ERZ4768210.2, whole genome shotgun sequence
trimmed_read1_3001425825-DNA.fastq.gz	gtdb_genomes_reps_r220/database/GCF/000/196/555/GCF_000196555.1_genomic.fna.gz	94.56	0.218	93.64-95.31	0.218	0.16-0.31	1	1.098	346/9990	89.72	NC_015067.1 Bifidobacterium longum subsp. longum JCM 1217, complete sequence
trimmed_read1_3001425825-DNA.fastq.gz	gtdb_genomes_reps_r220/database/GCA/927/911/535/GCA_927911535.1_genomic.fna.gz	94.56	0.205	93.39-95.69	0.205	0.13-0.29	1	1.145	221/6752	89.56	CAKMQC010000001.1 MAG TPA_asm: Streptococcus mitis isolate ERR3827286_bin.1_metaWRAP_v1.1_MAG genome assembly, contig: ERZ4768129.98, whole genome shotgun sequence
trimmed_read1_3001425825-DNA.fastq.gz	gtdb_genomes_reps_r220/database/GCF/002/096/925/GCF_002096925.1_genomic.fna.gz	94.56	0.271	93.72-95.44	0.271	0.21-0.35	1	1.279	355/8477	90.27	NZ_NCVN01000085.1 Streptococcus mitis strain B_009152_10 s_mitis_RS_009152_10_ID_1, whole genome shotgun sequence
trimmed_read1_3001425825-DNA.fastq.gz	gtdb_genomes_reps_r220/database/GCF/001/810/785/GCF_001810785.1_genomic.fna.gz	94.55	0.266	93.80-95.31	0.266	0.19-0.34	1	1.272	335/8148	90.22	NZ_KV802678.1 Streptococcus sp. HMSC073F11 Scaffold1, whole genome shotgun sequence
trimmed_read1_3001425825-DNA.fastq.gz	gtdb_genomes_reps_r220/database/GCF/002/871/495/GCF_002871495.1_genomic.fna.gz	94.55	0.237	93.80-95.37	0.237	0.17-0.31	1	1.223	359/9651	89.93	NZ_PNGD01000001.1 Streptococcus sp. UMB0029 ERR1203613.17957_1_25.1, whole genome shotgun sequence
trimmed_read1_3001425825-DNA.fastq.gz	gtdb_genomes_reps_r220/database/GCF/946/190/275/GCF_946190275.1_genomic.fna.gz	94.50	0.293	93.80-95.25	0.293	0.22-0.37	1	1.253	407/9210	90.43	NZ_CAMHZQ010000001.1 Streptococcus mitis isolate Streptococcus mitis NODE_1_length_295642_cov_144.812041, whole genome shotgun sequence
trimmed_read1_3001425825-DNA.fastq.gz	gtdb_genomes_reps_r220/database/GCF/002/096/815/GCF_002096815.1_genomic.fna.gz	94.50	0.251	93.72-95.48	0.251	0.17-0.33	1	1.291	326/8476	90.02	NZ_NCVJ01000021.1 Streptococcus mitis strain RH_12363_08 s_mitis_RH_12363_08_ID_1, whole genome shotgun sequence
trimmed_read1_3001425825-DNA.fastq.gz	gtdb_genomes_reps_r220/database/GCF/900/411/395/GCF_900411395.1_genomic.fna.gz	94.50	0.325	93.88-95.14	0.325	0.26-0.41	1	1.235	456/9460	90.68	NZ_OXCQ01000050.1 Streptococcus sp. 596553, whole genome shotgun sequence
trimmed_read1_3001425825-DNA.fastq.gz	gtdb_genomes_reps_r220/database/GCF/946/188/375/GCF_946188375.1_genomic.fna.gz	94.49	0.273	93.78-95.20	0.273	0.21-0.35	1	1.288	365/8818	90.24	NZ_CAMHUS010000001.1 Streptococcus mitis isolate Streptococcus mitis NODE_1_length_514561_cov_115.905146, whole genome shotgun sequence
trimmed_read1_3001425825-DNA.fastq.gz	gtdb_genomes_reps_r220/database/GCF/000/722/685/GCF_000722685.1_genomic.fna.gz	94.49	0.258	93.56-95.31	0.258	0.19-0.33	1	1.174	344/8785	90.08	NZ_JPFV01000001.1 Streptococcus mitis strain SK667 gsmSK667.contig.0_1, whole genome shotgun sequence
trimmed_read1_3001425825-DNA.fastq.gz	gtdb_genomes_reps_r220/database/GCF/009/496/085/GCF_009496085.1_genomic.fna.gz	94.48	0.267	93.74-95.34	0.267	0.18-0.34	1	1.287	363/9024	90.15	NZ_WIJN01000100.1 Streptococcus mitis strain SM13 NODE_100_length_642_cov_0.945631, whole genome shotgun sequence
trimmed_read1_3001425825-DNA.fastq.gz	gtdb_genomes_reps_r220/database/GCF/001/650/315/GCF_001650315.1_genomic.fna.gz	94.47	0.253	93.67-95.33	0.253	0.18-0.33	1	1.251	315/8172	90.03	NZ_LVJM01000001.1 Streptococcus sp. CCUG 49591 contig_1, whole genome shotgun sequence
trimmed_read1_3001425825-DNA.fastq.gz	gtdb_genomes_reps_r220/database/GCA/902/482/895/GCA_902482895.1_genomic.fna.gz	94.46	0.209	93.36-95.32	0.209	0.15-0.30	1	1.126	247/7666	89.51	CABTAV010000001.1 MAG TPA_asm: uncultured Streptococcus sp. isolate MGYG-HGUT-03136 genome assembly, contig: GUT_GENOME207866_1, whole genome shotgun sequence
trimmed_read1_3001425825-DNA.fastq.gz	gtdb_genomes_reps_r220/database/GCF/003/942/765/GCF_003942765.1_genomic.fna.gz	94.46	0.266	93.68-95.43	0.266	0.18-0.34	1	1.236	351/8775	90.14	NZ_RJNW01000001.1 Streptococcus mitis strain KLC01 D8849_contig001, whole genome shotgun sequence
trimmed_read1_3001425825-DNA.fastq.gz	gtdb_genomes_reps_r220/database/GCF/003/942/685/GCF_003942685.1_genomic.fna.gz	94.45	0.253	93.60-95.28	0.253	0.18-0.33	1	1.249	333/8731	90.00	NZ_RJNR01000001.1 Streptococcus mitis strain BCA12 D8855_contig001, whole genome shotgun sequence
trimmed_read1_3001425825-DNA.fastq.gz	gtdb_genomes_reps_r220/database/GCA/934/216/185/GCA_934216185.1_genomic.fna.gz	94.45	0.242	93.60-95.18	0.242	0.18-0.34	1	1.178	314/8588	89.88	CAKQBM010000001.1 MAG: uncultured Streptococcus sp. isolate REFINED_METABAT215_TOP10_CONTIGS_1500_ASSEMBLY_K77_MERGED__Hadza_MoBio_hadza-E-H_O_24_1936.13 genome assembly, contig: Hadza_MoBio_hadza-E-H_O_24_1936__NODE_170_length_36231_cov_7.962355, whole genome shotgun sequence
trimmed_read1_3001425825-DNA.fastq.gz	gtdb_genomes_reps_r220/database/GCF/001/074/635/GCF_001074635.1_genomic.fna.gz	94.44	0.305	93.72-95.08	0.305	0.23-0.40	1	1.282	400/8979	90.45	NZ_JUQO01000001.1 Streptococcus mitis strain 850_SMIT 0_226_2877, whole genome shotgun sequence
trimmed_read1_3001425825-DNA.fastq.gz	gtdb_genomes_reps_r220/database/GCA/905/221/205/GCA_905221205.1_genomic.fna.gz	94.43	0.232	93.53-95.42	0.232	0.16-0.30	1	1.289	294/8340	89.77	CAJNCG010000001.1 unidentified bacterium isolate Streptococcus species genome assembly, contig: NODE_1_length_670333_cov_54.9381, whole genome shotgun sequence
trimmed_read1_3001425825-DNA.fastq.gz	gtdb_genomes_reps_r220/database/GCA/905/221/165/GCA_905221165.1_genomic.fna.gz	94.43	0.271	93.72-95.21	0.271	0.20-0.35	1	1.306	314/7799	90.16	CAJNCC010000001.1 unidentified bacterium isolate Streptococcus species genome assembly, contig: NODE_1_length_337881_cov_61.2048, whole genome shotgun sequence
trimmed_read1_3001425825-DNA.fastq.gz	gtdb_genomes_reps_r220/database/GCF/003/627/155/GCF_003627155.1_genomic.fna.gz	94.43	0.255	93.53-95.18	0.255	0.19-0.34	1	1.160	318/8376	89.99	NZ_CP032621.1 Streptococcus gwangjuense strain KCOM 1679 (=ChDC B345) chromosome, complete genome
trimmed_read1_3001425825-DNA.fastq.gz	gtdb_genomes_reps_r220/database/GCA/018/364/455/GCA_018364455.1_genomic.fna.gz	94.42	0.306	93.73-94.92	0.306	0.24-0.39	1	1.165	406/9113	90.45	JAGZLW010000001.1 MAG: Streptococcus mitis isolate L3_114_025G1_dasL3_114_025G1_concoct_29 L3_114_025G1_scaffold_0, whole genome shotgun sequence
trimmed_read1_3001425825-DNA.fastq.gz	gtdb_genomes_reps_r220/database/GCA/946/190/245/GCA_946190245.1_genomic.fna.gz	94.42	0.249	93.52-95.18	0.249	0.18-0.33	1	1.282	358/9601	89.93	CAMIAC010000001.1 Streptococcus mitis genome assembly, contig: NODE_1_length_204978_cov_120.810372, whole genome shotgun sequence
trimmed_read1_3001425825-DNA.fastq.gz	gtdb_genomes_reps_r220/database/GCF/946/188/585/GCF_946188585.1_genomic.fna.gz	94.42	0.266	93.62-95.36	0.266	0.19-0.34	1	1.292	329/8349	90.09	NZ_CAMHVI010000001.1 Streptococcus mitis isolate Streptococcus mitis NODE_1_length_551605_cov_126.496499, whole genome shotgun sequence
trimmed_read1_3001425825-DNA.fastq.gz	gtdb_genomes_reps_r220/database/GCF/019/218/685/GCF_019218685.1_genomic.fna.gz	94.41	0.270	93.62-95.33	0.270	0.19-0.34	1	1.220	336/8424	90.13	NZ_JAHUZC010000010.1 Streptococcus vulneris strain DM3B3 NODE_10_length_85275_cov_315.799702, whole genome shotgun sequence
trimmed_read1_3001425825-DNA.fastq.gz	gtdb_genomes_reps_r220/database/GCF/000/222/785/GCF_000222785.1_genomic.fna.gz	94.41	0.262	93.45-95.30	0.262	0.19-0.34	1	1.178	321/8285	90.04	NZ_AFUF01000054.1 Streptococcus mitis SK569 ctg1129913977589, whole genome shotgun sequence
trimmed_read1_3001425825-DNA.fastq.gz	gtdb_genomes_reps_r220/database/GCA/905/202/265/GCA_905202265.1_genomic.fna.gz	94.41	0.193	93.38-95.52	0.193	0.13-0.27	1	1.095	285/9654	89.26	CAJKRE010000001.1 MAG TPA_asm: Bifidobacterium longum isolate ERR1430398-bin.4 genome assembly, contig: NODE_23_length_243841_cov_481.625003, whole genome shotgun sequence
trimmed_read1_3001425825-DNA.fastq.gz	gtdb_genomes_reps_r220/database/GCA/905/221/035/GCA_905221035.1_genomic.fna.gz	94.40	0.258	93.66-95.19	0.258	0.19-0.32	1	1.298	319/8375	90.00	CAJNBP010000001.1 unidentified bacterium isolate Streptococcus species genome assembly, contig: NODE_1_length_294953_cov_49.9758, whole genome shotgun sequence
trimmed_read1_3001425825-DNA.fastq.gz	gtdb_genomes_reps_r220/database/GCA/905/221/105/GCA_905221105.1_genomic.fna.gz	94.40	0.273	93.55-95.36	0.273	0.19-0.36	1	1.276	312/7784	90.14	CAJNBW010000001.1 unidentified bacterium isolate Streptococcus species genome assembly, contig: NODE_1_length_546383_cov_52.4209, whole genome shotgun sequence
trimmed_read1_3001425825-DNA.fastq.gz	gtdb_genomes_reps_r220/database/GCF/028/156/745/GCF_028156745.1_genomic.fna.gz	94.39	0.228	93.54-95.25	0.228	0.17-0.30	1	1.145	282/8273	89.67	NZ_JAODJG010000009.1 Streptococcus gwangjuense strain DP4_6_2 107, whole genome shotgun sequence
trimmed_read1_3001425825-DNA.fastq.gz	gtdb_genomes_reps_r220/database/GCA/905/371/275/GCA_905371275.1_genomic.fna.gz	94.39	0.192	93.28-95.53	0.192	0.12-0.28	1	1.095	252/8641	89.22	CAJPLH010000001.1 MAG: Prevotellaceae bacterium isolate SRR6059114-mag-bin.4 genome assembly, contig: SRR6059114-mag-bin.4_55, whole genome shotgun sequence
trimmed_read1_3001425825-DNA.fastq.gz	gtdb_genomes_reps_r220/database/GCF/022/137/125/GCF_022137125.1_genomic.fna.gz	94.38	0.307	93.67-95.12	0.307	0.22-0.39	1	1.269	361/8173	90.43	NZ_JAKNEQ010000001.1 Streptococcus mitis strain DFI.2.96 NNOOAJHE_1, whole genome shotgun sequence
trimmed_read1_3001425825-DNA.fastq.gz	gtdb_genomes_reps_r220/database/GCF/001/025/215/GCF_001025215.1_genomic.fna.gz	94.38	0.098	92.34-96.38	0.098	0.05-0.20	1	1.047	150/9671	87.42	NZ_AP012330.1 Bifidobacterium pseudocatenulatum DSM 20438 = JCM 1200 = LMG 10505 strain JCM 1200 chromosome, complete genome
trimmed_read1_3001425825-DNA.fastq.gz	gtdb_genomes_reps_r220/database/GCF/001/808/665/GCF_001808665.1_genomic.fna.gz	94.37	0.239	93.41-95.35	0.239	0.16-0.32	1	1.293	321/9115	89.77	NZ_KV794125.1 Streptococcus sp. HMSC070B10 Scaffold0, whole genome shotgun sequence
trimmed_read1_3001425825-DNA.fastq.gz	gtdb_genomes_reps_r220/database/GCF/030/217/725/GCF_030217725.1_genomic.fna.gz	94.37	0.280	93.58-95.19	0.280	0.21-0.35	1	1.279	323/7951	90.18	NZ_JASOOK010000010.1 Streptococcus sp. UMB1203 NODE_10_length_57271_cov_7.437389, whole genome shotgun sequence
trimmed_read1_3001425825-DNA.fastq.gz	gtdb_genomes_reps_r220/database/GCF/001/808/955/GCF_001808955.1_genomic.fna.gz	94.32	0.090	92.63-96.27	0.090	0.04-0.17	1	1.113	142/10004	87.17	NZ_KV795235.1 Rothia sp. HMSC078H08 Scaffold0, whole genome shotgun sequence
trimmed_read1_3001425825-DNA.fastq.gz	gtdb_genomes_reps_r220/database/GCA/927/910/965/GCA_927910965.1_genomic.fna.gz	94.32	0.284	93.60-95.03	0.284	0.22-0.36	1	1.258	360/8896	90.17	CAKMOM010000001.1 MAG TPA_asm: uncultured Streptococcus sp. isolate ERR3827222_bin.1_metaWRAP_v1.1_MAG genome assembly, contig: ERZ4768407.87, whole genome shotgun sequence
trimmed_read1_3001425825-DNA.fastq.gz	gtdb_genomes_reps_r220/database/GCF/946/190/115/GCF_946190115.1_genomic.fna.gz	94.32	0.326	93.60-95.01	0.326	0.25-0.41	1	1.249	385/8454	90.52	NZ_CAMHZG010000001.1 Streptococcus mitis isolate Streptococcus mitis NODE_1_length_220291_cov_95.818490, whole genome shotgun sequence
trimmed_read1_3001425825-DNA.fastq.gz	gtdb_genomes_reps_r220/database/GCF/905/187/535/GCF_905187535.1_genomic.fna.gz	94.31	0.266	93.40-95.29	0.266	0.18-0.35	1	1.256	328/8616	89.99	NZ_CAJJIE010000001.1 Streptococcus mitis isolate Streptococcus mitis, whole genome shotgun sequence
trimmed_read1_3001425825-DNA.fastq.gz	gtdb_genomes_reps_r220/database/GCF/000/222/025/GCF_000222025.1_genomic.fna.gz	94.30	0.251	93.20-95.00	0.251	0.19-0.35	1	1.132	272/7558	89.83	NZ_AFQO01000022.1 Haemophilus haemolyticus M19501 M19501_022, whole genome shotgun sequence
trimmed_read1_3001425825-DNA.fastq.gz	gtdb_genomes_reps_r220/database/GCF/905/187/495/GCF_905187495.1_genomic.fna.gz	94.29	0.325	93.50-95.07	0.325	0.24-0.44	1	1.261	372/8287	90.47	NZ_CAJJIB010000001.1 Streptococcus mitis isolate Streptococcus mitis, whole genome shotgun sequence
trimmed_read1_3001425825-DNA.fastq.gz	gtdb_genomes_reps_r220/database/GCF/001/074/975/GCF_001074975.1_genomic.fna.gz	94.28	0.296	93.49-94.97	0.296	0.22-0.39	1	1.249	370/8932	90.24	NZ_JUUO01000013.1 Streptococcus pseudopneumoniae strain 75_SPSE, whole genome shotgun sequence
trimmed_read1_3001425825-DNA.fastq.gz	gtdb_genomes_reps_r220/database/GCF/001/560/895/GCF_001560895.1_genomic.fna.gz	94.28	0.232	93.32-95.11	0.232	0.17-0.32	1	1.176	290/8692	89.61	NZ_CP014326.1 Streptococcus mitis strain SVGS_061 chromosome, complete genome
trimmed_read1_3001425825-DNA.fastq.gz	gtdb_genomes_reps_r220/database/GCF/003/942/995/GCF_003942995.1_genomic.fna.gz	94.28	0.308	93.54-94.93	0.308	0.23-0.40	1	1.245	383/8973	90.33	NZ_RJOH01000001.1 Streptococcus mitis strain BCC06 D8836_contig001, whole genome shotgun sequence
trimmed_read1_3001425825-DNA.fastq.gz	gtdb_genomes_reps_r220/database/GCF/003/944/325/GCF_003944325.1_genomic.fna.gz	94.27	0.252	93.48-95.20	0.252	0.18-0.33	1	1.240	338/9459	89.81	NZ_RJPX01000001.1 Streptococcus mitis strain BCC17 D8787_contig001, whole genome shotgun sequence
trimmed_read1_3001425825-DNA.fastq.gz	gtdb_genomes_reps_r220/database/GCA/905/221/145/GCA_905221145.1_genomic.fna.gz	94.27	0.269	93.50-95.15	0.269	0.19-0.35	1	1.296	307/8115	89.98	CAJNCA010000001.1 unidentified bacterium isolate Streptococcus species genome assembly, contig: NODE_1_length_542150_cov_74.7743, whole genome shotgun sequence
trimmed_read1_3001425825-DNA.fastq.gz	gtdb_genomes_reps_r220/database/GCA/905/221/235/GCA_905221235.1_genomic.fna.gz	94.25	0.272	93.49-95.17	0.272	0.19-0.35	1	1.273	326/8581	89.99	CAJNCJ010000001.1 unidentified bacterium isolate Streptococcus species genome assembly, contig: NODE_1_length_257994_cov_14.1844, whole genome shotgun sequence
trimmed_read1_3001425825-DNA.fastq.gz	gtdb_genomes_reps_r220/database/GCA/905/221/505/GCA_905221505.1_genomic.fna.gz	94.22	0.279	93.41-95.02	0.279	0.20-0.36	1	1.314	325/8433	90.03	CAJNDL010000001.1 unidentified bacterium isolate Streptococcus species genome assembly, contig: NODE_1_length_223941_cov_38.0438, whole genome shotgun sequence
trimmed_read1_3001425825-DNA.fastq.gz	gtdb_genomes_reps_r220/database/GCF/019/334/805/GCF_019334805.1_genomic.fna.gz	94.21	0.101	92.35-96.19	0.101	0.05-0.20	1	1.048	145/9545	87.37	NZ_CP079822.1 Rothia mucilaginosa strain LPB0405 chromosome, complete genome
trimmed_read1_3001425825-DNA.fastq.gz	gtdb_genomes_reps_r220/database/GCA/019/414/935/GCA_019414935.1_genomic.fna.gz	94.18	0.250	93.19-95.16	0.250	0.17-0.36	1	1.151	239/6922	89.71	DXLD01000001.1 MAG TPA_asm: Streptococcus sp. isolate HRGM_Genome_0315 HRGM_Genome_0315_1, whole genome shotgun sequence
trimmed_read1_3001425825-DNA.fastq.gz	gtdb_genomes_reps_r220/database/GCF/002/860/865/GCF_002860865.1_genomic.fna.gz	94.17	0.302	93.43-94.80	0.302	0.23-0.37	1	1.271	361/8904	90.18	NZ_PKIE01000001.1 Streptococcus mitis strain UMB1341 .21837_8_64.1, whole genome shotgun sequence
trimmed_read1_3001425825-DNA.fastq.gz	gtdb_genomes_reps_r220/database/GCF/003/352/385/GCF_003352385.1_genomic.fna.gz	94.17	0.221	93.13-95.13	0.221	0.15-0.33	1	1.114	263/8521	89.39	NZ_CP031243.1 Haemophilus haemolyticus strain M19346 chromosome, complete genome
trimmed_read1_3001425825-DNA.fastq.gz	gtdb_genomes_reps_r220/database/GCF/006/385/785/GCF_006385785.1_genomic.fna.gz	94.17	0.304	93.36-95.00	0.304	0.22-0.41	1	1.252	353/8626	90.20	NZ_VFSH01000001.1 Streptococcus shenyangsis strain D19 Scaffold1, whole genome shotgun sequence
trimmed_read1_3001425825-DNA.fastq.gz	gtdb_genomes_reps_r220/database/GCF/946/188/695/GCF_946188695.1_genomic.fna.gz	94.17	0.313	93.49-95.01	0.313	0.22-0.40	1	1.285	368/8785	90.27	NZ_CAMHWI010000001.1 Streptococcus mitis isolate Streptococcus mitis NODE_1_length_308064_cov_63.601548, whole genome shotgun sequence
trimmed_read1_3001425825-DNA.fastq.gz	gtdb_genomes_reps_r220/database/GCA/000/430/305/GCA_000430305.1_genomic.fna.gz	94.14	0.280	93.36-95.00	0.280	0.20-0.37	1	1.297	303/8074	89.95	ASZZ01000001.1 Streptococcus mitis 17/34 contig00001, whole genome shotgun sequence
trimmed_read1_3001425825-DNA.fastq.gz	gtdb_genomes_reps_r220/database/GCF/001/281/025/GCF_001281025.1_genomic.fna.gz	94.11	0.326	93.47-94.86	0.326	0.23-0.42	1	1.179	335/7893	90.31	NZ_CP012646.1 Streptococcus mitis strain KCOM 1350 (= ChDC B183) chromosome, complete genome
trimmed_read1_3001425825-DNA.fastq.gz	gtdb_genomes_reps_r220/database/GCF/003/943/935/GCF_003943935.1_genomic.fna.gz	94.11	0.311	93.45-94.87	0.311	0.22-0.39	1	1.302	348/8544	90.19	NZ_RJOB01000001.1 Streptococcus mitis strain BCC45 D8842_contig001, whole genome shotgun sequence
trimmed_read1_3001425825-DNA.fastq.gz	gtdb_genomes_reps_r220/database/GCF/005/844/455/GCF_005844455.1_genomic.fna.gz	94.10	0.239	93.22-95.09	0.239	0.16-0.32	1	1.279	298/9232	89.52	NZ_SPGF01000100.1 Streptococcus mitis strain 1001175st1_H6 NODE_100_length_2854_cov_77.3046, whole genome shotgun sequence
trimmed_read1_3001425825-DNA.fastq.gz	gtdb_genomes_reps_r220/database/GCA/000/385/835/GCA_000385835.1_genomic.fna.gz	94.10	0.313	93.35-94.78	0.313	0.25-0.40	1	1.286	360/8836	90.19	AQTU01000001.1 Streptococcus mitis 13/39 contig00001, whole genome shotgun sequence
trimmed_read1_3001425825-DNA.fastq.gz	gtdb_genomes_reps_r220/database/GCF/946/190/375/GCF_946190375.1_genomic.fna.gz	94.10	0.286	93.37-94.74	0.286	0.23-0.37	1	1.245	359/9452	89.99	NZ_CAMIAF010000001.1 Streptococcus mitis isolate Streptococcus mitis NODE_1_length_232215_cov_64.623009, whole genome shotgun sequence
trimmed_read1_3001425825-DNA.fastq.gz	gtdb_genomes_reps_r220/database/GCA/905/221/085/GCA_905221085.1_genomic.fna.gz	94.09	0.344	93.34-94.80	0.344	0.26-0.44	1	1.270	355/8047	90.42	CAJNBT010000001.1 unidentified bacterium isolate Streptococcus species genome assembly, contig: NODE_1_length_604251_cov_44.5148, whole genome shotgun sequence
trimmed_read1_3001425825-DNA.fastq.gz	gtdb_genomes_reps_r220/database/GCF/002/096/835/GCF_002096835.1_genomic.fna.gz	94.05	0.331	93.26-94.77	0.331	0.25-0.44	1	1.251	334/7905	90.30	NZ_NCVG01000023.1 Streptococcus mitis strain RH_43861_09 s_mitis_RH_43861_09_ID_1, whole genome shotgun sequence
trimmed_read1_3001425825-DNA.fastq.gz	gtdb_genomes_reps_r220/database/GCF/001/457/635/GCF_001457635.1_genomic.fna.gz	94.03	0.262	93.04-94.81	0.262	0.20-0.35	1	1.167	293/8578	89.68	NZ_LN831051.1 Streptococcus pneumoniae strain NCTC7465 chromosome 1, complete sequence
trimmed_read1_3001425825-DNA.fastq.gz	gtdb_genomes_reps_r220/database/GCF/003/493/605/GCF_003493605.1_genomic.fna.gz	94.02	0.288	93.21-94.83	0.288	0.21-0.37	1	1.158	291/7850	89.92	NZ_QQKA01000001.1 Haemophilus haemolyticus strain M19187 M19187_HUY4190A139_cleaned_ctg_3530, whole genome shotgun sequence
trimmed_read1_3001425825-DNA.fastq.gz	gtdb_genomes_reps_r220/database/GCA/905/221/285/GCA_905221285.1_genomic.fna.gz	93.99	0.326	93.27-94.71	0.326	0.24-0.42	1	1.329	346/8485	90.19	CAJNCM010000001.1 unidentified bacterium isolate Streptococcus species genome assembly, contig: NODE_1_length_380604_cov_54.0563, whole genome shotgun sequence
trimmed_read1_3001425825-DNA.fastq.gz	gtdb_genomes_reps_r220/database/GCF/003/493/685/GCF_003493685.1_genomic.fna.gz	93.98	0.232	92.90-94.74	0.232	0.17-0.31	1	1.160	268/8850	89.33	NZ_QQJW01000001.1 Haemophilus haemolyticus strain M26161 M26161_HUY4190A151_cleaned_ctg_3559, whole genome shotgun sequence
trimmed_read1_3001425825-DNA.fastq.gz	gtdb_genomes_reps_r220/database/GCF/026/782/865/GCF_026782865.1_genomic.fna.gz	93.91	0.312	93.07-94.77	0.312	0.23-0.40	1	1.312	308/8047	90.01	NZ_JAKUXK010000010.1 Streptococcus mitis strain B15023435 B15023435_S12_contig_10_consensus, whole genome shotgun sequence
trimmed_read1_3001425825-DNA.fastq.gz	gtdb_genomes_reps_r220/database/GCF/000/722/695/GCF_000722695.1_genomic.fna.gz	93.91	0.278	92.92-94.71	0.278	0.20-0.38	1	1.169	319/9219	89.72	NZ_JPFU01000001.1 Streptococcus mitis strain SK629 gsmSK629.contig.0_1, whole genome shotgun sequence
trimmed_read1_3001425825-DNA.fastq.gz	gtdb_genomes_reps_r220/database/GCF/026/782/895/GCF_026782895.1_genomic.fna.gz	93.89	0.354	93.24-94.48	0.354	0.26-0.45	1	1.258	364/8605	90.30	NZ_JAKUXJ010000010.1 Streptococcus mitis strain D13054009 D13054009_S15_contig_10_consensus, whole genome shotgun sequence
