Sample_file	Genome_file	Adjusted_ANI	Eff_cov	ANI_5-95_percentile	Eff_lambda	Lambda_5-95_percentile	Median_cov	Mean_cov_geq1	Containment_ind	Naive_ANI	Contig_name
trimmed_read1_3001370799-DNA.fastq.gz	gtdb_genomes_reps_r220/database/GCF/000/688/415/GCF_000688415.1_genomic.fna.gz	98.86	0.248	98.50-99.25	0.248	0.22-0.28	1	1.134	1511/9809	94.14	NZ_JIAH01000001.1 Corynebacterium pseudodiphtheriticum DSM 44287 O146DRAFT_scaffold00010.10_C, whole genome shotgun sequence
trimmed_read1_3001370799-DNA.fastq.gz	gtdb_genomes_reps_r220/database/GCF/001/679/005/GCF_001679005.1_genomic.fna.gz	98.31	0.577	98.09-98.55	0.577	0.53-0.63	1	1.341	2542/9834	95.73	NZ_LXTW01000001.1 Moraxella nonliquefaciens strain CCUG 348 contig_1, whole genome shotgun sequence
trimmed_read1_3001370799-DNA.fastq.gz	gtdb_genomes_reps_r220/database/GCF/000/245/815/GCF_000245815.1_genomic.fna.gz	97.50	0.347	97.09-97.96	0.347	0.30-0.41	1	1.194	1047/7821	93.72	NZ_JH601103.1 Dolosigranulum pigrum ATCC 51524 supercont1.1, whole genome shotgun sequence
trimmed_read1_3001370799-DNA.fastq.gz	gtdb_genomes_reps_r220/database/GCF/001/632/285/GCF_001632285.1_genomic.fna.gz	94.87	0.261	94.07-95.89	0.261	0.18-0.34	1	1.272	368/8176	90.48	NZ_LWAH01000001.1 Moraxella catarrhalis strain CCUG 353 contig_1, whole genome shotgun sequence
trimmed_read1_3001370799-DNA.fastq.gz	gtdb_genomes_reps_r220/database/GCF/000/220/085/GCF_000220085.1_genomic.fna.gz	94.71	0.065	91.91-95.72	0.065	0.05-0.15	1	1.032	95/8111	86.64	NZ_AFQV01000034.1 Streptococcus mitis SK1080 ctg1129645366110, whole genome shotgun sequence
trimmed_read1_3001370799-DNA.fastq.gz	gtdb_genomes_reps_r220/database/GCF/015/223/095/GCF_015223095.1_genomic.fna.gz	92.96	0.503	92.47-93.36	0.503	0.42-0.62	1	1.360	481/11687	90.22	NZ_JADFBZ010000001.1 Moraxella sp. K127 Contig_001, whole genome shotgun sequence
trimmed_read1_3001370799-DNA.fastq.gz	gtdb_genomes_reps_r220/database/GCF/030/439/915/GCF_030439915.1_genomic.fna.gz	92.88	0.088	90.58-93.36	0.088	0.08-0.20	1	1.111	72/8418	85.76	NZ_JAQFJG010000010.1 Streptococcus sp. SPS1 NODE_10_length_71805_cov_189.924538, whole genome shotgun sequence
trimmed_read1_3001370799-DNA.fastq.gz	gtdb_genomes_reps_r220/database/GCA/001/113/365/GCA_001113365.1_genomic.fna.gz	92.74	0.083	90.46-93.12	0.083	0.08-0.19	1	1.105	76/9843	85.48	CKYA01000001.1 Streptococcus pneumoniae genome assembly 6823_7#22, scaffold ERS021524SCcontig000001, whole genome shotgun sequence
trimmed_read1_3001370799-DNA.fastq.gz	gtdb_genomes_reps_r220/database/GCF/002/027/545/GCF_002027545.1_genomic.fna.gz	92.67	0.572	92.28-93.04	0.572	0.47-0.69	1	1.359	502/12181	90.22	NZ_MXAN01000001.1 Moraxella lacunata strain CCUG 4441 CCUG_4441T_0000001, whole genome shotgun sequence
trimmed_read1_3001370799-DNA.fastq.gz	gtdb_genomes_reps_r220/database/GCF/001/579/035/GCF_001579035.1_genomic.fna.gz	92.56	0.092	90.48-93.30	0.092	0.08-0.20	1	1.229	70/8717	85.59	NZ_KQ970285.1 Streptococcus mitis strain DD26 scaffold00001, whole genome shotgun sequence
trimmed_read1_3001370799-DNA.fastq.gz	gtdb_genomes_reps_r220/database/GCA/001/347/015/GCA_001347015.1_genomic.fna.gz	92.52	0.090	90.23-93.28	0.090	0.08-0.20	1	1.113	71/9220	85.47	CFGI01000001.1 Streptococcus pneumoniae genome assembly 6938_6#7, scaffold ERS022181SCcontig000001, whole genome shotgun sequence
trimmed_read1_3001370799-DNA.fastq.gz	gtdb_genomes_reps_r220/database/GCF/030/826/625/GCF_030826625.1_genomic.fna.gz	92.48	0.115	90.43-94.08	0.115	0.06-0.22	1	1.075	93/9660	86.09	NZ_JAPJNQ010000054.1 MAG: Corynebacterium sp. isolate RAGGC_12 NODE_1032_length_14664_cov_8.518995, whole genome shotgun sequence
trimmed_read1_3001370799-DNA.fastq.gz	gtdb_genomes_reps_r220/database/GCF/905/187/495/GCF_905187495.1_genomic.fna.gz	91.93	0.105	88.85-92.45	0.105	0.09-0.24	1	1.131	61/8287	85.35	NZ_CAJJIB010000001.1 Streptococcus mitis isolate Streptococcus mitis, whole genome shotgun sequence
trimmed_read1_3001370799-DNA.fastq.gz	gtdb_genomes_reps_r220/database/GCF/946/188/615/GCF_946188615.1_genomic.fna.gz	91.92	0.103	89.45-92.60	0.103	0.09-0.23	1	1.111	63/8605	85.33	NZ_CAMHVK010000001.1 Streptococcus mitis isolate Streptococcus mitis NODE_1_length_383254_cov_94.802522, whole genome shotgun sequence
trimmed_read1_3001370799-DNA.fastq.gz	gtdb_genomes_reps_r220/database/GCF/013/277/205/GCF_013277205.1_genomic.fna.gz	91.92	0.098	89.28-92.32	0.098	0.09-0.22	1	1.123	65/9465	85.16	NZ_VMMO01000001.1 Streptococcus sp. 202 202_S24_L001_R1_001_(paired)_contig_1, whole genome shotgun sequence
trimmed_read1_3001370799-DNA.fastq.gz	gtdb_genomes_reps_r220/database/GCF/000/375/525/GCF_000375525.1_genomic.fna.gz	91.85	0.250	90.57-93.09	0.250	0.16-0.37	1	1.168	167/10520	87.49	NZ_AQXC01000001.1 Corynebacterium propinquum DSM 44285 B142DRAFT_scaffold_0.1_C, whole genome shotgun sequence
trimmed_read1_3001370799-DNA.fastq.gz	gtdb_genomes_reps_r220/database/GCF/946/188/685/GCF_946188685.1_genomic.fna.gz	91.80	0.103	89.50-92.22	0.103	0.09-0.21	1	1.129	62/8937	85.18	NZ_CAMHWH010000001.1 Streptococcus mitis isolate Streptococcus mitis NODE_1_length_368939_cov_97.626665, whole genome shotgun sequence
trimmed_read1_3001370799-DNA.fastq.gz	gtdb_genomes_reps_r220/database/GCF/000/148/545/GCF_000148545.1_genomic.fna.gz	91.75	0.105	89.21-92.26	0.105	0.09-0.23	1	1.131	61/8822	85.18	NZ_AEDV01000108.1 Streptococcus mitis SK597 contigB5, whole genome shotgun sequence
trimmed_read1_3001370799-DNA.fastq.gz	gtdb_genomes_reps_r220/database/GCF/030/232/885/GCF_030232885.1_genomic.fna.gz	91.74	0.291	90.77-92.66	0.291	0.19-0.43	1	1.181	177/10137	87.76	NZ_JASPGD010000010.1 Corynebacterium sp. MSK297 NODE_10_length_83137_cov_46.783265, whole genome shotgun sequence
trimmed_read1_3001370799-DNA.fastq.gz	gtdb_genomes_reps_r220/database/GCF/026/782/895/GCF_026782895.1_genomic.fna.gz	91.72	0.107	89.26-92.32	0.107	0.10-0.23	1	1.133	60/8605	85.20	NZ_JAKUXJ010000010.1 Streptococcus mitis strain D13054009 D13054009_S15_contig_10_consensus, whole genome shotgun sequence
trimmed_read1_3001370799-DNA.fastq.gz	gtdb_genomes_reps_r220/database/GCF/008/763/935/GCF_008763935.1_genomic.fna.gz	91.59	0.121	89.57-93.01	0.121	0.08-0.26	1	1.057	70/9346	85.40	NZ_VTQF01000017.1 Streptococcus mitis strain DE0498 NODE_100_length_5450_cov_55.629293, whole genome shotgun sequence
trimmed_read1_3001370799-DNA.fastq.gz	gtdb_genomes_reps_r220/database/GCF/002/096/855/GCF_002096855.1_genomic.fna.gz	91.54	0.113	89.05-92.19	0.113	0.10-0.24	1	1.140	57/8240	85.18	NZ_NCVH01000033.1 Streptococcus mitis strain RH_17439_08 s_mitis_RH_17439_08_ID_1, whole genome shotgun sequence
trimmed_read1_3001370799-DNA.fastq.gz	gtdb_genomes_reps_r220/database/GCF/009/496/295/GCF_009496295.1_genomic.fna.gz	91.49	0.111	88.89-92.08	0.111	0.10-0.24	1	1.138	58/8682	85.08	NZ_WIJL01000010.1 Streptococcus mitis strain SM15 NODE_10_length_116604_cov_16.980606, whole genome shotgun sequence
trimmed_read1_3001370799-DNA.fastq.gz	gtdb_genomes_reps_r220/database/GCF/946/190/335/GCF_946190335.1_genomic.fna.gz	91.45	0.115	88.79-91.86	0.115	0.11-0.27	1	1.143	56/8196	85.14	NZ_CAMHZN010000001.1 Streptococcus mitis isolate Streptococcus mitis NODE_1_length_678925_cov_140.780463, whole genome shotgun sequence
trimmed_read1_3001370799-DNA.fastq.gz	gtdb_genomes_reps_r220/database/GCA/018/364/455/GCA_018364455.1_genomic.fna.gz	91.30	0.111	89.04-91.98	0.111	0.09-0.24	1	1.053	57/9113	84.90	JAGZLW010000001.1 MAG: Streptococcus mitis isolate L3_114_025G1_dasL3_114_025G1_concoct_29 L3_114_025G1_scaffold_0, whole genome shotgun sequence
trimmed_read1_3001370799-DNA.fastq.gz	gtdb_genomes_reps_r220/database/GCF/000/220/045/GCF_000220045.1_genomic.fna.gz	90.06	0.143	87.65-91.12	0.143	0.12-0.35	1	1.067	45/8681	84.39	NZ_AFQT01000054.1 Streptococcus mitis SK1073 ctg1129645355399, whole genome shotgun sequence
