Sample_file	Genome_file	Adjusted_ANI	Eff_cov	ANI_5-95_percentile	Eff_lambda	Lambda_5-95_percentile	Median_cov	Mean_cov_geq1	Containment_ind	Naive_ANI	Contig_name
trimmed_read1_3001378114-DNA.fastq.gz	gtdb_genomes_reps_r220/database/GCF/000/375/525/GCF_000375525.1_genomic.fna.gz	99.09	1.727	99.02-99.16	1.727	1.65-1.81	2	2.760	6524/10520	98.47	NZ_AQXC01000001.1 Corynebacterium propinquum DSM 44285 B142DRAFT_scaffold_0.1_C, whole genome shotgun sequence
trimmed_read1_3001378114-DNA.fastq.gz	gtdb_genomes_reps_r220/database/GCF/000/245/815/GCF_000245815.1_genomic.fna.gz	97.84	1.754	97.71-97.91	1.754	1.63-1.89	2	2.435	3284/7821	97.24	NZ_JH601103.1 Dolosigranulum pigrum ATCC 51524 supercont1.1, whole genome shotgun sequence
trimmed_read1_3001378114-DNA.fastq.gz	gtdb_genomes_reps_r220/database/GCF/030/232/885/GCF_030232885.1_genomic.fna.gz	94.35	1.967	94.01-94.53	1.967	1.74-2.76	2	2.858	1441/10137	93.90	NZ_JASPGD010000010.1 Corynebacterium sp. MSK297 NODE_10_length_83137_cov_46.783265, whole genome shotgun sequence
trimmed_read1_3001378114-DNA.fastq.gz	gtdb_genomes_reps_r220/database/GCF/000/688/415/GCF_000688415.1_genomic.fna.gz	91.87	3.188	NA-NA	HIGH	NA-NA	3	3.188	708/9809	91.87	NZ_JIAH01000001.1 Corynebacterium pseudodiphtheriticum DSM 44287 O146DRAFT_scaffold00010.10_C, whole genome shotgun sequence
trimmed_read1_3001378114-DNA.fastq.gz	gtdb_genomes_reps_r220/database/GCF/030/826/625/GCF_030826625.1_genomic.fna.gz	91.34	2.859	NA-NA	HIGH	NA-NA	3	2.859	583/9660	91.34	NZ_JAPJNQ010000054.1 MAG: Corynebacterium sp. isolate RAGGC_12 NODE_1032_length_14664_cov_8.518995, whole genome shotgun sequence
