trimmed_read1_3001328919-DNA.fastq.gz	gtdb_genomes_reps_r220/database/GCA/905/221/035/GCA_905221035.1_genomic.fna.gz	93.31	0.429	92.65-93.86	0.429	0.33-0.55	1	1.295	342/8375	90.20	CAJNBP010000001.1 unidentified bacterium isolate Streptococcus species genome assembly, contig: NODE_1_length_294953_cov_49.9758, whole genome shotgun sequence
trimmed_read1_3001328919-DNA.fastq.gz	gtdb_genomes_reps_r220/database/GCF/001/070/815/GCF_001070815.1_genomic.fna.gz	93.30	0.414	92.60-93.94	0.414	0.30-0.52	1	1.226	318/8046	90.10	NZ_JVLX01000006.1 Streptococcus pseudopneumoniae strain 315_SPSE, whole genome shotgun sequence
trimmed_read1_3001328919-DNA.fastq.gz	gtdb_genomes_reps_r220/database/GCF/946/190/065/GCF_946190065.1_genomic.fna.gz	93.30	0.372	92.51-93.91	0.372	0.27-0.49	1	1.293	328/8981	89.87	NZ_CAMHZD010000001.1 Streptococcus mitis isolate Streptococcus mitis NODE_1_length_218173_cov_162.355963, whole genome shotgun sequence
trimmed_read1_3001328919-DNA.fastq.gz	gtdb_genomes_reps_r220/database/GCA/001/914/195/GCA_001914195.1_genomic.fna.gz	93.30	0.475	92.66-93.77	0.475	0.37-0.61	1	1.275	382/8685	90.41	MKYF01000030.1 MAG: Streptococcus mitis isolate 0123W_40_11 0123W_scaffold_1041, whole genome shotgun sequence
trimmed_read1_3001328919-DNA.fastq.gz	gtdb_genomes_reps_r220/database/GCF/000/722/685/GCF_000722685.1_genomic.fna.gz	93.29	0.353	92.49-93.95	0.353	0.26-0.45	1	1.220	304/8785	89.72	NZ_JPFV01000001.1 Streptococcus mitis strain SK667 gsmSK667.contig.0_1, whole genome shotgun sequence
trimmed_read1_3001328919-DNA.fastq.gz	gtdb_genomes_reps_r220/database/GCA/905/221/545/GCA_905221545.1_genomic.fna.gz	93.29	0.450	92.60-93.88	0.450	0.34-0.58	1	1.324	339/8034	90.29	CAJNDO010000001.1 unidentified bacterium isolate Streptococcus species genome assembly, contig: NODE_1_length_233977_cov_53.6585, whole genome shotgun sequence
trimmed_read1_3001328919-DNA.fastq.gz	gtdb_genomes_reps_r220/database/GCA/927/911/355/GCA_927911355.1_genomic.fna.gz	93.29	0.446	92.65-93.83	0.446	0.34-0.56	1	1.223	291/6958	90.27	CAKMPG010000001.1 MAG TPA_asm: Streptococcus mitis isolate ERR3827238_bin.2_metaWRAP_v1.1_MAG genome assembly, contig: ERZ4768210.2, whole genome shotgun sequence
trimmed_read1_3001328919-DNA.fastq.gz	gtdb_genomes_reps_r220/database/GCF/003/942/775/GCF_003942775.1_genomic.fna.gz	93.27	0.427	92.65-93.77	0.427	0.34-0.53	1	1.261	357/8873	90.15	NZ_RJNX01000001.1 Streptococcus mitis strain BCC65 D8848_contig001, whole genome shotgun sequence
trimmed_read1_3001328919-DNA.fastq.gz	gtdb_genomes_reps_r220/database/GCF/003/942/995/GCF_003942995.1_genomic.fna.gz	93.26	0.439	92.59-93.78	0.439	0.35-0.55	1	1.274	368/8973	90.21	NZ_RJOH01000001.1 Streptococcus mitis strain BCC06 D8836_contig001, whole genome shotgun sequence
trimmed_read1_3001328919-DNA.fastq.gz	gtdb_genomes_reps_r220/database/GCF/002/096/735/GCF_002096735.1_genomic.fna.gz	93.26	0.489	92.59-93.74	0.489	0.39-0.61	1	1.301	369/8264	90.46	NZ_NCVC01000017.1 Streptococcus mitis strain RH_8961_10 s_mitis_RH_8961_10_ID_1, whole genome shotgun sequence
trimmed_read1_3001328919-DNA.fastq.gz	gtdb_genomes_reps_r220/database/GCF/003/943/935/GCF_003943935.1_genomic.fna.gz	93.26	0.403	92.59-93.90	0.403	0.31-0.50	1	1.281	327/8544	90.01	NZ_RJOB01000001.1 Streptococcus mitis strain BCC45 D8842_contig001, whole genome shotgun sequence
trimmed_read1_3001328919-DNA.fastq.gz	gtdb_genomes_reps_r220/database/GCF/019/929/545/GCF_019929545.1_genomic.fna.gz	93.26	0.438	92.60-93.83	0.438	0.34-0.55	1	1.298	342/8371	90.20	NZ_JAHZPT010000001.1 Streptococcus mitis strain CR123 Smitis_CR123_NinaOddballs_Sia_NO_1, whole genome shotgun sequence
trimmed_read1_3001328919-DNA.fastq.gz	gtdb_genomes_reps_r220/database/GCF/013/277/115/GCF_013277115.1_genomic.fna.gz	93.24	0.403	92.59-94.06	0.403	0.30-0.51	1	1.293	317/8331	89.99	NZ_VMMH01000001.1 Streptococcus sp. 714 714_S30_L001_R1_001_(paired)_contig_1, whole genome shotgun sequence
trimmed_read1_3001328919-DNA.fastq.gz	gtdb_genomes_reps_r220/database/GCF/020/089/495/GCF_020089495.2_genomic.fna.gz	93.23	0.438	92.55-93.81	0.438	0.34-0.56	1	1.299	344/8470	90.18	NZ_JAIRCA020000001.1 Streptococcus sp. IMAU 99199 IMAU99199, whole genome shotgun sequence
trimmed_read1_3001328919-DNA.fastq.gz	gtdb_genomes_reps_r220/database/GCA/946/190/245/GCA_946190245.1_genomic.fna.gz	93.21	0.422	92.58-93.68	0.422	0.34-0.53	1	1.290	376/9601	90.08	CAMIAC010000001.1 Streptococcus mitis genome assembly, contig: NODE_1_length_204978_cov_120.810372, whole genome shotgun sequence
trimmed_read1_3001328919-DNA.fastq.gz	gtdb_genomes_reps_r220/database/GCA/905/221/165/GCA_905221165.1_genomic.fna.gz	93.21	0.427	92.63-93.84	0.427	0.33-0.53	1	1.296	307/7799	90.09	CAJNCC010000001.1 unidentified bacterium isolate Streptococcus species genome assembly, contig: NODE_1_length_337881_cov_61.2048, whole genome shotgun sequence
trimmed_read1_3001328919-DNA.fastq.gz	gtdb_genomes_reps_r220/database/GCF/946/190/325/GCF_946190325.1_genomic.fna.gz	93.20	0.440	92.48-93.83	0.440	0.34-0.56	1	1.296	335/8293	90.17	NZ_CAMHZR010000001.1 Streptococcus mitis isolate Streptococcus mitis NODE_1_length_621990_cov_122.773401, whole genome shotgun sequence
trimmed_read1_3001328919-DNA.fastq.gz	gtdb_genomes_reps_r220/database/GCF/946/188/375/GCF_946188375.1_genomic.fna.gz	93.20	0.414	92.59-93.72	0.414	0.33-0.52	1	1.272	338/8818	90.01	NZ_CAMHUS010000001.1 Streptococcus mitis isolate Streptococcus mitis NODE_1_length_514561_cov_115.905146, whole genome shotgun sequence
trimmed_read1_3001328919-DNA.fastq.gz	gtdb_genomes_reps_r220/database/GCF/009/496/295/GCF_009496295.1_genomic.fna.gz	93.19	0.495	92.58-93.82	0.495	0.41-0.61	1	1.306	382/8682	90.41	NZ_WIJL01000010.1 Streptococcus mitis strain SM15 NODE_10_length_116604_cov_16.980606, whole genome shotgun sequence
trimmed_read1_3001328919-DNA.fastq.gz	gtdb_genomes_reps_r220/database/GCA/905/221/065/GCA_905221065.1_genomic.fna.gz	93.19	0.427	92.52-93.79	0.427	0.34-0.53	1	1.308	321/8205	90.07	CAJNBS010000001.1 unidentified bacterium isolate Streptococcus species genome assembly, contig: NODE_1_length_331008_cov_48.2727, whole genome shotgun sequence
trimmed_read1_3001328919-DNA.fastq.gz	gtdb_genomes_reps_r220/database/GCF/002/096/835/GCF_002096835.1_genomic.fna.gz	93.18	0.433	92.36-93.93	0.433	0.32-0.59	1	1.314	312/7905	90.10	NZ_NCVG01000023.1 Streptococcus mitis strain RH_43861_09 s_mitis_RH_43861_09_ID_1, whole genome shotgun sequence
trimmed_read1_3001328919-DNA.fastq.gz	gtdb_genomes_reps_r220/database/GCA/905/221/095/GCA_905221095.1_genomic.fna.gz	93.18	0.443	92.53-93.73	0.443	0.34-0.57	1	1.306	340/8478	90.14	CAJNBV010000001.1 unidentified bacterium isolate Streptococcus species genome assembly, contig: NODE_1_length_337823_cov_51.8384, whole genome shotgun sequence
trimmed_read1_3001328919-DNA.fastq.gz	gtdb_genomes_reps_r220/database/GCA/905/221/225/GCA_905221225.1_genomic.fna.gz	93.17	0.465	92.52-93.80	0.465	0.36-0.59	1	1.335	337/8095	90.25	CAJNCH010000001.1 unidentified bacterium isolate Streptococcus species genome assembly, contig: NODE_1_length_211129_cov_38.585, whole genome shotgun sequence
trimmed_read1_3001328919-DNA.fastq.gz	gtdb_genomes_reps_r220/database/GCF/001/074/975/GCF_001074975.1_genomic.fna.gz	93.17	0.435	92.37-93.67	0.435	0.35-0.57	1	1.314	353/8932	90.10	NZ_JUUO01000013.1 Streptococcus pseudopneumoniae strain 75_SPSE, whole genome shotgun sequence
trimmed_read1_3001328919-DNA.fastq.gz	gtdb_genomes_reps_r220/database/GCA/000/385/835/GCA_000385835.1_genomic.fna.gz	93.17	0.425	92.50-93.69	0.425	0.34-0.53	1	1.284	342/8836	90.04	AQTU01000001.1 Streptococcus mitis 13/39 contig00001, whole genome shotgun sequence
trimmed_read1_3001328919-DNA.fastq.gz	gtdb_genomes_reps_r220/database/GCF/946/902/915/GCF_946902915.1_genomic.fna.gz	93.16	0.280	92.19-93.92	0.280	0.20-0.40	1	1.158	240/8827	89.02	NZ_CAMPPY010000001.1 Streptococcus sp. Marseille-Q5986 contig00001, whole genome shotgun sequence
trimmed_read1_3001328919-DNA.fastq.gz	gtdb_genomes_reps_r220/database/GCF/946/188/585/GCF_946188585.1_genomic.fna.gz	93.12	0.402	92.42-93.76	0.402	0.30-0.50	1	1.282	305/8349	89.87	NZ_CAMHVI010000001.1 Streptococcus mitis isolate Streptococcus mitis NODE_1_length_551605_cov_126.496499, whole genome shotgun sequence
trimmed_read1_3001328919-DNA.fastq.gz	gtdb_genomes_reps_r220/database/GCF/016/658/865/GCF_016658865.1_genomic.fna.gz	93.11	0.377	92.37-93.85	0.377	0.27-0.49	1	1.231	295/8594	89.69	NZ_CP067992.1 Streptococcus mitis strain S022-V7-A3 chromosome, complete genome
trimmed_read1_3001328919-DNA.fastq.gz	gtdb_genomes_reps_r220/database/GCA/905/221/185/GCA_905221185.1_genomic.fna.gz	93.11	0.463	92.48-93.70	0.463	0.36-0.60	1	1.327	342/8418	90.18	CAJNCE010000001.1 unidentified bacterium isolate Streptococcus species genome assembly, contig: NODE_1_length_320457_cov_53.7269, whole genome shotgun sequence
trimmed_read1_3001328919-DNA.fastq.gz	gtdb_genomes_reps_r220/database/GCF/003/942/685/GCF_003942685.1_genomic.fna.gz	93.10	0.459	92.44-93.62	0.459	0.36-0.58	1	1.307	352/8731	90.16	NZ_RJNR01000001.1 Streptococcus mitis strain BCA12 D8855_contig001, whole genome shotgun sequence
trimmed_read1_3001328919-DNA.fastq.gz	gtdb_genomes_reps_r220/database/GCA/905/221/205/GCA_905221205.1_genomic.fna.gz	93.09	0.405	92.30-93.74	0.405	0.30-0.53	1	1.297	303/8340	89.86	CAJNCG010000001.1 unidentified bacterium isolate Streptococcus species genome assembly, contig: NODE_1_length_670333_cov_54.9381, whole genome shotgun sequence
trimmed_read1_3001328919-DNA.fastq.gz	gtdb_genomes_reps_r220/database/GCF/026/782/865/GCF_026782865.1_genomic.fna.gz	93.07	0.440	92.44-93.66	0.440	0.34-0.56	1	1.294	310/8047	90.03	NZ_JAKUXK010000010.1 Streptococcus mitis strain B15023435 B15023435_S12_contig_10_consensus, whole genome shotgun sequence
trimmed_read1_3001328919-DNA.fastq.gz	gtdb_genomes_reps_r220/database/GCA/905/221/375/GCA_905221375.1_genomic.fna.gz	93.05	0.443	92.31-93.69	0.443	0.34-0.56	1	1.306	340/8833	90.03	CAJNCY010000001.1 unidentified bacterium isolate Streptococcus species genome assembly, contig: NODE_1_length_291870_cov_37.7718, whole genome shotgun sequence
trimmed_read1_3001328919-DNA.fastq.gz	gtdb_genomes_reps_r220/database/GCA/000/430/305/GCA_000430305.1_genomic.fna.gz	93.05	0.434	92.19-93.71	0.434	0.33-0.57	1	1.317	306/8074	89.98	ASZZ01000001.1 Streptococcus mitis 17/34 contig00001, whole genome shotgun sequence
trimmed_read1_3001328919-DNA.fastq.gz	gtdb_genomes_reps_r220/database/GCF/000/220/045/GCF_000220045.1_genomic.fna.gz	93.05	0.406	92.32-93.65	0.406	0.34-0.51	1	1.225	311/8681	89.82	NZ_AFQT01000054.1 Streptococcus mitis SK1073 ctg1129645355399, whole genome shotgun sequence
trimmed_read1_3001328919-DNA.fastq.gz	gtdb_genomes_reps_r220/database/GCF/026/782/895/GCF_026782895.1_genomic.fna.gz	93.05	0.483	92.40-93.61	0.483	0.38-0.62	1	1.314	354/8605	90.22	NZ_JAKUXJ010000010.1 Streptococcus mitis strain D13054009 D13054009_S15_contig_10_consensus, whole genome shotgun sequence
trimmed_read1_3001328919-DNA.fastq.gz	gtdb_genomes_reps_r220/database/GCA/019/414/935/GCA_019414935.1_genomic.fna.gz	93.04	0.408	92.30-93.75	0.408	0.28-0.53	1	1.218	248/6922	89.82	DXLD01000001.1 MAG TPA_asm: Streptococcus sp. isolate HRGM_Genome_0315 HRGM_Genome_0315_1, whole genome shotgun sequence
trimmed_read1_3001328919-DNA.fastq.gz	gtdb_genomes_reps_r220/database/GCF/946/190/375/GCF_946190375.1_genomic.fna.gz	93.02	0.449	92.39-93.57	0.449	0.35-0.58	1	1.322	366/9452	90.04	NZ_CAMIAF010000001.1 Streptococcus mitis isolate Streptococcus mitis NODE_1_length_232215_cov_64.623009, whole genome shotgun sequence
trimmed_read1_3001328919-DNA.fastq.gz	gtdb_genomes_reps_r220/database/GCF/905/187/495/GCF_905187495.1_genomic.fna.gz	93.01	0.502	92.35-93.68	0.502	0.39-0.65	1	1.311	347/8287	90.27	NZ_CAJJIB010000001.1 Streptococcus mitis isolate Streptococcus mitis, whole genome shotgun sequence
trimmed_read1_3001328919-DNA.fastq.gz	gtdb_genomes_reps_r220/database/GCA/905/221/195/GCA_905221195.1_genomic.fna.gz	93.01	0.414	92.40-93.77	0.414	0.29-0.52	1	1.322	295/8196	89.83	CAJNCF010000001.1 unidentified bacterium isolate Streptococcus species genome assembly, contig: NODE_1_length_351178_cov_24.3909, whole genome shotgun sequence
trimmed_read1_3001328919-DNA.fastq.gz	gtdb_genomes_reps_r220/database/GCF/915/066/115/GCF_915066115.1_genomic.fna.gz	93.00	0.416	92.34-93.68	0.416	0.33-0.52	1	1.221	280/7792	89.83	NZ_CAJZDT010000001.1 MAG: uncultured Streptococcus sp. isolate SRR1045100_bin.1_metaWRAP_v1.1_MAG, whole genome shotgun sequence
trimmed_read1_3001328919-DNA.fastq.gz	gtdb_genomes_reps_r220/database/GCF/009/496/155/GCF_009496155.1_genomic.fna.gz	93.00	0.447	92.36-93.51	0.447	0.37-0.55	1	1.293	352/9227	90.00	NZ_WIJP01000010.1 Streptococcus mitis strain SM10 NODE_10_length_108696_cov_24.038307, whole genome shotgun sequence
trimmed_read1_3001328919-DNA.fastq.gz	gtdb_genomes_reps_r220/database/GCF/002/096/855/GCF_002096855.1_genomic.fna.gz	93.00	0.513	92.33-93.45	0.513	0.41-0.66	1	1.309	350/8240	90.31	NZ_NCVH01000033.1 Streptococcus mitis strain RH_17439_08 s_mitis_RH_17439_08_ID_1, whole genome shotgun sequence
trimmed_read1_3001328919-DNA.fastq.gz	gtdb_genomes_reps_r220/database/GCF/000/257/905/GCF_000257905.1_genomic.fna.gz	93.00	0.454	92.36-93.66	0.454	0.34-0.57	1	1.309	327/8469	90.03	NZ_AJJL01000001.1 Streptococcus mitis SK579 contig00033, whole genome shotgun sequence
trimmed_read1_3001328919-DNA.fastq.gz	gtdb_genomes_reps_r220/database/GCF/001/076/775/GCF_001076775.1_genomic.fna.gz	92.98	0.419	92.33-93.49	0.419	0.34-0.52	1	1.234	316/8803	89.82	NZ_JVGV01000002.1 Streptococcus pseudopneumoniae strain 445_SPSE 160_1845_293894, whole genome shotgun sequence
trimmed_read1_3001328919-DNA.fastq.gz	gtdb_genomes_reps_r220/database/GCF/005/144/795/GCF_005144795.1_genomic.fna.gz	92.97	0.436	92.36-93.61	0.436	0.33-0.53	1	1.283	314/8446	89.92	NZ_SWFJ01000010.1 Streptococcus mitis strain ColumbLawn NODE_10_length_101543_cov_167.293110, whole genome shotgun sequence
trimmed_read1_3001328919-DNA.fastq.gz	gtdb_genomes_reps_r220/database/GCF/022/137/125/GCF_022137125.1_genomic.fna.gz	92.96	0.492	92.32-93.62	0.492	0.38-0.63	1	1.335	331/8173	90.17	NZ_JAKNEQ010000001.1 Streptococcus mitis strain DFI.2.96 NNOOAJHE_1, whole genome shotgun sequence
trimmed_read1_3001328919-DNA.fastq.gz	gtdb_genomes_reps_r220/database/GCF/003/942/765/GCF_003942765.1_genomic.fna.gz	92.95	0.455	92.24-93.63	0.455	0.34-0.59	1	1.332	334/8775	89.99	NZ_RJNW01000001.1 Streptococcus mitis strain KLC01 D8849_contig001, whole genome shotgun sequence
trimmed_read1_3001328919-DNA.fastq.gz	gtdb_genomes_reps_r220/database/GCF/009/496/085/GCF_009496085.1_genomic.fna.gz	92.95	0.451	92.24-93.62	0.451	0.35-0.60	1	1.284	341/9024	89.97	NZ_WIJN01000100.1 Streptococcus mitis strain SM13 NODE_100_length_642_cov_0.945631, whole genome shotgun sequence
trimmed_read1_3001328919-DNA.fastq.gz	gtdb_genomes_reps_r220/database/GCF/006/384/255/GCF_006384255.1_genomic.fna.gz	92.95	0.229	91.82-94.24	0.229	0.15-0.34	1	1.162	191/8908	88.34	NZ_VCED01000001.1 Haemophilus seminalis strain SZY H1 Scaffold1, whole genome shotgun sequence
trimmed_read1_3001328919-DNA.fastq.gz	gtdb_genomes_reps_r220/database/GCF/023/110/375/GCF_023110375.1_genomic.fna.gz	92.94	0.469	92.28-93.44	0.469	0.37-0.59	1	1.282	330/8511	90.05	NZ_JALDVV010000010.1 Streptococcus mitis strain O7-1 NODE_10_length_62925_cov_19.542213, whole genome shotgun sequence
trimmed_read1_3001328919-DNA.fastq.gz	gtdb_genomes_reps_r220/database/GCF/946/188/615/GCF_946188615.1_genomic.fna.gz	92.93	0.475	92.29-93.52	0.475	0.37-0.59	1	1.303	337/8605	90.08	NZ_CAMHVK010000001.1 Streptococcus mitis isolate Streptococcus mitis NODE_1_length_383254_cov_94.802522, whole genome shotgun sequence
trimmed_read1_3001328919-DNA.fastq.gz	gtdb_genomes_reps_r220/database/GCF/901/542/415/GCF_901542415.1_genomic.fna.gz	92.92	0.434	92.20-93.55	0.434	0.34-0.56	1	1.251	315/8708	89.85	NZ_CABEHV010000001.1 Streptococcus mitis strain NCTC11189, whole genome shotgun sequence
trimmed_read1_3001328919-DNA.fastq.gz	gtdb_genomes_reps_r220/database/GCF/000/722/695/GCF_000722695.1_genomic.fna.gz	92.90	0.398	92.00-93.50	0.398	0.32-0.53	1	1.214	309/9219	89.62	NZ_JPFU01000001.1 Streptococcus mitis strain SK629 gsmSK629.contig.0_1, whole genome shotgun sequence
trimmed_read1_3001328919-DNA.fastq.gz	gtdb_genomes_reps_r220/database/GCF/002/096/925/GCF_002096925.1_genomic.fna.gz	92.89	0.466	92.21-93.46	0.466	0.37-0.59	1	1.292	322/8477	89.99	NZ_NCVN01000085.1 Streptococcus mitis strain B_009152_10 s_mitis_RS_009152_10_ID_1, whole genome shotgun sequence
trimmed_read1_3001328919-DNA.fastq.gz	gtdb_genomes_reps_r220/database/GCA/902/482/895/GCA_902482895.1_genomic.fna.gz	92.89	0.443	92.12-93.48	0.443	0.36-0.58	1	1.244	279/7666	89.86	CABTAV010000001.1 MAG TPA_asm: uncultured Streptococcus sp. isolate MGYG-HGUT-03136 genome assembly, contig: GUT_GENOME207866_1, whole genome shotgun sequence
trimmed_read1_3001328919-DNA.fastq.gz	gtdb_genomes_reps_r220/database/GCF/008/763/935/GCF_008763935.1_genomic.fna.gz	92.89	0.487	92.27-93.42	0.487	0.38-0.61	1	1.306	366/9346	90.08	NZ_VTQF01000017.1 Streptococcus mitis strain DE0498 NODE_100_length_5450_cov_55.629293, whole genome shotgun sequence
trimmed_read1_3001328919-DNA.fastq.gz	gtdb_genomes_reps_r220/database/GCF/003/942/965/GCF_003942965.1_genomic.fna.gz	92.88	0.475	92.29-93.37	0.475	0.37-0.59	1	1.305	308/8015	90.02	NZ_RJOG01000001.1 Streptococcus mitis strain BCC07 D8837_contig001, whole genome shotgun sequence
trimmed_read1_3001328919-DNA.fastq.gz	gtdb_genomes_reps_r220/database/GCA/001/752/465/GCA_001752465.1_genomic.fna.gz	92.88	0.336	91.96-93.68	0.336	0.25-0.44	1	1.267	266/9119	89.22	MDJB01000001.1 Haemophilus quentini strain K068 K068_S8_L001_R1_001_(paired)_contig_1, whole genome shotgun sequence
trimmed_read1_3001328919-DNA.fastq.gz	gtdb_genomes_reps_r220/database/GCF/030/217/725/GCF_030217725.1_genomic.fna.gz	92.87	0.489	92.23-93.49	0.489	0.39-0.61	1	1.314	312/7951	90.08	NZ_JASOOK010000010.1 Streptococcus sp. UMB1203 NODE_10_length_57271_cov_7.437389, whole genome shotgun sequence
trimmed_read1_3001328919-DNA.fastq.gz	gtdb_genomes_reps_r220/database/GCF/946/190/045/GCF_946190045.1_genomic.fna.gz	92.87	0.433	92.18-93.46	0.433	0.33-0.56	1	1.298	299/8370	89.81	NZ_CAMHYY010000001.1 Streptococcus mitis isolate Streptococcus mitis NODE_1_length_333422_cov_157.319918, whole genome shotgun sequence
trimmed_read1_3001328919-DNA.fastq.gz	gtdb_genomes_reps_r220/database/GCF/002/096/755/GCF_002096755.1_genomic.fna.gz	92.87	0.526	92.23-93.38	0.526	0.42-0.66	1	1.313	364/8803	90.23	NZ_NCVF01000026.1 Streptococcus mitis strain RH_50275_09 s_mitis_RH_50275_09_ID_1, whole genome shotgun sequence
trimmed_read1_3001328919-DNA.fastq.gz	gtdb_genomes_reps_r220/database/GCF/023/110/245/GCF_023110245.1_genomic.fna.gz	92.86	0.488	92.22-93.45	0.488	0.37-0.63	1	1.318	330/8455	90.07	NZ_JALDVR010000010.1 Streptococcus mitis strain S03 NODE_10_length_52279_cov_241.670492, whole genome shotgun sequence
trimmed_read1_3001328919-DNA.fastq.gz	gtdb_genomes_reps_r220/database/GCF/002/238/115/GCF_002238115.1_genomic.fna.gz	92.86	0.438	92.12-93.49	0.438	0.35-0.56	1	1.298	342/9550	89.82	NZ_NGVM01000099.1 Streptococcus sp. KR NODE_100_length_653_cov_34.199, whole genome shotgun sequence
trimmed_read1_3001328919-DNA.fastq.gz	gtdb_genomes_reps_r220/database/GCF/006/385/165/GCF_006385165.1_genomic.fna.gz	92.86	0.449	92.19-93.47	0.449	0.36-0.57	1	1.243	259/7122	89.86	NZ_VFJA01000001.1 Streptococcus symci strain C17 Scaffold1, whole genome shotgun sequence
trimmed_read1_3001328919-DNA.fastq.gz	gtdb_genomes_reps_r220/database/GCF/019/218/685/GCF_019218685.1_genomic.fna.gz	92.86	0.471	92.21-93.41	0.471	0.36-0.60	1	1.323	319/8424	89.98	NZ_JAHUZC010000010.1 Streptococcus vulneris strain DM3B3 NODE_10_length_85275_cov_315.799702, whole genome shotgun sequence
trimmed_read1_3001328919-DNA.fastq.gz	gtdb_genomes_reps_r220/database/GCF/023/109/515/GCF_023109515.1_genomic.fna.gz	92.85	0.553	92.18-93.35	0.553	0.44-0.69	1	1.320	369/8654	90.32	NZ_JALDUM010000010.1 Streptococcus mitis strain S39 NODE_10_length_3920_cov_103.945149, whole genome shotgun sequence
trimmed_read1_3001328919-DNA.fastq.gz	gtdb_genomes_reps_r220/database/GCF/946/188/695/GCF_946188695.1_genomic.fna.gz	92.84	0.510	92.19-93.44	0.510	0.40-0.67	1	1.329	353/8785	90.15	NZ_CAMHWI010000001.1 Streptococcus mitis isolate Streptococcus mitis NODE_1_length_308064_cov_63.601548, whole genome shotgun sequence
trimmed_read1_3001328919-DNA.fastq.gz	gtdb_genomes_reps_r220/database/GCA/905/221/455/GCA_905221455.1_genomic.fna.gz	92.84	0.461	92.15-93.49	0.461	0.36-0.61	1	1.309	317/8554	89.92	CAJNDF010000001.1 unidentified bacterium isolate Streptococcus species genome assembly, contig: NODE_1_length_328888_cov_49.2012, whole genome shotgun sequence
trimmed_read1_3001328919-DNA.fastq.gz	gtdb_genomes_reps_r220/database/GCF/005/844/455/GCF_005844455.1_genomic.fna.gz	92.84	0.426	92.13-93.45	0.426	0.33-0.54	1	1.302	321/9232	89.73	NZ_SPGF01000100.1 Streptococcus mitis strain 1001175st1_H6 NODE_100_length_2854_cov_77.3046, whole genome shotgun sequence
trimmed_read1_3001328919-DNA.fastq.gz	gtdb_genomes_reps_r220/database/GCF/023/109/105/GCF_023109105.1_genomic.fna.gz	92.82	0.444	92.17-93.45	0.444	0.34-0.57	1	1.287	300/8403	89.81	NZ_JALDTZ010000010.1 Streptococcus mitis strain S61 NODE_10_length_74443_cov_182.654775, whole genome shotgun sequence
trimmed_read1_3001328919-DNA.fastq.gz	gtdb_genomes_reps_r220/database/GCF/028/156/745/GCF_028156745.1_genomic.fna.gz	92.81	0.434	92.08-93.47	0.434	0.33-0.56	1	1.263	289/8273	89.74	NZ_JAODJG010000009.1 Streptococcus gwangjuense strain DP4_6_2 107, whole genome shotgun sequence
trimmed_read1_3001328919-DNA.fastq.gz	gtdb_genomes_reps_r220/database/GCF/000/960/005/GCF_000960005.1_genomic.fna.gz	92.81	0.484	92.13-93.35	0.484	0.38-0.61	1	1.244	311/8198	89.98	NZ_JYGP01000001.1 Streptococcus mitis strain OT25 TZ90_contig000001, whole genome shotgun sequence
trimmed_read1_3001328919-DNA.fastq.gz	gtdb_genomes_reps_r220/database/GCF/000/187/745/GCF_000187745.1_genomic.fna.gz	92.80	0.478	92.17-93.24	0.478	0.39-0.60	1	1.274	351/9331	89.96	NZ_GL732486.1 Streptococcus sp. M334 supercont1.1, whole genome shotgun sequence
trimmed_read1_3001328919-DNA.fastq.gz	gtdb_genomes_reps_r220/database/GCA/943/914/425/GCA_943914425.1_genomic.fna.gz	92.79	0.408	92.05-93.60	0.408	0.30-0.53	1	1.214	248/7525	89.58	CALUBZ010000001.1 MAG: uncultured Streptococcus sp. isolate aroCPJTBUv_bin.11.MAG genome assembly, contig: NODE_96_length_79274_cov_20.784913, whole genome shotgun sequence
trimmed_read1_3001328919-DNA.fastq.gz	gtdb_genomes_reps_r220/database/GCF/000/722/755/GCF_000722755.1_genomic.fna.gz	92.77	0.453	92.06-93.25	0.453	0.36-0.59	1	1.229	310/8714	89.80	NZ_JPFY01000001.1 Streptococcus mitis strain SK578 gsmSK578.contig.0_1, whole genome shotgun sequence
trimmed_read1_3001328919-DNA.fastq.gz	gtdb_genomes_reps_r220/database/GCF/002/871/495/GCF_002871495.1_genomic.fna.gz	92.75	0.402	92.06-93.38	0.402	0.29-0.51	1	1.293	311/9651	89.51	NZ_PNGD01000001.1 Streptococcus sp. UMB0029 ERR1203613.17957_1_25.1, whole genome shotgun sequence
trimmed_read1_3001328919-DNA.fastq.gz	gtdb_genomes_reps_r220/database/GCF/001/650/315/GCF_001650315.1_genomic.fna.gz	92.74	0.515	92.09-93.21	0.515	0.41-0.66	1	1.309	320/8172	90.08	NZ_LVJM01000001.1 Streptococcus sp. CCUG 49591 contig_1, whole genome shotgun sequence
trimmed_read1_3001328919-DNA.fastq.gz	gtdb_genomes_reps_r220/database/GCF/946/190/145/GCF_946190145.1_genomic.fna.gz	92.73	0.452	91.99-93.28	0.452	0.36-0.58	1	1.290	321/9123	89.77	NZ_CAMHZM010000001.1 Streptococcus mitis isolate Streptococcus mitis NODE_1_length_492142_cov_74.508555, whole genome shotgun sequence
trimmed_read1_3001328919-DNA.fastq.gz	gtdb_genomes_reps_r220/database/GCF/003/626/515/GCF_003626515.1_genomic.fna.gz	92.71	0.500	92.06-93.31	0.500	0.39-0.64	1	1.323	313/8292	89.97	NZ_RBCK01000001.1 Streptococcus chosunense strain ChDC B353 KCOM1699_1, whole genome shotgun sequence
trimmed_read1_3001328919-DNA.fastq.gz	gtdb_genomes_reps_r220/database/GCF/001/810/785/GCF_001810785.1_genomic.fna.gz	92.69	0.539	92.05-93.33	0.539	0.43-0.69	1	1.318	324/8148	90.12	NZ_KV802678.1 Streptococcus sp. HMSC073F11 Scaffold1, whole genome shotgun sequence
trimmed_read1_3001328919-DNA.fastq.gz	gtdb_genomes_reps_r220/database/GCF/946/190/155/GCF_946190155.1_genomic.fna.gz	92.68	0.500	92.01-93.10	0.500	0.40-0.62	1	1.308	312/8327	89.95	NZ_CAMHZL010000001.1 Streptococcus mitis isolate Streptococcus mitis NODE_1_length_388548_cov_94.757163, whole genome shotgun sequence
trimmed_read1_3001328919-DNA.fastq.gz	gtdb_genomes_reps_r220/database/GCF/000/722/765/GCF_000722765.2_genomic.fna.gz	92.67	0.496	92.02-93.26	0.496	0.36-0.63	1	1.247	300/8136	89.90	NZ_CP028415.1 Streptococcus mitis strain SK637 chromosome, complete genome
trimmed_read1_3001328919-DNA.fastq.gz	gtdb_genomes_reps_r220/database/GCF/001/808/665/GCF_001808665.1_genomic.fna.gz	92.64	0.447	91.95-93.25	0.447	0.35-0.57	1	1.308	308/9115	89.65	NZ_KV794125.1 Streptococcus sp. HMSC070B10 Scaffold0, whole genome shotgun sequence
trimmed_read1_3001328919-DNA.fastq.gz	gtdb_genomes_reps_r220/database/GCA/018/372/995/GCA_018372995.1_genomic.fna.gz	92.62	0.238	91.57-93.57	0.238	0.17-0.38	1	1.172	174/8819	88.11	JAHAHX010000023.1 MAG: Haemophilus haemolyticus isolate L3_098_047G1_dasL3_098_047G1_concoct_31 L3_098_047G1_scaffold_1020, whole genome shotgun sequence
trimmed_read1_3001328919-DNA.fastq.gz	gtdb_genomes_reps_r220/database/GCA/905/221/155/GCA_905221155.1_genomic.fna.gz	92.62	0.573	91.97-93.11	0.573	0.47-0.72	1	1.321	343/8454	90.18	CAJNCB010000001.1 unidentified bacterium isolate Streptococcus species genome assembly, contig: NODE_1_length_917501_cov_53.194, whole genome shotgun sequence
trimmed_read1_3001328919-DNA.fastq.gz	gtdb_genomes_reps_r220/database/GCF/013/305/725/GCF_013305725.1_genomic.fna.gz	92.60	0.448	92.04-93.14	0.448	0.35-0.55	1	1.230	291/8720	89.61	NZ_CP047883.1 Streptococcus mitis strain S022-V3-A4 chromosome, complete genome
