Sample_file	Genome_file	Adjusted_ANI	Eff_cov	ANI_5-95_percentile	Eff_lambda	Lambda_5-95_percentile	Median_cov	Mean_cov_geq1	Containment_ind	Naive_ANI	Contig_name
trimmed_read1_3001370807-DNA.fastq.gz	gtdb_genomes_reps_r220/database/GCF/003/030/305/GCF_003030305.1_genomic.fna.gz	97.82	0.034	95.24-98.20	0.034	0.03-0.08	1	1.017	179/10561	87.67	NZ_CP023676.1 Cutibacterium acnes strain ATCC 6919 chromosome, complete genome
trimmed_read1_3001370807-DNA.fastq.gz	gtdb_genomes_reps_r220/database/GCF/001/679/005/GCF_001679005.1_genomic.fna.gz	97.11	0.106	95.88-98.44	0.106	0.07-0.15	1	1.060	399/9834	90.18	NZ_LXTW01000001.1 Moraxella nonliquefaciens strain CCUG 348 contig_1, whole genome shotgun sequence
trimmed_read1_3001370807-DNA.fastq.gz	gtdb_genomes_reps_r220/database/GCF/000/245/815/GCF_000245815.1_genomic.fna.gz	96.21	0.106	94.78-97.78	0.106	0.06-0.17	1	1.046	239/7821	89.36	NZ_JH601103.1 Dolosigranulum pigrum ATCC 51524 supercont1.1, whole genome shotgun sequence
trimmed_read1_3001370807-DNA.fastq.gz	gtdb_genomes_reps_r220/database/GCF/001/632/285/GCF_001632285.1_genomic.fna.gz	95.31	0.068	93.12-96.12	0.068	0.05-0.14	1	1.049	122/8176	87.32	NZ_LWAH01000001.1 Moraxella catarrhalis strain CCUG 353 contig_1, whole genome shotgun sequence
trimmed_read1_3001370807-DNA.fastq.gz	gtdb_genomes_reps_r220/database/GCF/013/277/455/GCF_013277455.1_genomic.fna.gz	92.45	0.092	89.97-93.27	0.092	0.08-0.21	1	1.044	68/8788	85.49	NZ_VMMY01000001.1 Streptococcus sp. 5346 5346-99_S28_L001_R1_001_(paired)_contig_1, whole genome shotgun sequence
trimmed_read1_3001370807-DNA.fastq.gz	gtdb_genomes_reps_r220/database/GCF/002/027/545/GCF_002027545.1_genomic.fna.gz	92.18	0.082	89.65-93.02	0.082	0.07-0.17	1	1.065	77/12181	84.93	NZ_MXAN01000001.1 Moraxella lacunata strain CCUG 4441 CCUG_4441T_0000001, whole genome shotgun sequence
trimmed_read1_3001370807-DNA.fastq.gz	gtdb_genomes_reps_r220/database/GCF/002/096/845/GCF_002096845.1_genomic.fna.gz	92.01	0.100	89.89-92.57	0.100	0.09-0.21	1	1.048	63/8758	85.28	NZ_NCVK01000060.1 Streptococcus mitis strain OD_317805_11 s_mitis_OD_317805_11_ID_1, whole genome shotgun sequence
trimmed_read1_3001370807-DNA.fastq.gz	gtdb_genomes_reps_r220/database/GCF/002/860/905/GCF_002860905.1_genomic.fna.gz	91.36	0.111	89.12-92.04	0.111	0.10-0.24	1	1.053	57/8928	84.96	NZ_PKIG01000001.1 Streptococcus oralis subsp. dentisani strain UMB0832 .16933_8_21.1, whole genome shotgun sequence
trimmed_read1_3001370807-DNA.fastq.gz	gtdb_genomes_reps_r220/database/GCF/000/257/865/GCF_000257865.1_genomic.fna.gz	91.29	0.113	88.68-92.08	0.113	0.10-0.24	1	1.054	56/8814	84.94	NZ_AICU01000001.1 Streptococcus mitis SK575 contig00033, whole genome shotgun sequence
trimmed_read1_3001370807-DNA.fastq.gz	gtdb_genomes_reps_r220/database/GCA/001/070/715/GCA_001070715.1_genomic.fna.gz	91.19	0.113	88.86-92.16	0.113	0.09-0.26	1	1.054	56/9137	84.84	JVRR01000136.1 Streptococcus pseudopneumoniae strain 163_SPSE 1000_987_21661_898_,304+,902_, whole genome shotgun sequence
trimmed_read1_3001370807-DNA.fastq.gz	gtdb_genomes_reps_r220/database/GCF/001/579/035/GCF_001579035.1_genomic.fna.gz	91.06	0.120	88.65-91.83	0.120	0.10-0.25	1	1.093	54/8717	84.87	NZ_KQ970285.1 Streptococcus mitis strain DD26 scaffold00001, whole genome shotgun sequence
trimmed_read1_3001370807-DNA.fastq.gz	gtdb_genomes_reps_r220/database/GCF/946/188/685/GCF_946188685.1_genomic.fna.gz	91.04	0.118	88.71-91.56	0.118	0.10-0.26	1	1.056	54/8937	84.81	NZ_CAMHWH010000001.1 Streptococcus mitis isolate Streptococcus mitis NODE_1_length_368939_cov_97.626665, whole genome shotgun sequence
trimmed_read1_3001370807-DNA.fastq.gz	gtdb_genomes_reps_r220/database/GCF/013/277/515/GCF_013277515.1_genomic.fna.gz	91.03	0.118	88.81-91.55	0.118	0.11-0.25	1	1.056	54/8972	84.80	NZ_VMNB01000001.1 Streptococcus sp. k-402 k-402_R1_(paired)_contig_1, whole genome shotgun sequence
trimmed_read1_3001370807-DNA.fastq.gz	gtdb_genomes_reps_r220/database/GCF/001/074/635/GCF_001074635.1_genomic.fna.gz	91.02	0.118	88.81-91.74	0.118	0.10-0.25	1	1.056	54/8979	84.79	NZ_JUQO01000001.1 Streptococcus mitis strain 850_SMIT 0_226_2877, whole genome shotgun sequence
trimmed_read1_3001370807-DNA.fastq.gz	gtdb_genomes_reps_r220/database/GCF/000/148/545/GCF_000148545.1_genomic.fna.gz	90.97	0.120	88.64-91.70	0.120	0.10-0.26	1	1.057	53/8822	84.79	NZ_AEDV01000108.1 Streptococcus mitis SK597 contigB5, whole genome shotgun sequence
trimmed_read1_3001370807-DNA.fastq.gz	gtdb_genomes_reps_r220/database/GCA/001/347/015/GCA_001347015.1_genomic.fna.gz	90.95	0.118	88.42-91.76	0.118	0.10-0.25	1	1.056	54/9220	84.72	CFGI01000001.1 Streptococcus pneumoniae genome assembly 6938_6#7, scaffold ERS022181SCcontig000001, whole genome shotgun sequence
trimmed_read1_3001370807-DNA.fastq.gz	gtdb_genomes_reps_r220/database/GCA/905/221/285/GCA_905221285.1_genomic.fna.gz	90.86	0.125	88.20-91.61	0.125	0.11-0.31	1	1.059	51/8485	84.79	CAJNCM010000001.1 unidentified bacterium isolate Streptococcus species genome assembly, contig: NODE_1_length_380604_cov_54.0563, whole genome shotgun sequence
trimmed_read1_3001370807-DNA.fastq.gz	gtdb_genomes_reps_r220/database/GCA/016/839/165/GCA_016839165.1_genomic.fna.gz	90.85	0.080	88.76-92.35	0.080	0.05-0.16	1	1.038	130/33139	83.63	CP069300.1 Bradyrhizobium sp. PSBB068 chromosome, complete genome
trimmed_read1_3001370807-DNA.fastq.gz	gtdb_genomes_reps_r220/database/GCF/009/496/295/GCF_009496295.1_genomic.fna.gz	90.79	0.125	88.56-91.54	0.125	0.11-0.30	1	1.059	51/8682	84.73	NZ_WIJL01000010.1 Streptococcus mitis strain SM15 NODE_10_length_116604_cov_16.980606, whole genome shotgun sequence
trimmed_read1_3001370807-DNA.fastq.gz	gtdb_genomes_reps_r220/database/GCF/009/496/165/GCF_009496165.1_genomic.fna.gz	90.73	0.128	88.04-91.50	0.128	0.11-0.30	1	1.060	50/8510	84.73	NZ_WIJQ01000010.1 Streptococcus mitis strain SM08 NODE_10_length_53743_cov_22.439328, whole genome shotgun sequence
trimmed_read1_3001370807-DNA.fastq.gz	gtdb_genomes_reps_r220/database/GCA/905/221/245/GCA_905221245.1_genomic.fna.gz	90.73	0.151	88.53-92.16	0.151	0.09-0.33	1	1.070	57/8315	85.15	CAJNCK010000001.1 unidentified bacterium isolate Streptococcus species genome assembly, contig: NODE_1_length_394086_cov_61.6465, whole genome shotgun sequence
trimmed_read1_3001370807-DNA.fastq.gz	gtdb_genomes_reps_r220/database/GCF/013/277/415/GCF_013277415.1_genomic.fna.gz	90.68	0.145	88.39-91.85	0.145	0.09-0.29	1	1.068	59/9052	85.01	NZ_VMMX01000001.1 Streptococcus sp. 68 68_S3_L001_R1_001_(paired)_contig_1, whole genome shotgun sequence
trimmed_read1_3001370807-DNA.fastq.gz	gtdb_genomes_reps_r220/database/GCF/002/096/855/GCF_002096855.1_genomic.fna.gz	90.65	0.154	88.35-91.70	0.154	0.10-0.30	1	1.071	56/8240	85.13	NZ_NCVH01000033.1 Streptococcus mitis strain RH_17439_08 s_mitis_RH_17439_08_ID_1, whole genome shotgun sequence
trimmed_read1_3001370807-DNA.fastq.gz	gtdb_genomes_reps_r220/database/GCF/022/137/125/GCF_022137125.1_genomic.fna.gz	90.57	0.157	88.30-91.62	0.157	0.11-0.33	1	1.073	55/8173	85.10	NZ_JAKNEQ010000001.1 Streptococcus mitis strain DFI.2.96 NNOOAJHE_1, whole genome shotgun sequence
trimmed_read1_3001370807-DNA.fastq.gz	gtdb_genomes_reps_r220/database/GCA/927/910/965/GCA_927910965.1_genomic.fna.gz	90.53	0.151	88.14-91.67	0.151	0.10-0.31	1	1.052	58/8896	85.01	CAKMOM010000001.1 MAG TPA_asm: uncultured Streptococcus sp. isolate ERR3827222_bin.1_metaWRAP_v1.1_MAG genome assembly, contig: ERZ4768407.87, whole genome shotgun sequence
trimmed_read1_3001370807-DNA.fastq.gz	gtdb_genomes_reps_r220/database/GCF/030/439/915/GCF_030439915.1_genomic.fna.gz	90.52	0.133	87.91-91.10	0.133	0.12-0.30	1	1.062	48/8418	84.65	NZ_JAQFJG010000010.1 Streptococcus sp. SPS1 NODE_10_length_71805_cov_189.924538, whole genome shotgun sequence
trimmed_read1_3001370807-DNA.fastq.gz	gtdb_genomes_reps_r220/database/GCF/946/188/695/GCF_946188695.1_genomic.fna.gz	90.52	0.130	88.05-91.24	0.130	0.11-0.31	1	1.040	50/8785	84.64	NZ_CAMHWI010000001.1 Streptococcus mitis isolate Streptococcus mitis NODE_1_length_308064_cov_63.601548, whole genome shotgun sequence
trimmed_read1_3001370807-DNA.fastq.gz	gtdb_genomes_reps_r220/database/GCF/001/072/315/GCF_001072315.1_genomic.fna.gz	90.51	0.167	88.70-91.85	0.167	0.10-0.33	1	1.077	65/9310	85.20	NZ_JVLI01000001.1 Streptococcus pseudopneumoniae strain 330_SPSE 0_919_132734, whole genome shotgun sequence
trimmed_read1_3001370807-DNA.fastq.gz	gtdb_genomes_reps_r220/database/GCF/002/096/755/GCF_002096755.1_genomic.fna.gz	90.46	0.154	88.05-91.30	0.154	0.11-0.36	1	1.071	56/8803	84.95	NZ_NCVF01000026.1 Streptococcus mitis strain RH_50275_09 s_mitis_RH_50275_09_ID_1, whole genome shotgun sequence
trimmed_read1_3001370807-DNA.fastq.gz	gtdb_genomes_reps_r220/database/GCF/023/109/235/GCF_023109235.1_genomic.fna.gz	90.44	0.140	87.80-91.15	0.140	0.12-0.31	1	1.065	46/7968	84.68	NZ_JALDUC010000010.1 Streptococcus mitis strain S53 NODE_10_length_93322_cov_198.967258, whole genome shotgun sequence
trimmed_read1_3001370807-DNA.fastq.gz	gtdb_genomes_reps_r220/database/GCF/900/411/395/GCF_900411395.1_genomic.fna.gz	90.42	0.128	88.09-91.29	0.128	0.11-0.29	1	1.060	50/9460	84.44	NZ_OXCQ01000050.1 Streptococcus sp. 596553, whole genome shotgun sequence
trimmed_read1_3001370807-DNA.fastq.gz	gtdb_genomes_reps_r220/database/GCF/003/942/765/GCF_003942765.1_genomic.fna.gz	90.40	0.133	88.06-91.41	0.133	0.11-0.32	1	1.062	48/8775	84.53	NZ_RJNW01000001.1 Streptococcus mitis strain KLC01 D8849_contig001, whole genome shotgun sequence
trimmed_read1_3001370807-DNA.fastq.gz	gtdb_genomes_reps_r220/database/GCF/003/942/685/GCF_003942685.1_genomic.fna.gz	90.37	0.157	88.39-91.44	0.157	0.11-0.31	1	1.073	55/8731	84.92	NZ_RJNR01000001.1 Streptococcus mitis strain BCA12 D8855_contig001, whole genome shotgun sequence
trimmed_read1_3001370807-DNA.fastq.gz	gtdb_genomes_reps_r220/database/GCF/002/096/835/GCF_002096835.1_genomic.fna.gz	90.33	0.143	87.40-91.08	0.143	0.12-0.35	1	1.067	45/7905	84.64	NZ_NCVG01000023.1 Streptococcus mitis strain RH_43861_09 s_mitis_RH_43861_09_ID_1, whole genome shotgun sequence
trimmed_read1_3001370807-DNA.fastq.gz	gtdb_genomes_reps_r220/database/GCF/946/188/615/GCF_946188615.1_genomic.fna.gz	90.31	0.160	88.23-91.49	0.160	0.11-0.35	1	1.055	55/8605	84.96	NZ_CAMHVK010000001.1 Streptococcus mitis isolate Streptococcus mitis NODE_1_length_383254_cov_94.802522, whole genome shotgun sequence
trimmed_read1_3001370807-DNA.fastq.gz	gtdb_genomes_reps_r220/database/GCF/003/942/865/GCF_003942865.1_genomic.fna.gz	90.26	0.163	87.74-91.21	0.163	0.11-0.36	1	1.075	53/8424	84.92	NZ_RJNZ01000001.1 Streptococcus mitis strain BCC55 D8845_contig001, whole genome shotgun sequence
trimmed_read1_3001370807-DNA.fastq.gz	gtdb_genomes_reps_r220/database/GCF/002/096/815/GCF_002096815.1_genomic.fna.gz	90.26	0.140	87.85-90.97	0.140	0.12-0.33	1	1.065	46/8476	84.51	NZ_NCVJ01000021.1 Streptococcus mitis strain RH_12363_08 s_mitis_RH_12363_08_ID_1, whole genome shotgun sequence
trimmed_read1_3001370807-DNA.fastq.gz	gtdb_genomes_reps_r220/database/GCF/915/066/115/GCF_915066115.1_genomic.fna.gz	90.24	0.146	87.30-91.22	0.146	0.12-0.39	1	1.068	44/7792	84.62	NZ_CAJZDT010000001.1 MAG: uncultured Streptococcus sp. isolate SRR1045100_bin.1_metaWRAP_v1.1_MAG, whole genome shotgun sequence
trimmed_read1_3001370807-DNA.fastq.gz	gtdb_genomes_reps_r220/database/GCF/006/385/785/GCF_006385785.1_genomic.fna.gz	90.21	0.140	87.71-90.82	0.140	0.12-0.29	1	1.065	46/8626	84.46	NZ_VFSH01000001.1 Streptococcus shenyangsis strain D19 Scaffold1, whole genome shotgun sequence
trimmed_read1_3001370807-DNA.fastq.gz	gtdb_genomes_reps_r220/database/GCF/019/929/545/GCF_019929545.1_genomic.fna.gz	90.17	0.167	88.09-91.44	0.167	0.11-0.34	1	1.077	52/8371	84.88	NZ_JAHZPT010000001.1 Streptococcus mitis strain CR123 Smitis_CR123_NinaOddballs_Sia_NO_1, whole genome shotgun sequence
trimmed_read1_3001370807-DNA.fastq.gz	gtdb_genomes_reps_r220/database/GCA/905/221/505/GCA_905221505.1_genomic.fna.gz	90.14	0.143	87.61-90.87	0.143	0.12-0.33	1	1.067	45/8433	84.47	CAJNDL010000001.1 unidentified bacterium isolate Streptococcus species genome assembly, contig: NODE_1_length_223941_cov_38.0438, whole genome shotgun sequence
trimmed_read1_3001370807-DNA.fastq.gz	gtdb_genomes_reps_r220/database/GCF/001/810/785/GCF_001810785.1_genomic.fna.gz	90.14	0.170	87.76-91.42	0.170	0.11-0.35	1	1.078	51/8148	84.90	NZ_KV802678.1 Streptococcus sp. HMSC073F11 Scaffold1, whole genome shotgun sequence
trimmed_read1_3001370807-DNA.fastq.gz	gtdb_genomes_reps_r220/database/GCF/020/089/495/GCF_020089495.2_genomic.fna.gz	90.13	0.143	87.54-90.63	0.143	0.12-0.33	1	1.043	46/8470	84.51	NZ_JAIRCA020000001.1 Streptococcus sp. IMAU 99199 IMAU99199, whole genome shotgun sequence
trimmed_read1_3001370807-DNA.fastq.gz	gtdb_genomes_reps_r220/database/GCF/013/277/475/GCF_013277475.1_genomic.fna.gz	90.12	0.160	87.82-91.02	0.160	0.11-0.36	1	1.074	54/9183	84.73	NZ_VMMZ01000001.1 Streptococcus sp. k-628 k-628_S22_L001_R1_001_(paired)_contig_1, whole genome shotgun sequence
trimmed_read1_3001370807-DNA.fastq.gz	gtdb_genomes_reps_r220/database/GCF/905/187/495/GCF_905187495.1_genomic.fna.gz	90.09	0.170	87.78-91.37	0.170	0.11-0.37	1	1.078	51/8287	84.86	NZ_CAJJIB010000001.1 Streptococcus mitis isolate Streptococcus mitis, whole genome shotgun sequence
trimmed_read1_3001370807-DNA.fastq.gz	gtdb_genomes_reps_r220/database/GCF/946/190/155/GCF_946190155.1_genomic.fna.gz	90.05	0.146	87.24-91.14	0.146	0.11-0.37	1	1.044	45/8327	84.50	NZ_CAMHZL010000001.1 Streptococcus mitis isolate Streptococcus mitis NODE_1_length_388548_cov_94.757163, whole genome shotgun sequence
trimmed_read1_3001370807-DNA.fastq.gz	gtdb_genomes_reps_r220/database/GCF/013/277/205/GCF_013277205.1_genomic.fna.gz	90.03	0.160	88.06-91.29	0.160	0.11-0.36	1	1.074	54/9465	84.65	NZ_VMMO01000001.1 Streptococcus sp. 202 202_S24_L001_R1_001_(paired)_contig_1, whole genome shotgun sequence
trimmed_read1_3001370807-DNA.fastq.gz	gtdb_genomes_reps_r220/database/GCF/013/276/955/GCF_013276955.1_genomic.fna.gz	90.03	0.163	88.06-90.98	0.163	0.12-0.35	1	1.075	53/9123	84.70	NZ_VMLZ01000001.1 Streptococcus sp. 1453 1453_S31_L001_R1_001_(paired)_contig_1, whole genome shotgun sequence
