Sample_file	Genome_file	Adjusted_ANI	Eff_cov	ANI_5-95_percentile	Eff_lambda	Lambda_5-95_percentile	Median_cov	Mean_cov_geq1	Containment_ind	Naive_ANI	Contig_name
trimmed_read1_3001201470-DNA.fastq.gz	gtdb_genomes_reps_r220/database/GCF/003/030/305/GCF_003030305.1_genomic.fna.gz	97.80	0.172	97.14-98.36	0.172	0.14-0.21	1	1.098	840/10561	92.16	NZ_CP023676.1 Cutibacterium acnes strain ATCC 6919 chromosome, complete genome
trimmed_read1_3001201470-DNA.fastq.gz	gtdb_genomes_reps_r220/database/GCA/016/839/165/GCA_016839165.1_genomic.fna.gz	92.50	0.179	91.74-93.25	0.179	0.13-0.24	1	1.082	486/33139	87.27	CP069300.1 Bradyrhizobium sp. PSBB068 chromosome, complete genome
trimmed_read1_3001201470-DNA.fastq.gz	gtdb_genomes_reps_r220/database/GCF/001/457/635/GCF_001457635.1_genomic.fna.gz	91.73	0.107	89.26-92.16	0.107	0.10-0.23	1	1.083	60/8578	85.21	NZ_LN831051.1 Streptococcus pneumoniae strain NCTC7465 chromosome 1, complete sequence
trimmed_read1_3001201470-DNA.fastq.gz	gtdb_genomes_reps_r220/database/GCF/003/697/165/GCF_003697165.2_genomic.fna.gz	91.46	0.109	89.51-93.29	0.109	0.06-0.20	1	1.088	137/21223	84.99	NZ_CP033092.2 Escherichia coli DSM 30083 = JCM 1649 = ATCC 11775 chromosome, complete genome
trimmed_read1_3001201470-DNA.fastq.gz	gtdb_genomes_reps_r220/database/GCF/000/194/175/GCF_000194175.1_genomic.fna.gz	91.38	0.067	88.66-91.69	0.067	0.06-0.15	1	1.033	92/23097	83.67	NZ_AEZI02000028.1 Escherichia coli 1.2741 Contig1651129016, whole genome shotgun sequence
trimmed_read1_3001201470-DNA.fastq.gz	gtdb_genomes_reps_r220/database/GCA/943/913/655/GCA_943913655.1_genomic.fna.gz	91.36	0.140	89.01-92.25	0.140	0.11-0.34	1	1.170	47/5936	85.55	CALTZA010000001.1 MAG: uncultured Francisella sp. isolate G79AyWT62A_bin.4.MAG genome assembly, contig: NODE_9_length_210779_cov_13.887189, whole genome shotgun sequence
trimmed_read1_3001201470-DNA.fastq.gz	gtdb_genomes_reps_r220/database/GCF/008/326/345/GCF_008326345.1_genomic.fna.gz	91.18	0.102	88.59-91.68	0.102	0.09-0.23	1	1.079	63/11390	84.56	NZ_BJEN01000001.1 Cutibacterium modestum strain M12 contig01, whole genome shotgun sequence
trimmed_read1_3001201470-DNA.fastq.gz	gtdb_genomes_reps_r220/database/GCF/900/200/035/GCF_900200035.1_genomic.fna.gz	91.14	0.085	89.23-92.99	0.085	0.05-0.15	1	1.041	123/26823	84.05	NZ_FZTC01000054.1 Klebsiella grimontii strain 06D021, whole genome shotgun sequence
trimmed_read1_3001201470-DNA.fastq.gz	gtdb_genomes_reps_r220/database/GCF/900/411/395/GCF_900411395.1_genomic.fna.gz	90.30	0.130	87.96-91.08	0.130	0.11-0.30	1	1.061	49/9460	84.39	NZ_OXCQ01000050.1 Streptococcus sp. 596553, whole genome shotgun sequence
